
Unique values in metadata.mods.originInfo.dateCreated field:

	copyright 1987

	{'@encoding': 'edtf', '@keyDate': 'yes', '#text': '1987'}

	copyright 1988

	{'@encoding': 'edtf', '@keyDate': 'yes', '#text': '1988'}

	copyright 1979

	{'@encoding': 'edtf', '@keyDate': 'yes', '#text': '1979'}

	copyright 1989

	{'@encoding': 'edtf', '@keyDate': 'yes', '#text': '1989'}

	copyright 1980

	{'@encoding': 'edtf', '@keyDate': 'yes', '#text': '1980'}

	copyright 1990

	{'@encoding': 'edtf', '@keyDate': 'yes', '#text': '1990'}

	approximate 1974

	{'@encoding': 'edtf', '@keyDate': 'yes', '@qualifier': 'approximate', '#text': '1974~'}

	copyright 1991

	{'@encoding': 'edtf', '@keyDate': 'yes', '#text': '1991'}

	copyright 1992

	{'@encoding': 'edtf', '@keyDate': 'yes', '#text': '1992'}

	copyright 1993

	{'@encoding': 'edtf', '@keyDate': 'yes', '#text': '1993'}

	copyright 1994

	{'@encoding': 'edtf', '@keyDate': 'yes', '#text': '1994'}

	copyright 1995

	{'@encoding': 'edtf', '@keyDate': 'yes', '#text': '1995'}

	copyright 1977

	{'@encoding': 'edtf', '@keyDate': 'yes', '#text': '1977'}

	copyright 1996

	{'@encoding': 'edtf', '@keyDate': 'yes', '#text': '1996'}

	copyright 1997

	{'@encoding': 'edtf', '@keyDate': 'yes', '#text': '1997'}

	copyright 1998

	{'@encoding': 'edtf', '@keyDate': 'yes', '#text': '1998'}

	copyright 1999

	{'@encoding': 'edtf', '@keyDate': 'yes', '#text': '1999'}

	copyright 2000

	{'@encoding': 'edtf', '@keyDate': 'yes', '#text': '2000'}

	copyright 2001

	{'@encoding': 'edtf', '@keyDate': 'yes', '#text': '2001'}

	copyright 2002

	{'@encoding': 'edtf', '@keyDate': 'yes', '#text': '2002'}

	copyright 2003

	{'@encoding': 'edtf', '@keyDate': 'yes', '#text': '2003'}

	copyright 2004

	{'@encoding': 'edtf', '@keyDate': 'yes', '#text': '2004'}

	copyright 1981

	{'@encoding': 'edtf', '@keyDate': 'yes', '#text': '1981'}

	copyright 1982

	{'@encoding': 'edtf', '@keyDate': 'yes', '#text': '1982'}

	copyright 1978

	{'@encoding': 'edtf', '@keyDate': 'yes', '#text': '1978'}

	copyright 1983

	{'@encoding': 'edtf', '@keyDate': 'yes', '#text': '1983'}

	copyright 1984

	{'@encoding': 'edtf', '@keyDate': 'yes', '#text': '1984'}

	copyright 1985

	{'@encoding': 'edtf', '@keyDate': 'yes', '#text': '1985'}

	copyright 1986

	{'@encoding': 'edtf', '@keyDate': 'yes', '#text': '1986'}

	{'@encoding': 'edtf', '@keyDate': 'yes', '@point': 'end', '#text': '1897'}

	{'@encoding': 'edtf', '@keyDate': 'yes', '@point': 'start', '#text': '1895'}

	{'@qualifier': 'approximate', '#text': '1895-1897'}

	1895-1897

	March 17, 1910

	{'@encoding': 'edtf', '#text': '1910-03-17'}

	March 16, 1910

	{'@encoding': 'edtf', '#text': '1910-03-16'}

	March 17,1909

	{'@encoding': 'edtf', '#text': '1909-03-17'}

	March 19, 1910

	{'@encoding': 'edtf', '#text': '1910-03-19'}

	1910

	{'@encoding': 'edtf', '#text': '1910'}

	February 2, 1911

	{'@encoding': 'edtf', '#text': '1911-02-02'}

	March 22, 1910

	{'@encoding': 'edtf', '#text': '1910-03-22'}

	March 18, 1910

	{'@encoding': 'edtf', '#text': '1910-03-18'}

	{'@encoding': 'edtf', '@keyDate': 'yes', '@qualifier': 'inferred', '#text': '1909'}

	{'@qualifier': 'inferred', '#text': '1909'}

	1976

	{'@encoding': 'edtf', '@keyDate': 'yes', '#text': '1976'}

	unknown

	{'@encoding': 'edtf', '@keyDate': 'yes', '@qualifier': 'inferred', '#text': '1966'}

	1981

	1982

	1975

	{'@encoding': 'edtf', '@keyDate': 'yes', '#text': '1975'}

	1978

	1977

	1983

	1968

	{'@encoding': 'edtf', '@keyDate': 'yes', '#text': '1968'}

	1980

	1966

	{'@encoding': 'edtf', '@keyDate': 'yes', '#text': '1966'}

	1930

	{'@encoding': 'edtf', '@keyDate': 'yes', '#text': '1930'}

	1967

	{'@encoding': 'edtf', '@keyDate': 'yes', '#text': '1967'}

	1979

	1970

	{'@encoding': 'edtf', '@keyDate': 'yes', '#text': '1970'}

	1972

	{'@encoding': 'edtf', '@keyDate': 'yes', '#text': '1972'}

	1973

	{'@encoding': 'edtf', '@keyDate': 'yes', '#text': '1973'}

	1987-1988

	1960

	{'@encoding': 'edtf', '@keyDate': 'yes', '#text': '1960'}

	1964

	{'@encoding': 'edtf', '@keyDate': 'yes', '#text': '1964'}

	1984

	1987

	1969

	{'@encoding': 'edtf', '@keyDate': 'yes', '#text': '1969'}

	1932

	{'@encoding': 'edtf', '@keyDate': 'yes', '#text': '1932'}

	1989

	1955

	{'@encoding': 'edtf', '@keyDate': 'yes', '#text': '1955'}

	1965

	{'@encoding': 'edtf', '@keyDate': 'yes', '#text': '1965'}

	2004

	1995

	1988

	1971-1972

	{'@encoding': 'edtf', '@keyDate': 'yes', '#text': '1971'}

	1991

	1974

	{'@encoding': 'edtf', '@keyDate': 'yes', '#text': '1974'}

	1971

	2001

	1884

	{'@encoding': 'edtf', '@keyDate': 'yes', '#text': '1884'}

	1890

	{'@encoding': 'edtf', '@keyDate': 'yes', '#text': '1890'}

	1903

	{'@encoding': 'edtf', '@keyDate': 'yes', '#text': '1903'}

	1917

	{'@encoding': 'edtf', '@keyDate': 'yes', '#text': '1917'}

	1922

	{'@encoding': 'edtf', '@keyDate': 'yes', '#text': '1922'}

	Undated

	{'@encoding': 'edtf', '@keyDate': 'yes', '@point': 'end', '#text': '1969'}

	{'@encoding': 'edtf', '@keyDate': 'yes', '@point': 'start', '@qualifier': 'inferred', '#text': '1940'}

	1959-10-26

	{'@encoding': 'edtf', '@keyDate': 'yes', '#text': '1959-10-26'}

	1953-06

	{'@encoding': 'edtf', '@keyDate': 'yes', '#text': '1953-06'}

	1953-09-28

	{'@encoding': 'edtf', '@keyDate': 'yes', '#text': '1953-09-28'}

	1957-08-28

	{'@encoding': 'edtf', '@keyDate': 'yes', '#text': '1957-08-28'}

	1950-09-28

	{'@encoding': 'edtf', '@keyDate': 'yes', '#text': '1950-09-28'}

	1954-08-25

	{'@encoding': 'edtf', '@keyDate': 'yes', '#text': '1954-08-25'}

	1968-10

	{'@encoding': 'edtf', '@keyDate': 'yes', '#text': '1968-10'}

	1960-06-10

	{'@encoding': 'edtf', '@keyDate': 'yes', '#text': '1960-06-10'}

	1954-10-31

	{'@encoding': 'edtf', '@keyDate': 'yes', '#text': '1954-10-31'}

	1956-10-22

	{'@encoding': 'edtf', '@keyDate': 'yes', '#text': '1956-10-22'}

	1958-10-24

	{'@encoding': 'edtf', '@keyDate': 'yes', '#text': '1958-10-24'}

	1964-01

	{'@encoding': 'edtf', '@keyDate': 'yes', '#text': '1964-01'}

	1973-01

	{'@encoding': 'edtf', '@keyDate': 'yes', '#text': '1973-01'}

	1954-03-02

	{'@encoding': 'edtf', '@keyDate': 'yes', '#text': '1954-03-02'}

	1960-11-05

	{'@encoding': 'edtf', '@keyDate': 'yes', '#text': '1960-11-05'}

	1956-12-14

	{'@encoding': 'edtf', '@keyDate': 'yes', '#text': '1956-12-14'}

	1954-10-15

	{'@encoding': 'edtf', '@keyDate': 'yes', '#text': '1954-10-15'}

	1953-09-27

	{'@encoding': 'edtf', '@keyDate': 'yes', '#text': '1953-09-27'}

	1954-06-01

	{'@encoding': 'edtf', '@keyDate': 'yes', '#text': '1954-06-01'}

	1958-11-07

	{'@encoding': 'edtf', '@keyDate': 'yes', '#text': '1958-11-07'}

	1957-10-20

	{'@encoding': 'edtf', '@keyDate': 'yes', '#text': '1957-10-20'}

	1959-09-28

	{'@encoding': 'edtf', '@keyDate': 'yes', '#text': '1959-09-28'}

	1960-10-27

	{'@encoding': 'edtf', '@keyDate': 'yes', '#text': '1960-10-27'}

	1954-10-25

	{'@encoding': 'edtf', '@keyDate': 'yes', '#text': '1954-10-25'}

	1953-01

	{'@encoding': 'edtf', '@keyDate': 'yes', '#text': '1953-01'}

	1960-03

	{'@encoding': 'edtf', '@keyDate': 'yes', '#text': '1960-03'}

	1972-05-22

	{'@encoding': 'edtf', '@keyDate': 'yes', '#text': '1972-05-22'}

	1952-10-05

	{'@encoding': 'edtf', '@keyDate': 'yes', '#text': '1952-10-05'}

	1958-03-16

	{'@encoding': 'edtf', '@keyDate': 'yes', '#text': '1958-03-16'}

	1953-02

	{'@encoding': 'edtf', '@keyDate': 'yes', '#text': '1953-02'}

	1959-09-27

	{'@encoding': 'edtf', '@keyDate': 'yes', '#text': '1959-09-27'}

	1955-10-25

	{'@encoding': 'edtf', '@keyDate': 'yes', '#text': '1955-10-25'}

	1954-02-05

	{'@encoding': 'edtf', '@keyDate': 'yes', '#text': '1954-02-05'}

	None

	{'@encoding': 'edtf', '@keyDate': 'yes'}

	1952

	{'@encoding': 'edtf', '@keyDate': 'yes', '#text': '1952'}

	1954-05-16

	{'@encoding': 'edtf', '@keyDate': 'yes', '#text': '1954-05-16'}

	1958-10-29

	{'@encoding': 'edtf', '@keyDate': 'yes', '#text': '1958-10-29'}

	1952-09

	{'@encoding': 'edtf', '@keyDate': 'yes', '#text': '1952-09'}

	1958-10-15

	{'@encoding': 'edtf', '@keyDate': 'yes', '#text': '1958-10-15'}

	1958-10-23

	{'@encoding': 'edtf', '@keyDate': 'yes', '#text': '1958-10-23'}

	1954-06-15

	{'@encoding': 'edtf', '@keyDate': 'yes', '#text': '1954-06-15'}

	1957-06-12

	{'@encoding': 'edtf', '@keyDate': 'yes', '#text': '1957-06-12'}

	1959-10-15

	{'@encoding': 'edtf', '@keyDate': 'yes', '#text': '1959-10-15'}

	1953-10-03

	{'@encoding': 'edtf', '@keyDate': 'yes', '#text': '1953-10-03'}

	1954-10-27

	{'@encoding': 'edtf', '@keyDate': 'yes', '#text': '1954-10-27'}

	1960-10-05

	{'@encoding': 'edtf', '@keyDate': 'yes', '#text': '1960-10-05'}

	1954-10-30

	{'@encoding': 'edtf', '@keyDate': 'yes', '#text': '1954-10-30'}

	1959-10-01

	{'@encoding': 'edtf', '@keyDate': 'yes', '#text': '1959-10-01'}

	1956-06-12

	{'@encoding': 'edtf', '@keyDate': 'yes', '#text': '1956-06-12'}

	1960-11-03

	{'@encoding': 'edtf', '@keyDate': 'yes', '#text': '1960-11-03'}

	1962-10

	{'@encoding': 'edtf', '@keyDate': 'yes', '#text': '1962-10'}

	1956-10-29

	{'@encoding': 'edtf', '@keyDate': 'yes', '#text': '1956-10-29'}

	1954-10-28

	{'@encoding': 'edtf', '@keyDate': 'yes', '#text': '1954-10-28'}

	1957-06-02

	{'@encoding': 'edtf', '@keyDate': 'yes', '#text': '1957-06-02'}

	1966-10

	{'@encoding': 'edtf', '@keyDate': 'yes', '#text': '1966-10'}

	1958-11-25

	{'@encoding': 'edtf', '@keyDate': 'yes', '#text': '1958-11-25'}

	1956-10-31

	{'@encoding': 'edtf', '@keyDate': 'yes', '#text': '1956-10-31'}

	1953-10-18

	{'@encoding': 'edtf', '@keyDate': 'yes', '#text': '1953-10-18'}

	1958-10-22

	{'@encoding': 'edtf', '@keyDate': 'yes', '#text': '1958-10-22'}

	1954-01-22

	{'@encoding': 'edtf', '@keyDate': 'yes', '#text': '1954-01-22'}

	1954-01-08

	{'@encoding': 'edtf', '@keyDate': 'yes', '#text': '1954-01-08'}

	1957-10-18

	{'@encoding': 'edtf', '@keyDate': 'yes', '#text': '1957-10-18'}

	1953-11-27

	{'@encoding': 'edtf', '@keyDate': 'yes', '#text': '1953-11-27'}

	1955-10-16

	{'@encoding': 'edtf', '@keyDate': 'yes', '#text': '1955-10-16'}

	1960-04-22

	{'@encoding': 'edtf', '@keyDate': 'yes', '#text': '1960-04-22'}

	1964-10

	{'@encoding': 'edtf', '@keyDate': 'yes', '#text': '1964-10'}

	1953-06-08

	{'@encoding': 'edtf', '@keyDate': 'yes', '#text': '1953-06-08'}

	1959-11-04

	{'@encoding': 'edtf', '@keyDate': 'yes', '#text': '1959-11-04'}

	1954-07-10

	{'@encoding': 'edtf', '@keyDate': 'yes', '#text': '1954-07-10'}

	1957-01-17

	{'@encoding': 'edtf', '@keyDate': 'yes', '#text': '1957-01-17'}

	1959-05

	{'@encoding': 'edtf', '@keyDate': 'yes', '#text': '1959-05'}

	1954-06-16

	{'@encoding': 'edtf', '@keyDate': 'yes', '#text': '1954-06-16'}

	1960-10-20

	{'@encoding': 'edtf', '@keyDate': 'yes', '#text': '1960-10-20'}

	1959-04

	{'@encoding': 'edtf', '@keyDate': 'yes', '#text': '1959-04'}

	1953-10-20

	{'@encoding': 'edtf', '@keyDate': 'yes', '#text': '1953-10-20'}

	1953-10-23

	{'@encoding': 'edtf', '@keyDate': 'yes', '#text': '1953-10-23'}

	1954-04-05

	{'@encoding': 'edtf', '@keyDate': 'yes', '#text': '1954-04-05'}

	1956-10-24

	{'@encoding': 'edtf', '@keyDate': 'yes', '#text': '1956-10-24'}

	1957-06-28

	{'@encoding': 'edtf', '@keyDate': 'yes', '#text': '1957-06-28'}

	1953-10-22

	{'@encoding': 'edtf', '@keyDate': 'yes', '#text': '1953-10-22'}

	1953-10-19

	{'@encoding': 'edtf', '@keyDate': 'yes', '#text': '1953-10-19'}

	1954-04-02

	{'@encoding': 'edtf', '@keyDate': 'yes', '#text': '1954-04-02'}

	1958-11-09

	{'@encoding': 'edtf', '@keyDate': 'yes', '#text': '1958-11-09'}

	1955-10-29

	{'@encoding': 'edtf', '@keyDate': 'yes', '#text': '1955-10-29'}

	1953-10-17

	{'@encoding': 'edtf', '@keyDate': 'yes', '#text': '1953-10-17'}

	1954-08-22

	{'@encoding': 'edtf', '@keyDate': 'yes', '#text': '1954-08-22'}

	1954-11-03

	{'@encoding': 'edtf', '@keyDate': 'yes', '#text': '1954-11-03'}

	1957-12-10

	{'@encoding': 'edtf', '@keyDate': 'yes', '#text': '1957-12-10'}

	1954-10-06

	{'@encoding': 'edtf', '@keyDate': 'yes', '#text': '1954-10-06'}

	1956-06-28

	{'@encoding': 'edtf', '@keyDate': 'yes', '#text': '1956-06-28'}

	1959-10-27

	{'@encoding': 'edtf', '@keyDate': 'yes', '#text': '1959-10-27'}

	1954-10-01

	{'@encoding': 'edtf', '@keyDate': 'yes', '#text': '1954-10-01'}

	1955-05-19

	{'@encoding': 'edtf', '@keyDate': 'yes', '#text': '1955-05-19'}

	1957-10-31

	{'@encoding': 'edtf', '@keyDate': 'yes', '#text': '1957-10-31'}

	1955-08-20

	{'@encoding': 'edtf', '@keyDate': 'yes', '#text': '1955-08-20'}

	1955-06-12

	{'@encoding': 'edtf', '@keyDate': 'yes', '#text': '1955-06-12'}

	1954-06-08

	{'@encoding': 'edtf', '@keyDate': 'yes', '#text': '1954-06-08'}

	1959-10-20

	{'@encoding': 'edtf', '@keyDate': 'yes', '#text': '1959-10-20'}

	1954-08

	{'@encoding': 'edtf', '@keyDate': 'yes', '#text': '1954-08'}

	1954-10-22

	{'@encoding': 'edtf', '@keyDate': 'yes', '#text': '1954-10-22'}

	1954-10-11

	{'@encoding': 'edtf', '@keyDate': 'yes', '#text': '1954-10-11'}

	1956-06-26

	{'@encoding': 'edtf', '@keyDate': 'yes', '#text': '1956-06-26'}

	1953-10-21

	{'@encoding': 'edtf', '@keyDate': 'yes', '#text': '1953-10-21'}

	1954-06-02

	{'@encoding': 'edtf', '@keyDate': 'yes', '#text': '1954-06-02'}

	1954-07-06

	{'@encoding': 'edtf', '@keyDate': 'yes', '#text': '1954-07-06'}

	1955-05-18

	{'@encoding': 'edtf', '@keyDate': 'yes', '#text': '1955-05-18'}

	1954-10-20

	{'@encoding': 'edtf', '@keyDate': 'yes', '#text': '1954-10-20'}

	1958-06-13

	{'@encoding': 'edtf', '@keyDate': 'yes', '#text': '1958-06-13'}

	1956-06-25

	{'@encoding': 'edtf', '@keyDate': 'yes', '#text': '1956-06-25'}

	1953-07-15

	{'@encoding': 'edtf', '@keyDate': 'yes', '#text': '1953-07-15'}

	1961-11-03

	{'@encoding': 'edtf', '@keyDate': 'yes', '#text': '1961-11-03'}

	1975-01

	{'@encoding': 'edtf', '@keyDate': 'yes', '#text': '1975-01'}

	1958-12-17

	{'@encoding': 'edtf', '@keyDate': 'yes', '#text': '1958-12-17'}

	1953-07-22

	{'@encoding': 'edtf', '@keyDate': 'yes', '#text': '1953-07-22'}

	1974-10

	{'@encoding': 'edtf', '@keyDate': 'yes', '#text': '1974-10'}

	1959-11-02

	{'@encoding': 'edtf', '@keyDate': 'yes', '#text': '1959-11-02'}

	1955-10-26

	{'@encoding': 'edtf', '@keyDate': 'yes', '#text': '1955-10-26'}

	1958-10-30

	{'@encoding': 'edtf', '@keyDate': 'yes', '#text': '1958-10-30'}

	1952-10

	{'@encoding': 'edtf', '@keyDate': 'yes', '#text': '1952-10'}

	1956-11-02

	{'@encoding': 'edtf', '@keyDate': 'yes', '#text': '1956-11-02'}

	1953-12-16

	{'@encoding': 'edtf', '@keyDate': 'yes', '#text': '1953-12-16'}

	1975-10

	{'@encoding': 'edtf', '@keyDate': 'yes', '#text': '1975-10'}

	1958-05-14

	{'@encoding': 'edtf', '@keyDate': 'yes', '#text': '1958-05-14'}

	1960-10-24

	{'@encoding': 'edtf', '@keyDate': 'yes', '#text': '1960-10-24'}

	1960-04-29

	{'@encoding': 'edtf', '@keyDate': 'yes', '#text': '1960-04-29'}

	1967-06

	{'@encoding': 'edtf', '@keyDate': 'yes', '#text': '1967-06'}

	1960-05-01

	{'@encoding': 'edtf', '@keyDate': 'yes', '#text': '1960-05-01'}

	1955-04-17

	{'@encoding': 'edtf', '@keyDate': 'yes', '#text': '1955-04-17'}

	1954-04-21

	{'@encoding': 'edtf', '@keyDate': 'yes', '#text': '1954-04-21'}

	1957-05-12

	{'@encoding': 'edtf', '@keyDate': 'yes', '#text': '1957-05-12'}

	1967-04

	{'@encoding': 'edtf', '@keyDate': 'yes', '#text': '1967-04'}

	1974-04

	{'@encoding': 'edtf', '@keyDate': 'yes', '#text': '1974-04'}

	1956-09-30

	{'@encoding': 'edtf', '@keyDate': 'yes', '#text': '1956-09-30'}

	1963-04-14

	{'@encoding': 'edtf', '@keyDate': 'yes', '#text': '1963-04-14'}

	1968-04

	{'@encoding': 'edtf', '@keyDate': 'yes', '#text': '1968-04'}

	1960-05-10

	{'@encoding': 'edtf', '@keyDate': 'yes', '#text': '1960-05-10'}

	1956-04-28

	{'@encoding': 'edtf', '@keyDate': 'yes', '#text': '1956-04-28'}

	1960-05-16

	{'@encoding': 'edtf', '@keyDate': 'yes', '#text': '1960-05-16'}

	1955-05-20

	{'@encoding': 'edtf', '@keyDate': 'yes', '#text': '1955-05-20'}

	1960-05-14

	{'@encoding': 'edtf', '@keyDate': 'yes', '#text': '1960-05-14'}

	1955-07-23

	{'@encoding': 'edtf', '@keyDate': 'yes', '#text': '1955-07-23'}

	1960-05-09

	{'@encoding': 'edtf', '@keyDate': 'yes', '#text': '1960-05-09'}

	1958-08-31

	{'@encoding': 'edtf', '@keyDate': 'yes', '#text': '1958-08-31'}

	1958-05-28

	{'@encoding': 'edtf', '@keyDate': 'yes', '#text': '1958-05-28'}

	1958-05-01

	{'@encoding': 'edtf', '@keyDate': 'yes', '#text': '1958-05-01'}

	1953-05

	{'@encoding': 'edtf', '@keyDate': 'yes', '#text': '1953-05'}

	1972-10

	{'@encoding': 'edtf', '@keyDate': 'yes', '#text': '1972-10'}

	1953-04

	{'@encoding': 'edtf', '@keyDate': 'yes', '#text': '1953-04'}

	1844 Summer

	{'@encoding': 'edtf', '@keyDate': 'yes', '#text': '1844-22'}

	1843 Summer

	{'@encoding': 'edtf', '@keyDate': 'yes', '#text': '1843-22'}

	1842 Summer

	{'@encoding': 'edtf', '@keyDate': 'yes', '#text': '1842-22'}

	1841 Summer

	{'@encoding': 'edtf', '@keyDate': 'yes', '#text': '1841-22'}

	1854 Summer

	{'@encoding': 'edtf', '@keyDate': 'yes', '#text': '1854-22'}

	1850 Summer

	{'@encoding': 'edtf', '@keyDate': 'yes', '#text': '1850-22'}

	1873 Spring

	{'@encoding': 'edtf', '@keyDate': 'yes', '#text': '1873-21'}

	1874 Spring

	{'@encoding': 'edtf', '@keyDate': 'yes', '#text': '1874-21'}

	1875 Spring

	{'@encoding': 'edtf', '@keyDate': 'yes', '#text': '1875-21'}

	1876 Spring

	{'@encoding': 'edtf', '@keyDate': 'yes', '#text': '1876-21'}

	1878 Spring

	{'@encoding': 'edtf', '@keyDate': 'yes', '#text': '1878-21'}

	1879 Spring

	{'@encoding': 'edtf', '@keyDate': 'yes', '#text': '1879-21'}

	1882 Spring

	{'@encoding': 'edtf', '@keyDate': 'yes', '#text': '1882-21'}

	1888 Spring

	{'@encoding': 'edtf', '@keyDate': 'yes', '#text': '1888-21'}

	1889 Spring

	{'@encoding': 'edtf', '@keyDate': 'yes', '#text': '1889-21'}

	1890 Spring

	{'@encoding': 'edtf', '@keyDate': 'yes', '#text': '1890-21'}

	1891 Spring

	{'@encoding': 'edtf', '@keyDate': 'yes', '#text': '1891-21'}

	1892 Spring

	{'@encoding': 'edtf', '@keyDate': 'yes', '#text': '1892-21'}

	1893 Spring

	{'@encoding': 'edtf', '@keyDate': 'yes', '#text': '1893-21'}

	1894 Spring

	{'@encoding': 'edtf', '@keyDate': 'yes', '#text': '1894-21'}

	1895 Spring

	{'@encoding': 'edtf', '@keyDate': 'yes', '#text': '1895-21'}

	1896 Spring

	{'@encoding': 'edtf', '@keyDate': 'yes', '#text': '1896-21'}

	1897 Spring

	{'@encoding': 'edtf', '@keyDate': 'yes', '#text': '1897-21'}

	1898 Spring

	{'@encoding': 'edtf', '@keyDate': 'yes', '#text': '1898-21'}

	1899 Spring

	{'@encoding': 'edtf', '@keyDate': 'yes', '#text': '1899-21'}

	1900 Spring

	{'@encoding': 'edtf', '@keyDate': 'yes', '#text': '1900-21'}

	1901 Spring

	{'@encoding': 'edtf', '@keyDate': 'yes', '#text': '1901-21'}

	1902 Spring

	{'@encoding': 'edtf', '@keyDate': 'yes', '#text': '1902-21'}

	1903 Spring

	{'@encoding': 'edtf', '@keyDate': 'yes', '#text': '1903-21'}

	1904 Spring

	{'@encoding': 'edtf', '@keyDate': 'yes', '#text': '1904-21'}

	1905 Spring

	{'@encoding': 'edtf', '@keyDate': 'yes', '#text': '1905-21'}

	1906 Spring

	{'@encoding': 'edtf', '@keyDate': 'yes', '#text': '1906-21'}

	1907 Spring

	{'@encoding': 'edtf', '@keyDate': 'yes', '#text': '1907-21'}

	1908 Spring

	{'@encoding': 'edtf', '@keyDate': 'yes', '#text': '1908-21'}

	1909 Spring

	{'@encoding': 'edtf', '@keyDate': 'yes', '#text': '1909-21'}

	1910 Spring

	{'@encoding': 'edtf', '@keyDate': 'yes', '#text': '1910-21'}

	1911 Spring

	{'@encoding': 'edtf', '@keyDate': 'yes', '#text': '1911-21'}

	1912 Spring

	{'@encoding': 'edtf', '@keyDate': 'yes', '#text': '1912-21'}

	1913 Spring

	{'@encoding': 'edtf', '@keyDate': 'yes', '#text': '1913-21'}

	1914 Spring

	{'@encoding': 'edtf', '@keyDate': 'yes', '#text': '1914-21'}

	1918 Spring

	{'@encoding': 'edtf', '@keyDate': 'yes', '#text': '1918-21'}

	1919 Spring

	{'@encoding': 'edtf', '@keyDate': 'yes', '#text': '1919-21'}

	1924 Spring

	{'@encoding': 'edtf', '@keyDate': 'yes', '#text': '1924-21'}

	1925 Spring

	{'@encoding': 'edtf', '@keyDate': 'yes', '#text': '1925-21'}

	1926 Spring

	{'@encoding': 'edtf', '@keyDate': 'yes', '#text': '1926-21'}

	1927 Summer

	{'@encoding': 'edtf', '@keyDate': 'yes', '#text': '1927-22'}

	1927 Spring

	{'@encoding': 'edtf', '@keyDate': 'yes', '#text': '1927-21'}

	1928 Spring

	{'@encoding': 'edtf', '@keyDate': 'yes', '#text': '1928-21'}

	1928 Summer

	{'@encoding': 'edtf', '@keyDate': 'yes', '#text': '1928-22'}

	1929 Spring

	{'@encoding': 'edtf', '@keyDate': 'yes', '#text': '1929-21'}

	1929 Summer

	{'@encoding': 'edtf', '@keyDate': 'yes', '#text': '1929-22'}

	1930 Spring

	{'@encoding': 'edtf', '@keyDate': 'yes', '#text': '1930-21'}

	1930 Summer

	{'@encoding': 'edtf', '@keyDate': 'yes', '#text': '1930-22'}

	1931 Spring

	{'@encoding': 'edtf', '@keyDate': 'yes', '#text': '1931-21'}

	1932 Spring

	{'@encoding': 'edtf', '@keyDate': 'yes', '#text': '1932-21'}

	1933 Spring

	{'@encoding': 'edtf', '@keyDate': 'yes', '#text': '1933-21'}

	1933 Summer

	{'@encoding': 'edtf', '@keyDate': 'yes', '#text': '1933-22'}

	1934 Spring

	{'@encoding': 'edtf', '@keyDate': 'yes', '#text': '1934-21'}

	1934 Summer

	{'@encoding': 'edtf', '@keyDate': 'yes', '#text': '1934-22'}

	1935 Spring

	{'@encoding': 'edtf', '@keyDate': 'yes', '#text': '1935-21'}

	1935 Summer

	{'@encoding': 'edtf', '@keyDate': 'yes', '#text': '1935-22'}

	1936 Spring

	{'@encoding': 'edtf', '@keyDate': 'yes', '#text': '1936-21'}

	1936 Summer

	{'@encoding': 'edtf', '@keyDate': 'yes', '#text': '1936-22'}

	1937 Spring

	{'@encoding': 'edtf', '@keyDate': 'yes', '#text': '1937-21'}

	1937 Summer

	{'@encoding': 'edtf', '@keyDate': 'yes', '#text': '1937-22'}

	1938 Spring

	{'@encoding': 'edtf', '@keyDate': 'yes', '#text': '1938-21'}

	1938 Summer

	{'@encoding': 'edtf', '@keyDate': 'yes', '#text': '1938-22'}

	1939 Spring

	{'@encoding': 'edtf', '@keyDate': 'yes', '#text': '1939-21'}

	1939 Summer

	{'@encoding': 'edtf', '@keyDate': 'yes', '#text': '1939-22'}

	1940 Spring

	{'@encoding': 'edtf', '@keyDate': 'yes', '#text': '1940-21'}

	1940 Summer

	{'@encoding': 'edtf', '@keyDate': 'yes', '#text': '1940-22'}

	1941 Spring

	{'@encoding': 'edtf', '@keyDate': 'yes', '#text': '1941-21'}

	1941 Summer

	{'@encoding': 'edtf', '@keyDate': 'yes', '#text': '1941-22'}

	1942 Spring

	{'@encoding': 'edtf', '@keyDate': 'yes', '#text': '1942-21'}

	1942 Summer

	{'@encoding': 'edtf', '@keyDate': 'yes', '#text': '1942-22'}

	1943 Fall

	{'@encoding': 'edtf', '@keyDate': 'yes', '#text': '1943-23'}

	1943 Summer

	{'@encoding': 'edtf', '@keyDate': 'yes', '#text': '1943-22'}

	1943 Winter

	{'@encoding': 'edtf', '@keyDate': 'yes', '#text': '1943-24'}

	1944 Fall

	{'@encoding': 'edtf', '@keyDate': 'yes', '#text': '1944-23'}

	1944 Spring

	{'@encoding': 'edtf', '@keyDate': 'yes', '#text': '1944-21'}

	1944 Summer

	{'@encoding': 'edtf', '@keyDate': 'yes', '#text': '1944-22'}

	1944 Winter

	{'@encoding': 'edtf', '@keyDate': 'yes', '#text': '1944-24'}

	1945 Fall

	{'@encoding': 'edtf', '@keyDate': 'yes', '#text': '1945-23'}

	1945 Spring

	{'@encoding': 'edtf', '@keyDate': 'yes', '#text': '1945-21'}

	1945 Summer

	{'@encoding': 'edtf', '@keyDate': 'yes', '#text': '1945-22'}

	1945 Winter

	{'@encoding': 'edtf', '@keyDate': 'yes', '#text': '1945-24'}

	1946 Spring

	{'@encoding': 'edtf', '@keyDate': 'yes', '#text': '1946-21'}

	1946 Summer

	{'@encoding': 'edtf', '@keyDate': 'yes', '#text': '1946-22'}

	1947 Spring

	{'@encoding': 'edtf', '@keyDate': 'yes', '#text': '1947-21'}

	1948 Fall

	{'@encoding': 'edtf', '@keyDate': 'yes', '#text': '1948-23'}

	1948 Summer

	{'@encoding': 'edtf', '@keyDate': 'yes', '#text': '1948-22'}

	1948 Spring

	{'@encoding': 'edtf', '@keyDate': 'yes', '#text': '1948-21'}

	1949 Winter

	{'@encoding': 'edtf', '@keyDate': 'yes', '#text': '1949-24'}

	1949 Spring

	{'@encoding': 'edtf', '@keyDate': 'yes', '#text': '1949-21'}

	1949 Summer

	{'@encoding': 'edtf', '@keyDate': 'yes', '#text': '1949-22'}

	1949 Fall

	{'@encoding': 'edtf', '@keyDate': 'yes', '#text': '1949-23'}

	1950 Fall

	{'@encoding': 'edtf', '@keyDate': 'yes', '#text': '1950-23'}

	1950 Spring

	{'@encoding': 'edtf', '@keyDate': 'yes', '#text': '1950-21'}

	1950 Summer

	{'@encoding': 'edtf', '@keyDate': 'yes', '#text': '1950-22'}

	1950 Winter

	{'@encoding': 'edtf', '@keyDate': 'yes', '#text': '1950-24'}

	1951 Fall

	{'@encoding': 'edtf', '@keyDate': 'yes', '#text': '1951-23'}

	1951 Spring

	{'@encoding': 'edtf', '@keyDate': 'yes', '#text': '1951-21'}

	1951 Summer

	{'@encoding': 'edtf', '@keyDate': 'yes', '#text': '1951-22'}

	1951 Winter

	{'@encoding': 'edtf', '@keyDate': 'yes', '#text': '1951-24'}

	1952 Fall

	{'@encoding': 'edtf', '@keyDate': 'yes', '#text': '1952-23'}

	1952 Spring

	{'@encoding': 'edtf', '@keyDate': 'yes', '#text': '1952-21'}

	1952 Summer

	{'@encoding': 'edtf', '@keyDate': 'yes', '#text': '1952-22'}

	1952 Winter

	{'@encoding': 'edtf', '@keyDate': 'yes', '#text': '1952-24'}

	1953 Fall

	{'@encoding': 'edtf', '@keyDate': 'yes', '#text': '1953-23'}

	1953 Spring

	{'@encoding': 'edtf', '@keyDate': 'yes', '#text': '1953-21'}

	1953 Summer

	{'@encoding': 'edtf', '@keyDate': 'yes', '#text': '1953-22'}

	1953 Winter

	{'@encoding': 'edtf', '@keyDate': 'yes', '#text': '1953-24'}

	1954 Fall

	{'@encoding': 'edtf', '@keyDate': 'yes', '#text': '1954-23'}

	1954 Spring

	{'@encoding': 'edtf', '@keyDate': 'yes', '#text': '1954-21'}

	1954 Summer

	{'@encoding': 'edtf', '@keyDate': 'yes', '#text': '1954-22'}

	1954 Winter

	{'@encoding': 'edtf', '@keyDate': 'yes', '#text': '1954-24'}

	1955 Fall

	{'@encoding': 'edtf', '@keyDate': 'yes', '#text': '1955-23'}

	1955 Spring

	{'@encoding': 'edtf', '@keyDate': 'yes', '#text': '1955-21'}

	1955 Summer

	{'@encoding': 'edtf', '@keyDate': 'yes', '#text': '1955-22'}

	1955 Winter

	{'@encoding': 'edtf', '@keyDate': 'yes', '#text': '1955-24'}

	1956 Fall

	{'@encoding': 'edtf', '@keyDate': 'yes', '#text': '1956-23'}

	1956 Spring

	{'@encoding': 'edtf', '@keyDate': 'yes', '#text': '1956-21'}

	1956 Summer

	{'@encoding': 'edtf', '@keyDate': 'yes', '#text': '1956-22'}

	1956 Winter

	{'@encoding': 'edtf', '@keyDate': 'yes', '#text': '1956-24'}

	1957 Fall

	{'@encoding': 'edtf', '@keyDate': 'yes', '#text': '1957-23'}

	1957 Spring

	{'@encoding': 'edtf', '@keyDate': 'yes', '#text': '1957-21'}

	1957 Summer

	{'@encoding': 'edtf', '@keyDate': 'yes', '#text': '1957-22'}

	1957 Winter

	{'@encoding': 'edtf', '@keyDate': 'yes', '#text': '1957-24'}

	1958 Fall

	{'@encoding': 'edtf', '@keyDate': 'yes', '#text': '1958-23'}

	1958 Spring

	{'@encoding': 'edtf', '@keyDate': 'yes', '#text': '1958-21'}

	1958 Summer

	{'@encoding': 'edtf', '@keyDate': 'yes', '#text': '1958-22'}

	1958 Winter

	{'@encoding': 'edtf', '@keyDate': 'yes', '#text': '1958-24'}

	1959 Fall

	{'@encoding': 'edtf', '@keyDate': 'yes', '#text': '1959-23'}

	1959 Spring

	{'@encoding': 'edtf', '@keyDate': 'yes', '#text': '1959-21'}

	1959 Summer

	{'@encoding': 'edtf', '@keyDate': 'yes', '#text': '1959-22'}

	1959 Winter

	{'@encoding': 'edtf', '@keyDate': 'yes', '#text': '1959-24'}

	1960 Fall

	{'@encoding': 'edtf', '@keyDate': 'yes', '#text': '1960-23'}

	1960 Spring

	{'@encoding': 'edtf', '@keyDate': 'yes', '#text': '1960-21'}

	1960 Summer

	{'@encoding': 'edtf', '@keyDate': 'yes', '#text': '1960-22'}

	1960 Winter

	{'@encoding': 'edtf', '@keyDate': 'yes', '#text': '1960-24'}

	1961 Fall

	{'@encoding': 'edtf', '@keyDate': 'yes', '#text': '1961-23'}

	1961 Spring

	{'@encoding': 'edtf', '@keyDate': 'yes', '#text': '1961-21'}

	1961 Summer

	{'@encoding': 'edtf', '@keyDate': 'yes', '#text': '1961-22'}

	1961 Winter

	{'@encoding': 'edtf', '@keyDate': 'yes', '#text': '1961-24'}

	1962 Fall

	{'@encoding': 'edtf', '@keyDate': 'yes', '#text': '1962-23'}

	1962 Spring

	{'@encoding': 'edtf', '@keyDate': 'yes', '#text': '1962-21'}

	1962 Summer

	{'@encoding': 'edtf', '@keyDate': 'yes', '#text': '1962-22'}

	1962 Winter

	{'@encoding': 'edtf', '@keyDate': 'yes', '#text': '1962-24'}

	1963 Fall

	{'@encoding': 'edtf', '@keyDate': 'yes', '#text': '1963-23'}

	1963 Spring

	{'@encoding': 'edtf', '@keyDate': 'yes', '#text': '1963-21'}

	1963 Summer

	{'@encoding': 'edtf', '@keyDate': 'yes', '#text': '1963-22'}

	1963 Winter

	{'@encoding': 'edtf', '@keyDate': 'yes', '#text': '1963-24'}

	1964 Fall

	{'@encoding': 'edtf', '@keyDate': 'yes', '#text': '1964-23'}

	1964 Spring

	{'@encoding': 'edtf', '@keyDate': 'yes', '#text': '1964-21'}

	1964 Summer

	{'@encoding': 'edtf', '@keyDate': 'yes', '#text': '1964-22'}

	1964 Winter

	{'@encoding': 'edtf', '@keyDate': 'yes', '#text': '1964-24'}

	1965 Fall

	{'@encoding': 'edtf', '@keyDate': 'yes', '#text': '1965-23'}

	1965 Spring

	{'@encoding': 'edtf', '@keyDate': 'yes', '#text': '1965-21'}

	1965 Summer

	{'@encoding': 'edtf', '@keyDate': 'yes', '#text': '1965-22'}

	1965 Winter

	{'@encoding': 'edtf', '@keyDate': 'yes', '#text': '1965-24'}

	1966 Fall

	{'@encoding': 'edtf', '@keyDate': 'yes', '#text': '1966-23'}

	1966 Spring

	{'@encoding': 'edtf', '@keyDate': 'yes', '#text': '1966-21'}

	1966 Summer

	{'@encoding': 'edtf', '@keyDate': 'yes', '#text': '1966-22'}

	1966 Winter

	{'@encoding': 'edtf', '@keyDate': 'yes', '#text': '1966-24'}

	1967 Fall

	{'@encoding': 'edtf', '@keyDate': 'yes', '#text': '1967-23'}

	1967 Spring

	{'@encoding': 'edtf', '@keyDate': 'yes', '#text': '1967-21'}

	1967 Summer

	{'@encoding': 'edtf', '@keyDate': 'yes', '#text': '1967-22'}

	1967 Winter

	{'@encoding': 'edtf', '@keyDate': 'yes', '#text': '1967-24'}

	1968 Fall

	{'@encoding': 'edtf', '@keyDate': 'yes', '#text': '1968-23'}

	1968 Spring

	{'@encoding': 'edtf', '@keyDate': 'yes', '#text': '1968-21'}

	1968 Summer

	{'@encoding': 'edtf', '@keyDate': 'yes', '#text': '1968-22'}

	1968 Winter

	{'@encoding': 'edtf', '@keyDate': 'yes', '#text': '1968-24'}

	1969 Fall

	{'@encoding': 'edtf', '@keyDate': 'yes', '#text': '1969-23'}

	1969 Spring

	{'@encoding': 'edtf', '@keyDate': 'yes', '#text': '1969-21'}

	1969 Summer

	{'@encoding': 'edtf', '@keyDate': 'yes', '#text': '1969-22'}

	1969 Winter

	{'@encoding': 'edtf', '@keyDate': 'yes', '#text': '1969-24'}

	1970 Fall

	{'@encoding': 'edtf', '@keyDate': 'yes', '#text': '1970-23'}

	1970 Spring

	{'@encoding': 'edtf', '@keyDate': 'yes', '#text': '1970-21'}

	1970 Summer

	{'@encoding': 'edtf', '@keyDate': 'yes', '#text': '1970-22'}

	1970 Winter

	{'@encoding': 'edtf', '@keyDate': 'yes', '#text': '1970-24'}

	1971 Fall

	{'@encoding': 'edtf', '@keyDate': 'yes', '#text': '1971-23'}

	1971 Spring

	{'@encoding': 'edtf', '@keyDate': 'yes', '#text': '1971-21'}

	1971 Summer

	{'@encoding': 'edtf', '@keyDate': 'yes', '#text': '1971-22'}

	1971 Winter

	{'@encoding': 'edtf', '@keyDate': 'yes', '#text': '1971-24'}

	1972 Fall

	{'@encoding': 'edtf', '@keyDate': 'yes', '#text': '1972-23'}

	1972 Spring

	{'@encoding': 'edtf', '@keyDate': 'yes', '#text': '1972-21'}

	1972 Summer

	{'@encoding': 'edtf', '@keyDate': 'yes', '#text': '1972-22'}

	1972 Winter

	{'@encoding': 'edtf', '@keyDate': 'yes', '#text': '1972-24'}

	1973 Fall

	{'@encoding': 'edtf', '@keyDate': 'yes', '#text': '1973-23'}

	1973 Spring

	{'@encoding': 'edtf', '@keyDate': 'yes', '#text': '1973-21'}

	1973 Summer

	{'@encoding': 'edtf', '@keyDate': 'yes', '#text': '1973-22'}

	1973 Winter

	{'@encoding': 'edtf', '@keyDate': 'yes', '#text': '1973-24'}

	1974 Fall

	{'@encoding': 'edtf', '@keyDate': 'yes', '#text': '1974-23'}

	1974 Spring

	{'@encoding': 'edtf', '@keyDate': 'yes', '#text': '1974-21'}

	1974 Summer

	{'@encoding': 'edtf', '@keyDate': 'yes', '#text': '1974-22'}

	1974 Winter

	{'@encoding': 'edtf', '@keyDate': 'yes', '#text': '1974-24'}

	1975 Fall

	{'@encoding': 'edtf', '@keyDate': 'yes', '#text': '1975-23'}

	1975 Spring

	{'@encoding': 'edtf', '@keyDate': 'yes', '#text': '1975-21'}

	1975 Summer

	{'@encoding': 'edtf', '@keyDate': 'yes', '#text': '1975-22'}

	1975 Winter

	{'@encoding': 'edtf', '@keyDate': 'yes', '#text': '1975-24'}

	1976 Fall

	{'@encoding': 'edtf', '@keyDate': 'yes', '#text': '1976-23'}

	1976 Spring

	{'@encoding': 'edtf', '@keyDate': 'yes', '#text': '1976-21'}

	1976 Summer

	{'@encoding': 'edtf', '@keyDate': 'yes', '#text': '1976-22'}

	1976 Winter

	{'@encoding': 'edtf', '@keyDate': 'yes', '#text': '1976-24'}

	1977 Fall

	{'@encoding': 'edtf', '@keyDate': 'yes', '#text': '1977-23'}

	1977 Spring

	{'@encoding': 'edtf', '@keyDate': 'yes', '#text': '1977-21'}

	1977 Summer

	{'@encoding': 'edtf', '@keyDate': 'yes', '#text': '1977-22'}

	1977 Winter

	{'@encoding': 'edtf', '@keyDate': 'yes', '#text': '1977-24'}

	1978 Fall

	{'@encoding': 'edtf', '@keyDate': 'yes', '#text': '1978-23'}

	1978 Spring

	{'@encoding': 'edtf', '@keyDate': 'yes', '#text': '1978-21'}

	1978 Summer

	{'@encoding': 'edtf', '@keyDate': 'yes', '#text': '1978-22'}

	1978 Winter

	{'@encoding': 'edtf', '@keyDate': 'yes', '#text': '1978-24'}

	1979 Fall

	{'@encoding': 'edtf', '@keyDate': 'yes', '#text': '1979-23'}

	1979 Spring

	{'@encoding': 'edtf', '@keyDate': 'yes', '#text': '1979-21'}

	1979 Summer

	{'@encoding': 'edtf', '@keyDate': 'yes', '#text': '1979-22'}

	1979 Winter

	{'@encoding': 'edtf', '@keyDate': 'yes', '#text': '1979-24'}

	1980 Fall

	{'@encoding': 'edtf', '@keyDate': 'yes', '#text': '1980-23'}

	1980 Spring

	{'@encoding': 'edtf', '@keyDate': 'yes', '#text': '1980-21'}

	1980 Summer

	{'@encoding': 'edtf', '@keyDate': 'yes', '#text': '1980-22'}

	1980 Winter

	{'@encoding': 'edtf', '@keyDate': 'yes', '#text': '1980-24'}

	1981 Fall

	{'@encoding': 'edtf', '@keyDate': 'yes', '#text': '1981-23'}

	1981 Spring

	{'@encoding': 'edtf', '@keyDate': 'yes', '#text': '1981-21'}

	1981 Summer

	{'@encoding': 'edtf', '@keyDate': 'yes', '#text': '1981-22'}

	1981 Winter

	{'@encoding': 'edtf', '@keyDate': 'yes', '#text': '1981-24'}

	1982 Fall

	{'@encoding': 'edtf', '@keyDate': 'yes', '#text': '1982-23'}

	1982 Spring

	{'@encoding': 'edtf', '@keyDate': 'yes', '#text': '1982-21'}

	1982 Summer

	{'@encoding': 'edtf', '@keyDate': 'yes', '#text': '1982-22'}

	1982 Winter

	{'@encoding': 'edtf', '@keyDate': 'yes', '#text': '1982-24'}

	1983 Fall

	{'@encoding': 'edtf', '@keyDate': 'yes', '#text': '1983-23'}

	1983 Spring

	{'@encoding': 'edtf', '@keyDate': 'yes', '#text': '1983-21'}

	1983 Summer

	{'@encoding': 'edtf', '@keyDate': 'yes', '#text': '1983-22'}

	1983 Winter

	{'@encoding': 'edtf', '@keyDate': 'yes', '#text': '1983-24'}

	1984 Fall

	{'@encoding': 'edtf', '@keyDate': 'yes', '#text': '1984-23'}

	1984 Spring

	{'@encoding': 'edtf', '@keyDate': 'yes', '#text': '1984-21'}

	1984 Summer

	{'@encoding': 'edtf', '@keyDate': 'yes', '#text': '1984-22'}

	1984 Winter

	{'@encoding': 'edtf', '@keyDate': 'yes', '#text': '1984-24'}

	1985 Fall

	{'@encoding': 'edtf', '@keyDate': 'yes', '#text': '1985-23'}

	1985 Spring

	{'@encoding': 'edtf', '@keyDate': 'yes', '#text': '1985-21'}

	1985 Summer

	{'@encoding': 'edtf', '@keyDate': 'yes', '#text': '1985-22'}

	1985 Winter

	{'@encoding': 'edtf', '@keyDate': 'yes', '#text': '1985-24'}

	1986 Fall

	{'@encoding': 'edtf', '@keyDate': 'yes', '#text': '1986-23'}

	1986 Spring

	{'@encoding': 'edtf', '@keyDate': 'yes', '#text': '1986-21'}

	1986 Summer

	{'@encoding': 'edtf', '@keyDate': 'yes', '#text': '1986-22'}

	1986 Winter

	{'@encoding': 'edtf', '@keyDate': 'yes', '#text': '1986-24'}

	1987 Fall

	{'@encoding': 'edtf', '@keyDate': 'yes', '#text': '1987-23'}

	1987 Spring

	{'@encoding': 'edtf', '@keyDate': 'yes', '#text': '1987-21'}

	1987 Summer

	{'@encoding': 'edtf', '@keyDate': 'yes', '#text': '1987-22'}

	1987 Winter

	{'@encoding': 'edtf', '@keyDate': 'yes', '#text': '1987-24'}

	1988 Fall

	{'@encoding': 'edtf', '@keyDate': 'yes', '#text': '1988-23'}

	1988 Spring

	{'@encoding': 'edtf', '@keyDate': 'yes', '#text': '1988-21'}

	1988 Summer

	{'@encoding': 'edtf', '@keyDate': 'yes', '#text': '1988-22'}

	1988 Winter

	{'@encoding': 'edtf', '@keyDate': 'yes', '#text': '1988-24'}

	1989 Fall

	{'@encoding': 'edtf', '@keyDate': 'yes', '#text': '1989-23'}

	1989 Spring

	{'@encoding': 'edtf', '@keyDate': 'yes', '#text': '1989-21'}

	1989 Summer

	{'@encoding': 'edtf', '@keyDate': 'yes', '#text': '1989-22'}

	1990 Fall

	{'@encoding': 'edtf', '@keyDate': 'yes', '#text': '1990-23'}

	1990 Spring

	{'@encoding': 'edtf', '@keyDate': 'yes', '#text': '1990-21'}

	1990 Summer

	{'@encoding': 'edtf', '@keyDate': 'yes', '#text': '1990-22'}

	1991 Fall

	{'@encoding': 'edtf', '@keyDate': 'yes', '#text': '1991-23'}

	1991 Spring

	{'@encoding': 'edtf', '@keyDate': 'yes', '#text': '1991-21'}

	1991 Summer

	{'@encoding': 'edtf', '@keyDate': 'yes', '#text': '1991-22'}

	1992 Fall

	{'@encoding': 'edtf', '@keyDate': 'yes', '#text': '1992-23'}

	1992 Spring

	{'@encoding': 'edtf', '@keyDate': 'yes', '#text': '1992-21'}

	1992 Summer

	{'@encoding': 'edtf', '@keyDate': 'yes', '#text': '1992-22'}

	1993 Fall

	{'@encoding': 'edtf', '@keyDate': 'yes', '#text': '1993-23'}

	1993 Spring

	{'@encoding': 'edtf', '@keyDate': 'yes', '#text': '1993-21'}

	1993 Summer

	{'@encoding': 'edtf', '@keyDate': 'yes', '#text': '1993-22'}

	1994 Fall

	{'@encoding': 'edtf', '@keyDate': 'yes', '#text': '1994-23'}

	1994 Spring

	{'@encoding': 'edtf', '@keyDate': 'yes', '#text': '1994-21'}

	1994 Summer

	{'@encoding': 'edtf', '@keyDate': 'yes', '#text': '1994-22'}

	1995 Fall

	{'@encoding': 'edtf', '@keyDate': 'yes', '#text': '1995-23'}

	1995 Spring

	{'@encoding': 'edtf', '@keyDate': 'yes', '#text': '1995-21'}

	1995 Summer

	{'@encoding': 'edtf', '@keyDate': 'yes', '#text': '1995-22'}

	1996 Fall

	{'@encoding': 'edtf', '@keyDate': 'yes', '#text': '1996-23'}

	1996 Spring

	{'@encoding': 'edtf', '@keyDate': 'yes', '#text': '1996-21'}

	1996 Summer

	{'@encoding': 'edtf', '@keyDate': 'yes', '#text': '1996-22'}

	1997 Fall

	{'@encoding': 'edtf', '@keyDate': 'yes', '#text': '1997-23'}

	1997 Spring

	{'@encoding': 'edtf', '@keyDate': 'yes', '#text': '1997-21'}

	1997 Summer

	{'@encoding': 'edtf', '@keyDate': 'yes', '#text': '1997-22'}

	1998 Fall

	{'@encoding': 'edtf', '@keyDate': 'yes', '#text': '1998-23'}

	1998 Spring

	{'@encoding': 'edtf', '@keyDate': 'yes', '#text': '1998-21'}

	1998 Summer

	{'@encoding': 'edtf', '@keyDate': 'yes', '#text': '1998-22'}

	1999 Fall

	{'@encoding': 'edtf', '@keyDate': 'yes', '#text': '1999-23'}

	1999 Spring

	{'@encoding': 'edtf', '@keyDate': 'yes', '#text': '1999-21'}

	1999 Summer

	{'@encoding': 'edtf', '@keyDate': 'yes', '#text': '1999-22'}

	2000 Fall

	{'@encoding': 'edtf', '@keyDate': 'yes', '#text': '2000-23'}

	2000 Spring

	{'@encoding': 'edtf', '@keyDate': 'yes', '#text': '2000-21'}

	2000 Summer

	{'@encoding': 'edtf', '@keyDate': 'yes', '#text': '2000-22'}

	2001 Fall

	{'@encoding': 'edtf', '@keyDate': 'yes', '#text': '2001-23'}

	2001 Spring

	{'@encoding': 'edtf', '@keyDate': 'yes', '#text': '2001-21'}

	2001 Summer

	{'@encoding': 'edtf', '@keyDate': 'yes', '#text': '2001-22'}

	2002 Fall

	{'@encoding': 'edtf', '@keyDate': 'yes', '#text': '2002-23'}

	2002 Spring

	{'@encoding': 'edtf', '@keyDate': 'yes', '#text': '2002-21'}

	2003 Fall

	{'@encoding': 'edtf', '@keyDate': 'yes', '#text': '2003-23'}

	2003 Spring

	{'@encoding': 'edtf', '@keyDate': 'yes', '#text': '2003-21'}

	2004 Fall

	{'@encoding': 'edtf', '@keyDate': 'yes', '#text': '2004-23'}

	2004 Spring

	{'@encoding': 'edtf', '@keyDate': 'yes', '#text': '2004-21'}

	2005 Fall

	{'@encoding': 'edtf', '@keyDate': 'yes', '#text': '2005-23'}

	2005 Spring

	{'@encoding': 'edtf', '@keyDate': 'yes', '#text': '2005-21'}

	2006 Fall

	{'@encoding': 'edtf', '@keyDate': 'yes', '#text': '2006-23'}

	2006 Spring

	{'@encoding': 'edtf', '@keyDate': 'yes', '#text': '2006-21'}

	2007 Fall

	{'@encoding': 'edtf', '@keyDate': 'yes', '#text': '2007-23'}

	2007 Spring

	{'@encoding': 'edtf', '@keyDate': 'yes', '#text': '2007-21'}

	2008 Fall

	{'@encoding': 'edtf', '@keyDate': 'yes', '#text': '2008-23'}

	2008 Spring

	{'@encoding': 'edtf', '@keyDate': 'yes', '#text': '2008-21'}

	2009 Fall

	{'@encoding': 'edtf', '@keyDate': 'yes', '#text': '2009-23'}

	2009 Spring

	{'@encoding': 'edtf', '@keyDate': 'yes', '#text': '2009-21'}

	2010 Fall

	{'@encoding': 'edtf', '@keyDate': 'yes', '#text': '2010-23'}

	2011 Fall

	{'@encoding': 'edtf', '@keyDate': 'yes', '#text': '2011-23'}

	2011 Spring

	{'@encoding': 'edtf', '@keyDate': 'yes', '#text': '2011-21'}

	2012 Fall

	{'@encoding': 'edtf', '@keyDate': 'yes', '#text': '2012-23'}

	2012 Spring

	{'@encoding': 'edtf', '@keyDate': 'yes', '#text': '2012-21'}

	2013 Fall

	{'@encoding': 'edtf', '@keyDate': 'yes', '#text': '2013-23'}

	1925

	{'@encoding': 'edtf', '@keyDate': 'yes', '#text': '1925'}

	1871?

	{'@encoding': 'edtf', '@keyDate': 'yes', '@qualifier': 'questionable', '#text': '1871'}

	1917?

	{'@encoding': 'edtf', '@keyDate': 'yes', '@qualifier': 'questionable', '#text': '1917'}

	1885

	{'@encoding': 'edtf', '@keyDate': 'yes', '#text': '1885'}

	early 1900s

	{'@encoding': 'edtf', '@keyDate': 'yes', '@qualifier': 'approximate', '#text': '1900'}

	1888

	{'@encoding': 'edtf', '@keyDate': 'yes', '#text': '1888'}

	{'@encoding': 'edtf', '@keyDate': 'yes', '#text': '1910'}

	1891

	{'@encoding': 'edtf', '@keyDate': 'yes', '#text': '1891'}

	1901

	{'@encoding': 'edtf', '@keyDate': 'yes', '#text': '1901'}

	1923

	{'@encoding': 'edtf', '@keyDate': 'yes', '#text': '1923'}

	1916

	{'@encoding': 'edtf', '@keyDate': 'yes', '#text': '1916'}

	1869-1870

	{'@encoding': 'edtf', '@keyDate': 'yes', '#text': '1869'}

	ca. 1875

	{'@encoding': 'edtf', '@keyDate': 'yes', '@qualifier': 'approximate', '#text': '1875'}

	ca. 1868

	{'@encoding': 'edtf', '@keyDate': 'yes', '@qualifier': 'approximate', '#text': '1868'}

	1936

	{'@encoding': 'edtf', '@keyDate': 'yes', '#text': '1936'}

	1842

	{'@encoding': 'edtf', '@keyDate': 'yes', '#text': '1842'}

	1921

	{'@encoding': 'edtf', '@keyDate': 'yes', '#text': '1921'}

	ca. 1795

	{'@encoding': 'edtf', '@keyDate': 'yes', '@qualifier': 'approximate', '#text': '1795'}

	1915

	{'@encoding': 'edtf', '@keyDate': 'yes', '#text': '1915'}

	ca. 1850

	{'@encoding': 'edtf', '@keyDate': 'yes', '@qualifier': 'approximate', '#text': '1850'}

	1896

	{'@encoding': 'edtf', '@keyDate': 'yes', '#text': '1896'}

	1851

	{'@encoding': 'edtf', '@keyDate': 'yes', '#text': '1851'}

	1847

	{'@encoding': 'edtf', '@keyDate': 'yes', '#text': '1847'}

	ca. 1915

	{'@encoding': 'edtf', '@keyDate': 'yes', '@qualifier': 'approximate', '#text': '1915'}

	ca. 1819-1824

	{'@encoding': 'edtf', '@keyDate': 'yes', '@qualifier': 'approximate', '#text': '1819'}

	1833-1835

	{'@encoding': 'edtf', '@keyDate': 'yes', '#text': '1833'}

	ca. 1890

	{'@encoding': 'edtf', '@keyDate': 'yes', '@qualifier': 'approximate', '#text': '1890'}

	pre-1900

	{'@encoding': 'edtf', '@keyDate': 'yes', '@qualifier': 'inferred', '#text': '1700'}

	ca. 1910

	{'@encoding': 'edtf', '@keyDate': 'yes', '@qualifier': 'approximate', '#text': '1910'}

	ca. 1901

	{'@encoding': 'edtf', '@keyDate': 'yes', '@qualifier': 'approximate', '#text': '1901'}

	Unknown

	{'@encoding': 'edtf', '@keyDate': 'yes', '@qualifier': 'inferred', '#text': '1870'}

	1905-1910

	{'@encoding': 'edtf', '@keyDate': 'yes', '#text': '1905'}

	ca. 1905

	{'@encoding': 'edtf', '@keyDate': 'yes', '@qualifier': 'approximate', '#text': '1905'}

	{'@encoding': 'edtf', '@keyDate': 'yes', '@qualifier': 'inferred', '#text': '1902'}

	1786

	{'@encoding': 'edtf', '@keyDate': 'yes', '#text': '1786'}

	1808

	{'@encoding': 'edtf', '@keyDate': 'yes', '#text': '1808'}

	1904

	{'@encoding': 'edtf', '@keyDate': 'yes', '#text': '1904'}

	1924?

	{'@encoding': 'edtf', '@keyDate': 'yes', '@qualifier': 'questionable', '#text': '1924'}

	1834?

	{'@encoding': 'edtf', '@keyDate': 'yes', '@qualifier': 'questionable', '#text': '1834'}

	{'@encoding': 'edtf', '@keyDate': 'yes', '#text': '1900'}

	1856

	{'@encoding': 'edtf', '@keyDate': 'yes', '#text': '1856'}

	1793

	{'@encoding': 'edtf', '@keyDate': 'yes', '#text': '1793'}

	ca. 1900

	1886

	{'@encoding': 'edtf', '@keyDate': 'yes', '#text': '1886'}

	1842?

	{'@encoding': 'edtf', '@keyDate': 'yes', '@qualifier': 'questionable', '#text': '1842'}

	1794

	{'@encoding': 'edtf', '@keyDate': 'yes', '#text': '1794'}

	1874-1877

	{'@encoding': 'edtf', '@keyDate': 'yes', '#text': '1874'}

	1802

	{'@encoding': 'edtf', '@keyDate': 'yes', '#text': '1802'}

	pre-1910

	{'@encoding': 'edtf', '@keyDate': 'yes', '@qualifier': 'questionable', '#text': '1700'}

	perhaps as early as the 1860s

	{'@encoding': 'edtf', '@keyDate': 'yes', '@qualifier': 'questionable', '#text': '1860'}

	1850

	{'@encoding': 'edtf', '@keyDate': 'yes', '#text': '1850'}

	1877

	{'@encoding': 'edtf', '@keyDate': 'yes', '#text': '1877'}

	1920s?

	{'@encoding': 'edtf', '@keyDate': 'yes', '@qualifier': 'questionable', '#text': '1920'}

	prior to 1860

	1930s

	{'@encoding': 'edtf', '@keyDate': 'yes', '@qualifier': 'inferred', '#text': '1800'}

	ca. 1920

	{'@encoding': 'edtf', '@keyDate': 'yes', '@qualifier': 'approximate', '#text': '1920'}

	1850s

	1887

	{'@encoding': 'edtf', '@keyDate': 'yes', '#text': '1887'}

	1902

	{'@encoding': 'edtf', '@keyDate': 'yes', '#text': '1902'}

	1840s-1870s

	{'@encoding': 'edtf', '@keyDate': 'yes', '#text': '1840'}

	about 1930

	{'@encoding': 'edtf', '@keyDate': 'yes', '@qualifier': 'approximate', '#text': '1930'}

	before 1890

	19th century

	{'@encoding': 'edtf', '@keyDate': 'yes', '@qualifier': 'approximate', '#text': '1800'}

	1895

	{'@encoding': 'edtf', '@keyDate': 'yes', '#text': '1895'}

	ca. 1876

	{'@encoding': 'edtf', '@keyDate': 'yes', '@qualifier': 'approximate', '#text': '1876'}

	ca. 1916-1917

	{'@encoding': 'edtf', '@keyDate': 'yes', '@qualifier': 'approximate', '#text': '1916'}

	1931?

	{'@encoding': 'edtf', '@keyDate': 'yes', '@qualifier': 'questionable', '#text': '1931'}

	1926

	{'@encoding': 'edtf', '@keyDate': 'yes', '#text': '1926'}

	ca. 1900-1908

	{'@encoding': 'edtf', '@keyDate': 'yes', '@qualifier': 'inferred', '#text': '1890'}

	ca. 1874

	{'@encoding': 'edtf', '@keyDate': 'yes', '@qualifier': 'approximate', '#text': '1874'}

	ca. 1870

	{'@encoding': 'edtf', '@keyDate': 'yes', '@qualifier': 'approximate', '#text': '1870'}

	ca. 1914

	{'@encoding': 'edtf', '@keyDate': 'yes', '@qualifier': 'approximate', '#text': '1914'}

	1940s

	{'@encoding': 'edtf', '@keyDate': 'yes', '@qualifier': 'approximate', '#text': '1940'}

	1874

	1940s?

	{'@encoding': 'edtf', '@keyDate': 'yes', '@qualifier': 'inferred', '#text': '1940'}

	1880s

	{'@encoding': 'edtf', '@keyDate': 'yes', '@qualifier': 'approximate', '#text': '1880'}

	from 1937 to 1946

	{'@encoding': 'edtf', '@keyDate': 'yes', '#text': '1937'}

	{'@encoding': 'edtf', '@keyDate': 'yes', '#text': '1880'}

	1907

	{'@encoding': 'edtf', '@keyDate': 'yes', '#text': '1907'}

	1925?

	{'@encoding': 'edtf', '@keyDate': 'yes', '@qualifier': 'questionable', '#text': '1925'}

	ca.1900

	[1925-1967?]

	{'@encoding': 'edtf', '@keyDate': 'yes', '@point': 'end', '#text': '1967'}

	{'@encoding': 'edtf', '@keyDate': 'yes', '@point': 'start', '@qualifier': 'inferred', '#text': '1925'}

	2/12/1953

	{'@encoding': 'edtf', '@keyDate': 'yes', '#text': '1953-02-12'}

	6/15/1951

	{'@encoding': 'edtf', '@keyDate': 'yes', '#text': '1951-06-15'}

	1/7/1953

	{'@encoding': 'edtf', '@keyDate': 'yes', '#text': '1953-01-07'}

	4/1/1954

	{'@encoding': 'edtf', '@keyDate': 'yes', '#text': '1954-04-01'}

	10/1/1958

	{'@encoding': 'edtf', '@keyDate': 'yes', '#text': '1958-10-01'}

	5/8/1932

	{'@encoding': 'edtf', '@keyDate': 'yes', '#text': '1932-05-08'}

	9/1/1961

	{'@encoding': 'edtf', '@keyDate': 'yes', '#text': '1961-09-01'}

	9/30/1955

	{'@encoding': 'edtf', '@keyDate': 'yes', '#text': '1955-09-30'}

	3/1/1957

	{'@encoding': 'edtf', '@keyDate': 'yes', '#text': '1957-03-01'}

	1/1/1963

	{'@encoding': 'edtf', '@keyDate': 'yes', '#text': '1963-01-01'}

	7/29/1957

	{'@encoding': 'edtf', '@keyDate': 'yes', '#text': '1957-07-29'}

	1908

	{'@encoding': 'edtf', '@keyDate': 'yes', '#text': '1908'}

	11/1/1962

	{'@encoding': 'edtf', '@keyDate': 'yes', '#text': '1962-11-01'}

	1919

	{'@encoding': 'edtf', '@keyDate': 'yes', '#text': '1919'}

	1954

	{'@encoding': 'edtf', '@keyDate': 'yes', '#text': '1954'}

	1905

	1920

	{'@encoding': 'edtf', '@keyDate': 'yes', '#text': '1920'}

	8/6/1957

	{'@encoding': 'edtf', '@keyDate': 'yes', '#text': '1957-08-06'}

	11/18/1951

	{'@encoding': 'edtf', '@keyDate': 'yes', '#text': '1951-11-18'}

	7/14/1951

	{'@encoding': 'edtf', '@keyDate': 'yes', '#text': '1951-07-14'}

	10/1/1956

	{'@encoding': 'edtf', '@keyDate': 'yes', '#text': '1956-10-01'}

	3/19/1959

	{'@encoding': 'edtf', '@keyDate': 'yes', '#text': '1959-03-19'}

	1956

	{'@encoding': 'edtf', '@keyDate': 'yes', '#text': '1956'}

	7/17/1950

	{'@encoding': 'edtf', '@keyDate': 'yes', '#text': '1950-07-17'}

	9/19/1956

	{'@encoding': 'edtf', '@keyDate': 'yes', '#text': '1956-09-19'}

	8/1/1960

	{'@encoding': 'edtf', '@keyDate': 'yes', '#text': '1960-08-01'}

	8/15/1953

	{'@encoding': 'edtf', '@keyDate': 'yes', '#text': '1953-08-15'}

	9/1/1953

	{'@encoding': 'edtf', '@keyDate': 'yes', '#text': '1953-09-01'}

	5/1/1941

	{'@encoding': 'edtf', '@keyDate': 'yes', '#text': '1941-05-01'}

	7/4/1958

	{'@encoding': 'edtf', '@keyDate': 'yes', '#text': '1958-07-04'}

	8/4/1944

	{'@encoding': 'edtf', '@keyDate': 'yes', '#text': '1944-08-04'}

	9/1/1958

	{'@encoding': 'edtf', '@keyDate': 'yes', '#text': '1958-09-01'}

	3/16/1949

	{'@encoding': 'edtf', '@keyDate': 'yes', '#text': '1949-03-16'}

	2/19/1960

	{'@encoding': 'edtf', '@keyDate': 'yes', '#text': '1960-02-19'}

	2/20/1960

	{'@encoding': 'edtf', '@keyDate': 'yes', '#text': '1960-02-20'}

	1935

	{'@encoding': 'edtf', '@keyDate': 'yes', '#text': '1935'}

	1953

	{'@encoding': 'edtf', '@keyDate': 'yes', '#text': '1953'}

	1940

	{'@encoding': 'edtf', '@keyDate': 'yes', '#text': '1940'}

	9/1/1956

	{'@encoding': 'edtf', '@keyDate': 'yes', '#text': '1956-09-01'}

	5/15/1952

	{'@encoding': 'edtf', '@keyDate': 'yes', '#text': '1952-05-15'}

	2/5/1954

	3/21/1956

	{'@encoding': 'edtf', '@keyDate': 'yes', '#text': '1956-03-21'}

	5/1/1952

	{'@encoding': 'edtf', '@keyDate': 'yes', '#text': '1952-05-01'}

	1948

	{'@encoding': 'edtf', '@keyDate': 'yes', '#text': '1948'}

	5/26/1952

	{'@encoding': 'edtf', '@keyDate': 'yes', '#text': '1952-05-26'}

	3/8/1952

	{'@encoding': 'edtf', '@keyDate': 'yes', '#text': '1952-03-08'}

	2/1/1952

	{'@encoding': 'edtf', '@keyDate': 'yes', '#text': '1952-02-01'}

	3/10/1952

	{'@encoding': 'edtf', '@keyDate': 'yes', '#text': '1952-03-10'}

	4/20/1952

	{'@encoding': 'edtf', '@keyDate': 'yes', '#text': '1952-04-20'}

	5/25/1952

	{'@encoding': 'edtf', '@keyDate': 'yes', '#text': '1952-05-25'}

	4/4/1952

	{'@encoding': 'edtf', '@keyDate': 'yes', '#text': '1952-04-04'}

	2/15/1956

	{'@encoding': 'edtf', '@keyDate': 'yes', '#text': '1956-02-15'}

	8/22/1956

	{'@encoding': 'edtf', '@keyDate': 'yes', '#text': '1956-08-22'}

	2/17/1956

	{'@encoding': 'edtf', '@keyDate': 'yes', '#text': '1956-02-17'}

	8/8/1967

	{'@encoding': 'edtf', '@keyDate': 'yes', '#text': '1967-08-08'}

	7/13/1956

	{'@encoding': 'edtf', '@keyDate': 'yes', '#text': '1956-07-13'}

	1/1/1917

	{'@encoding': 'edtf', '@keyDate': 'yes', '#text': '1917-01-01'}

	4/1/1917

	{'@encoding': 'edtf', '@keyDate': 'yes', '#text': '1917-04-01'}

	7/1/1917

	{'@encoding': 'edtf', '@keyDate': 'yes', '#text': '1917-07-01'}

	10/1/1917

	{'@encoding': 'edtf', '@keyDate': 'yes', '#text': '1917-10-01'}

	1918

	{'@encoding': 'edtf', '@keyDate': 'yes', '#text': '1918'}

	7/1/1918

	{'@encoding': 'edtf', '@keyDate': 'yes', '#text': '1918-07-01'}

	1/1/1919

	{'@encoding': 'edtf', '@keyDate': 'yes', '#text': '1919-01-01'}

	4/1/1919

	{'@encoding': 'edtf', '@keyDate': 'yes', '#text': '1919-04-01'}

	7/1/1919

	{'@encoding': 'edtf', '@keyDate': 'yes', '#text': '1919-07-01'}

	1/1/1920

	{'@encoding': 'edtf', '@keyDate': 'yes', '#text': '1920-01-01'}

	10/1/1920

	{'@encoding': 'edtf', '@keyDate': 'yes', '#text': '1920-10-01'}

	4/1/1921

	{'@encoding': 'edtf', '@keyDate': 'yes', '#text': '1921-04-01'}

	7/1/1921

	{'@encoding': 'edtf', '@keyDate': 'yes', '#text': '1921-07-01'}

	10/1/1921

	{'@encoding': 'edtf', '@keyDate': 'yes', '#text': '1921-10-01'}

	7/1/1922

	{'@encoding': 'edtf', '@keyDate': 'yes', '#text': '1922-07-01'}

	4/1/1923

	{'@encoding': 'edtf', '@keyDate': 'yes', '#text': '1923-04-01'}

	7/1/1923

	{'@encoding': 'edtf', '@keyDate': 'yes', '#text': '1923-07-01'}

	1924

	{'@encoding': 'edtf', '@keyDate': 'yes', '#text': '1924'}

	4/1/1925

	{'@encoding': 'edtf', '@keyDate': 'yes', '#text': '1925-04-01'}

	1/1/1926

	{'@encoding': 'edtf', '@keyDate': 'yes', '#text': '1926-01-01'}

	4/1/1926

	{'@encoding': 'edtf', '@keyDate': 'yes', '#text': '1926-04-01'}

	1/1/1927

	{'@encoding': 'edtf', '@keyDate': 'yes', '#text': '1927-01-01'}

	3/1/1927

	{'@encoding': 'edtf', '@keyDate': 'yes', '#text': '1927-03-01'}

	1927

	{'@encoding': 'edtf', '@keyDate': 'yes', '#text': '1927'}

	1/1/1928

	{'@encoding': 'edtf', '@keyDate': 'yes', '#text': '1928-01-01'}

	1928

	{'@encoding': 'edtf', '@keyDate': 'yes', '#text': '1928'}

	5/1/1928

	{'@encoding': 'edtf', '@keyDate': 'yes', '#text': '1928-05-01'}

	7/2/1928

	{'@encoding': 'edtf', '@keyDate': 'yes', '#text': '1928-07-02'}

	11/1/1928

	{'@encoding': 'edtf', '@keyDate': 'yes', '#text': '1928-11-01'}

	1/1/1929

	{'@encoding': 'edtf', '@keyDate': 'yes', '#text': '1929-01-01'}

	1929

	{'@encoding': 'edtf', '@keyDate': 'yes', '#text': '1929'}

	7/1/1929

	{'@encoding': 'edtf', '@keyDate': 'yes', '#text': '1929-07-01'}

	5/1/1940

	{'@encoding': 'edtf', '@keyDate': 'yes', '#text': '1940-05-01'}

	2/1/1941

	{'@encoding': 'edtf', '@keyDate': 'yes', '#text': '1941-02-01'}

	1941

	{'@encoding': 'edtf', '@keyDate': 'yes', '#text': '1941'}

	1942

	{'@encoding': 'edtf', '@keyDate': 'yes', '#text': '1942'}

	7/1/1942

	{'@encoding': 'edtf', '@keyDate': 'yes', '#text': '1942-07-01'}

	1943

	{'@encoding': 'edtf', '@keyDate': 'yes', '#text': '1943'}

	7/1/1943

	{'@encoding': 'edtf', '@keyDate': 'yes', '#text': '1943-07-01'}

	1944

	{'@encoding': 'edtf', '@keyDate': 'yes', '#text': '1944'}

	1945

	{'@encoding': 'edtf', '@keyDate': 'yes', '#text': '1945'}

	1946

	{'@encoding': 'edtf', '@keyDate': 'yes', '#text': '1946'}

	1946 Autumn

	{'@encoding': 'edtf', '@keyDate': 'yes', '#text': '1946-23'}

	1947

	{'@encoding': 'edtf', '@keyDate': 'yes', '#text': '1947'}

	6/1/1947

	{'@encoding': 'edtf', '@keyDate': 'yes', '#text': '1947-06-01'}

	1949

	{'@encoding': 'edtf', '@keyDate': 'yes', '#text': '1949'}

	1949 Autumn-1950 Winter

	1950

	{'@encoding': 'edtf', '@keyDate': 'yes', '#text': '1950'}

	1951

	{'@encoding': 'edtf', '@keyDate': 'yes', '#text': '1951'}

	1952 Autumn

	1957

	{'@encoding': 'edtf', '@keyDate': 'yes', '#text': '1957'}

	1957 Autumn

	1958

	{'@encoding': 'edtf', '@keyDate': 'yes', '#text': '1958'}

	1959

	{'@encoding': 'edtf', '@keyDate': 'yes', '#text': '1959'}

	1961

	{'@encoding': 'edtf', '@keyDate': 'yes', '#text': '1961'}

	1962

	{'@encoding': 'edtf', '@keyDate': 'yes', '#text': '1962'}

	1963

	{'@encoding': 'edtf', '@keyDate': 'yes', '#text': '1963'}

	2/1/1966

	{'@encoding': 'edtf', '@keyDate': 'yes', '#text': '1966-02-01'}

	6/1/1966

	{'@encoding': 'edtf', '@keyDate': 'yes', '#text': '1966-06-01'}

	6/1/1967

	{'@encoding': 'edtf', '@keyDate': 'yes', '#text': '1967-06-01'}

	6/1/1968

	{'@encoding': 'edtf', '@keyDate': 'yes', '#text': '1968-06-01'}

	12/1/1968

	{'@encoding': 'edtf', '@keyDate': 'yes', '#text': '1968-12-01'}

	4/1/1969

	{'@encoding': 'edtf', '@keyDate': 'yes', '#text': '1969-04-01'}

	6/1/1969

	{'@encoding': 'edtf', '@keyDate': 'yes', '#text': '1969-06-01'}

	2/1/1970

	{'@encoding': 'edtf', '@keyDate': 'yes', '#text': '1970-02-01'}

	4/1/1970

	{'@encoding': 'edtf', '@keyDate': 'yes', '#text': '1970-04-01'}

	6/1/1970

	{'@encoding': 'edtf', '@keyDate': 'yes', '#text': '1970-06-01'}

	12/1/1970

	{'@encoding': 'edtf', '@keyDate': 'yes', '#text': '1970-12-01'}

	2/1/1971

	{'@encoding': 'edtf', '@keyDate': 'yes', '#text': '1971-02-01'}

	10/1/1971

	{'@encoding': 'edtf', '@keyDate': 'yes', '#text': '1971-10-01'}

	6/1/1972

	{'@encoding': 'edtf', '@keyDate': 'yes', '#text': '1972-06-01'}

	2/1/1973

	{'@encoding': 'edtf', '@keyDate': 'yes', '#text': '1973-02-01'}

	4/1/1973

	{'@encoding': 'edtf', '@keyDate': 'yes', '#text': '1973-04-01'}

	10/1/1973

	{'@encoding': 'edtf', '@keyDate': 'yes', '#text': '1973-10-01'}

	1975 Autumn

	1981 Autumn

	1983 Autumn

	1984 Autumn

	1985

	1986

	1990

	1990 Autumn

	1991 Winter

	{'@encoding': 'edtf', '@keyDate': 'yes', '#text': '1991-24'}

	1992

	1993

	1994

	1994 Autumn

	1996 Winter

	{'@encoding': 'edtf', '@keyDate': 'yes', '#text': '1996-24'}

	1996

	1996 Autumn

	1997

	1997 Autumn

	1998

	1998 Autumn

	1999

	1999 Autumn

	2000

	2001 Winter

	{'@encoding': 'edtf', '@keyDate': 'yes', '#text': '2001-24'}

	2002 Winter

	{'@encoding': 'edtf', '@keyDate': 'yes', '#text': '2002-24'}

	2002

	2003 Winter

	{'@encoding': 'edtf', '@keyDate': 'yes', '#text': '2003-24'}

	2003

	2003 Summer

	{'@encoding': 'edtf', '@keyDate': 'yes', '#text': '2003-22'}

	2003 Autumn

	2005 Winter

	{'@encoding': 'edtf', '@keyDate': 'yes', '#text': '2005-24'}

	2005

	{'@encoding': 'edtf', '@keyDate': 'yes', '#text': '2005'}

	2005 Summer

	{'@encoding': 'edtf', '@keyDate': 'yes', '#text': '2005-22'}

	2005 Autumn

	2006

	{'@encoding': 'edtf', '@keyDate': 'yes', '#text': '2006'}

	2006 Summer

	{'@encoding': 'edtf', '@keyDate': 'yes', '#text': '2006-22'}

	2006 Autumn

	2007

	{'@encoding': 'edtf', '@keyDate': 'yes', '#text': '2007'}

	2007 Autumn

	2008

	{'@encoding': 'edtf', '@keyDate': 'yes', '#text': '2008'}

	2008 Summer

	{'@encoding': 'edtf', '@keyDate': 'yes', '#text': '2008-22'}

	2008 Autumn

	2009 Winter

	{'@encoding': 'edtf', '@keyDate': 'yes', '#text': '2009-24'}

	2009

	{'@encoding': 'edtf', '@keyDate': 'yes', '#text': '2009'}

	2009 Autumn

	2010

	{'@encoding': 'edtf', '@keyDate': 'yes', '#text': '2010'}

	2011

	{'@encoding': 'edtf', '@keyDate': 'yes', '#text': '2011'}

	2012

	{'@encoding': 'edtf', '@keyDate': 'yes', '#text': '2012'}

	2012 Summer

	{'@encoding': 'edtf', '@keyDate': 'yes', '#text': '2012-22'}

	2013 Winter

	{'@encoding': 'edtf', '@keyDate': 'yes', '#text': '2013-24'}

	2013

	{'@encoding': 'edtf', '@keyDate': 'yes', '#text': '2013'}

	2014

	{'@encoding': 'edtf', '@keyDate': 'yes', '#text': '2014'}

	2014 Spring

	{'@encoding': 'edtf', '@keyDate': 'yes', '#text': '2014-21'}

	1931

	{'@encoding': 'edtf', '@keyDate': 'yes', '#text': '1931'}

	4/1/1932

	{'@encoding': 'edtf', '@keyDate': 'yes', '#text': '1932-04-01'}

	1933

	{'@encoding': 'edtf', '@keyDate': 'yes', '#text': '1933'}

	1/1/1934

	{'@encoding': 'edtf', '@keyDate': 'yes', '#text': '1934-01-01'}

	7/1/1934

	{'@encoding': 'edtf', '@keyDate': 'yes', '#text': '1934-07-01'}

	1934 Autumn

	{'@encoding': 'edtf', '@keyDate': 'yes', '#text': '1934-23'}

	1/1/1935

	{'@encoding': 'edtf', '@keyDate': 'yes', '#text': '1935-01-01'}

	9/1/1935

	{'@encoding': 'edtf', '@keyDate': 'yes', '#text': '1935-09-01'}

	1937 Winter

	{'@encoding': 'edtf', '@keyDate': 'yes', '#text': '1937-24'}

	1937

	10/1/1937

	{'@encoding': 'edtf', '@keyDate': 'yes', '#text': '1937-10-01'}

	1938

	{'@encoding': 'edtf', '@keyDate': 'yes', '#text': '1938'}

	1939

	{'@encoding': 'edtf', '@keyDate': 'yes', '#text': '1939'}

	5/1/1939

	{'@encoding': 'edtf', '@keyDate': 'yes', '#text': '1939-05-01'}

	8/1/1939

	{'@encoding': 'edtf', '@keyDate': 'yes', '#text': '1939-08-01'}

	10/1/1939

	{'@encoding': 'edtf', '@keyDate': 'yes', '#text': '1939-10-01'}

	November 5, 1979

	{'@encoding': 'edtf', '@keyDate': 'yes', '#text': '1979-11-05'}

	May 31, 1966

	{'@encoding': 'edtf', '@keyDate': 'yes', '#text': '1966-05-31'}

	May, 13, 1966

	{'@encoding': 'edtf', '@keyDate': 'yes', '#text': '1966-05-13'}

	October 1, 1966

	{'@encoding': 'edtf', '@keyDate': 'yes', '#text': '1966-10-01'}

	March 25, 1987

	{'@encoding': 'edtf', '@keyDate': 'yes', '#text': '1987-03-25'}

	May 22, 1987

	{'@encoding': 'edtf', '@keyDate': 'yes', '#text': '1987-05-22'}

	February 5, 1978

	{'@encoding': 'edtf', '@keyDate': 'yes', '#text': '1978-02-05'}

	February 7, 1978

	{'@encoding': 'edtf', '@keyDate': 'yes', '#text': '1978-02-07'}

	June 1, 1977

	{'@encoding': 'edtf', '@keyDate': 'yes', '#text': '1977-06-01'}

	June 6, 1972

	{'@encoding': 'edtf', '@keyDate': 'yes', '#text': '1972-06-06'}

	May 19, 1977

	{'@encoding': 'edtf', '@keyDate': 'yes', '#text': '1977-05-19'}

	April 18, 1977

	{'@encoding': 'edtf', '@keyDate': 'yes', '#text': '1977-04-18'}

	{'@qualifier': 'approximate', '#text': 'November-December 1978'}

	{'@qualifier': 'approximate', '@encoding': 'edtf', '@keyDate': 'yes', '@point': 'end', '#text': '1978-12'}

	{'@qualifier': 'approximate', '@encoding': 'edtf', '@keyDate': 'yes', '@point': 'start', '#text': '1978-11'}

	January 14, 1977

	{'@encoding': 'edtf', '@keyDate': 'yes', '#text': '1977-01-14'}

	October 20, 1976

	{'@encoding': 'edtf', '@keyDate': 'yes', '#text': '1976-10-20'}

	February 4, 1976

	{'@encoding': 'edtf', '@keyDate': 'yes', '#text': '1976-02-04'}

	{'@qualifier': 'approximate', '#text': 'March-August 1973'}

	{'@qualifier': 'approximate', '@encoding': 'edtf', '@keyDate': 'yes', '@point': 'end', '#text': '1973-08'}

	{'@qualifier': 'approximate', '@encoding': 'edtf', '@keyDate': 'yes', '@point': 'start', '#text': '1973-03'}

	August 23, 1975

	{'@encoding': 'edtf', '@keyDate': 'yes', '#text': '1975-08-23'}

	June 26, 1975

	{'@encoding': 'edtf', '@keyDate': 'yes', '#text': '1975-06-26'}

	June 14, 1975

	{'@encoding': 'edtf', '@keyDate': 'yes', '#text': '1975-06-14'}

	June 12, 1975

	{'@encoding': 'edtf', '@keyDate': 'yes', '#text': '1975-06-12'}

	June 6, 1975

	{'@encoding': 'edtf', '@keyDate': 'yes', '#text': '1975-06-06'}

	June 3, 1975

	{'@encoding': 'edtf', '@keyDate': 'yes', '#text': '1975-06-03'}

	April 30, 1975

	{'@encoding': 'edtf', '@keyDate': 'yes', '#text': '1975-04-30'}

	March 7, 1975

	{'@encoding': 'edtf', '@keyDate': 'yes', '#text': '1975-03-07'}

	January 26, 1975

	{'@encoding': 'edtf', '@keyDate': 'yes', '#text': '1975-01-26'}

	January 17, 1975

	{'@encoding': 'edtf', '@keyDate': 'yes', '#text': '1975-01-17'}

	February 1973

	{'@encoding': 'edtf', '@keyDate': 'yes', '#text': '1973-02'}

	December 17, 1974

	{'@encoding': 'edtf', '@keyDate': 'yes', '#text': '1974-12-17'}

	December 9, 1974

	{'@encoding': 'edtf', '@keyDate': 'yes', '#text': '1974-12-09'}

	{'@qualifier': 'approximate', '#text': 'June 1972-October 1974'}

	{'@qualifier': 'approximate', '@encoding': 'edtf', '@keyDate': 'yes', '@point': 'end', '#text': '1974-10'}

	{'@qualifier': 'approximate', '@encoding': 'edtf', '@keyDate': 'yes', '@point': 'start', '#text': '1972-06'}

	{'@qualifier': 'approximate', '#text': 'August-December 1973'}

	{'@qualifier': 'approximate', '@encoding': 'edtf', '@keyDate': 'yes', '@point': 'end', '#text': '1973-12'}

	{'@qualifier': 'approximate', '@encoding': 'edtf', '@keyDate': 'yes', '@point': 'start', '#text': '1973-08'}

	{'@qualifier': 'approximate', '#text': '1974-1976'}

	{'@qualifier': 'approximate', '@encoding': 'edtf', '@keyDate': 'yes', '@point': 'end', '#text': '1976'}

	{'@qualifier': 'approximate', '@encoding': 'edtf', '@keyDate': 'yes', '@point': 'start', '#text': '1974'}

	{'@qualifier': 'approximate', '#text': 'July-November 1974'}

	{'@qualifier': 'approximate', '@encoding': 'edtf', '@keyDate': 'yes', '@point': 'end', '#text': '1974-11'}

	{'@qualifier': 'approximate', '@encoding': 'edtf', '@keyDate': 'yes', '@point': 'start', '#text': '1974-07'}

	September 12,1974

	{'@encoding': 'edtf', '@keyDate': 'yes', '#text': '1974-09-12'}

	September 26, 1974

	{'@encoding': 'edtf', '@keyDate': 'yes', '#text': '1974-09-26'}

	September 10, 1974

	{'@encoding': 'edtf', '@keyDate': 'yes', '#text': '1974-09-10'}

	July 26, 1974

	{'@encoding': 'edtf', '@keyDate': 'yes', '#text': '1974-07-26'}

	July 25, 1974

	{'@encoding': 'edtf', '@keyDate': 'yes', '#text': '1974-07-25'}

	June 26, 1974

	{'@encoding': 'edtf', '@keyDate': 'yes', '#text': '1974-06-26'}

	June 20, 1974

	{'@encoding': 'edtf', '@keyDate': 'yes', '#text': '1974-06-20'}

	June 12, 1974

	{'@encoding': 'edtf', '@keyDate': 'yes', '#text': '1974-06-12'}

	June 2, 1974

	{'@encoding': 'edtf', '@keyDate': 'yes', '#text': '1974-06-02'}

	{'@qualifier': 'approximate', '#text': '1960-1990'}

	{'@qualifier': 'approximate', '@encoding': 'edtf', '@keyDate': 'yes', '@point': 'end', '#text': '1990'}

	{'@qualifier': 'approximate', '@encoding': 'edtf', '@keyDate': 'yes', '@point': 'start', '#text': '1960'}

	May 2, 1974

	{'@encoding': 'edtf', '@keyDate': 'yes', '#text': '1974-05-02'}

	April 10, 1974

	{'@encoding': 'edtf', '@keyDate': 'yes', '#text': '1974-04-10'}

	{'@qualifier': 'approximate', '#text': 'September-October 1974'}

	{'@qualifier': 'approximate', '@encoding': 'edtf', '@keyDate': 'yes', '@point': 'start', '#text': '1974-09'}

	February 28, 1974

	{'@encoding': 'edtf', '@keyDate': 'yes', '#text': '1974-02-28'}

	February 8, 1974

	{'@encoding': 'edtf', '@keyDate': 'yes', '#text': '1974-02-08'}

	December 20, 1973

	{'@encoding': 'edtf', '@keyDate': 'yes', '#text': '1973-12-20'}

	November 1973

	{'@encoding': 'edtf', '@keyDate': 'yes', '#text': '1973-11'}

	November 19, 1973

	{'@encoding': 'edtf', '@keyDate': 'yes', '#text': '1973-11-19'}

	September 27, 1973

	{'@encoding': 'edtf', '@keyDate': 'yes', '#text': '1973-09-27'}

	September 19, 1973

	{'@encoding': 'edtf', '@keyDate': 'yes', '#text': '1973-09-19'}

	{'@qualifier': 'approximate', '#text': '1973'}

	{'@qualifier': 'approximate', '@encoding': 'edtf', '@keyDate': 'yes', '#text': '1973'}

	August 3, 1973

	{'@encoding': 'edtf', '@keyDate': 'yes', '#text': '1973-08-03'}

	July 29, 1973

	{'@encoding': 'edtf', '@keyDate': 'yes', '#text': '1973-07-29'}

	June 8, 1973

	{'@encoding': 'edtf', '@keyDate': 'yes', '#text': '1973-06-08'}

	July 27, 1973

	{'@encoding': 'edtf', '@keyDate': 'yes', '#text': '1973-07-27'}

	June 25, 1973

	{'@encoding': 'edtf', '@keyDate': 'yes', '#text': '1973-06-25'}

	June 24, 1973

	{'@encoding': 'edtf', '@keyDate': 'yes', '#text': '1973-06-24'}

	June 4, 1973

	{'@encoding': 'edtf', '@keyDate': 'yes', '#text': '1973-06-04'}

	May 17, 1973

	{'@encoding': 'edtf', '@keyDate': 'yes', '#text': '1973-05-17'}

	May 16, 1973

	{'@encoding': 'edtf', '@keyDate': 'yes', '#text': '1973-05-16'}

	April 10, 1973

	{'@encoding': 'edtf', '@keyDate': 'yes', '#text': '1973-04-10'}

	March 27, 1973

	{'@encoding': 'edtf', '@keyDate': 'yes', '#text': '1973-03-27'}

	March 13, 1973

	{'@encoding': 'edtf', '@keyDate': 'yes', '#text': '1973-03-13'}

	{'@qualifier': 'approximate', '#text': 'June 1972-1973'}

	March 14, 1973

	{'@encoding': 'edtf', '@keyDate': 'yes', '#text': '1973-03-14'}

	March 8, 1973

	{'@encoding': 'edtf', '@keyDate': 'yes', '#text': '1973-03-08'}

	April 18, 1972

	{'@encoding': 'edtf', '@keyDate': 'yes', '#text': '1972-04-18'}

	October 31, 1968

	{'@encoding': 'edtf', '@keyDate': 'yes', '#text': '1968-10-31'}

	{'@qualifier': 'approximate', '#text': '1967-1968'}

	{'@qualifier': 'approximate', '@encoding': 'edtf', '@keyDate': 'yes', '@point': 'end', '#text': '1968'}

	{'@qualifier': 'approximate', '@encoding': 'edtf', '@keyDate': 'yes', '@point': 'start', '#text': '1967'}

	{'@qualifier': 'approximate', '#text': 'July-December 1976'}

	{'@qualifier': 'approximate', '@encoding': 'edtf', '@keyDate': 'yes', '@point': 'end', '#text': '1976-12'}

	{'@qualifier': 'approximate', '@encoding': 'edtf', '@keyDate': 'yes', '@point': 'start', '#text': '1976-07'}

	{'@qualifier': 'approximate', '#text': 'January 1977'}

	{'@qualifier': 'approximate', '@encoding': 'edtf', '@keyDate': 'yes', '#text': '1977-01'}

	October 9, 1968

	{'@encoding': 'edtf', '@keyDate': 'yes', '#text': '1968-10-09'}

	March 8, 1975

	{'@encoding': 'edtf', '@keyDate': 'yes', '#text': '1975-03-08'}

	November 10, 1985

	{'@encoding': 'edtf', '@keyDate': 'yes', '#text': '1985-11-10'}

	September 26, 1985

	{'@encoding': 'edtf', '@keyDate': 'yes', '#text': '1985-09-26'}

	September 1985

	{'@encoding': 'edtf', '@keyDate': 'yes', '#text': '1985-11'}

	May 17, 1985

	{'@encoding': 'edtf', '@keyDate': 'yes', '#text': '1985-05-17'}

	May 15, 1985

	{'@encoding': 'edtf', '@keyDate': 'yes', '#text': '1985-05-15'}

	May 13, 1985

	{'@encoding': 'edtf', '@keyDate': 'yes', '#text': '1985-05-13'}

	May 7, 1985

	{'@encoding': 'edtf', '@keyDate': 'yes', '#text': '1985-05-07'}

	May 1, 1985

	{'@encoding': 'edtf', '@keyDate': 'yes', '#text': '1985-05-01'}

	April 28, 1985

	{'@encoding': 'edtf', '@keyDate': 'yes', '#text': '1985-04-28'}

	March 8, 1985

	{'@encoding': 'edtf', '@keyDate': 'yes', '#text': '1985-03-08'}

	June 7, 1978

	{'@encoding': 'edtf', '@keyDate': 'yes', '#text': '1978-06-07'}

	{'@qualifier': 'approximate', '#text': '1977-1978'}

	{'@qualifier': 'approximate', '@encoding': 'edtf', '@keyDate': 'yes', '@point': 'end', '#text': '1978'}

	{'@qualifier': 'approximate', '@encoding': 'edtf', '@keyDate': 'yes', '@point': 'start', '#text': '1977'}

	November 7, 1975

	{'@encoding': 'edtf', '@keyDate': 'yes', '#text': '1975-11-07'}

	September 18, 1975

	{'@encoding': 'edtf', '@keyDate': 'yes', '#text': '1975-09-18'}

	{'@qualifier': 'approximate', '#text': 'December 1977'}

	{'@qualifier': 'approximate', '@encoding': 'edtf', '@keyDate': 'yes', '#text': '1977-12'}

	January 13, 1977

	{'@encoding': 'edtf', '@keyDate': 'yes', '#text': '1977-01-13'}

	July 3, 1976

	{'@encoding': 'edtf', '@keyDate': 'yes', '#text': '1976-07-03'}

	June-July 1976

	{'@encoding': 'edtf', '@keyDate': 'yes', '#text': '1976-06/1976-07'}

	September 13, 1976

	{'@encoding': 'edtf', '@keyDate': 'yes', '#text': '1976-09-13'}

	September 17, 1976

	{'@encoding': 'edtf', '@keyDate': 'yes', '#text': '1976-09-17'}

	September 1-7, 1982

	{'@encoding': 'edtf', '@keyDate': 'yes', '#text': '1982-09-01/1982-09-07'}

	June 11, 1982

	{'@encoding': 'edtf', '@keyDate': 'yes', '#text': '1982-06-11'}

	{'@qualifier': 'approximate', '#text': 'May 1, 1982'}

	{'@qualifier': 'approximate', '@encoding': 'edtf', '@keyDate': 'yes', '#text': '1982-05-01'}

	February 12, 1982

	{'@encoding': 'edtf', '@keyDate': 'yes', '#text': '1982-02-12'}

	January 29, 1982

	{'@encoding': 'edtf', '@keyDate': 'yes', '#text': '1982-01-29'}

	{'@qualifier': 'approximate', '#text': '1980s'}

	{'@qualifier': 'approximate', '@encoding': 'edtf', '@keyDate': 'yes', '@point': 'end', '#text': '1989'}

	{'@qualifier': 'approximate', '@encoding': 'edtf', '@keyDate': 'yes', '@point': 'start', '#text': '1980'}

	November 4, 1981

	{'@encoding': 'edtf', '@keyDate': 'yes', '#text': '1981-11-04'}

	September 1981

	{'@encoding': 'edtf', '@keyDate': 'yes', '#text': '1981-09'}

	November 1979

	{'@encoding': 'edtf', '@keyDate': 'yes', '#text': '1979-11'}

	November 6-9, 1979

	{'@encoding': 'edtf', '@keyDate': 'yes', '#text': '1979-11-06/1979-11-09'}

	May 1, 1978

	{'@encoding': 'edtf', '@keyDate': 'yes', '#text': '1978-05-01'}

	July 1975

	{'@encoding': 'edtf', '@keyDate': 'yes', '#text': '1975-07'}

	May 28, 1978

	{'@encoding': 'edtf', '@keyDate': 'yes', '#text': '1978-05-28'}

	January 1978

	{'@encoding': 'edtf', '@keyDate': 'yes', '#text': '1978-01'}

	January-April 1978

	{'@encoding': 'edtf', '@keyDate': 'yes', '#text': '1978-01/1978-04'}

	January 17, 1978

	{'@encoding': 'edtf', '@keyDate': 'yes', '#text': '1978-01-17'}

	February 1978

	{'@encoding': 'edtf', '@keyDate': 'yes', '#text': '1978-02'}

	February-March 1978

	{'@encoding': 'edtf', '@keyDate': 'yes', '#text': '1978-02/1978-03'}

	September 19, 1978

	{'@encoding': 'edtf', '@keyDate': 'yes', '#text': '1978-09-19'}

	August 1978

	{'@encoding': 'edtf', '@keyDate': 'yes', '#text': '1978-08'}

	December 7, 1977

	{'@encoding': 'edtf', '@keyDate': 'yes', '#text': '1977-12-07'}

	November 10, 1977

	{'@encoding': 'edtf', '@keyDate': 'yes', '#text': '1977-11-10'}

	November 1, 1977

	{'@encoding': 'edtf', '@keyDate': 'yes', '#text': '1977-11-01'}

	October 24, 1977

	{'@encoding': 'edtf', '@keyDate': 'yes', '#text': '1977-10-24'}

	October 22, 1977

	{'@encoding': 'edtf', '@keyDate': 'yes', '#text': '1977-10-22'}

	October 1, 1977

	{'@encoding': 'edtf', '@keyDate': 'yes', '#text': '1977-10-01'}

	September 17, 1977

	{'@encoding': 'edtf', '@keyDate': 'yes', '#text': '1977-09-17'}

	September 1, 1977

	{'@encoding': 'edtf', '@keyDate': 'yes', '#text': '1977-09-01'}

	August 30, 1977

	{'@encoding': 'edtf', '@keyDate': 'yes', '#text': '1977-08-30'}

	1977-1978

	{'@encoding': 'edtf', '@keyDate': 'yes', '#text': '1977/1978'}

	January-July 1977

	{'@encoding': 'edtf', '@keyDate': 'yes', '#text': '1977-01/1977-07'}

	June 27, 1977

	{'@encoding': 'edtf', '@keyDate': 'yes', '#text': '1977-06-27'}

	June 11, 1977

	{'@encoding': 'edtf', '@keyDate': 'yes', '#text': '1977-06-11'}

	June 2, 1977

	{'@encoding': 'edtf', '@keyDate': 'yes', '#text': '1977-06-02'}

	May 1977

	{'@encoding': 'edtf', '@keyDate': 'yes', '#text': '1977-05'}

	May 21, 1977

	{'@encoding': 'edtf', '@keyDate': 'yes', '#text': '1977-05-21'}

	May 10, 1977

	{'@encoding': 'edtf', '@keyDate': 'yes', '#text': '1977-05-10'}

	April 30, 1977

	{'@encoding': 'edtf', '@keyDate': 'yes', '#text': '1977-04-30'}

	April 27, 1977

	{'@encoding': 'edtf', '@keyDate': 'yes', '#text': '1977-04-27'}

	July 1977

	{'@encoding': 'edtf', '@keyDate': 'yes', '#text': '1977-07'}

	March 12, 1977

	{'@encoding': 'edtf', '@keyDate': 'yes', '#text': '1977-03-12'}

	March 7, 1977

	{'@encoding': 'edtf', '@keyDate': 'yes', '#text': '1977-03-07'}

	March 5, 1977

	{'@encoding': 'edtf', '@keyDate': 'yes', '#text': '1977-03-05'}

	March 4, 1977

	{'@encoding': 'edtf', '@keyDate': 'yes', '#text': '1977-03-04'}

	February 1977

	{'@encoding': 'edtf', '@keyDate': 'yes', '#text': '1977-02'}

	February 5, 1977

	{'@encoding': 'edtf', '@keyDate': 'yes', '#text': '1977-02-05'}

	1977-1979

	{'@encoding': 'edtf', '@keyDate': 'yes', '#text': '1977/1979'}

	{'@qualifier': 'approximate', '#text': '1975?'}

	{'@qualifier': 'approximate', '@encoding': 'edtf', '@keyDate': 'yes', '#text': '1975'}

	September 13, 1985

	{'@encoding': 'edtf', '@keyDate': 'yes', '#text': '1985-09-13'}

	August 7, 1985

	{'@encoding': 'edtf', '@keyDate': 'yes', '#text': '1985-08-07'}

	September 23, 1976

	{'@encoding': 'edtf', '@keyDate': 'yes', '#text': '1976-09-23'}

	August 16, 1976

	{'@encoding': 'edtf', '@keyDate': 'yes', '#text': '1976-08-16'}

	June 21, 1976

	{'@encoding': 'edtf', '@keyDate': 'yes', '#text': '1976-06-21'}

	February 12, 1976

	{'@encoding': 'edtf', '@keyDate': 'yes', '#text': '1976-02-12'}

	August 5, 1985

	{'@encoding': 'edtf', '@keyDate': 'yes', '#text': '1985-08-05'}

	January 7, 1976

	{'@encoding': 'edtf', '@keyDate': 'yes', '#text': '1976-01-07'}

	January 28, 1976

	{'@encoding': 'edtf', '@keyDate': 'yes', '#text': '1976-01-28'}

	January22, 1976

	{'@encoding': 'edtf', '@keyDate': 'yes', '#text': '1976-01-22'}

	January 21, 1976

	{'@encoding': 'edtf', '@keyDate': 'yes', '#text': '1976-01-21'}

	August 2, 1985

	{'@encoding': 'edtf', '@keyDate': 'yes', '#text': '1985-08-02'}

	December 4, 1975

	{'@encoding': 'edtf', '@keyDate': 'yes', '#text': '1975-12-04'}

	December 2, 1975

	{'@encoding': 'edtf', '@keyDate': 'yes', '#text': '1975-12-02'}

	October 22, 1975

	{'@encoding': 'edtf', '@keyDate': 'yes', '#text': '1975-10-22'}

	July 31, 1985

	{'@encoding': 'edtf', '@keyDate': 'yes', '#text': '1985-07-31'}

	October 21, 1975

	{'@encoding': 'edtf', '@keyDate': 'yes', '#text': '1975-10-21'}

	October 10, 1975

	{'@encoding': 'edtf', '@keyDate': 'yes', '#text': '1975-10-10'}

	August-September 1975

	{'@encoding': 'edtf', '@keyDate': 'yes', '#text': '1975-08/1975-09'}

	June 23-26, 1985

	{'@encoding': 'edtf', '@keyDate': 'yes', '#text': '1985-06-23/1985-06-26'}

	September 16, 1975

	{'@encoding': 'edtf', '@keyDate': 'yes', '#text': '1975-09-16'}

	September 12, 1975

	{'@encoding': 'edtf', '@keyDate': 'yes', '#text': '1975-09-12'}

	September 10, 1975

	{'@encoding': 'edtf', '@keyDate': 'yes', '#text': '1975-09-10'}

	July 29, 1975

	{'@encoding': 'edtf', '@keyDate': 'yes', '#text': '1975-07-29'}

	February, 1976

	{'@encoding': 'edtf', '@keyDate': 'yes', '#text': '1976-02'}

	April 27, 1974

	{'@encoding': 'edtf', '@keyDate': 'yes', '#text': '1974-04-27'}

	{'@qualifier': 'questionable', '#text': 'September 11, 1975'}

	{'@qualifier': 'questionable', '@encoding': 'edtf', '@keyDate': 'yes', '#text': '1975-09-11'}

	{'@qualifier': 'approximate', '#text': '1975-1976'}

	{'@qualifier': 'approximate', '@encoding': 'edtf', '@keyDate': 'yes', '@point': 'start', '#text': '1975'}

	April, 1975

	{'@encoding': 'edtf', '@keyDate': 'yes', '#text': '1975-04'}

	September-October 1975

	{'@encoding': 'edtf', '@keyDate': 'yes', '#text': '1975-10-09'}

	June 13, 1975

	{'@encoding': 'edtf', '@keyDate': 'yes', '#text': '1975-06-13'}

	May 22, 1985

	{'@encoding': 'edtf', '@keyDate': 'yes', '#text': '1985-05-22'}

	1950 - 1960

	{'@encoding': 'edtf', '@keyDate': 'yes', '@point': 'end', '#text': '1960'}

	{'@encoding': 'edtf', '@keyDate': 'yes', '@point': 'start', '#text': '1950'}

	1850 - 1859

	{'@encoding': 'edtf', '@keyDate': 'yes', '@point': 'end', '#text': '1859'}

	{'@encoding': 'edtf', '@keyDate': 'yes', '@point': 'start', '#text': '1850'}

	1925 - 1930

	{'@encoding': 'edtf', '@keyDate': 'yes', '@point': 'end', '#text': '1930'}

	{'@encoding': 'edtf', '@keyDate': 'yes', '@point': 'start', '#text': '1925'}

	1912

	{'@encoding': 'edtf', '@keyDate': 'yes', '#text': '1912'}

	1930 - 1940

	{'@encoding': 'edtf', '@keyDate': 'yes', '@point': 'end', '#text': '1940'}

	{'@encoding': 'edtf', '@keyDate': 'yes', '@point': 'start', '#text': '1930'}

	1880

	07/07/96

	{'@encoding': 'edtf', '@keyDate': 'yes', '#text': '1996-07-07'}

	09/09/21

	{'@encoding': 'edtf', '@keyDate': 'yes', '#text': '1921-09-09'}

	1890 - 1912

	{'@encoding': 'edtf', '@keyDate': 'yes', '@point': 'end', '#text': '1912'}

	{'@encoding': 'edtf', '@keyDate': 'yes', '@point': 'start', '#text': '1890'}

	1900

	undated

	{'@encoding': 'edtf', '@keyDate': 'yes', '@point': 'end', '#text': '1996'}

	{'@encoding': 'edtf', '@keyDate': 'yes', '@point': 'start', '@qualifier': 'inferred', '#text': '1856'}

	1918 - 1927

	{'@encoding': 'edtf', '@keyDate': 'yes', '@point': 'end', '#text': '1927'}

	{'@encoding': 'edtf', '@keyDate': 'yes', '@point': 'start', '#text': '1918'}

	1863

	{'@encoding': 'edtf', '@keyDate': 'yes', '#text': '1863'}

	1966 - 1974

	{'@encoding': 'edtf', '@keyDate': 'yes', '@point': 'end', '#text': '1974'}

	{'@encoding': 'edtf', '@keyDate': 'yes', '@point': 'start', '#text': '1966'}

	1964 - 1967

	{'@encoding': 'edtf', '@keyDate': 'yes', '@point': 'start', '#text': '1964'}

	1926 - 1965

	{'@encoding': 'edtf', '@keyDate': 'yes', '@point': 'end', '#text': '1965'}

	{'@encoding': 'edtf', '@keyDate': 'yes', '@point': 'start', '#text': '1926'}

	1917 - 1971

	{'@encoding': 'edtf', '@keyDate': 'yes', '@point': 'end', '#text': '1971'}

	{'@encoding': 'edtf', '@keyDate': 'yes', '@point': 'start', '#text': '1917'}

	1898 - 1978

	{'@encoding': 'edtf', '@keyDate': 'yes', '@point': 'end', '#text': '1978'}

	{'@encoding': 'edtf', '@keyDate': 'yes', '@point': 'start', '#text': '1898'}

	1950 - 1959

	{'@encoding': 'edtf', '@keyDate': 'yes', '@point': 'end', '#text': '1959'}

	1913 - 1917

	{'@encoding': 'edtf', '@keyDate': 'yes', '@point': 'end', '#text': '1917'}

	{'@encoding': 'edtf', '@keyDate': 'yes', '@point': 'start', '#text': '1913'}

	1874 - 1925

	{'@encoding': 'edtf', '@keyDate': 'yes', '@point': 'end', '#text': '1925'}

	{'@encoding': 'edtf', '@keyDate': 'yes', '@point': 'start', '#text': '1874'}

	1915 - 1922

	{'@encoding': 'edtf', '@keyDate': 'yes', '@point': 'end', '#text': '1922'}

	{'@encoding': 'edtf', '@keyDate': 'yes', '@point': 'start', '#text': '1915'}

	1915 - 1924

	{'@encoding': 'edtf', '@keyDate': 'yes', '@point': 'end', '#text': '1924'}

	1906 - 1916

	{'@encoding': 'edtf', '@keyDate': 'yes', '@point': 'end', '#text': '1916'}

	{'@encoding': 'edtf', '@keyDate': 'yes', '@point': 'start', '#text': '1906'}

	06/28/63

	{'@encoding': 'edtf', '@keyDate': 'yes', '#text': '1963-06-28'}

	1900 - 1936

	{'@encoding': 'edtf', '@keyDate': 'yes', '@point': 'end', '#text': '1936'}

	{'@encoding': 'edtf', '@keyDate': 'yes', '@point': 'start', '#text': '1900'}

	1889 - 1910

	{'@encoding': 'edtf', '@keyDate': 'yes', '@point': 'end', '#text': '1910'}

	{'@encoding': 'edtf', '@keyDate': 'yes', '@point': 'start', '#text': '1889'}

	1890 - 1947

	{'@encoding': 'edtf', '@keyDate': 'yes', '@point': 'end', '#text': '1947'}

	1849 - 1885

	{'@encoding': 'edtf', '@keyDate': 'yes', '@point': 'end', '#text': '1885'}

	{'@encoding': 'edtf', '@keyDate': 'yes', '@point': 'start', '#text': '1849'}

	1923 - 1927

	{'@encoding': 'edtf', '@keyDate': 'yes', '@point': 'start', '#text': '1923'}

	1905 - 1930

	{'@encoding': 'edtf', '@keyDate': 'yes', '@point': 'start', '#text': '1905'}

	1875 - 1964

	{'@encoding': 'edtf', '@keyDate': 'yes', '@point': 'end', '#text': '1964'}

	{'@encoding': 'edtf', '@keyDate': 'yes', '@point': 'start', '#text': '1875'}

	1902 - 1921

	{'@encoding': 'edtf', '@keyDate': 'yes', '@point': 'end', '#text': '1921'}

	{'@encoding': 'edtf', '@keyDate': 'yes', '@point': 'start', '#text': '1902'}

	1930 - 1966

	{'@encoding': 'edtf', '@keyDate': 'yes', '@point': 'end', '#text': '1966'}

	1968-08

	{'@encoding': 'edtf', '@keyDate': 'yes', '#text': '1968-08'}

	1918 - 1929

	{'@encoding': 'edtf', '@keyDate': 'yes', '@point': 'end', '#text': '1929'}

	1920 - 1929

	{'@encoding': 'edtf', '@keyDate': 'yes', '@point': 'start', '#text': '1920'}

	07/18/63

	{'@encoding': 'edtf', '@keyDate': 'yes', '#text': '1963-07-18'}

	1961 - 1990

	{'@encoding': 'edtf', '@keyDate': 'yes', '@point': 'end', '#text': '1990'}

	{'@encoding': 'edtf', '@keyDate': 'yes', '@point': 'start', '#text': '1961'}

	1901 - 1905

	{'@encoding': 'edtf', '@keyDate': 'yes', '@point': 'end', '#text': '1905'}

	{'@encoding': 'edtf', '@keyDate': 'yes', '@point': 'start', '#text': '1901'}

	1900 - 1908

	{'@encoding': 'edtf', '@keyDate': 'yes', '@point': 'end', '#text': '1908'}

	1966 - 1973

	{'@encoding': 'edtf', '@keyDate': 'yes', '@point': 'end', '#text': '1973'}

	1900 - 1915

	{'@encoding': 'edtf', '@keyDate': 'yes', '@point': 'end', '#text': '1915'}

	1928 - 1989

	{'@encoding': 'edtf', '@keyDate': 'yes', '@point': 'end', '#text': '1989'}

	{'@encoding': 'edtf', '@keyDate': 'yes', '@point': 'start', '#text': '1928'}

	1828 - 1882

	{'@encoding': 'edtf', '@keyDate': 'yes', '@point': 'end', '#text': '1882'}

	{'@encoding': 'edtf', '@keyDate': 'yes', '@point': 'start', '#text': '1828'}

	1895 - 1898

	{'@encoding': 'edtf', '@keyDate': 'yes', '@point': 'end', '#text': '1898'}

	1902 - 1920

	{'@encoding': 'edtf', '@keyDate': 'yes', '@point': 'end', '#text': '1920'}

	1905 - 1909

	{'@encoding': 'edtf', '@keyDate': 'yes', '@point': 'end', '#text': '1909'}

	1947 - 1958

	{'@encoding': 'edtf', '@keyDate': 'yes', '@point': 'end', '#text': '1958'}

	{'@encoding': 'edtf', '@keyDate': 'yes', '@point': 'start', '#text': '1947'}

	1968 - 1980

	{'@encoding': 'edtf', '@keyDate': 'yes', '@point': 'end', '#text': '1980'}

	{'@encoding': 'edtf', '@keyDate': 'yes', '@point': 'start', '#text': '1968'}

	1909

	{'@encoding': 'edtf', '@keyDate': 'yes', '#text': '1909'}

	1855 - 1901

	{'@encoding': 'edtf', '@keyDate': 'yes', '@point': 'end', '#text': '1901'}

	{'@encoding': 'edtf', '@keyDate': 'yes', '@point': 'start', '#text': '1855'}

	1920 - 1926

	{'@encoding': 'edtf', '@keyDate': 'yes', '@point': 'end', '#text': '1926'}

	1924 - 1980

	{'@encoding': 'edtf', '@keyDate': 'yes', '@point': 'start', '#text': '1924'}

	1954 - 1963

	{'@encoding': 'edtf', '@keyDate': 'yes', '@point': 'end', '#text': '1963'}

	{'@encoding': 'edtf', '@keyDate': 'yes', '@point': 'start', '#text': '1954'}

	1906 - 1928

	{'@encoding': 'edtf', '@keyDate': 'yes', '@point': 'end', '#text': '1928'}

	1964 - 1969

	1900 - 1905

	1930 - 1963

	1895 - 1922

	1902 - 1919

	{'@encoding': 'edtf', '@keyDate': 'yes', '@point': 'end', '#text': '1919'}

	1899

	{'@encoding': 'edtf', '@keyDate': 'yes', '#text': '1899'}

	1898 - 1899

	{'@encoding': 'edtf', '@keyDate': 'yes', '@point': 'end', '#text': '1899'}

	1930-1950

	{'@encoding': 'edtf', '@keyDate': 'yes', '@point': 'end', '#text': '1950'}

	1950 - 1970

	{'@encoding': 'edtf', '@keyDate': 'yes', '@point': 'end', '#text': '1970'}

	1934 - 1954

	{'@encoding': 'edtf', '@keyDate': 'yes', '@point': 'end', '#text': '1954'}

	{'@encoding': 'edtf', '@keyDate': 'yes', '@point': 'start', '#text': '1934'}

	1916 - 1922

	{'@encoding': 'edtf', '@keyDate': 'yes', '@point': 'start', '#text': '1916'}

	1931 - 1940

	{'@encoding': 'edtf', '@keyDate': 'yes', '@point': 'start', '#text': '1931'}

	1894 - 1916

	{'@encoding': 'edtf', '@keyDate': 'yes', '@point': 'start', '#text': '1894'}

	1917 - 1940

	1917 - 1973

	1928-10

	{'@encoding': 'edtf', '@keyDate': 'yes', '#text': '1928-10'}

	03/08/09

	{'@encoding': 'edtf', '@keyDate': 'yes', '#text': '1909-03-08'}

	1865

	{'@encoding': 'edtf', '@keyDate': 'yes', '#text': '1865'}

	03/29/62

	{'@encoding': 'edtf', '@keyDate': 'yes', '#text': '1962-03-29'}

	1968 - 1971

	1870 - 1881

	{'@encoding': 'edtf', '@keyDate': 'yes', '@point': 'end', '#text': '1881'}

	{'@encoding': 'edtf', '@keyDate': 'yes', '@point': 'start', '#text': '1870'}

	1894 - 1909

	1969 - 1970

	{'@encoding': 'edtf', '@keyDate': 'yes', '@point': 'start', '#text': '1969'}

	1970 - 1984

	{'@encoding': 'edtf', '@keyDate': 'yes', '@point': 'end', '#text': '1984'}

	{'@encoding': 'edtf', '@keyDate': 'yes', '@point': 'start', '#text': '1970'}

	1876 - 1900

	{'@encoding': 'edtf', '@keyDate': 'yes', '@point': 'end', '#text': '1900'}

	{'@encoding': 'edtf', '@keyDate': 'yes', '@point': 'start', '#text': '1876'}

	1870 - 1900

	05/01/68

	{'@encoding': 'edtf', '@keyDate': 'yes', '#text': '1968-05-01'}

	1894 - 1895

	{'@encoding': 'edtf', '@keyDate': 'yes', '@point': 'end', '#text': '1895'}

	1968 - 1972

	{'@encoding': 'edtf', '@keyDate': 'yes', '@point': 'end', '#text': '1972'}

	1890 - 1898

	1959 - 1960

	{'@encoding': 'edtf', '@keyDate': 'yes', '@point': 'start', '#text': '1959'}

	1880 - 1910

	{'@encoding': 'edtf', '@keyDate': 'yes', '@point': 'start', '#text': '1880'}

	1880 - 1898

	1898 - 1929

	1869 - 1901

	{'@encoding': 'edtf', '@keyDate': 'yes', '@point': 'start', '#text': '1869'}

	1979 - 1985

	{'@encoding': 'edtf', '@keyDate': 'yes', '@point': 'end', '#text': '1985'}

	{'@encoding': 'edtf', '@keyDate': 'yes', '@point': 'start', '#text': '1979'}

	1959 - 1968

	{'@encoding': 'edtf', '@keyDate': 'yes', '@point': 'end', '#text': '1968'}

	1870

	{'@encoding': 'edtf', '@keyDate': 'yes', '#text': '1870'}

	1865 - 1893

	{'@encoding': 'edtf', '@keyDate': 'yes', '@point': 'end', '#text': '1893'}

	{'@encoding': 'edtf', '@keyDate': 'yes', '@point': 'start', '#text': '1865'}

	09/01/86

	{'@encoding': 'edtf', '@keyDate': 'yes', '#text': '1986-09-01'}

	08/11/86

	{'@encoding': 'edtf', '@keyDate': 'yes', '#text': '1986-08-11'}

	1898 - 1910

	09/17/63

	{'@encoding': 'edtf', '@keyDate': 'yes', '#text': '1963-09-17'}

	09/19/63

	{'@encoding': 'edtf', '@keyDate': 'yes', '#text': '1963-09-19'}

	08/07/61

	{'@encoding': 'edtf', '@keyDate': 'yes', '#text': '1961-08-07'}

	1865 - 1875

	{'@encoding': 'edtf', '@keyDate': 'yes', '@point': 'end', '#text': '1875'}

	1791

	{'@encoding': 'edtf', '@keyDate': 'yes', '#text': '1791'}

	1882 - 1910

	{'@encoding': 'edtf', '@keyDate': 'yes', '@point': 'start', '#text': '1882'}

	1910 - 1920

	{'@encoding': 'edtf', '@keyDate': 'yes', '@point': 'start', '#text': '1910'}

	1898 - 1944

	{'@encoding': 'edtf', '@keyDate': 'yes', '@point': 'end', '#text': '1944'}

	1980 - 1982

	{'@encoding': 'edtf', '@keyDate': 'yes', '@point': 'end', '#text': '1982'}

	{'@encoding': 'edtf', '@keyDate': 'yes', '@point': 'start', '#text': '1980'}

	1880 - 1900

	1913

	{'@encoding': 'edtf', '@keyDate': 'yes', '#text': '1913'}

	1900 - 1912

	1914 - 1918

	{'@encoding': 'edtf', '@keyDate': 'yes', '@point': 'end', '#text': '1918'}

	{'@encoding': 'edtf', '@keyDate': 'yes', '@point': 'start', '#text': '1914'}

	1900 - 1930

	1927 - 1933

	{'@encoding': 'edtf', '@keyDate': 'yes', '@point': 'end', '#text': '1933'}

	{'@encoding': 'edtf', '@keyDate': 'yes', '@point': 'start', '#text': '1927'}

	1890 - 1910

	1885 - 1899

	{'@encoding': 'edtf', '@keyDate': 'yes', '@point': 'start', '#text': '1885'}

	1880 - 1930

	1914 - 1930

	1913 - 1971

	1845 - 1885

	{'@encoding': 'edtf', '@keyDate': 'yes', '@point': 'start', '#text': '1845'}

	05/01/90

	{'@encoding': 'edtf', '@keyDate': 'yes', '#text': '1990-05-01'}

	06/03/83

	{'@encoding': 'edtf', '@keyDate': 'yes', '#text': '1983-06-03'}

	1897

	{'@encoding': 'edtf', '@keyDate': 'yes', '#text': '1897'}

	1942 - 1963

	{'@encoding': 'edtf', '@keyDate': 'yes', '@point': 'start', '#text': '1942'}

	1934 - 1943

	{'@encoding': 'edtf', '@keyDate': 'yes', '@point': 'end', '#text': '1943'}

	1937 - 1964

	{'@encoding': 'edtf', '@keyDate': 'yes', '@point': 'start', '#text': '1937'}

	1952 - 1961

	{'@encoding': 'edtf', '@keyDate': 'yes', '@point': 'end', '#text': '1961'}

	{'@encoding': 'edtf', '@keyDate': 'yes', '@point': 'start', '#text': '1952'}

	1934

	{'@encoding': 'edtf', '@keyDate': 'yes', '#text': '1934'}

	1906

	{'@encoding': 'edtf', '@keyDate': 'yes', '#text': '1906'}

	1910 - 1913

	{'@encoding': 'edtf', '@keyDate': 'yes', '@point': 'end', '#text': '1913'}

	1911

	{'@encoding': 'edtf', '@keyDate': 'yes', '#text': '1911'}

	01/09/15

	{'@encoding': 'edtf', '@keyDate': 'yes', '#text': '1915-01-09'}

	1912 - 1915

	{'@encoding': 'edtf', '@keyDate': 'yes', '@point': 'start', '#text': '1912'}

	1926 - 1935

	{'@encoding': 'edtf', '@keyDate': 'yes', '@point': 'end', '#text': '1935'}

	1914

	{'@encoding': 'edtf', '@keyDate': 'yes', '#text': '1914'}

	1893 - 1966

	{'@encoding': 'edtf', '@keyDate': 'yes', '@point': 'start', '#text': '1893'}

	1900-1910

	1897 - 1960

	{'@encoding': 'edtf', '@keyDate': 'yes', '@point': 'start', '#text': '1897'}

	1906 - 1970

	1932 - 1943

	{'@encoding': 'edtf', '@keyDate': 'yes', '@point': 'start', '#text': '1932'}

	1901 - 1919

	1910-09

	{'@encoding': 'edtf', '@keyDate': 'yes', '#text': '1910-09'}

	1909 - 1911

	{'@encoding': 'edtf', '@keyDate': 'yes', '@point': 'end', '#text': '1911'}

	{'@encoding': 'edtf', '@keyDate': 'yes', '@point': 'start', '#text': '1909'}

	1936 - 1946

	{'@encoding': 'edtf', '@keyDate': 'yes', '@point': 'end', '#text': '1946'}

	{'@encoding': 'edtf', '@keyDate': 'yes', '@point': 'start', '#text': '1936'}

	1915 - 1916

	1901 - 1943

	10/07/09

	{'@encoding': 'edtf', '@keyDate': 'yes', '#text': '1909-10-07'}

	04/12/10

	{'@encoding': 'edtf', '@keyDate': 'yes', '#text': '1910-04-12'}

	1907 - 1910

	{'@encoding': 'edtf', '@keyDate': 'yes', '@point': 'start', '#text': '1907'}

	07/28/10

	{'@encoding': 'edtf', '@keyDate': 'yes', '#text': '1910-07-28'}

	1928 - 1968

	10/08/06

	{'@encoding': 'edtf', '@keyDate': 'yes', '#text': '1906-10-08'}

	1907 - 1920

	07/03/12

	{'@encoding': 'edtf', '@keyDate': 'yes', '#text': '1912-07-03'}

	1934 - 1963

	1900 - 1920

	02/20/10

	{'@encoding': 'edtf', '@keyDate': 'yes', '#text': '1910-02-20'}

	09/03/11

	{'@encoding': 'edtf', '@keyDate': 'yes', '#text': '1911-09-03'}

	11/05/18

	{'@encoding': 'edtf', '@keyDate': 'yes', '#text': '1918-11-05'}

	12/14/11

	{'@encoding': 'edtf', '@keyDate': 'yes', '#text': '1911-12-14'}

	10/27/62

	{'@encoding': 'edtf', '@keyDate': 'yes', '#text': '1962-10-27'}

	09/07/20

	{'@encoding': 'edtf', '@keyDate': 'yes', '#text': '1920-09-07'}

	12/15/13

	{'@encoding': 'edtf', '@keyDate': 'yes', '#text': '1913-12-15'}

	11/21/17

	{'@encoding': 'edtf', '@keyDate': 'yes', '#text': '1917-11-21'}

	07/10/37

	{'@encoding': 'edtf', '@keyDate': 'yes', '#text': '1937-07-10'}

	07/24/15

	{'@encoding': 'edtf', '@keyDate': 'yes', '#text': '1915-07-24'}

	01/21/08

	{'@encoding': 'edtf', '@keyDate': 'yes', '#text': '1908-01-21'}

	1898 - 1920

	1992 - 2007

	{'@encoding': 'edtf', '@keyDate': 'yes', '@point': 'end', '#text': '2007'}

	{'@encoding': 'edtf', '@keyDate': 'yes', '@point': 'start', '#text': '1992'}

	1948 - 1954

	{'@encoding': 'edtf', '@keyDate': 'yes', '@point': 'start', '#text': '1948'}

	1930 - 1968

	1948 - 1960

	1924 - 1956

	{'@encoding': 'edtf', '@keyDate': 'yes', '@point': 'end', '#text': '1956'}

	1991 - 2006

	{'@encoding': 'edtf', '@keyDate': 'yes', '@point': 'end', '#text': '2006'}

	{'@encoding': 'edtf', '@keyDate': 'yes', '@point': 'start', '#text': '1991'}

	1904 - 1920

	{'@encoding': 'edtf', '@keyDate': 'yes', '@point': 'start', '#text': '1904'}

	1885 - 1919

	1925 - 1935

	1900 - 1910

	1896 - 1922

	{'@encoding': 'edtf', '@keyDate': 'yes', '@point': 'start', '#text': '1896'}

	1927 - 1935

	1944 - 1968

	{'@encoding': 'edtf', '@keyDate': 'yes', '@point': 'start', '#text': '1944'}

	1948 - 1952

	{'@encoding': 'edtf', '@keyDate': 'yes', '@point': 'end', '#text': '1952'}

	1913 - 1985

	1901 - 1920

	1902 - 1906

	{'@encoding': 'edtf', '@keyDate': 'yes', '@point': 'end', '#text': '1906'}

	1924 - 1930

	1954 - 1968

	1954 - 1962

	{'@encoding': 'edtf', '@keyDate': 'yes', '@point': 'end', '#text': '1962'}

	1945 - 1962

	{'@encoding': 'edtf', '@keyDate': 'yes', '@point': 'start', '#text': '1945'}

	1889

	{'@encoding': 'edtf', '@keyDate': 'yes', '#text': '1889'}

	1899 - 1902

	{'@encoding': 'edtf', '@keyDate': 'yes', '@point': 'end', '#text': '1902'}

	{'@encoding': 'edtf', '@keyDate': 'yes', '@point': 'start', '#text': '1899'}

	1890 - 1900

	1920 - 1921

	1934 - 1940

	1925 - 1928

	1908 - 1920

	{'@encoding': 'edtf', '@keyDate': 'yes', '@point': 'start', '#text': '1908'}

	1920 - 1922

	1897 - 1915

	1924 - 1925

	1934 - 1947

	1891 - 1902

	{'@encoding': 'edtf', '@keyDate': 'yes', '@point': 'start', '#text': '1891'}

	1916 - 1928

	1898

	{'@encoding': 'edtf', '@keyDate': 'yes', '#text': '1898'}

	1911 - 1932

	{'@encoding': 'edtf', '@keyDate': 'yes', '@point': 'end', '#text': '1932'}

	{'@encoding': 'edtf', '@keyDate': 'yes', '@point': 'start', '#text': '1911'}

	1884 - 1902

	{'@encoding': 'edtf', '@keyDate': 'yes', '@point': 'start', '#text': '1884'}

	1927 - 1931

	{'@encoding': 'edtf', '@keyDate': 'yes', '@point': 'end', '#text': '1931'}

	1928 - 1937

	{'@encoding': 'edtf', '@keyDate': 'yes', '@point': 'end', '#text': '1937'}

	1912 - 1913

	1909 - 1920

	1922 - 1928

	{'@encoding': 'edtf', '@keyDate': 'yes', '@point': 'start', '#text': '1922'}

	1893 - 1911

	1910 - 1930

	1919 - 1929

	{'@encoding': 'edtf', '@keyDate': 'yes', '@point': 'start', '#text': '1919'}

	1924 - 1927

	1918 - 1921

	1928 - 1930

	1982-05-01 - 1982-10-31

	{'@encoding': 'edtf', '@keyDate': 'yes', '@point': 'end', '#text': '1982-10-31'}

	{'@encoding': 'edtf', '@keyDate': 'yes', '@point': 'start', '#text': '1982-05-01'}

	1930-01 - 1939-01

	{'@encoding': 'edtf', '@keyDate': 'yes', '@point': 'end', '#text': '1939-01'}

	{'@encoding': 'edtf', '@keyDate': 'yes', '@point': 'start', '#text': '1930-01'}

	1930-01 - 1939-12

	{'@encoding': 'edtf', '@keyDate': 'yes', '@point': 'end', '#text': '1939-12'}

	1930 - 1939

	{'@encoding': 'edtf', '@keyDate': 'yes', '@point': 'end', '#text': '1939'}

	1958-1963

	1962, 1973

	1958-1962

	1969-1970

	1958, 1961-1962

	1965, 1968, 1991

	1968-1969

	1968-1970

	1969-06-18

	{'@encoding': 'edtf', '@keyDate': 'yes', '#text': '1970-06-11'}

	{'@encoding': 'edtf', '@keyDate': 'yes', '@qualifier': 'inferred', '#text': '1839'}

	1966-1967, 1976

	1966-1968

	1977 July

	1965-1966

	1966, 1979

	{'@encoding': 'edtf', '@keyDate': 'yes', '#text': '1967-06-11'}

	1961, 1981

	1966 June

	{'@encoding': 'edtf', '@keyDate': 'yes', '#text': '1966-06'}

	1958 (summer)

	1959 (summer)

	1961 (summer)

	1962 (summer)

	1963 (summer)

	1956, 1958

	1970 October 18

	{'@encoding': 'edtf', '@keyDate': 'yes', '#text': '1970-10-18'}

	1970-1971

	1964-1974

	{'@encoding': 'edtf', '@keyDate': 'yes', '#text': '1965-08-2'}

	1965 (circa)

	{'@encoding': 'edtf', '@keyDate': 'yes', '@qualifier': 'approximate', '#text': '1965'}

	1965, 1966

	1965-1966, 1984-1985

	1965-1974

	1965-1969, 1970-1975, 1981-1987, 1991

	1957-1963

	1928-1931

	1/8/1928

	{'@encoding': 'edtf', '@keyDate': 'yes', '#text': '1928-01-08'}

	1/22/1928

	{'@encoding': 'edtf', '@keyDate': 'yes', '#text': '1928-01-22'}

	2/4-5/1928

	{'@encoding': 'edtf', '@keyDate': 'yes', '@point': 'end', '#text': '1928-02-05'}

	{'@encoding': 'edtf', '@keyDate': 'yes', '@point': 'start', '#text': '1928-02-04'}

	3/3-4/1928

	{'@encoding': 'edtf', '@keyDate': 'yes', '@point': 'end', '#text': '1928-03-04'}

	{'@encoding': 'edtf', '@keyDate': 'yes', '@point': 'start', '#text': '1928-03-03'}

	3/18/1928

	{'@encoding': 'edtf', '@keyDate': 'yes', '#text': '1928-03-18'}

	5/20/1928

	{'@encoding': 'edtf', '@keyDate': 'yes', '#text': '1928-05-20'}

	6/2-3/1928

	{'@encoding': 'edtf', '@keyDate': 'yes', '@point': 'end', '#text': '1928-06-03'}

	{'@encoding': 'edtf', '@keyDate': 'yes', '@point': 'start', '#text': '1928-06-02'}

	7/29/1928

	{'@encoding': 'edtf', '@keyDate': 'yes', '#text': '1928-07-29'}

	5/18-19/1929

	{'@encoding': 'edtf', '@keyDate': 'yes', '@point': 'end', '#text': '1929-05-19'}

	{'@encoding': 'edtf', '@keyDate': 'yes', '@point': 'start', '#text': '1929-05-18'}

	8/31-9/1-2/1929

	{'@encoding': 'edtf', '@keyDate': 'yes', '@point': 'end', '#text': '1929-09-02'}

	{'@encoding': 'edtf', '@keyDate': 'yes', '@point': 'start', '#text': '1929-08-31'}

	12/15/1929

	{'@encoding': 'edtf', '@keyDate': 'yes', '#text': '1929-12-15'}

	1/12/1930

	{'@encoding': 'edtf', '@keyDate': 'yes', '#text': '1930-01-12'}

	12/15/1930

	{'@encoding': 'edtf', '@keyDate': 'yes', '#text': '1930-12-15'}

	2/1/1931

	{'@encoding': 'edtf', '@keyDate': 'yes', '#text': '1931-02-01'}

	2/15/1931

	{'@encoding': 'edtf', '@keyDate': 'yes', '#text': '1931-02-15'}

	3/22/1931

	{'@encoding': 'edtf', '@keyDate': 'yes', '#text': '1931-03-22'}

	4/11-12/1931

	{'@encoding': 'edtf', '@keyDate': 'yes', '@point': 'end', '#text': '1931-04-12'}

	{'@encoding': 'edtf', '@keyDate': 'yes', '@point': 'start', '#text': '1931-04-11'}

	4/12/1931

	{'@encoding': 'edtf', '@keyDate': 'yes', '#text': '1931-04-12'}

	5/2-3/1931

	{'@encoding': 'edtf', '@keyDate': 'yes', '@point': 'end', '#text': '1931-05-03'}

	{'@encoding': 'edtf', '@keyDate': 'yes', '@point': 'start', '#text': '1931-05-02'}

	2015

	{'@encoding': 'edtf', '@keyDate': 'yes', '#text': '2015'}

	2016

	2017

	{'@encoding': 'edtf', '@keyDate': 'yes', '#text': '2017'}

	1867-1913

	{'@encoding': 'edtf', '#text': '1867/1913'}

	1870-1913

	{'@encoding': 'edtf', '#text': '1870/1913'}

	1865-1895

	{'@encoding': 'edtf', '#text': '1865/1895'}

	1870-1899

	{'@encoding': 'edtf', '#text': '1870/1899'}

	1870-1929

	{'@encoding': 'edtf', '#text': '1870/1929'}

	1870-1885

	{'@encoding': 'edtf', '#text': '1870/1885'}

	1893-1929

	{'@encoding': 'edtf', '#text': '1893/1929'}

	1870-1879

	{'@encoding': 'edtf', '#text': '1870/1879'}

	1880-1889

	{'@encoding': 'edtf', '#text': '1880/1889'}

	1860-1906

	{'@encoding': 'edtf', '#text': '1860/1906'}

	1880-1918

	{'@encoding': 'edtf', '#text': '1880/1918'}

	1860-1890

	{'@encoding': 'edtf', '#text': '1860/1890'}

	1869-1880

	{'@encoding': 'edtf', '#text': '1869/1880'}

	1867-1928

	{'@encoding': 'edtf', '#text': '1867/1928'}

	1900-1913

	{'@encoding': 'edtf', '#text': '1900/1913'}

	1898-1912

	{'@encoding': 'edtf', '#text': '1898/1912'}

	{'@encoding': 'edtf', '#text': '1900'}

	1856-1859

	{'@encoding': 'edtf', '#text': '1856/1859'}

	1880-1913

	{'@encoding': 'edtf', '#text': '1880/1913'}

	1869-1889

	{'@encoding': 'edtf', '#text': '1869/1889'}

	1870-1909

	{'@encoding': 'edtf', '#text': '1870/1909'}

	1900-1909

	{'@encoding': 'edtf', '#text': '1900/1909'}

	1912-1913

	{'@encoding': 'edtf', '#text': '1912/1913'}

	1899-1913

	{'@encoding': 'edtf', '#text': '1899/1913'}

	1857

	{'@encoding': 'edtf', '#text': '1857'}

	1865-1885

	{'@encoding': 'edtf', '#text': '1865/1885'}

	1922-1932

	{'@encoding': 'edtf', '#text': '1922/1932'}

	1851-1852

	{'@encoding': 'edtf', '#text': '1851/1852'}

	{'@encoding': 'edtf', '@keyDate': 'yes', '@qualifier': 'inferred', '#text': '1730'}

	circa 1900

	circa 1925

	{'@encoding': 'edtf', '@keyDate': 'yes', '@qualifier': 'approximate', '#text': '1925'}

	circa 1931

	{'@encoding': 'edtf', '@keyDate': 'yes', '@qualifier': 'approximate', '#text': '1931'}

	circa 1932

	{'@encoding': 'edtf', '@keyDate': 'yes', '@qualifier': 'approximate', '#text': '1932'}

	circa 1930s

	{'@encoding': 'edtf', '@keyDate': 'yes', '@point': 'start', '#text': 'Sat Jul 01 00:00:00 EDT 2000'}

	{'@encoding': 'edtf', '@keyDate': 'yes', '@point': 'start', '#text': 'Thu Mar 01 00:00:00 EST 2001'}

	{'@encoding': 'edtf', '@keyDate': 'yes', '@point': 'start', '#text': 'Wed Aug 01 00:00:00 EDT 2001'}

	{'@encoding': 'edtf', '@keyDate': 'yes', '@point': 'start', '#text': 'Mon Apr 01 00:00:00 EST 2002'}

	{'@encoding': 'edtf', '@keyDate': 'yes', '@point': 'start', '#text': 'Thu Aug 01 00:00:00 EDT 2002'}

	{'@encoding': 'edtf', '@keyDate': 'yes', '@point': 'start', '#text': '2003-21'}

	{'@encoding': 'edtf', '@keyDate': 'yes', '@point': 'start', '#text': '2004-21'}

	{'@encoding': 'edtf', '@keyDate': 'yes', '@point': 'start', '#text': '2004-23'}

	{'@encoding': 'edtf', '@keyDate': 'yes', '@point': 'start', '#text': '2005-21'}

	{'@encoding': 'edtf', '@keyDate': 'yes', '@point': 'start', '#text': '2005-23'}

	{'@encoding': 'edtf', '@keyDate': 'yes', '@point': 'start', '#text': '2006-21'}

	{'@encoding': 'edtf', '@keyDate': 'yes', '@point': 'start', '#text': '2006-23'}

	{'@encoding': 'edtf', '@keyDate': 'yes', '@point': 'start', '#text': '2007-21'}

	{'@encoding': 'edtf', '@keyDate': 'yes', '@point': 'start', '#text': '2007-23'}

	{'@encoding': 'edtf', '@keyDate': 'yes', '@point': 'start', '#text': '2008-21'}

	{'@encoding': 'edtf', '@keyDate': 'yes', '@point': 'start', '#text': '2008-23'}

	{'@encoding': 'edtf', '@keyDate': 'yes', '@point': 'start', '#text': '2009-21'}

	{'@encoding': 'edtf', '@keyDate': 'yes', '@point': 'start', '#text': '2009-23'}

	{'@encoding': 'edtf', '@keyDate': 'yes', '@point': 'start', '#text': '2010-21'}

	{'@encoding': 'edtf', '@keyDate': 'yes', '@point': 'start', '#text': '2010-23'}

	{'@encoding': 'edtf', '@keyDate': 'yes', '@point': 'start', '#text': '2011-21'}

	{'@encoding': 'edtf', '@keyDate': 'yes', '@point': 'start', '#text': '2011-23'}

	{'@encoding': 'edtf', '@keyDate': 'yes', '@point': 'start', '#text': '2012-21'}

	{'@encoding': 'edtf', '@keyDate': 'yes', '@point': 'start', '#text': '2012-23'}

	{'@encoding': 'edtf', '@keyDate': 'yes', '@point': 'start', '#text': '2013-21'}

	{'@encoding': 'edtf', '@keyDate': 'yes', '@point': 'start', '#text': '2013-23'}

	{'@encoding': 'edtf', '@keyDate': 'yes', '@point': 'start', '#text': '2014-21'}

	{'@encoding': 'edtf', '@keyDate': 'yes', '@point': 'start', '#text': '2014-23'}

	{'@encoding': 'edtf', '@keyDate': 'yes', '@point': 'start', '#text': '2015-21'}

	{'@encoding': 'edtf', '@keyDate': 'yes', '@point': 'start', '#text': '2015-23'}

	{'@encoding': 'edtf', '@keyDate': 'yes', '@point': 'start', '#text': '2016-21'}

	{'@encoding': 'edtf', '@keyDate': 'yes', '@point': 'start', '#text': '2016-23'}

	{'@encoding': 'edtf', '@keyDate': 'yes', '@point': 'start', '#text': '2017-21'}

	{'@encoding': 'edtf', '@keyDate': 'yes', '@point': 'start', '#text': '2017-23'}

	approximately between 1945 and 1970

	{'@encoding': 'edtf', '@keyDate': 'yes', '@point': 'start', '@qualifier': 'approximate', '#text': '1945'}

	approximately between 1870 and 1925

	{'@encoding': 'edtf', '@keyDate': 'yes', '@point': 'start', '@qualifier': 'approximate', '#text': '1870'}

	probably between 1900 and 1920

	{'@encoding': 'edtf', '@keyDate': 'yes', '@point': 'start', '@qualifier': 'inferred', '#text': '1900'}

	approximately between 1890 and 1920

	{'@encoding': 'edtf', '@keyDate': 'yes', '@point': 'start', '@qualifier': 'approximate', '#text': '1890'}

	probably between 1900 and 1930

	between 1912 and 1913

	approximately between 1900 and 1930

	{'@encoding': 'edtf', '@keyDate': 'yes', '@point': 'start', '@qualifier': 'approximate', '#text': '1900'}

	approximately between 1900 and 1910

	between 1900 and 1930

	probably between 1836 and 1862

	{'@encoding': 'edtf', '@keyDate': 'yes', '@point': 'end', '#text': '1862'}

	{'@encoding': 'edtf', '@keyDate': 'yes', '@point': 'start', '@qualifier': 'inferred', '#text': '1836'}

	approximately between 1880 and 1890

	{'@encoding': 'edtf', '@keyDate': 'yes', '@point': 'end', '#text': '1890'}

	{'@encoding': 'edtf', '@keyDate': 'yes', '@point': 'start', '@qualifier': 'approximate', '#text': '1880'}

	1917-11

	{'@encoding': 'edtf', '@keyDate': 'yes', '#text': '1917-11'}

	1866-04-30

	{'@encoding': 'edtf', '@keyDate': 'yes', '#text': '1866-04-30'}

	1862-03-15

	{'@encoding': 'edtf', '@keyDate': 'yes', '#text': '1862-03-15'}

	1862-07-05

	{'@encoding': 'edtf', '@keyDate': 'yes', '#text': '1862-07-05'}

	1881-06-25

	{'@encoding': 'edtf', '@keyDate': 'yes', '#text': '1881-06-25'}

	1878-03-23

	{'@encoding': 'edtf', '@keyDate': 'yes', '#text': '1878-03-23'}

	1879-08-23

	{'@encoding': 'edtf', '@keyDate': 'yes', '#text': '1879-08-23'}

	1879-09-20

	{'@encoding': 'edtf', '@keyDate': 'yes', '#text': '1879-09-20'}

	1864-09-10

	{'@encoding': 'edtf', '@keyDate': 'yes', '#text': '1864-09-10'}

	1862-07-04

	{'@encoding': 'edtf', '@keyDate': 'yes', '#text': '1862-07-04'}

	1864-04-30

	{'@encoding': 'edtf', '@keyDate': 'yes', '#text': '1864-04-30'}

	1863-06-27

	{'@encoding': 'edtf', '@keyDate': 'yes', '#text': '1863-06-27'}

	1862-07-28

	{'@encoding': 'edtf', '@keyDate': 'yes', '#text': '1862-07-28'}

	1959-07-31

	{'@encoding': 'edtf', '@keyDate': 'yes', '#text': '1959-07-31'}

	approximately between 1950 and 1959

	{'@encoding': 'edtf', '@keyDate': 'yes', '@point': 'start', '@qualifier': 'approximate', '#text': '1950'}

	approximately between 1960 and 1967

	{'@encoding': 'edtf', '@keyDate': 'yes', '@point': 'start', '@qualifier': 'approximate', '#text': '1960'}

	1912-05-21

	{'@encoding': 'edtf', '@keyDate': 'yes', '#text': '1912-05-21'}

	approximately between 1865 and 1900

	{'@encoding': 'edtf', '@keyDate': 'yes', '@point': 'start', '@qualifier': 'approximate', '#text': '1865'}

	between 1920 and 1935?

	{'@encoding': 'edtf', '@keyDate': 'yes', '@point': 'start', '@qualifier': 'questionable', '#text': '1920'}

	between 1910 and 1920?

	{'@encoding': 'edtf', '@keyDate': 'yes', '@point': 'start', '@qualifier': 'questionable', '#text': '1910'}

	1912-04-17

	{'@encoding': 'edtf', '@keyDate': 'yes', '#text': '1912-04-17'}

	1912-04-18

	{'@encoding': 'edtf', '@keyDate': 'yes', '#text': '1912-04-18'}

	1912-04-08

	{'@encoding': 'edtf', '@keyDate': 'yes', '#text': '1912-04-08'}

	1912-04

	{'@encoding': 'edtf', '@keyDate': 'yes', '#text': '1912-04'}

	1912-04-07

	{'@encoding': 'edtf', '@keyDate': 'yes', '#text': '1912-04-07'}

	1912-04-06

	{'@encoding': 'edtf', '@keyDate': 'yes', '#text': '1912-04-06'}

	between 1900 and 1940?

	{'@encoding': 'edtf', '@keyDate': 'yes', '@point': 'start', '@qualifier': 'questionable', '#text': '1900'}

	between 1890 and 1930?

	{'@encoding': 'edtf', '@keyDate': 'yes', '@point': 'start', '@qualifier': 'questionable', '#text': '1890'}

	1928-11-16

	{'@encoding': 'edtf', '@keyDate': 'yes', '#text': '1928-11-16'}

	1920-08-14

	{'@encoding': 'edtf', '@keyDate': 'yes', '#text': '1920-08-14'}

	1920-08-09

	{'@encoding': 'edtf', '@keyDate': 'yes', '#text': '1920-08-09'}

	1920-08-10

	{'@encoding': 'edtf', '@keyDate': 'yes', '#text': '1920-08-10'}

	1920-08-16

	{'@encoding': 'edtf', '@keyDate': 'yes', '#text': '1920-08-16'}

	1920-08-13

	{'@encoding': 'edtf', '@keyDate': 'yes', '#text': '1920-08-13'}

	1920-08-11

	{'@encoding': 'edtf', '@keyDate': 'yes', '#text': '1920-08-11'}

	1920-09-02

	{'@encoding': 'edtf', '@keyDate': 'yes', '#text': '1920-09-02'}

	1920-08-21

	{'@encoding': 'edtf', '@keyDate': 'yes', '#text': '1920-08-21'}

	1920-08-24

	{'@encoding': 'edtf', '@keyDate': 'yes', '#text': '1920-08-24'}

	1920-08-20

	{'@encoding': 'edtf', '@keyDate': 'yes', '#text': '1920-08-20'}

	1920-08-22

	{'@encoding': 'edtf', '@keyDate': 'yes', '#text': '1920-08-22'}

	1920-08-26

	{'@encoding': 'edtf', '@keyDate': 'yes', '#text': '1920-08-26'}

	1920-08

	{'@encoding': 'edtf', '@keyDate': 'yes', '#text': '1920-08'}

	1920-08-19

	{'@encoding': 'edtf', '@keyDate': 'yes', '#text': '1920-08-19'}

	1864

	{'@encoding': 'edtf', '@keyDate': 'yes', '#text': '1864'}

	1861

	{'@encoding': 'edtf', '@keyDate': 'yes', '#text': '1861'}

	1875

	{'@encoding': 'edtf', '@keyDate': 'yes', '#text': '1875'}

	1868

	{'@encoding': 'edtf', '@keyDate': 'yes', '#text': '1868'}

	1862

	{'@encoding': 'edtf', '@keyDate': 'yes', '#text': '1862'}

	1937-03

	{'@encoding': 'edtf', '@keyDate': 'yes', '#text': '1937-03'}

	1934-03

	{'@encoding': 'edtf', '@keyDate': 'yes', '#text': '1934-03'}

	1934-12

	{'@encoding': 'edtf', '@keyDate': 'yes', '#text': '1934-12'}

	1936-03-31

	{'@encoding': 'edtf', '@keyDate': 'yes', '#text': '1936-03-31'}

	1935-04-27

	{'@encoding': 'edtf', '@keyDate': 'yes', '#text': '1935-04-27'}

	1935-06-25

	{'@encoding': 'edtf', '@keyDate': 'yes', '#text': '1935-06-25'}

	probably between 1935 and 1942

	{'@encoding': 'edtf', '@keyDate': 'yes', '@point': 'end', '#text': '1942'}

	{'@encoding': 'edtf', '@keyDate': 'yes', '@point': 'start', '@qualifier': 'inferred', '#text': '1935'}

	between 1935 and 1942

	{'@encoding': 'edtf', '@keyDate': 'yes', '@point': 'start', '#text': '1935'}

	1937-01-26

	{'@encoding': 'edtf', '@keyDate': 'yes', '#text': '1937-01-26'}

	1937-01-27

	{'@encoding': 'edtf', '@keyDate': 'yes', '#text': '1937-01-27'}

	1754-07

	{'@encoding': 'edtf', '@keyDate': 'yes', '#text': '1754-07'}

	1803

	{'@encoding': 'edtf', '@keyDate': 'yes', '#text': '1803'}

	between 1796 and 1838?

	{'@encoding': 'edtf', '@keyDate': 'yes', '@point': 'end', '#text': '1838'}

	{'@encoding': 'edtf', '@keyDate': 'yes', '@point': 'start', '@qualifier': 'questionable', '#text': '1796'}

	approximately between 1850 and 1877

	{'@encoding': 'edtf', '@keyDate': 'yes', '@point': 'end', '#text': '1877'}

	{'@encoding': 'edtf', '@keyDate': 'yes', '@point': 'start', '@qualifier': 'approximate', '#text': '1850'}

	1795-01-10

	{'@encoding': 'edtf', '@keyDate': 'yes', '#text': '1795-01-10'}

	1806

	{'@encoding': 'edtf', '@keyDate': 'yes', '#text': '1806'}

	1836-02-23

	{'@encoding': 'edtf', '@keyDate': 'yes', '#text': '1836-02-23'}

	1869

	1800

	{'@encoding': 'edtf', '@keyDate': 'yes', '#text': '1800'}

	1838

	{'@encoding': 'edtf', '@keyDate': 'yes', '#text': '1838'}

	1795

	{'@encoding': 'edtf', '@keyDate': 'yes', '#text': '1795'}

	1816

	{'@encoding': 'edtf', '@keyDate': 'yes', '#text': '1816'}

	1818

	{'@encoding': 'edtf', '@keyDate': 'yes', '#text': '1818'}

	between 1785 and 1790

	{'@encoding': 'edtf', '@keyDate': 'yes', '@point': 'end', '#text': '1790'}

	{'@encoding': 'edtf', '@keyDate': 'yes', '@point': 'start', '#text': '1785'}

	between 1819 and 1826

	{'@encoding': 'edtf', '@keyDate': 'yes', '@point': 'end', '#text': '1826'}

	{'@encoding': 'edtf', '@keyDate': 'yes', '@point': 'start', '#text': '1819'}

	1837-01

	{'@encoding': 'edtf', '@keyDate': 'yes', '#text': '1837-01'}

	1833-01

	{'@encoding': 'edtf', '@keyDate': 'yes', '#text': '1833-01'}

	1830-01

	{'@encoding': 'edtf', '@keyDate': 'yes', '#text': '1830-01'}

	1940-12-11

	{'@encoding': 'edtf', '@keyDate': 'yes', '#text': '1940-12-11'}

	1946-08-09

	{'@encoding': 'edtf', '@keyDate': 'yes', '#text': '1946-08-09'}

	1925-01-01

	{'@encoding': 'edtf', '@keyDate': 'yes', '#text': '1925-01-01'}

	1858

	{'@encoding': 'edtf', '@keyDate': 'yes', '#text': '1858'}

	1925-07

	{'@encoding': 'edtf', '@keyDate': 'yes', '#text': '1925-07'}

	1948-04-05

	{'@encoding': 'edtf', '@keyDate': 'yes', '#text': '1948-04-05'}

	probably between 1890 and 1958

	{'@encoding': 'edtf', '@keyDate': 'yes', '@point': 'start', '@qualifier': 'inferred', '#text': '1890'}

	probably between 1807 and 1870

	{'@encoding': 'edtf', '@keyDate': 'yes', '@point': 'end', '#text': '1870'}

	{'@encoding': 'edtf', '@keyDate': 'yes', '@point': 'start', '@qualifier': 'inferred', '#text': '1807'}

	approximately between 1945 and 1960

	between 1850 and 1865

	{'@encoding': 'edtf', '@keyDate': 'yes', '@point': 'end', '#text': '1865'}

	between 1913 and 1915

	between 1907 and 1927

	approximately between 1940 and 1958

	{'@encoding': 'edtf', '@keyDate': 'yes', '@point': 'start', '@qualifier': 'approximate', '#text': '1940'}

	approximately between 1920 and 1940

	{'@encoding': 'edtf', '@keyDate': 'yes', '@point': 'start', '@qualifier': 'approximate', '#text': '1920'}

	approximately between 1890 and 1910

	approximately between 1927 and 1957

	{'@encoding': 'edtf', '@keyDate': 'yes', '@point': 'end', '#text': '1957'}

	{'@encoding': 'edtf', '@keyDate': 'yes', '@point': 'start', '@qualifier': 'approximate', '#text': '1927'}

	1892

	{'@encoding': 'edtf', '@keyDate': 'yes', '#text': '1892'}

	approximately between 1880 and 1900

	approximately between 1910 and 1920

	{'@encoding': 'edtf', '@keyDate': 'yes', '@point': 'start', '@qualifier': 'approximate', '#text': '1910'}

	between 1920 and 1930?

	between 1910 and 1925?

	1876

	{'@encoding': 'edtf', '@keyDate': 'yes', '#text': '1876'}

	approximately between 1930 and 1960

	{'@encoding': 'edtf', '@keyDate': 'yes', '@point': 'start', '@qualifier': 'approximate', '#text': '1930'}

	between 1900 and 1920?

	probably between 1890 and 1901

	between 1900 and 1925?

	approximately between 1901 and 1939

	{'@encoding': 'edtf', '@keyDate': 'yes', '@point': 'start', '@qualifier': 'approximate', '#text': '1901'}

	between 1910 and 1930?

	approximately between 1901 and 1945

	{'@encoding': 'edtf', '@keyDate': 'yes', '@point': 'end', '#text': '1945'}

	approximately between 1901 and 1938

	{'@encoding': 'edtf', '@keyDate': 'yes', '@point': 'end', '#text': '1938'}

	between 1867 and 1921?

	{'@encoding': 'edtf', '@keyDate': 'yes', '@point': 'start', '@qualifier': 'questionable', '#text': '1867'}

	1918-06-18

	{'@encoding': 'edtf', '@keyDate': 'yes', '#text': '1918-06-18'}

	1944-11-05

	{'@encoding': 'edtf', '@keyDate': 'yes', '#text': '1944-11-05'}

	between 1918 and 1935?

	{'@encoding': 'edtf', '@keyDate': 'yes', '@point': 'start', '@qualifier': 'questionable', '#text': '1918'}

	1976-06-28

	{'@encoding': 'edtf', '@keyDate': 'yes', '#text': '1976-06-28'}

	1911-08-10

	{'@encoding': 'edtf', '@keyDate': 'yes', '#text': '1911-08-10'}

	approximately between 1945 and 1965

	between 1934 and 1945?

	{'@encoding': 'edtf', '@keyDate': 'yes', '@point': 'start', '@qualifier': 'questionable', '#text': '1934'}

	between 1934 and 1954?

	approximately between 1930 and 1939

	1968-02

	{'@encoding': 'edtf', '@keyDate': 'yes', '#text': '1968-02'}

	1968-03

	{'@encoding': 'edtf', '@keyDate': 'yes', '#text': '1968-03'}

	1968-03-06

	{'@encoding': 'edtf', '@keyDate': 'yes', '#text': '1968-03-06'}

	1968-02-23

	{'@encoding': 'edtf', '@keyDate': 'yes', '#text': '1968-02-23'}

	1968-02-26

	{'@encoding': 'edtf', '@keyDate': 'yes', '#text': '1968-02-26'}

	1968-03-26

	{'@encoding': 'edtf', '@keyDate': 'yes', '#text': '1968-03-26'}

	1969-04-03

	{'@encoding': 'edtf', '@keyDate': 'yes', '#text': '1969-04-03'}

	1968-03-28

	{'@encoding': 'edtf', '@keyDate': 'yes', '#text': '1968-03-28'}

	approximately between 1860 and 1869

	{'@encoding': 'edtf', '@keyDate': 'yes', '@point': 'end', '#text': '1869'}

	{'@encoding': 'edtf', '@keyDate': 'yes', '@point': 'start', '@qualifier': 'approximate', '#text': '1860'}

	1865?

	{'@encoding': 'edtf', '@keyDate': 'yes', '@qualifier': 'questionable', '#text': '1865'}

	between 1922 and 1935

	between 1865 and 1895?

	{'@encoding': 'edtf', '@keyDate': 'yes', '@point': 'start', '@qualifier': 'questionable', '#text': '1865'}

	approximately between 1871 and 1886

	{'@encoding': 'edtf', '@keyDate': 'yes', '@point': 'end', '#text': '1886'}

	{'@encoding': 'edtf', '@keyDate': 'yes', '@point': 'start', '@qualifier': 'approximate', '#text': '1871'}

	1956-09-01

	1834

	{'@encoding': 'edtf', '@keyDate': 'yes', '#text': '1834'}

	1890?

	{'@encoding': 'edtf', '@keyDate': 'yes', '@qualifier': 'questionable', '#text': '1890'}

	probably between 1939 and 1945

	{'@encoding': 'edtf', '@keyDate': 'yes', '@point': 'start', '@qualifier': 'inferred', '#text': '1939'}

	between 1888 and 1950?

	{'@encoding': 'edtf', '@keyDate': 'yes', '@point': 'start', '@qualifier': 'questionable', '#text': '1888'}

	probably between 1920 and 1930

	{'@encoding': 'edtf', '@keyDate': 'yes', '@point': 'start', '@qualifier': 'inferred', '#text': '1920'}

	between 1920 and 1950?

	probably between 1941 and 1945

	{'@encoding': 'edtf', '@keyDate': 'yes', '@point': 'start', '@qualifier': 'inferred', '#text': '1941'}

	between 1930 and 1940?

	{'@encoding': 'edtf', '@keyDate': 'yes', '@point': 'start', '@qualifier': 'questionable', '#text': '1930'}

	1915-07-04

	{'@encoding': 'edtf', '@keyDate': 'yes', '#text': '1915-07-04'}

	1947-06

	{'@encoding': 'edtf', '@keyDate': 'yes', '#text': '1947-06'}

	approximately between 1920 and 1930

	1894-11-17

	{'@encoding': 'edtf', '@keyDate': 'yes', '#text': '1894-11-17'}

	approximately between 1930 and 1935

	1919-05-15

	{'@encoding': 'edtf', '@keyDate': 'yes', '#text': '1919-05-15'}

	approximately between 1875 and 1925

	{'@encoding': 'edtf', '@keyDate': 'yes', '@point': 'start', '@qualifier': 'approximate', '#text': '1875'}

	approximately between 1940 and 1945

	1868-03-23

	{'@encoding': 'edtf', '@keyDate': 'yes', '#text': '1868-03-23'}

	1869-02-28

	{'@encoding': 'edtf', '@keyDate': 'yes', '#text': '1869-02-28'}

	approximately between 1930 and 1940

	approximately between 1890 and 1895

	1928-

	{'@encoding': 'edtf', '@keyDate': 'yes', '#text': '1928-'}

	1928-03-20

	{'@encoding': 'edtf', '@keyDate': 'yes', '#text': '1928-03-20'}

	1928-01-24

	{'@encoding': 'edtf', '@keyDate': 'yes', '#text': '1928-01-24'}

	1928-01-15

	{'@encoding': 'edtf', '@keyDate': 'yes', '#text': '1928-01-15'}

	between 1890 and 1915?

	approximately between 1920 and 1939

	approximately between 1932 and 1934

	{'@encoding': 'edtf', '@keyDate': 'yes', '@point': 'end', '#text': '1934'}

	{'@encoding': 'edtf', '@keyDate': 'yes', '@point': 'start', '@qualifier': 'approximate', '#text': '1932'}

	between 1930 and 1939?

	between 1933 and 1937?

	{'@encoding': 'edtf', '@keyDate': 'yes', '@point': 'start', '@qualifier': 'questionable', '#text': '1933'}

	between 1920 and 1939?

	approximately between 1985 and 1987

	{'@encoding': 'edtf', '@keyDate': 'yes', '@point': 'end', '#text': '1987'}

	{'@encoding': 'edtf', '@keyDate': 'yes', '@point': 'start', '@qualifier': 'approximate', '#text': '1985'}

	1926-11

	{'@encoding': 'edtf', '@keyDate': 'yes', '#text': '1926-11'}

	1927-08-24

	{'@encoding': 'edtf', '@keyDate': 'yes', '#text': '1927-08-24'}

	1926-12-02

	{'@encoding': 'edtf', '@keyDate': 'yes', '#text': '1926-12-02'}

	1927-02

	{'@encoding': 'edtf', '@keyDate': 'yes', '#text': '1927-02'}

	1927-06

	{'@encoding': 'edtf', '@keyDate': 'yes', '#text': '1927-06'}

	1927-09-25

	{'@encoding': 'edtf', '@keyDate': 'yes', '#text': '1927-09-25'}

	1927-10-04

	{'@encoding': 'edtf', '@keyDate': 'yes', '#text': '1927-10-04'}

	1927-10-09

	{'@encoding': 'edtf', '@keyDate': 'yes', '#text': '1927-10-09'}

	1927-10-15

	{'@encoding': 'edtf', '@keyDate': 'yes', '#text': '1927-10-15'}

	1929-10

	{'@encoding': 'edtf', '@keyDate': 'yes', '#text': '1929-10'}

	approximately between 1880 and 1910

	approximately between 1880 and 1990

	approximately between 1875 and 1910

	approximately between 1885 and 1890

	{'@encoding': 'edtf', '@keyDate': 'yes', '@point': 'start', '@qualifier': 'approximate', '#text': '1885'}

	1858-06-08

	{'@encoding': 'edtf', '@keyDate': 'yes', '#text': '1858-06-08'}

	probably between 1909 and 1955

	{'@encoding': 'edtf', '@keyDate': 'yes', '@point': 'end', '#text': '1955'}

	{'@encoding': 'edtf', '@keyDate': 'yes', '@point': 'start', '@qualifier': 'inferred', '#text': '1909'}

	probably between 1850 and 1950

	{'@encoding': 'edtf', '@keyDate': 'yes', '@point': 'start', '@qualifier': 'inferred', '#text': '1850'}

	1913-02-10

	{'@encoding': 'edtf', '@keyDate': 'yes', '#text': '1913-02-10'}

	between 1900 and 1930?

	1920-02-09

	{'@encoding': 'edtf', '@keyDate': 'yes', '#text': '1920-02-09'}

	approximately between 1941 and 1945

	{'@encoding': 'edtf', '@keyDate': 'yes', '@point': 'start', '@qualifier': 'approximate', '#text': '1941'}

	approximately between 1917 and 1918

	{'@encoding': 'edtf', '@keyDate': 'yes', '@point': 'start', '@qualifier': 'approximate', '#text': '1917'}

	1935-06-21

	{'@encoding': 'edtf', '@keyDate': 'yes', '#text': '1935-06-21'}

	probably between 1900 and 1940

	between 1900 and 1950?

	between 1865 and 1910?

	between 1970 and 1974

	1943-08-18

	{'@encoding': 'edtf', '@keyDate': 'yes', '#text': '1943-08-18'}

	1943-11-06

	{'@encoding': 'edtf', '@keyDate': 'yes', '#text': '1943-11-06'}

	1943-11

	{'@encoding': 'edtf', '@keyDate': 'yes', '#text': '1943-11'}

	1943-10

	{'@encoding': 'edtf', '@keyDate': 'yes', '#text': '1943-10'}

	approximately between 1939 and 1945

	{'@encoding': 'edtf', '@keyDate': 'yes', '@point': 'start', '@qualifier': 'approximate', '#text': '1939'}

	probably between 1945 and 1968

	{'@encoding': 'edtf', '@keyDate': 'yes', '@point': 'start', '@qualifier': 'inferred', '#text': '1945'}

	probably between 1912 and 1924

	{'@encoding': 'edtf', '@keyDate': 'yes', '@point': 'start', '@qualifier': 'inferred', '#text': '1912'}

	between 1920 and 1929

	approximately between 1918 and 1929

	{'@encoding': 'edtf', '@keyDate': 'yes', '@point': 'start', '@qualifier': 'approximate', '#text': '1918'}

	probably between 1910 and 1920

	{'@encoding': 'edtf', '@keyDate': 'yes', '@point': 'start', '@qualifier': 'inferred', '#text': '1910'}

	approximately between 1917 and 1929

	probably between 1930 and 1965

	{'@encoding': 'edtf', '@keyDate': 'yes', '@point': 'start', '@qualifier': 'inferred', '#text': '1930'}

	approximately between 1942 and 1965

	{'@encoding': 'edtf', '@keyDate': 'yes', '@point': 'start', '@qualifier': 'approximate', '#text': '1942'}

	approximately between 1950 and 1965

	probably between 1920 and 1940

	probably between 1935 and 1950

	approximately between 1908 and 1912

	{'@encoding': 'edtf', '@keyDate': 'yes', '@point': 'start', '@qualifier': 'approximate', '#text': '1908'}

	1951-04-30

	{'@encoding': 'edtf', '@keyDate': 'yes', '#text': '1951-04-30'}

	1913-03-13

	{'@encoding': 'edtf', '@keyDate': 'yes', '#text': '1913-03-13'}

	between 1941 and 1945

	{'@encoding': 'edtf', '@keyDate': 'yes', '@point': 'start', '#text': '1941'}

	1944-12

	{'@encoding': 'edtf', '@keyDate': 'yes', '#text': '1944-12'}

	1943-06-01

	{'@encoding': 'edtf', '@keyDate': 'yes', '#text': '1943-06-01'}

	1944-01-28

	{'@encoding': 'edtf', '@keyDate': 'yes', '#text': '1944-01-28'}

	probably between 1934 and 1946

	{'@encoding': 'edtf', '@keyDate': 'yes', '@point': 'start', '@qualifier': 'inferred', '#text': '1934'}

	probably between 1926 and 1946

	{'@encoding': 'edtf', '@keyDate': 'yes', '@point': 'start', '@qualifier': 'inferred', '#text': '1926'}

	probably between 1926 and 1934

	approximately between 1862 and 1865

	{'@encoding': 'edtf', '@keyDate': 'yes', '@point': 'start', '@qualifier': 'approximate', '#text': '1862'}

	probably between 1860 and 1879

	{'@encoding': 'edtf', '@keyDate': 'yes', '@point': 'end', '#text': '1879'}

	{'@encoding': 'edtf', '@keyDate': 'yes', '@point': 'start', '@qualifier': 'inferred', '#text': '1860'}

	approximately between 1928 and 1932

	{'@encoding': 'edtf', '@keyDate': 'yes', '@point': 'start', '@qualifier': 'approximate', '#text': '1928'}

	approximately between 1930 and 1932

	1930-06

	{'@encoding': 'edtf', '@keyDate': 'yes', '#text': '1930-06'}

	between 1931 and 1932

	probably between 1960-01 and 1979-01

	{'@encoding': 'edtf', '@keyDate': 'yes', '@point': 'end', '#text': '1979-01'}

	{'@encoding': 'edtf', '@keyDate': 'yes', '@point': 'start', '@qualifier': 'inferred', '#text': '1960-01'}

	probably between 1965 and 1970

	{'@encoding': 'edtf', '@keyDate': 'yes', '@point': 'start', '@qualifier': 'inferred', '#text': '1965'}

	probably between 1963 and 1967

	{'@encoding': 'edtf', '@keyDate': 'yes', '@point': 'start', '@qualifier': 'inferred', '#text': '1963'}

	probably between 1960 and 1970

	{'@encoding': 'edtf', '@keyDate': 'yes', '@point': 'start', '@qualifier': 'inferred', '#text': '1960'}

	probably between 1970 and 1980

	{'@encoding': 'edtf', '@keyDate': 'yes', '@point': 'start', '@qualifier': 'inferred', '#text': '1970'}

	probably between 1970 and 1975

	{'@encoding': 'edtf', '@keyDate': 'yes', '@point': 'end', '#text': '1975'}

	probably between 1968 and 1972

	{'@encoding': 'edtf', '@keyDate': 'yes', '@point': 'start', '@qualifier': 'inferred', '#text': '1968'}

	probably between 1946 and 1956

	{'@encoding': 'edtf', '@keyDate': 'yes', '@point': 'start', '@qualifier': 'inferred', '#text': '1946'}

	probably between 1910 and 1930

	approximately between 1958 and 1968

	{'@encoding': 'edtf', '@keyDate': 'yes', '@point': 'start', '@qualifier': 'approximate', '#text': '1958'}

	approximately between 1958 and 1980

	probably between 1968 and 1975

	probably between 1969 and 1985

	{'@encoding': 'edtf', '@keyDate': 'yes', '@point': 'start', '@qualifier': 'inferred', '#text': '1969'}

	approximately between 1942 and 1950

	probably between 1985 and 1990

	{'@encoding': 'edtf', '@keyDate': 'yes', '@point': 'start', '@qualifier': 'inferred', '#text': '1985'}

	approximately between 1990 and 2000

	{'@encoding': 'edtf', '@keyDate': 'yes', '@point': 'end', '#text': '2000'}

	{'@encoding': 'edtf', '@keyDate': 'yes', '@point': 'start', '@qualifier': 'approximate', '#text': '1990'}

	probably between 1980 and 1989

	{'@encoding': 'edtf', '@keyDate': 'yes', '@point': 'start', '@qualifier': 'inferred', '#text': '1980'}

	approximately between 1975 and 1979

	{'@encoding': 'edtf', '@keyDate': 'yes', '@point': 'end', '#text': '1979'}

	{'@encoding': 'edtf', '@keyDate': 'yes', '@point': 'start', '@qualifier': 'approximate', '#text': '1975'}

	probably between 1959 and 1975

	{'@encoding': 'edtf', '@keyDate': 'yes', '@point': 'start', '@qualifier': 'inferred', '#text': '1959'}

	between 1878 and 1911

	{'@encoding': 'edtf', '@keyDate': 'yes', '@point': 'start', '#text': '1878'}

	probably between 1853 and 1892

	{'@encoding': 'edtf', '@keyDate': 'yes', '@point': 'end', '#text': '1892'}

	{'@encoding': 'edtf', '@keyDate': 'yes', '@point': 'start', '@qualifier': 'inferred', '#text': '1853'}

	1900-02-20

	{'@encoding': 'edtf', '@keyDate': 'yes', '#text': '1900-02-20'}

	1909-11-10

	{'@encoding': 'edtf', '@keyDate': 'yes', '#text': '1909-11-10'}

	probably between 1942 and 1945

	{'@encoding': 'edtf', '@keyDate': 'yes', '@point': 'start', '@qualifier': 'inferred', '#text': '1942'}

	probably between 1942 and 1943

	probably between 1916 and 1918

	{'@encoding': 'edtf', '@keyDate': 'yes', '@point': 'start', '@qualifier': 'inferred', '#text': '1916'}

	1948-05-12

	{'@encoding': 'edtf', '@keyDate': 'yes', '#text': '1948-05-12'}

	approximately between 1940 and 1950

	approximately between 1945 and 1955

	1817

	{'@encoding': 'edtf', '@keyDate': 'yes', '#text': '1817'}

	1830

	{'@encoding': 'edtf', '@keyDate': 'yes', '#text': '1830'}

	1867

	{'@encoding': 'edtf', '@keyDate': 'yes', '#text': '1867'}

	1845-06-24

	{'@encoding': 'edtf', '@keyDate': 'yes', '#text': '1845-06-24'}

	approximately between 1840 and 1880

	{'@encoding': 'edtf', '@keyDate': 'yes', '@point': 'end', '#text': '1880'}

	{'@encoding': 'edtf', '@keyDate': 'yes', '@point': 'start', '@qualifier': 'approximate', '#text': '1840'}

	1822

	{'@encoding': 'edtf', '@keyDate': 'yes', '#text': '1822'}

	1901-09-00

	{'@encoding': 'edtf', '@keyDate': 'yes', '#text': '1901-09-00'}

	probably between 1836 and 1842

	{'@encoding': 'edtf', '@keyDate': 'yes', '@point': 'end', '#text': '1842'}

	1810

	{'@encoding': 'edtf', '@keyDate': 'yes', '#text': '1810'}

	approximately between 1890 and 1917

	approximately between 1860 and 1865

	approximately between 1870 and 1910

	approximately between 1870 and 1878

	{'@encoding': 'edtf', '@keyDate': 'yes', '@point': 'end', '#text': '1878'}

	approximately between 1865 and 1890

	approximately between 1865 and 1910

	approximately between 1870 and 1900

	approximately between 1870 and 1897

	approximately between 1899 and 1926

	{'@encoding': 'edtf', '@keyDate': 'yes', '@point': 'start', '@qualifier': 'approximate', '#text': '1899'}

	approximately between 1860 and 1886

	approximately between 1885 and 1925

	approximately between 1875 and 1892

	1854

	{'@encoding': 'edtf', '@keyDate': 'yes', '#text': '1854'}

	approximately between 1870 and 1892

	approximately between 1880 and 1922

	approximately between 1853 and 1863

	{'@encoding': 'edtf', '@keyDate': 'yes', '@point': 'end', '#text': '1863'}

	{'@encoding': 'edtf', '@keyDate': 'yes', '@point': 'start', '@qualifier': 'approximate', '#text': '1853'}

	approximately between 1896 and 1926

	{'@encoding': 'edtf', '@keyDate': 'yes', '@point': 'start', '@qualifier': 'approximate', '#text': '1896'}

	approximately between 1867 and 1893

	{'@encoding': 'edtf', '@keyDate': 'yes', '@point': 'start', '@qualifier': 'approximate', '#text': '1867'}

	approximately between 1870 and 1930

	approximately between 1860 and 1898

	approximately between 1865 and 1920

	approximately between 1870 and 1924

	approximately between 1867 and 1881

	approximately between 1893 and 1928

	{'@encoding': 'edtf', '@keyDate': 'yes', '@point': 'start', '@qualifier': 'approximate', '#text': '1893'}

	approximately between 1890 and 1927

	approximately between 1875 and 1889

	{'@encoding': 'edtf', '@keyDate': 'yes', '@point': 'end', '#text': '1889'}

	approximately between 1855 and 1900

	{'@encoding': 'edtf', '@keyDate': 'yes', '@point': 'start', '@qualifier': 'approximate', '#text': '1855'}

	approximately between 1850 and 1878

	1928-07-01

	{'@encoding': 'edtf', '@keyDate': 'yes', '#text': '1928-07-01'}

	approximately between 1855 and 1910

	approximately between 1864 and 1904

	{'@encoding': 'edtf', '@keyDate': 'yes', '@point': 'end', '#text': '1904'}

	{'@encoding': 'edtf', '@keyDate': 'yes', '@point': 'start', '@qualifier': 'approximate', '#text': '1864'}

	approximately between 1890 and 1925

	approximately between 1900 and 1917

	approximately between 1855 and 1879

	approximately between 1860 and 1900

	approximately between 1890 and 1914

	{'@encoding': 'edtf', '@keyDate': 'yes', '@point': 'end', '#text': '1914'}

	approximately between 1870 and 1894

	{'@encoding': 'edtf', '@keyDate': 'yes', '@point': 'end', '#text': '1894'}

	approximately between 1870 and 1886

	approximately between 1870 and 1891

	{'@encoding': 'edtf', '@keyDate': 'yes', '@point': 'end', '#text': '1891'}

	approximately between 1863 and 1908

	{'@encoding': 'edtf', '@keyDate': 'yes', '@point': 'start', '@qualifier': 'approximate', '#text': '1863'}

	approximately between 1858 and 1892

	{'@encoding': 'edtf', '@keyDate': 'yes', '@point': 'start', '@qualifier': 'approximate', '#text': '1858'}

	approximately between 1900 and 1922

	approximately between 1872 and 1898

	{'@encoding': 'edtf', '@keyDate': 'yes', '@point': 'start', '@qualifier': 'approximate', '#text': '1872'}

	approximately between 1900 and 1923

	{'@encoding': 'edtf', '@keyDate': 'yes', '@point': 'end', '#text': '1923'}

	approximately between 1880 and 1917

	approximately between 1900 and 1927

	approximately between 1880 and 1915

	approximately between 1880 and 1909

	approximately between 1870 and 1887

	{'@encoding': 'edtf', '@keyDate': 'yes', '@point': 'end', '#text': '1887'}

	approximately between 1860 and 1902

	approximately between 1860 and 1899

	approximately between 1870 and 1911

	approximately between 1880 and 1920

	approximately between 1870 and 1912

	approximately between 1895 and 1916

	{'@encoding': 'edtf', '@keyDate': 'yes', '@point': 'start', '@qualifier': 'approximate', '#text': '1895'}

	approximately between 1860 and 1888

	{'@encoding': 'edtf', '@keyDate': 'yes', '@point': 'end', '#text': '1888'}

	approximately between 1860 and 1891

	approximately between 1867 and 1888

	approximately between 1870 and 1918

	approximately between 1860 and 1883

	{'@encoding': 'edtf', '@keyDate': 'yes', '@point': 'end', '#text': '1883'}

	approximately between 1870 and 1920

	approximately between 1880 and 1912

	approximately between 1883 and 1917

	{'@encoding': 'edtf', '@keyDate': 'yes', '@point': 'start', '@qualifier': 'approximate', '#text': '1883'}

	approximately between 1860 and 1897

	approximately between 1885 and 1923

	approximately between 1890 and 1924

	approximately between 1860 and 1920

	approximately between 1880-01 and 1900-01

	{'@encoding': 'edtf', '@keyDate': 'yes', '@point': 'end', '#text': '1900-01'}

	{'@encoding': 'edtf', '@keyDate': 'yes', '@point': 'start', '@qualifier': 'approximate', '#text': '1880-01'}

	approximately between 1858 and 1899

	approximately between 1876 and 1898

	{'@encoding': 'edtf', '@keyDate': 'yes', '@point': 'start', '@qualifier': 'approximate', '#text': '1876'}

	approximately between 1859 and 1883

	{'@encoding': 'edtf', '@keyDate': 'yes', '@point': 'start', '@qualifier': 'approximate', '#text': '1859'}

	approximately between 1860 and 1895

	approximately between 1866 and 1906

	{'@encoding': 'edtf', '@keyDate': 'yes', '@point': 'start', '@qualifier': 'approximate', '#text': '1866'}

	approximately between 1865 and 1891

	approximately between 1868 and 1898

	{'@encoding': 'edtf', '@keyDate': 'yes', '@point': 'start', '@qualifier': 'approximate', '#text': '1868'}

	approximately between 1869 and 1894

	{'@encoding': 'edtf', '@keyDate': 'yes', '@point': 'start', '@qualifier': 'approximate', '#text': '1869'}

	approximately between 1874 and 1900

	{'@encoding': 'edtf', '@keyDate': 'yes', '@point': 'start', '@qualifier': 'approximate', '#text': '1874'}

	approximately between 1857 and 1884

	{'@encoding': 'edtf', '@keyDate': 'yes', '@point': 'end', '#text': '1884'}

	{'@encoding': 'edtf', '@keyDate': 'yes', '@point': 'start', '@qualifier': 'approximate', '#text': '1857'}

	approximately between 1987 and 1997

	{'@encoding': 'edtf', '@keyDate': 'yes', '@point': 'end', '#text': '1997'}

	{'@encoding': 'edtf', '@keyDate': 'yes', '@point': 'start', '@qualifier': 'approximate', '#text': '1987'}

	approximately between 1990 and 1999

	{'@encoding': 'edtf', '@keyDate': 'yes', '@point': 'end', '#text': '1999'}

	approximately between 1992 and 1997

	{'@encoding': 'edtf', '@keyDate': 'yes', '@point': 'start', '@qualifier': 'approximate', '#text': '1992'}

	1956-05-28

	{'@encoding': 'edtf', '@keyDate': 'yes', '#text': '1956-05-28'}

	approximately between 1940 and 1955

	between 1900 and 1935?

	approximately between 1950 and 1955

	approximately between 1910 and 1925

	approximately between 1930 and 1945

	approximately between 1900 and 1915

	approximately between 1900 and 1920

	1860

	{'@encoding': 'edtf', '@keyDate': 'yes', '#text': '1860'}

	approximately between 1850 and 1860

	{'@encoding': 'edtf', '@keyDate': 'yes', '@point': 'end', '#text': '1860'}

	approximately between 1855 and 1873

	{'@encoding': 'edtf', '@keyDate': 'yes', '@point': 'end', '#text': '1873'}

	1887-06-22

	{'@encoding': 'edtf', '@keyDate': 'yes', '#text': '1887-06-22'}

	between 1880 and 1920?

	{'@encoding': 'edtf', '@keyDate': 'yes', '@point': 'start', '@qualifier': 'questionable', '#text': '1880'}

	1978-11

	{'@encoding': 'edtf', '@keyDate': 'yes', '#text': '1978-11'}

	1976-10

	{'@encoding': 'edtf', '@keyDate': 'yes', '#text': '1976-10'}

	1976-11

	{'@encoding': 'edtf', '@keyDate': 'yes', '#text': '1976-11'}

	between 1850 and 1950?

	{'@encoding': 'edtf', '@keyDate': 'yes', '@point': 'start', '@qualifier': 'questionable', '#text': '1850'}

	1975-10-31

	{'@encoding': 'edtf', '@keyDate': 'yes', '#text': '1975-10-31'}

	approximately between 1977 and 1985

	{'@encoding': 'edtf', '@keyDate': 'yes', '@point': 'start', '@qualifier': 'approximate', '#text': '1977'}

	approximately between 1967 and 1976

	{'@encoding': 'edtf', '@keyDate': 'yes', '@point': 'end', '#text': '1976'}

	{'@encoding': 'edtf', '@keyDate': 'yes', '@point': 'start', '@qualifier': 'approximate', '#text': '1967'}

	probably between 1916 and 1944

	between 1900 and 1975?

	between 1935 and 1965?

	{'@encoding': 'edtf', '@keyDate': 'yes', '@point': 'start', '@qualifier': 'questionable', '#text': '1935'}

	between 1900 and 1999?

	between 1938 and 1942

	{'@encoding': 'edtf', '@keyDate': 'yes', '@point': 'start', '#text': '1938'}

	between 1940 and 1941

	{'@encoding': 'edtf', '@keyDate': 'yes', '@point': 'end', '#text': '1941'}

	{'@encoding': 'edtf', '@keyDate': 'yes', '@point': 'start', '#text': '1940'}

	1940-41

	{'@encoding': 'edtf', '@keyDate': 'yes', '#text': '1940-41'}

	1938-42

	{'@encoding': 'edtf', '@keyDate': 'yes', '#text': '1938-42'}

	between 1939 and 1942

	{'@encoding': 'edtf', '@keyDate': 'yes', '@point': 'start', '#text': '1939'}

	between 1948 and 1949

	{'@encoding': 'edtf', '@keyDate': 'yes', '@point': 'end', '#text': '1949'}

	approximately between 1940 and 1949

	approximately between 1938 and 1948

	{'@encoding': 'edtf', '@keyDate': 'yes', '@point': 'end', '#text': '1948'}

	{'@encoding': 'edtf', '@keyDate': 'yes', '@point': 'start', '@qualifier': 'approximate', '#text': '1938'}

	between 1947 and 1948

	between 1938 and 1948

	between 1941 and 1942

	between 1938 and 2007-07-30

	{'@encoding': 'edtf', '@keyDate': 'yes', '@point': 'end', '#text': '2007-07-30'}

	between 1900 and 1925

	between 1960 and 2007?

	{'@encoding': 'edtf', '@keyDate': 'yes', '@point': 'start', '@qualifier': 'questionable', '#text': '1960'}

	approximately between 1942 and 1945

	1943-12

	{'@encoding': 'edtf', '@keyDate': 'yes', '#text': '1943-12'}

	approximately between 1945 and 1950

	1943-01-02

	{'@encoding': 'edtf', '@keyDate': 'yes', '#text': '1943-01-02'}

	probably between 1960 and 1969

	1969-02-20

	{'@encoding': 'edtf', '@keyDate': 'yes', '#text': '1969-02-20'}

	1968-11-13

	{'@encoding': 'edtf', '@keyDate': 'yes', '#text': '1968-11-13'}

	1968-11-15

	{'@encoding': 'edtf', '@keyDate': 'yes', '#text': '1968-11-15'}

	1968-11-19

	{'@encoding': 'edtf', '@keyDate': 'yes', '#text': '1968-11-19'}

	1969-01-10

	{'@encoding': 'edtf', '@keyDate': 'yes', '#text': '1969-01-10'}

	1969-01-21

	{'@encoding': 'edtf', '@keyDate': 'yes', '#text': '1969-01-21'}

	1968-12-04

	{'@encoding': 'edtf', '@keyDate': 'yes', '#text': '1968-12-04'}

	probably between 1967 and 1969

	{'@encoding': 'edtf', '@keyDate': 'yes', '@point': 'start', '@qualifier': 'inferred', '#text': '1967'}

	1969-06-20

	{'@encoding': 'edtf', '@keyDate': 'yes', '#text': '1969-06-20'}

	1969-07-16

	{'@encoding': 'edtf', '@keyDate': 'yes', '#text': '1969-07-16'}

	1969-11-19

	{'@encoding': 'edtf', '@keyDate': 'yes', '#text': '1969-11-19'}

	1970-03-13

	{'@encoding': 'edtf', '@keyDate': 'yes', '#text': '1970-03-13'}

	1970-09-14

	{'@encoding': 'edtf', '@keyDate': 'yes', '#text': '1970-09-14'}

	1971-03-02

	{'@encoding': 'edtf', '@keyDate': 'yes', '#text': '1971-03-02'}

	1971-07-02

	{'@encoding': 'edtf', '@keyDate': 'yes', '#text': '1971-07-02'}

	1971-07-07

	{'@encoding': 'edtf', '@keyDate': 'yes', '#text': '1971-07-07'}

	1971-07-06

	{'@encoding': 'edtf', '@keyDate': 'yes', '#text': '1971-07-06'}

	1971-12-04

	{'@encoding': 'edtf', '@keyDate': 'yes', '#text': '1971-12-04'}

	1969-08-20

	{'@encoding': 'edtf', '@keyDate': 'yes', '#text': '1969-08-20'}

	1969-09-08

	{'@encoding': 'edtf', '@keyDate': 'yes', '#text': '1969-09-08'}

	1970-08-17

	{'@encoding': 'edtf', '@keyDate': 'yes', '#text': '1970-08-17'}

	1970-09-30

	{'@encoding': 'edtf', '@keyDate': 'yes', '#text': '1970-09-30'}

	1970-07-16

	{'@encoding': 'edtf', '@keyDate': 'yes', '#text': '1970-07-16'}

	1971-04-23

	{'@encoding': 'edtf', '@keyDate': 'yes', '#text': '1971-04-23'}

	1971-04-13

	{'@encoding': 'edtf', '@keyDate': 'yes', '#text': '1971-04-13'}

	between 1907 and 1908

	approximately between 1870 and 1880

	1855

	{'@encoding': 'edtf', '@keyDate': 'yes', '#text': '1855'}

	approximately between 1885 and 1920

	1804

	{'@encoding': 'edtf', '@keyDate': 'yes', '#text': '1804'}

	1835

	{'@encoding': 'edtf', '@keyDate': 'yes', '#text': '1835'}

	1934-03-07

	{'@encoding': 'edtf', '@keyDate': 'yes', '#text': '1934-03-07'}

	1924-01-01

	{'@encoding': 'edtf', '@keyDate': 'yes', '#text': '1924-01-01'}

	1960-01

	{'@encoding': 'edtf', '@keyDate': 'yes', '#text': '1960-01'}

	1948-01

	{'@encoding': 'edtf', '@keyDate': 'yes', '#text': '1948-01'}

	1958-01

	{'@encoding': 'edtf', '@keyDate': 'yes', '#text': '1958-01'}

	1950-01

	{'@encoding': 'edtf', '@keyDate': 'yes', '#text': '1950-01'}

	1962-01

	{'@encoding': 'edtf', '@keyDate': 'yes', '#text': '1962-01'}

	approximately between 1966-01 and 1967-01

	{'@encoding': 'edtf', '@keyDate': 'yes', '@point': 'end', '#text': '1967-01'}

	{'@encoding': 'edtf', '@keyDate': 'yes', '@point': 'start', '@qualifier': 'approximate', '#text': '1966-01'}

	1955-01

	{'@encoding': 'edtf', '@keyDate': 'yes', '#text': '1955-01'}

	1934-05-27

	{'@encoding': 'edtf', '@keyDate': 'yes', '#text': '1934-05-27'}

	1928-01

	{'@encoding': 'edtf', '@keyDate': 'yes', '#text': '1928-01'}

	1951-01

	{'@encoding': 'edtf', '@keyDate': 'yes', '#text': '1951-01'}

	1930-01

	{'@encoding': 'edtf', '@keyDate': 'yes', '#text': '1930-01'}

	between 1925 and 1930

	between 1925 and 1935

	approximately between 1919 and 1925

	{'@encoding': 'edtf', '@keyDate': 'yes', '@point': 'start', '@qualifier': 'approximate', '#text': '1919'}

	1929-11-28

	{'@encoding': 'edtf', '@keyDate': 'yes', '#text': '1929-11-28'}

	1987-05-29

	{'@encoding': 'edtf', '@keyDate': 'yes', '#text': '1987-05-29'}

	1883

	{'@encoding': 'edtf', '@keyDate': 'yes', '#text': '1883'}

	between 1950 and 1965

	between 1975 and 1980

	{'@encoding': 'edtf', '@keyDate': 'yes', '@point': 'start', '#text': '1975'}

	between 1970 and 1985

	approximately between 1915 and 1920

	{'@encoding': 'edtf', '@keyDate': 'yes', '@point': 'start', '@qualifier': 'approximate', '#text': '1915'}

	approximately between 1920 and 1955

	approximately between 1950 and 1975

	approximately between 1955 and 1965

	{'@encoding': 'edtf', '@keyDate': 'yes', '@point': 'start', '@qualifier': 'approximate', '#text': '1955'}

	approximately between 1890 and 1930

	approximately between 1878 and 1908

	{'@encoding': 'edtf', '@keyDate': 'yes', '@point': 'start', '@qualifier': 'approximate', '#text': '1878'}

	approximately between 1955 and 1970

	approximately between 1910 and 1930

	between 1960 and 1962

	{'@encoding': 'edtf', '@keyDate': 'yes', '@point': 'start', '#text': '1960'}

	1960-03-03

	{'@encoding': 'edtf', '@keyDate': 'yes', '#text': '1960-03-03'}

	between 1925 and 1940

	between 1885 and 1930

	between 1960 and 1980

	approximately between 1940 and 1980

	approximately between 1930 and 1975

	approximately between 1898 and 1919

	{'@encoding': 'edtf', '@keyDate': 'yes', '@point': 'start', '@qualifier': 'approximate', '#text': '1898'}

	approximately between 1920 and 1960

	approximately between 1915 and 1930

	1893-01-16

	{'@encoding': 'edtf', '@keyDate': 'yes', '#text': '1893-01-16'}

	approximately between 1875 and 1920

	approximately between 1880 and 1918

	approximately between 1870 and 1890

	approximately between 1885 and 1865

	approximately between 1885 and 1910

	1919-11-11

	{'@encoding': 'edtf', '@keyDate': 'yes', '#text': '1919-11-11'}

	approximately between 1924 and 1955

	{'@encoding': 'edtf', '@keyDate': 'yes', '@point': 'start', '@qualifier': 'approximate', '#text': '1924'}

	approximately between 1933 and 1936

	{'@encoding': 'edtf', '@keyDate': 'yes', '@point': 'start', '@qualifier': 'approximate', '#text': '1933'}

	approximately between 1885 and 1905

	1965-06-24

	{'@encoding': 'edtf', '@keyDate': 'yes', '#text': '1965-06-24'}

	between 1945 and 1970?

	{'@encoding': 'edtf', '@keyDate': 'yes', '@point': 'start', '@qualifier': 'questionable', '#text': '1945'}

	approximately between 1941 and 1943

	approximately between 1905 and 1925

	{'@encoding': 'edtf', '@keyDate': 'yes', '@point': 'start', '@qualifier': 'approximate', '#text': '1905'}

	between 1906 and 1931

	probably between 1904 and 1906

	{'@encoding': 'edtf', '@keyDate': 'yes', '@point': 'start', '@qualifier': 'inferred', '#text': '1904'}

	1914-06

	{'@encoding': 'edtf', '@keyDate': 'yes', '#text': '1914-06'}

	1963-07

	{'@encoding': 'edtf', '@keyDate': 'yes', '#text': '1963-07'}

	approximately between 1900 and 1935

	approximately between 1860 and 1870

	approximately between 1890 and 1915

	approximately between 1960 and 1969

	approximately between 1940 and 1990

	1937-08-16

	{'@encoding': 'edtf', '@keyDate': 'yes', '#text': '1937-08-16'}

	probably between 1907 and 1910

	{'@encoding': 'edtf', '@keyDate': 'yes', '@point': 'start', '@qualifier': 'inferred', '#text': '1907'}

	approximately between 1890 and 1950

	approximately between 1915 and 1925

	approximately between 1920 and 1935

	1949-02

	{'@encoding': 'edtf', '@keyDate': 'yes', '#text': '1949-02'}

	approximately between 1920 and 1945

	approximately between 2000 and 2005

	{'@encoding': 'edtf', '@keyDate': 'yes', '@point': 'end', '#text': '2005'}

	{'@encoding': 'edtf', '@keyDate': 'yes', '@point': 'start', '@qualifier': 'approximate', '#text': '2000'}

	probably between 1930 and 1939

	approximately between 1900 and 1950

	1908-06-27

	{'@encoding': 'edtf', '@keyDate': 'yes', '#text': '1908-06-27'}

	between 1915 and 1950

	approximately between 1920 and 1954

	approximately between 1941 and 1970

	approximately between 1940 and 1970

	between 1790 and 1826?

	{'@encoding': 'edtf', '@keyDate': 'yes', '@point': 'start', '@qualifier': 'questionable', '#text': '1790'}

	1908-12-01

	{'@encoding': 'edtf', '@keyDate': 'yes', '#text': '1908-12-01'}

	approximately between 1950 and 1970

	probably between 1900 and 1907

	{'@encoding': 'edtf', '@keyDate': 'yes', '@point': 'end', '#text': '1907'}

	approximately between 1930 and 1955

	probably between 1880 and 1900

	{'@encoding': 'edtf', '@keyDate': 'yes', '@point': 'start', '@qualifier': 'inferred', '#text': '1880'}

	1896-07-06

	{'@encoding': 'edtf', '@keyDate': 'yes', '#text': '1896-07-06'}

	approximately between 1910 and 1945

	1912-08-15

	{'@encoding': 'edtf', '@keyDate': 'yes', '#text': '1912-08-15'}

	probably between 1920 and 1925

	probably between 1890 and 1900

	approximately between 1930 and 1950

	probably between 1880 and 1890

	approximately between 1900 and 1940

	1845

	{'@encoding': 'edtf', '@keyDate': 'yes', '#text': '1845'}

	approximately between 1890 and 1900

	between 1911 and 1912

	approximately between 1903 and 1905

	{'@encoding': 'edtf', '@keyDate': 'yes', '@point': 'start', '@qualifier': 'approximate', '#text': '1903'}

	1944-06-29

	{'@encoding': 'edtf', '@keyDate': 'yes', '#text': '1944-06-29'}

	1928-05-15

	{'@encoding': 'edtf', '@keyDate': 'yes', '#text': '1928-05-15'}

	1930-11-07

	{'@encoding': 'edtf', '@keyDate': 'yes', '#text': '1930-11-07'}

	1930-11-30

	{'@encoding': 'edtf', '@keyDate': 'yes', '#text': '1930-11-30'}

	1938-06-29

	{'@encoding': 'edtf', '@keyDate': 'yes', '#text': '1938-06-29'}

	1930-11-17

	{'@encoding': 'edtf', '@keyDate': 'yes', '#text': '1930-11-17'}

	2008-04-09

	{'@encoding': 'edtf', '@keyDate': 'yes', '#text': '2008-04-09'}

	1866-06

	{'@encoding': 'edtf', '@keyDate': 'yes', '#text': '1866-06'}

	1947-04-25

	{'@encoding': 'edtf', '@keyDate': 'yes', '#text': '1947-04-25'}

	between 1850 and 1930?

	between 1850 and 1920?

	between 1910 and 1930

	between 1890 and 1960?

	between 1800 and 1865?

	{'@encoding': 'edtf', '@keyDate': 'yes', '@point': 'start', '@qualifier': 'questionable', '#text': '1800'}

	approximately between 1863 and 1877

	approximately between 1870 and 1915

	1790

	{'@encoding': 'edtf', '@keyDate': 'yes', '#text': '1790'}

	between 1800 and 1900?

	1840

	approximately between 1880 and 1940

	1912-08-23

	{'@encoding': 'edtf', '@keyDate': 'yes', '#text': '1912-08-23'}

	approximately between 1880 and 1930

	approximately between 1948 and 1958

	{'@encoding': 'edtf', '@keyDate': 'yes', '@point': 'start', '@qualifier': 'approximate', '#text': '1948'}

	approximately between 1925 and 1955

	{'@encoding': 'edtf', '@keyDate': 'yes', '@point': 'start', '@qualifier': 'approximate', '#text': '1925'}

	between 1930 and 1960?

	between 1870 and 1910?

	{'@encoding': 'edtf', '@keyDate': 'yes', '@point': 'start', '@qualifier': 'questionable', '#text': '1870'}

	between 1940 and 1945?

	{'@encoding': 'edtf', '@keyDate': 'yes', '@point': 'start', '@qualifier': 'questionable', '#text': '1940'}

	between 1930 and 1950?

	probably between 1940 and 1943

	1945-07

	{'@encoding': 'edtf', '@keyDate': 'yes', '#text': '1945-07'}

	1945-08-15

	{'@encoding': 'edtf', '@keyDate': 'yes', '#text': '1945-08-15'}

	1945-04

	{'@encoding': 'edtf', '@keyDate': 'yes', '#text': '1945-04'}

	1945-08

	{'@encoding': 'edtf', '@keyDate': 'yes', '#text': '1945-08'}

	1945-10-03

	{'@encoding': 'edtf', '@keyDate': 'yes', '#text': '1945-10-03'}

	1945-05-27

	{'@encoding': 'edtf', '@keyDate': 'yes', '#text': '1945-05-27'}

	1945-04-20

	{'@encoding': 'edtf', '@keyDate': 'yes', '#text': '1945-04-20'}

	1945-03-17

	{'@encoding': 'edtf', '@keyDate': 'yes', '#text': '1945-03-17'}

	1945-10

	{'@encoding': 'edtf', '@keyDate': 'yes', '#text': '1945-10'}

	1945-03

	{'@encoding': 'edtf', '@keyDate': 'yes', '#text': '1945-03'}

	1945-09-16

	{'@encoding': 'edtf', '@keyDate': 'yes', '#text': '1945-09-16'}

	1945-01

	{'@encoding': 'edtf', '@keyDate': 'yes', '#text': '1945-01'}

	1945-10-05

	{'@encoding': 'edtf', '@keyDate': 'yes', '#text': '1945-10-05'}

	1945-05-05

	{'@encoding': 'edtf', '@keyDate': 'yes', '#text': '1945-05-05'}

	approximately between 1852 and 1903

	{'@encoding': 'edtf', '@keyDate': 'yes', '@point': 'end', '#text': '1903'}

	{'@encoding': 'edtf', '@keyDate': 'yes', '@point': 'start', '@qualifier': 'approximate', '#text': '1852'}

	approximately between 1880 and 1889

	probably between 1880 and 1889

	approximately between 1908 and 1915

	probably between 1880-01 and 1900-01

	{'@encoding': 'edtf', '@keyDate': 'yes', '@point': 'start', '@qualifier': 'inferred', '#text': '1880-01'}

	1842-01

	{'@encoding': 'edtf', '@keyDate': 'yes', '#text': '1842-01'}

	1991-01-31

	{'@encoding': 'edtf', '@keyDate': 'yes', '#text': '1991-01-31'}

	approximately between 1960 and 1975

	between 1900 and 1915?

	1917-09-05

	{'@encoding': 'edtf', '@keyDate': 'yes', '#text': '1917-09-05'}

	1924-11-14

	{'@encoding': 'edtf', '@keyDate': 'yes', '#text': '1924-11-14'}

	1945-06-20

	{'@encoding': 'edtf', '@keyDate': 'yes', '#text': '1945-06-20'}

	approximately between 1923 and 1924

	{'@encoding': 'edtf', '@keyDate': 'yes', '@point': 'start', '@qualifier': 'approximate', '#text': '1923'}

	1798-01-01

	{'@encoding': 'edtf', '@keyDate': 'yes', '#text': '1798-01-01'}

	approximately between 1905-01 and 1910-01

	{'@encoding': 'edtf', '@keyDate': 'yes', '@point': 'end', '#text': '1910-01'}

	{'@encoding': 'edtf', '@keyDate': 'yes', '@point': 'start', '@qualifier': 'approximate', '#text': '1905-01'}

	approximately between 1928-01 and 1930-01

	{'@encoding': 'edtf', '@keyDate': 'yes', '@point': 'end', '#text': '1930-01'}

	{'@encoding': 'edtf', '@keyDate': 'yes', '@point': 'start', '@qualifier': 'approximate', '#text': '1928-01'}

	approximately between 1960 and 1970

	1931-07-14

	{'@encoding': 'edtf', '@keyDate': 'yes', '#text': '1931-07-14'}

	1927-09-15

	{'@encoding': 'edtf', '@keyDate': 'yes', '#text': '1927-09-15'}

	between 1942 and 1945

	approximately between 1900-01 and 1905-01

	{'@encoding': 'edtf', '@keyDate': 'yes', '@point': 'end', '#text': '1905-01'}

	{'@encoding': 'edtf', '@keyDate': 'yes', '@point': 'start', '@qualifier': 'approximate', '#text': '1900-01'}

	1922-01

	{'@encoding': 'edtf', '@keyDate': 'yes', '#text': '1922-01'}

	approximately between 1900-01 and 1929-01

	{'@encoding': 'edtf', '@keyDate': 'yes', '@point': 'end', '#text': '1929-01'}

	1939-03-19

	{'@encoding': 'edtf', '@keyDate': 'yes', '#text': '1939-03-19'}

	1890-01

	{'@encoding': 'edtf', '@keyDate': 'yes', '#text': '1890-01'}

	approximately between 1920-01 and 1929-01

	{'@encoding': 'edtf', '@keyDate': 'yes', '@point': 'start', '@qualifier': 'approximate', '#text': '1920-01'}

	1910-01

	{'@encoding': 'edtf', '@keyDate': 'yes', '#text': '1910-01'}

	1839-02-14

	{'@encoding': 'edtf', '@keyDate': 'yes', '#text': '1839-02-14'}

	approximately between 1925-01 and 1930-01

	{'@encoding': 'edtf', '@keyDate': 'yes', '@point': 'start', '@qualifier': 'approximate', '#text': '1925-01'}

	1920-01

	{'@encoding': 'edtf', '@keyDate': 'yes', '#text': '1920-01'}

	1960-01-01

	{'@encoding': 'edtf', '@keyDate': 'yes', '#text': '1960-01-01'}

	1863-01-04

	{'@encoding': 'edtf', '@keyDate': 'yes', '#text': '1863-01-04'}

	1861-09-02

	{'@encoding': 'edtf', '@keyDate': 'yes', '#text': '1861-09-02'}

	1900-01

	{'@encoding': 'edtf', '@keyDate': 'yes', '#text': '1900-01'}

	1948-04-18

	{'@encoding': 'edtf', '@keyDate': 'yes', '#text': '1948-04-18'}

	1890-01-01

	{'@encoding': 'edtf', '@keyDate': 'yes', '#text': '1890-01-01'}

	1892-01

	{'@encoding': 'edtf', '@keyDate': 'yes', '#text': '1892-01'}

	1912-09-12

	{'@encoding': 'edtf', '@keyDate': 'yes', '#text': '1912-09-12'}

	1910-01-01

	{'@encoding': 'edtf', '@keyDate': 'yes', '#text': '1910-01-01'}

	1901-04-01

	{'@encoding': 'edtf', '@keyDate': 'yes', '#text': '1901-04-01'}

	1930-01-01

	{'@encoding': 'edtf', '@keyDate': 'yes', '#text': '1930-01-01'}

	1878-02

	{'@encoding': 'edtf', '@keyDate': 'yes', '#text': '1878-02'}

	1864-01-01

	{'@encoding': 'edtf', '@keyDate': 'yes', '#text': '1864-01-01'}

	approximately between 1859-01 and 1875-01

	{'@encoding': 'edtf', '@keyDate': 'yes', '@point': 'end', '#text': '1875-01'}

	{'@encoding': 'edtf', '@keyDate': 'yes', '@point': 'start', '@qualifier': 'approximate', '#text': '1859-01'}

	1880-01

	{'@encoding': 'edtf', '@keyDate': 'yes', '#text': '1880-01'}

	1956-12-25

	{'@encoding': 'edtf', '@keyDate': 'yes', '#text': '1956-12-25'}

	1906-01

	{'@encoding': 'edtf', '@keyDate': 'yes', '#text': '1906-01'}

	1896-01

	{'@encoding': 'edtf', '@keyDate': 'yes', '#text': '1896-01'}

	1950-09

	{'@encoding': 'edtf', '@keyDate': 'yes', '#text': '1950-09'}

	1963-01

	{'@encoding': 'edtf', '@keyDate': 'yes', '#text': '1963-01'}

	between 1904 and 1908

	between 1900 and 1908

	between 1930 and 1939

	1963-10-05

	{'@encoding': 'edtf', '@keyDate': 'yes', '#text': '1963-10-05'}

	between 1983 and 1993?

	{'@encoding': 'edtf', '@keyDate': 'yes', '@point': 'end', '#text': '1993'}

	{'@encoding': 'edtf', '@keyDate': 'yes', '@point': 'start', '@qualifier': 'questionable', '#text': '1983'}

	between 1974 and 1984?

	{'@encoding': 'edtf', '@keyDate': 'yes', '@point': 'start', '@qualifier': 'questionable', '#text': '1974'}

	between 1982 and 1992?

	{'@encoding': 'edtf', '@keyDate': 'yes', '@point': 'end', '#text': '1992'}

	{'@encoding': 'edtf', '@keyDate': 'yes', '@point': 'start', '@qualifier': 'questionable', '#text': '1982'}

	1756

	{'@encoding': 'edtf', '@keyDate': 'yes', '#text': '1756'}

	approximately between 1970 and 1990

	{'@encoding': 'edtf', '@keyDate': 'yes', '@point': 'start', '@qualifier': 'approximate', '#text': '1970'}

	approximately between 1972 and 1984

	{'@encoding': 'edtf', '@keyDate': 'yes', '@point': 'start', '@qualifier': 'approximate', '#text': '1972'}

	between 1967 and 1982

	{'@encoding': 'edtf', '@keyDate': 'yes', '@point': 'start', '#text': '1967'}

	approximately between 1967 and 1983

	{'@encoding': 'edtf', '@keyDate': 'yes', '@point': 'end', '#text': '1983'}

	approximately between 1978 and 1998

	{'@encoding': 'edtf', '@keyDate': 'yes', '@point': 'end', '#text': '1998'}

	{'@encoding': 'edtf', '@keyDate': 'yes', '@point': 'start', '@qualifier': 'approximate', '#text': '1978'}

	December 24, 1949

	August 3-4, 1940

	January 8, 1950

	January 22, 1950

	February 5, 1950

	June 10-11, 1950

	August 9-11, 1940

	July 2, 1950

	July 1950

	August 12-20, 1950

	September 1-2, 1940

	September 3, 1950

	September 17, 1950

	October 14-15, 1950

	November 12, 1950

	December 1950

	January 14, 1951

	January 21, 1951

	February 4, 1951

	February 11, 1951

	September 29, 1940

	February 18, 1951

	March 10, 1951

	October 6, 1940

	March 17-18, 1951

	April 21-22, 1951

	April 29, 1951

	October 13, 1940

	May 6, 1951

	May 20, 1951

	June 3, 1951

	June 10, 1951

	December 11, 1924

	June 16-17, 1951

	June 24, 1951

	July 1, 1951

	July 4, 1951

	July 7, 1951

	July 8, 1951

	July 12, 1951

	July 14, 1951

	July 25, 1951

	July 29, 1951

	August 4-5, 1951

	August 18-19, 1951

	August 25-26, 1951

	September 1-3, 1951

	September 23, 1951

	September 29-30, 1951

	October 27, 1940

	October 7, 1951

	November 10-11, 1951

	December 27, 1951

	January 20, 1952

	November 10, 1940

	March 8-9, 1952

	March 1952

	April 13, 1952

	May 4, 1952

	November 24, 1940

	May 30-June 2, 1952

	December 8, 1940

	May 30-June 3, 1952

	December 15, 1940

	June 29, 1952

	July 17, 1952

	August 31-September 1, 1952

	September 21, 1952

	January 12, 1941

	October 11, 1952

	November 9, 1952

	November 21, 1952

	December 25, 1952

	February 8, 1953

	March 8, 1953

	April 19, 1953

	April 1953

	May 16, 1953

	May 31, 1953

	July 3-4, 1953

	July 7, 1953

	July 9, 1953

	July 19, 1953

	August 1, 1953

	August 22-23, 1953

	September 6-8, 1953

	October 3-4, 1953

	January 31-February 2, 1941

	October 2, 1953

	:November 15, 1953

	December 5, 1953

	December 13, 1953

	December 31, 1952-January 1, 1953

	February 9, 1941

	January 1-2, 1954

	January 17, 1954

	February 15, 1941

	January 31, 1954

	February 7, 13, 1954

	February 28, March 14, 1954

	March 11, 1954

	March 14, 27, April 3, 1954

	April 24-25, 1954

	May 1, 22-23, 1954

	May 2, 1954

	June 12-13, 1954

	June 19-20, 1954

	February 23, 1941

	August 9, 1954

	September 4-6, 1954

	March 1-2, 1941

	March, 8, 1941

	October 30-31, 1954

	December 25, 1954

	January 16, 1955

	March 13, May 28-29, 1955

	March 9, 1941

	March 13, 1955

	July 9, 1955

	March 15, 1941

	August 6-7, 1955

	September 3-5, 1955

	September 17, 1955

	October 3, November 5, 1955

	April 13, 1941

	October 29-30, 1955

	May 18, 1941

	January 2, 1956

	January 15, 1956

	January 22, 1956

	April 1, 1956

	May 25, 1941

	May 20, 1956

	August 19, 1956

	September 3, 1956

	June 8, 1941

	October 21, 1956

	January 20, 1957

	March 24, 1957

	June 16, 1957

	August 24, 1957

	November 30, 1957

	January 4, 1958

	February 16, 1958

	June 14-15, 1941

	April 27-28, 1958

	June 14, 1958

	July 6, 1941

	September 1-2, 1958

	October 5, 1958

	July 17, 1941

	October 17-24, 1958

	July 19-20, 1941

	November 8, 1958

	February 2, 1959

	July 4, 1959

	December 6, 1959

	August 3, 1941

	April 10, May 1, 1960

	May 28-30, 1960

	October 15-16, 1960

	November 1, 1960

	May 17, 1936

	August 1954

	August 16-17, 1941

	October 26, 1925

	August 30-September 1, 1941

	circa 1930

	Summer 1925

	May 2, 1937

	May 14, 1938

	November 28, 1937

	April 3, 1938

	March 25, 1939

	March 25, 1926

	circa 1935

	April 2, 1938

	November 2, 1941

	May 26, 1935

	September 3-6, 1927

	November 9, 1941

	June 5, 1927

	circa 1927

	July 29, 1927

	February 27, 1927

	circa 1920

	November 23, 1941

	December 7, 1941

	circa1920

	December 28, 1941

	March 17, 1929

	December 1, 1935

	November 30, 1935

	February 6, 1944

	August 7, 1931

	December 4, 1932

	January 2, 1933

	May 29, 1952

	August, 23, 1936

	October 19, 1930

	March 11, 1933

	May 30, 1948

	Februrary 21, 1935

	July 26, 1931

	May 6, 1945

	January 1, 1933

	May 6, 1934

	July 4, 1937

	December 2-3, 1933

	June 28, 1937

	August 22, 1937

	January 31, 1937

	September 4-5, 1943

	September 1, 1947

	circa 1940s

	July 15, 1934

	July 5, 1931

	September 2, 1934

	September 3, 1934

	May 27, 1934

	June 6, 1937

	October 21, 1934

	October 12, 1935

	June 29, 1948

	May 26, 1934

	February 10, 1935

	February 16, 1947

	September 15, 1935

	January 10, 1937

	January 4, 1942

	August 1928

	May 24, 1931

	July 25, 1931

	May 17, 1931

	August 20, 1937

	June 21-22, 1930

	August 1-7, 1949

	March 16, 1947

	June 19, 1938

	September 1, 1951

	May 11, 1940

	April 26, 1936

	August 4, 1940

	August 23, 1936

	April 12, 1936

	June 16, 1929

	July 4-6, 1935

	June 2, 1952

	circa 1950

	April 15, 1932

	February 24, 1935

	June 15, 1929

	February 23, 1948

	August 5, 1934

	circa 1940

	April 4, 1948

	August 1, 1947

	August 18, 1935

	August 12, 1934

	June 2, 1929

	February 7, 1943

	October 8, 1939

	January 8, 1928

	August 7, 1938

	February 17, 1935

	November 6, 1927

	February 10, 1940

	March 22, 1931

	November 21, 1937

	December 29, 1929

	January 28, 1940

	February 11, 1940

	January 29, 1928

	March 9, 1930

	February 22, 1947

	April 14, 1935

	January 5, 1936

	February 27, 1938

	February 16, 1944

	March 4-6, 1928

	January 10, 1932

	January 27, 1946

	November 7, 1937

	April 1, 1928

	September 5, 1938

	February 23, 1936

	January 2, 1950

	January 2, 1938

	January 20, 1935

	November 9, 1946

	June 16-17, 1928

	January 1925

	November 15, 1942

	November 6, 1937

	October 19, 1947

	October 26, 1947

	January 18, 1942

	May 6, 1928

	September 24, 1933

	October 20, 1934

	October 10, 1936

	February 25, 1947

	July 21, 1927

	November 27, 1932

	March 29, 1942

	May 5, 1940

	October 8, 1936

	February 1, 1942

	July 12, 1937

	September 3, 1939

	March 10, 1929

	November 11, 1952

	July 1, 1952

	December 19, 1937

	October 15, 1938

	October 18, 1936

	June 15, 1941

	June 6-7, 1927

	June 14, 1931

	January 26, 1936

	January 31, 1932

	April 10, 1932

	September 21-22, 1935

	December 18, 1938

	November 30, 1930

	April 1, 1933

	March 4, 1941

	December 17, 1939

	March 30, 1947

	May 16, 1937

	September 30, 1945

	August 19, 1928

	September 19-20, 1931

	July 1, 1939

	August 29, 1937

	April 7, 1935

	April 18, 1943

	June 21, 1936

	June 13, 1937

	April 30, 1939

	May 3, 1942

	March 5, 1932

	November 19, 1933

	April 29, 1934

	March 18, 1934

	July 28, 1946

	July 22, 1945

	May 26, 1946

	August 17, 1941

	April 20, 1941

	May 5, 1946

	December 12, 1936

	July 27, 1939

	August 21, 1936

	September 12, 1940

	February 21, 1943

	March 19, 1944

	August 19, 1939

	July 21, 1940

	May 21, 1939

	May 23, 1937

	June 11, 1933

	October 9, 1938

	January 12, 1936

	May 28-30, 1932

	November 26, 1933

	September 10, 1940

	March 2, 1947

	April 2, 1931

	June 24, 1934

	January 30, 1938

	February 7, 1932

	June 9, 1946

	March 7, 1937

	July 30, 1939

	January 13, 1935

	April 26, 1942

	August 6, 1933

	October 24, 1931

	July 4, 1936

	June 25, 1932

	August, 1935

	December 25, 1925

	May 31, 1942

	June 23, 1946

	August 21, 1949

	January 14, 1934

	December 28-29, 1946

	March 3, 1940

	May 16, 1932

	February 2, 1947

	March 12, 1933

	October 1, 1933

	June 23, 1935

	April 3-4, 1948

	April 4, 1946

	February 6, 1937

	July 7, 1945

	March 6, 1936

	June 4, 1939

	October 7, 1937

	December 2, 1934

	April 22, 1934

	May 20, 1934

	July 4, 1934

	June 9, 1935

	April 29, 1939

	July 11, 1948

	November 19, 1947

	May 30, 1936

	June 29-July 7, 1946

	March 21, 1948

	April 11, 1948

	June 29, 1946

	September 1-2, 1927

	March 26, 1933

	September 27, 1933

	June 14, 1942

	October 4, 1944

	May 30, 1937

	May 30, 1938

	October 12, 1947

	May 19, 1947

	July 6, 1935

	June 27, 1942

	October 18, 1930

	June 20, 1937

	October 29, 1929

	January 1, 1939

	April 27, 1937

	February 27, 1949

	March 1-2, 1949

	March 31, 1948

	September 1, 1929

	June 9, 1929

	December 21, 1927

	December 28, 1929

	July 23, 1942

	November 10, 1946

	November 29, 1931

	July 4, 1935

	October 11, 1925

	August 18, 1929

	May 3, 1936

	August 17, 1929

	November 19, 1944

	April 29, 1930

	November 29, 1942

	March 22, 1936

	February 23, 1947

	January 3, 1943

	August 10, 1940

	June 18, 1939

	December 8, 1934

	June 22, 1935

	February 8, 1940

	October 15, 1933

	June 11, 1950

	August 20, 1949

	September 18, 1932

	May 7, 1939

	September 14, 1929

	May 27, 1933

	May 24, 1951

	January 22, 1939

	November 24, 1946

	February 9, 1936

	September 4, 1939

	October 13, 1935

	March 17, 1930

	July 8, 1928

	September 15, 1929

	September 4, 1933

	January 8, 1939

	March 1, 1941

	May 7, 1941

	June 14, 1936

	November 19. 1933

	September 17, 1933

	February 23, 1935

	May 29, 1933

	August 19, 1945

	August 3, 1940

	April 4, 1937

	December 23, 1931

	April 25, 1937

	April 5, 1936

	July 14-15, 1928

	April 6, 1931

	September 14-15, 1929

	October 5, 1930

	April 1935

	April 8, 1934

	September 1, 1935

	February 2, 1937

	January 26, 1930

	March 23, 1930

	October 30, 1938

	September 1, 1941

	March 19, 1929

	July 4, 1942

	July 24, 1938

	April 16, 1939

	August 14, 1938

	August 16, 1937

	February 8, 1931

	July 4, 1938

	August 4, 1929

	September 4, 1938

	June 13, 1931

	September 23, 1934

	April 19, 1936

	April 4, 1943

	February 11, 1934

	June 17, 1928

	October 15, 1950

	April 28, 1946

	March 2, 1941

	January 9, 1938

	January 30, 1933

	September 16, 1928

	January 30, 1934

	February 2, 1935

	October 30, 1934

	June 26, 1946

	March 25, 1945

	September 6, 1942

	February 7, 1937

	April 21, 1951

	May 20, 1955

	July 2, 1944

	October 8, 1944

	October 30, 1949

	August 5, 1951

	May 19, 1935

	February 14, 1951

	August 26, 1951

	May 2, 1943

	January 4, 1931

	June 4, 1933

	April 3, 1932

	April 9, 1933

	August 7, 1953

	July 7, 1938

	July 16, 1936

	November 23, 1930

	August 2, 1949

	February 14, 1949

	June 2, 1935

	August 19, 1930

	August 7, 1932

	April 23, 1937

	September 26, 1937

	August 25, 1931

	April 22, 1951

	October 30, 1940

	April 2, 1933

	August 19, 1951

	April 22, 1945

	April 24, 1938

	January 18, 1948

	November 10, 1935

	May 16, 1943

	January 19-20, 1929

	August 27, 1950

	August 11, 1935

	September 16, 1934

	May 31, 1930

	May 1, 1930

	May 30, 1943

	June 16, 1951

	January 2,1933

	August 5, 1949

	August 3, 1943

	August 3, 1939

	May 7, 1933

	September 6, 1952

	March 8, 1941

	September 2, 1951

	September 7, 1936

	May 31, 1931

	August 26, 1956

	July 4, 1943

	November 22, 1931

	November 31, 1931

	September 6, 1950

	September 2, 1946

	September 1-3, 1934

	September 20, 1931

	July 4, 1932

	November 19, 1930

	July 18, 1943

	November 5-6, 1927

	January 1928

	December 31, 1927- January 1, 1928

	February 24, 1929

	February 19, 1928

	April 15, 1928

	May 4-6, 1928

	September 26, 1943

	June 1928

	October 9-10, 1943

	August 12, 1928

	September 29-30, 1928

	October 14, 1928

	October 27-28, 1928

	November 11, 1928

	November 25, 1928

	March 24, 1929

	December 9, 1928

	January 6, 1929

	October 24, 1943

	February 10, 1929

	March 9-10, 1929

	November 7, 1943

	December 10, 1943

	April 20, 1929

	April 17, 1929

	January 9, 1944

	May 5, 1929

	June 1-2, 1929

	June 8-9, 1929

	June 15-16, 1929

	January 23, 1944

	July 7, 1929

	July 19-21, 1929

	August 31-September 2, 1929

	September 28-29, 1929

	October 13, 1929

	November 3, 1929

	November 17, 1929

	March 5, 1944

	November 30-December 1, 1929

	December 15, 1929

	January 1930

	February 8-9, 1930

	February 22-23, 1930

	April 2, 1944

	April 12-13, 1930

	April 27, 1930

	May 10, 1930

	May 18, 1930

	May 25, 1930

	June 8, 1930

	June 21, 1930

	July 5-6, 1930

	July 20, 1930

	August 2-3, 1930

	August 16-17, 1930

	August 26-28, 1930

	July 16, 1944

	September 13-14, 1930

	October 4-5, 1930

	October 12, 1930

	November 1-2, 1930

	November 22-23, 1930

	July 30, 1944

	August 6-9, 1931

	December 13, 1930

	Jannuary 4, 1931

	January 11, 1931

	January 18, 1931

	February 1, 1931

	February 15, 1931

	circa July or August 1944

	March 1, 1931

	September 2-4, 1944

	March 15, 1931

	April 12, 1931

	April 26, 1931

	May 2-3, 1931

	May 16-17, 1931

	May 23-24, 1931

	September 10, 1944

	May 30-31, 1931

	July 4-5, 1931

	July 25-26, 1931

	August 23, 1931

	September 5-7, 1931

	September 24, 1944

	September 26-27, 1931

	October 10, 1931

	October 24-25, 1931

	October 1-8, 1944

	November 28-29, 1931

	December 6, 1931

	January 2-3, 1932

	February 20-21, 1932

	January 1-2, 1933

	February 28, 1932

	March 5-6, 1932

	March 20, 1932

	April 15-16, 1932

	April 30, 1932

	May 1, 1932

	May 14, 1932

	June 18-19, 1932

	June 25-26, 1932

	July 2-4, 1932

	July 17, 1932

	October 22, 1944

	January 22, 1933

	July 24, 1932

	July 31, 1932

	August 28, 1932

	September 3-4, 1932

	September 17, 1932

	October 1-2, 1932

	October 30, 1932

	November 6, 1932

	November 5, 1944

	December 11, 1932

	January 8, 1933

	January 15, 1933

	February 4-5, 1933

	February 19, 1933

	March 5, 1933

	March 11-12, 1933

	April 1-2, 1933

	April 8-9, 1933

	April 22-23, 1933

	May 6-7, 1933

	May 21, 1933

	May 27-29, 1933

	June 3-4, 1933

	June 10-11, 1933

	June 18, 1933

	June 18. 1933

	December 3, 1944

	July 1, 1933

	July 8-9, 1933

	July 16, 1933

	September 2-4, 1933

	January 7, 1945

	September 23-24, 1933

	January 21, 1945

	August 20, 1933

	October 14-15, 1933

	October 29, 1933

	February 4, 1945

	November 12, 1933

	December 16-17, 1933

	December 31, 1933

	January 21, 1934

	December 27, 1936

	January 28, 1934

	February 3-4, 1934

	March 4, 1945

	March 4, 1934

	March 11, 1934

	March 25, 1934

	April 15, 1934

	May 26-27, 1934

	June 3, 1934

	April 7-8, 1945

	June 10, 1934

	June 16-17, 1934

	June 23-24, 1934

	July 14-15, 1934

	July 22, 1934

	August 19, 1934

	September 9, 1934

	May 26-27, 1945

	August 11, 1938

	September 30, 1934

	October 7, 1934

	October 14, 1934

	June 10, 1945

	October 28, 1934

	November 3, 1934

	November 18, 1934

	December 9, 1934

	April 24-25, 1937

	July 1, 1945

	December 30, 1934

	April 27, 1935

	May 28, 1939

	May 5, 1935

	May 18-19, 1935

	May 25-26, 1935

	January 6, 1935

	January 27, 1935

	February 22-23, 1935

	March 17, 1935

	March 31, 1935

	August 19-23, 1945

	June 15-16, 1935

	September 2-3, 1945

	July 29-30, 1939

	June 22-23, 1935

	July 13-14, 1935

	July 20, 1935

	July 24, 1935

	August 3-4, 1935

	January 21, 1940

	August 10-11, 1935

	August 14, 1935

	August 17-18, 1935

	October, 11-14, 1945

	August 21, 1935

	August 24-25, 1935

	September 1-2, 1935

	September 8, 1935

	September 20, 1935

	September 22, 1935

	September 29, 1935

	October 5-6, 1935

	October 12-13, 1935

	October 21, 1945

	October 20, 1935

	October 27, 1935

	November 1, 1935

	November 2-3, 1935

	November 11, 1945

	November 14, 1935

	November 24, 1935

	November 30-December 1, 1935

	November 25, 1945

	December 29, 1935

	January 11, 1936

	December 9, 1945

	February 5, 1936

	February 16, 1936

	March 1, 1936

	March 4, 1936

	March 8, 1936

	March 19, 1936

	February 10, 1946

	March 10, 1946

	April 11, 1936

	May 6, 1936

	May 16, 1936

	May 30-31, 1936

	June 7, 1936

	March 17, 1946

	June 13-14, 1936

	March 31, 1946

	June 20-21, 1936

	July 4-5, 1936

	July 15-16, 1936

	February 17-March 23, 1969

	December 30, 1969-January 10, 1970

	November, 1938

	June 3-7, 1968

	May 29-30, 1937

	July 7-25, 1970

	September 3-5, 1938

	September 27, 1936

	October 4-December 4, 1963

	September 5-7, 1936

	August 8, 1937

	February 22, 1938

	circa 1915

	April 28-29, 1969

	December 8-15, 1968

	May 19, 1946

	May 11-19, 1969

	circa July 4, 1913

	July 2-4, 1938

	August 26-September 18, 1967

	circa 1960

	October 17, 1937

	May 26, 1939

	July 30-August 17, 1971

	August 21, 1938

	August-September, 1935

	October 7, 26, 1967

	circa 1938

	December 23, 1939

	August 8-22, 1970

	November 4-11, 1960

	August 20, 1970

	June 27-28, 1937

	October 10, 1962

	circa 1945

	August 15, 1937

	July 17-18, 1937

	May 22-23, 1937

	September 2-4, 1939

	circa 1970

	February 5, 1939

	February 21, 1937

	October 25, 1968

	October 24, 1968

	September 24, 1967

	June 13-22, 1968

	March 1-10, 1968

	May 30-June 1, 1930

	March 26-April 6, 1969

	October 25, 1936

	February 14, 1971

	April 30-May 1, 1938

	March 20, 1938

	Wed Apr 01 00:00:00 EDT 1942

	June 9-11, 1968

	November 15-December 6, 1969

	December 25, 1967

	October 4, 1943

	May 20-21, 1939

	January 31-April 20, 1962

	January 16, 1938

	July 27, 1937

	June 11-12, 1969

	March 12-13, 1938

	December 23, 1970 - February 9, 1971

	January 24, 1937

	June 19-20, 1937

	September 25, 1938

	January 30, 1937

	January 7-8, 1928

	1927-1929

	February 19, 1939

	August 17, 1968

	December 31, 1939

	August 20, 1967

	January 3, 1937

	February 25, 1968

	March 31-April 2, 1970

	April 27, 1927

	September 18-29, 1968

	July 25, 1937

	July 3-5, 1937

	November 22, 1970

	August 16, 1936

	May 28, 1938

	July 11-12, 1937

	November 26, 1967-January 7, 1968

	December 24-26, 1968

	circa 1968

	August 28-September 4, 1968

	October 4, 1936

	May 3, 1968

	October 27, 1968

	March 27, 1938

	Thu Nov 24 00:00:00 EST 1955

	June 12, 1938

	April 29-30, 1939

	December 5, 1937

	November 29, 1936

	August 1923

	December 17, 1938

	February 3-5, 1968

	March 19, 1939

	March 27-April 6, 1968

	June 18-19, 1938

	November 27, 1938

	April 11, 1970

	April 11, 1937

	June 4, 1956

	December 16, 1939

	January 17, 1962

	September 16, 1968

	July 21, 1946

	March 5, 1939

	November 14, 1937

	July 28-August 18, 1968

	February 22-26, 1971

	May 6-7, 1939

	November 12-13, 1968

	October 23, 1970

	August 1-2, 1936

	June 3-4, 1939

	August 6, 1936

	September 12, 1937

	February 24, 1970

	March 28, 1968

	November 28, 1968

	February 20, 1937

	August 4, 1946

	January 7-February 1, 1968

	July 21, 1968

	August 11, 1946

	July 19-28, 1971

	June 7, 1970

	Fri Jul 12 00:00:00 EDT 1968

	October 9-November 4, 1969

	Sun Feb 20 00:00:00 EST 1949

	August 18, 1946

	circa 1928

	circa 1920-1927

	August 31-September 2, 1946

	January 2-3, 1937

	October 6-7, 1968

	September 14-15, 1946

	April 20, 1969

	March 29-30, 1970

	December 12-13, 1936

	February 13, 1938

	circa 1937

	October 6, 1946

	October 24, 1937

	May 22-30, 1969

	October 13, 1946

	October 20, 1946

	July 1-2, 1939

	November 9-10, 1946

	January 29, 1939

	August 1, 1937

	December 15, 1946

	December 29, 1946

	May 13-June 13, 1972

	January 12, 1947

	September 18, 1937

	April 14, 1968

	May 16, 1968

	April 5, 1962

	Mon May 15 00:00:00 EDT 1961

	Feburary 2, 1947

	February 9, 1947

	April 7-17, 1971

	April 21, 1940

	October 10, 1937

	January 16, 1962

	March 10, 1968

	May 15, 1938

	June 1957

	June 12-13, 1937

	July 12, 1938

	March 9, 1947

	Sun Jan 13 00:00:00 EST 1946

	December 10, 1938

	March 28, 1962

	Sun Jun 08 00:00:00 EDT 1941

	April 13, 1947

	June 10-11, 1939

	May 4, 1947

	May 16, 1962

	May 25, 1947

	August 16, 1947

	August 30-September 1, 1947

	October 11-12, 1947

	October 18-19, 1947

	December 24-25, 1969

	April 2, 1939

	February 22-23, 1948

	February 29, 1948

	May 19, 1940

	May 29-31, 1948

	June 26-29, 1948

	July 3-11, 1948

	June 9, 1940

	August 21, 1948

	September 4-6, 1948

	November 14, 1948

	June 30, 1940

	January 18, 1949

	January 23, 1949

	January 30, 1949

	July 7, 1940

	February 13, 1949

	February 22, 1949

	May 7-8, 1949

	July 17, 1949

	July 1940

	July 20-21, 1940

	August 20-21, 1949

	August 28, 1949

	September 3-5, 1949

	October 16, 1949

	October 22, 1949

	October 23, 1949

	October 29, 1949

	November 6, 1949

	{'@encoding': 'edtf', '@keyDate': 'yes', '@point': 'end', '#text': '2010'}

	{'@encoding': 'edtf', '@keyDate': 'yes', '@point': 'start', '@qualifier': 'inferred', '#text': '1923'}

	1974-06-07

	{'@encoding': 'edtf', '@keyDate': 'yes', '#text': '1974-06-07'}

	1975-07-14

	{'@encoding': 'edtf', '@keyDate': 'yes', '#text': '1975-07-14'}

	10/12/2008

	{'@encoding': 'edtf', '@keyDate': 'yes', '#text': '2008-10-12'}

	10/7/2008

	{'@encoding': 'edtf', '@keyDate': 'yes', '#text': '2008-10-07'}

	10/16/2008

	{'@encoding': 'edtf', '@keyDate': 'yes', '#text': '2008-10-16'}

	9/1/2007

	{'@encoding': 'edtf', '@keyDate': 'yes', '#text': '2007-09-01'}

	3/4/1965

	{'@encoding': 'edtf', '@keyDate': 'yes', '#text': '1965-03-04'}

	6/18/1989

	{'@encoding': 'edtf', '@keyDate': 'yes', '#text': '1989-06-18'}

	6/22/1999

	{'@encoding': 'edtf', '@keyDate': 'yes', '#text': '1999-06-22'}

	6/28/1982

	{'@encoding': 'edtf', '@keyDate': 'yes', '#text': '1982-06-28'}

	8/1/1996

	{'@encoding': 'edtf', '@keyDate': 'yes', '#text': '1996-08-01'}

	6/21/2000

	{'@encoding': 'edtf', '@keyDate': 'yes', '#text': '2000-06-21'}

	{'@encoding': 'edtf', '@keyDate': 'yes', '@qualifier': 'inferred', '#text': '1934'}

	6/8/2003

	{'@encoding': 'edtf', '@keyDate': 'yes', '#text': '2003-06-08'}

	10/23/2008

	{'@encoding': 'edtf', '@keyDate': 'yes', '#text': '2008-10-23'}

	8/22/2004

	{'@encoding': 'edtf', '@keyDate': 'yes', '#text': '2004-08-22'}

	9/19/2002

	{'@encoding': 'edtf', '@keyDate': 'yes', '#text': '2002-09-19'}

	6/18/2010

	{'@encoding': 'edtf', '@keyDate': 'yes', '#text': '2010-06-18'}

	6/5/2010

	{'@encoding': 'edtf', '@keyDate': 'yes', '#text': '2010-06-05'}

	6/8/2010

	{'@encoding': 'edtf', '@keyDate': 'yes', '#text': '2010-06-08'}

	5/17/2009

	{'@encoding': 'edtf', '@keyDate': 'yes', '#text': '2009-05-17'}

	5/24/2009

	{'@encoding': 'edtf', '@keyDate': 'yes', '#text': '2009-05-24'}

	5/28/2008

	{'@encoding': 'edtf', '@keyDate': 'yes', '#text': '2008-05-28'}

	6/12/2010

	{'@encoding': 'edtf', '@keyDate': 'yes', '#text': '2010-06-12'}

	5/16/2010

	{'@encoding': 'edtf', '@keyDate': 'yes', '#text': '2010-05-16'}

	5/16/2006

	{'@encoding': 'edtf', '@keyDate': 'yes', '#text': '2006-05-16'}

	5/2/2006

	{'@encoding': 'edtf', '@keyDate': 'yes', '#text': '2006-05-02'}

	11/18/2003

	{'@encoding': 'edtf', '@keyDate': 'yes', '#text': '2003-11-18'}

	11/18/2004

	{'@encoding': 'edtf', '@keyDate': 'yes', '#text': '2004-11-18'}

	11/20/2004

	{'@encoding': 'edtf', '@keyDate': 'yes', '#text': '2004-11-20'}

	11/22/2006

	{'@encoding': 'edtf', '@keyDate': 'yes', '#text': '2006-11-22'}

	7/1/2010

	{'@encoding': 'edtf', '@keyDate': 'yes', '#text': '2010-07-01'}

	3/14/2006

	{'@encoding': 'edtf', '@keyDate': 'yes', '#text': '2006-03-14'}

	11/23/2003

	{'@encoding': 'edtf', '@keyDate': 'yes', '#text': '2003-11-23'}

	6/6/2010

	{'@encoding': 'edtf', '@keyDate': 'yes', '#text': '2010-06-06'}

	5/29/2008

	{'@encoding': 'edtf', '@keyDate': 'yes', '#text': '2008-05-29'}

	9/20/2007

	{'@encoding': 'edtf', '@keyDate': 'yes', '#text': '2007-09-20'}

	9/18/2007

	{'@encoding': 'edtf', '@keyDate': 'yes', '#text': '2007-09-18'}

	9/16/2007

	{'@encoding': 'edtf', '@keyDate': 'yes', '#text': '2007-09-16'}

	12/13/2006

	{'@encoding': 'edtf', '@keyDate': 'yes', '#text': '2006-12-13'}

	11/4/2007

	{'@encoding': 'edtf', '@keyDate': 'yes', '#text': '2007-11-04'}

	11/8/2007

	{'@encoding': 'edtf', '@keyDate': 'yes', '#text': '2007-11-08'}

	8/28/2007

	{'@encoding': 'edtf', '@keyDate': 'yes', '#text': '2007-08-28'}

	3/30/2008

	{'@encoding': 'edtf', '@keyDate': 'yes', '#text': '2008-03-30'}

	3/1/1953

	{'@encoding': 'edtf', '@keyDate': 'yes', '#text': '1953-03-01'}

	7/8/2008

	{'@encoding': 'edtf', '@keyDate': 'yes', '#text': '2008-07-08'}

	7/23/2009

	{'@encoding': 'edtf', '@keyDate': 'yes', '#text': '2009-07-23'}

	7/21/2009

	{'@encoding': 'edtf', '@keyDate': 'yes', '#text': '2009-07-21'}

	7/28/2009

	{'@encoding': 'edtf', '@keyDate': 'yes', '#text': '2009-07-28'}

	7/19/2009

	{'@encoding': 'edtf', '@keyDate': 'yes', '#text': '2009-07-19'}

	6/18/2006

	{'@encoding': 'edtf', '@keyDate': 'yes', '#text': '2006-06-18'}

	7/28/2000

	{'@encoding': 'edtf', '@keyDate': 'yes', '#text': '2000-07-28'}

	9/3/2009

	{'@encoding': 'edtf', '@keyDate': 'yes', '#text': '2009-09-03'}

	8/15/2009

	{'@encoding': 'edtf', '@keyDate': 'yes', '#text': '2009-08-15'}

	7/11/2009

	{'@encoding': 'edtf', '@keyDate': 'yes', '#text': '2009-07-11'}

	7/17/2007

	{'@encoding': 'edtf', '@keyDate': 'yes', '#text': '2007-07-17'}

	7/11/2006

	{'@encoding': 'edtf', '@keyDate': 'yes', '#text': '2006-07-11'}

	8/5/2007

	{'@encoding': 'edtf', '@keyDate': 'yes', '#text': '2007-08-05'}

	7/25/2006

	{'@encoding': 'edtf', '@keyDate': 'yes', '#text': '2006-07-25'}

	8/21/2007

	{'@encoding': 'edtf', '@keyDate': 'yes', '#text': '2007-08-21'}

	6/20/2009

	{'@encoding': 'edtf', '@keyDate': 'yes', '#text': '2009-06-20'}

	7/20/2002

	{'@encoding': 'edtf', '@keyDate': 'yes', '#text': '2002-07-20'}

	6/12/2008

	{'@encoding': 'edtf', '@keyDate': 'yes', '#text': '2008-06-12'}

	6/15/2008

	{'@encoding': 'edtf', '@keyDate': 'yes', '#text': '2008-06-15'}

	6/10/2008

	{'@encoding': 'edtf', '@keyDate': 'yes', '#text': '2008-06-10'}

	7/22/2009

	{'@encoding': 'edtf', '@keyDate': 'yes', '#text': '2009-07-22'}

	8/4/2009

	{'@encoding': 'edtf', '@keyDate': 'yes', '#text': '2009-08-04'}

	7/18/2010

	{'@encoding': 'edtf', '@keyDate': 'yes', '#text': '2010-07-18'}

	7/29/2010

	{'@encoding': 'edtf', '@keyDate': 'yes', '#text': '2010-07-29'}

	7/17/2010

	{'@encoding': 'edtf', '@keyDate': 'yes', '#text': '2010-07-17'}

	7/31/2010

	{'@encoding': 'edtf', '@keyDate': 'yes', '#text': '2010-07-31'}

	6/1/2006

	{'@encoding': 'edtf', '@keyDate': 'yes', '#text': '2006-06-01'}

	11/25/2001

	{'@encoding': 'edtf', '@keyDate': 'yes', '#text': '2001-11-25'}

	11/13/2001

	{'@encoding': 'edtf', '@keyDate': 'yes', '#text': '2001-11-13'}

	10/31/2000

	{'@encoding': 'edtf', '@keyDate': 'yes', '#text': '2000-10-31'}

	10/12/1991

	{'@encoding': 'edtf', '@keyDate': 'yes', '#text': '1991-10-12'}

	11/20/1998

	{'@encoding': 'edtf', '@keyDate': 'yes', '#text': '1998-11-20'}

	10/21/1999

	{'@encoding': 'edtf', '@keyDate': 'yes', '#text': '1999-10-21'}

	9/1/1998

	{'@encoding': 'edtf', '@keyDate': 'yes', '#text': '1998-09-01'}

	8/31/1991

	{'@encoding': 'edtf', '@keyDate': 'yes', '#text': '1991-08-31'}

	4/1/2004

	{'@encoding': 'edtf', '@keyDate': 'yes', '#text': '2004-04-01'}

	4/10/2005

	{'@encoding': 'edtf', '@keyDate': 'yes', '#text': '2005-04-10'}

	4/6/2003

	{'@encoding': 'edtf', '@keyDate': 'yes', '#text': '2003-04-06'}

	3/31/2007

	{'@encoding': 'edtf', '@keyDate': 'yes', '#text': '2007-03-31'}

	4/8/2008

	{'@encoding': 'edtf', '@keyDate': 'yes', '#text': '2008-04-08'}

	4/20/2004

	{'@encoding': 'edtf', '@keyDate': 'yes', '#text': '2004-04-20'}

	4/29/2003

	{'@encoding': 'edtf', '@keyDate': 'yes', '#text': '2003-04-29'}

	4/1/2003

	{'@encoding': 'edtf', '@keyDate': 'yes', '#text': '2003-04-01'}

	4/16/2003

	{'@encoding': 'edtf', '@keyDate': 'yes', '#text': '2003-04-16'}

	4/21/2003

	{'@encoding': 'edtf', '@keyDate': 'yes', '#text': '2003-04-21'}

	4/8/2009

	{'@encoding': 'edtf', '@keyDate': 'yes', '#text': '2009-04-08'}

	1/29/2009

	{'@encoding': 'edtf', '@keyDate': 'yes', '#text': '2009-01-29'}

	4/9/2009

	{'@encoding': 'edtf', '@keyDate': 'yes', '#text': '2009-04-09'}

	5/6/2007

	{'@encoding': 'edtf', '@keyDate': 'yes', '#text': '2007-05-06'}

	5/11/2009

	{'@encoding': 'edtf', '@keyDate': 'yes', '#text': '2009-05-11'}

	5/31/2009

	{'@encoding': 'edtf', '@keyDate': 'yes', '#text': '2009-05-31'}

	5/20/2010

	{'@encoding': 'edtf', '@keyDate': 'yes', '#text': '2010-05-20'}

	4/24/1992

	{'@encoding': 'edtf', '@keyDate': 'yes', '#text': '1992-04-24'}

	4/1/1962

	{'@encoding': 'edtf', '@keyDate': 'yes', '#text': '1962-04-01'}

	6/1/1995

	{'@encoding': 'edtf', '@keyDate': 'yes', '#text': '1995-06-01'}

	4/20/2006

	{'@encoding': 'edtf', '@keyDate': 'yes', '#text': '2006-04-20'}

	4/1/1967

	{'@encoding': 'edtf', '@keyDate': 'yes', '#text': '1967-04-01'}

	4/18/2002

	{'@encoding': 'edtf', '@keyDate': 'yes', '#text': '2002-04-18'}

	4/17/2003

	{'@encoding': 'edtf', '@keyDate': 'yes', '#text': '2003-04-17'}

	5/7/2009

	{'@encoding': 'edtf', '@keyDate': 'yes', '#text': '2009-05-07'}

	3/27/1949

	{'@encoding': 'edtf', '@keyDate': 'yes', '#text': '1949-03-27'}

	4/11/2008

	{'@encoding': 'edtf', '@keyDate': 'yes', '#text': '2008-04-11'}

	3/20/1950

	{'@encoding': 'edtf', '@keyDate': 'yes', '#text': '1950-03-20'}

	4/12/2009

	{'@encoding': 'edtf', '@keyDate': 'yes', '#text': '2009-04-12'}

	4/11/2009

	{'@encoding': 'edtf', '@keyDate': 'yes', '#text': '2009-04-11'}

	1/28/2006

	{'@encoding': 'edtf', '@keyDate': 'yes', '#text': '2006-01-28'}

	3/23/2004

	{'@encoding': 'edtf', '@keyDate': 'yes', '#text': '2004-03-23'}

	1/26/2005

	{'@encoding': 'edtf', '@keyDate': 'yes', '#text': '2005-01-26'}

	2/22/2007

	{'@encoding': 'edtf', '@keyDate': 'yes', '#text': '2007-02-22'}

	2/24/2007

	{'@encoding': 'edtf', '@keyDate': 'yes', '#text': '2007-02-24'}

	2/2/2004

	{'@encoding': 'edtf', '@keyDate': 'yes', '#text': '2004-02-02'}

	2/19/2005

	{'@encoding': 'edtf', '@keyDate': 'yes', '#text': '2005-02-19'}

	3/5/2004

	{'@encoding': 'edtf', '@keyDate': 'yes', '#text': '2004-03-05'}

	2/1/2006

	{'@encoding': 'edtf', '@keyDate': 'yes', '#text': '2006-02-01'}

	3/1/2004

	{'@encoding': 'edtf', '@keyDate': 'yes', '#text': '2004-03-01'}

	2/21/2004

	{'@encoding': 'edtf', '@keyDate': 'yes', '#text': '2004-02-21'}

	2/16/2006

	{'@encoding': 'edtf', '@keyDate': 'yes', '#text': '2006-02-16'}

	3/14/2004

	{'@encoding': 'edtf', '@keyDate': 'yes', '#text': '2004-03-14'}

	1/23/2005

	{'@encoding': 'edtf', '@keyDate': 'yes', '#text': '2005-01-23'}

	3/4/2007

	{'@encoding': 'edtf', '@keyDate': 'yes', '#text': '2007-03-04'}

	3/12/2007

	{'@encoding': 'edtf', '@keyDate': 'yes', '#text': '2007-03-12'}

	3/13/2007

	{'@encoding': 'edtf', '@keyDate': 'yes', '#text': '2007-03-13'}

	7/1/1951

	{'@encoding': 'edtf', '@keyDate': 'yes', '#text': '1951-07-01'}

	3/9/2007

	{'@encoding': 'edtf', '@keyDate': 'yes', '#text': '2007-03-09'}

	1/21/1985

	{'@encoding': 'edtf', '@keyDate': 'yes', '#text': '1985-01-21'}

	1/1/1975

	{'@encoding': 'edtf', '@keyDate': 'yes', '#text': '1975-01-01'}

	10/24/1965

	{'@encoding': 'edtf', '@keyDate': 'yes', '#text': '1965-10-24'}

	1/1/1973

	{'@encoding': 'edtf', '@keyDate': 'yes', '#text': '1973-01-01'}

	4/1/1980

	{'@encoding': 'edtf', '@keyDate': 'yes', '#text': '1980-04-01'}

	1/3/2007

	{'@encoding': 'edtf', '@keyDate': 'yes', '#text': '2007-01-03'}

	12/7/2003

	{'@encoding': 'edtf', '@keyDate': 'yes', '#text': '2003-12-07'}

	12/1/1996

	{'@encoding': 'edtf', '@keyDate': 'yes', '#text': '1996-12-01'}

	9/27/2008

	{'@encoding': 'edtf', '@keyDate': 'yes', '#text': '2008-09-27'}

	5/12/2009

	{'@encoding': 'edtf', '@keyDate': 'yes', '#text': '2009-05-12'}

	5/1/1962

	{'@encoding': 'edtf', '@keyDate': 'yes', '#text': '1962-05-01'}

	5/29/2002

	{'@encoding': 'edtf', '@keyDate': 'yes', '#text': '2002-05-29'}

	5/9/2010

	{'@encoding': 'edtf', '@keyDate': 'yes', '#text': '2010-05-09'}

	7/1/1966

	{'@encoding': 'edtf', '@keyDate': 'yes', '#text': '1966-07-01'}

	11/1/1996

	{'@encoding': 'edtf', '@keyDate': 'yes', '#text': '1996-11-01'}

	9/1/2008

	{'@encoding': 'edtf', '@keyDate': 'yes', '#text': '2008-09-01'}

	5/1/1998

	{'@encoding': 'edtf', '@keyDate': 'yes', '#text': '1998-05-01'}

	5/1/2011

	{'@encoding': 'edtf', '@keyDate': 'yes', '#text': '2011-05-01'}

	7/1/1998

	{'@encoding': 'edtf', '@keyDate': 'yes', '#text': '1998-07-01'}

	4/1/1997

	{'@encoding': 'edtf', '@keyDate': 'yes', '#text': '1997-04-01'}

	5/1/1995

	{'@encoding': 'edtf', '@keyDate': 'yes', '#text': '1995-05-01'}

	7/1/1995

	{'@encoding': 'edtf', '@keyDate': 'yes', '#text': '1995-07-01'}

	5/1/2004

	{'@encoding': 'edtf', '@keyDate': 'yes', '#text': '2004-05-01'}

	6/1/1973

	{'@encoding': 'edtf', '@keyDate': 'yes', '#text': '1973-06-01'}

	8/1/1981

	{'@encoding': 'edtf', '@keyDate': 'yes', '#text': '1981-08-01'}

	7/1/1967

	{'@encoding': 'edtf', '@keyDate': 'yes', '#text': '1967-07-01'}

	6/1/1996

	{'@encoding': 'edtf', '@keyDate': 'yes', '#text': '1996-06-01'}

	6/28/1997

	{'@encoding': 'edtf', '@keyDate': 'yes', '#text': '1997-06-28'}

	6/10/1998

	{'@encoding': 'edtf', '@keyDate': 'yes', '#text': '1998-06-10'}

	6/1/1976

	{'@encoding': 'edtf', '@keyDate': 'yes', '#text': '1976-06-01'}

	6/1/1978

	{'@encoding': 'edtf', '@keyDate': 'yes', '#text': '1978-06-01'}

	6/1/1982

	{'@encoding': 'edtf', '@keyDate': 'yes', '#text': '1982-06-01'}

	6/11/2002

	{'@encoding': 'edtf', '@keyDate': 'yes', '#text': '2002-06-11'}

	8/1/2001

	{'@encoding': 'edtf', '@keyDate': 'yes', '#text': '2001-08-01'}

	5/29/2004

	{'@encoding': 'edtf', '@keyDate': 'yes', '#text': '2004-05-29'}

	7/30/2002

	{'@encoding': 'edtf', '@keyDate': 'yes', '#text': '2002-07-30'}

	5/1/1984

	{'@encoding': 'edtf', '@keyDate': 'yes', '#text': '1984-05-01'}

	3/22/1997

	{'@encoding': 'edtf', '@keyDate': 'yes', '#text': '1997-03-22'}

	7/1/1985

	{'@encoding': 'edtf', '@keyDate': 'yes', '#text': '1985-07-01'}

	5/1/1996

	{'@encoding': 'edtf', '@keyDate': 'yes', '#text': '1996-05-01'}

	12/1/1997

	{'@encoding': 'edtf', '@keyDate': 'yes', '#text': '1997-12-01'}

	11/1/2011

	{'@encoding': 'edtf', '@keyDate': 'yes', '#text': '2011-11-01'}

	8/1/1998

	{'@encoding': 'edtf', '@keyDate': 'yes', '#text': '1998-08-01'}

	10/16/2007

	{'@encoding': 'edtf', '@keyDate': 'yes', '#text': '2007-10-16'}

	9/30/2004

	{'@encoding': 'edtf', '@keyDate': 'yes', '#text': '2004-09-30'}

	10/9/2004

	{'@encoding': 'edtf', '@keyDate': 'yes', '#text': '2004-10-09'}

	7/8/2004

	{'@encoding': 'edtf', '@keyDate': 'yes', '#text': '2004-07-08'}

	7/10/2004

	{'@encoding': 'edtf', '@keyDate': 'yes', '#text': '2004-07-10'}

	9/1/1995

	{'@encoding': 'edtf', '@keyDate': 'yes', '#text': '1995-09-01'}

	8/5/2006

	{'@encoding': 'edtf', '@keyDate': 'yes', '#text': '2006-08-05'}

	7/1/2006

	{'@encoding': 'edtf', '@keyDate': 'yes', '#text': '2006-07-01'}

	8/27/2008

	{'@encoding': 'edtf', '@keyDate': 'yes', '#text': '2008-08-27'}

	8/16/2006

	{'@encoding': 'edtf', '@keyDate': 'yes', '#text': '2006-08-16'}

	6/30/2006

	{'@encoding': 'edtf', '@keyDate': 'yes', '#text': '2006-06-30'}

	8/18/2006

	{'@encoding': 'edtf', '@keyDate': 'yes', '#text': '2006-08-18'}

	9/10/2006

	{'@encoding': 'edtf', '@keyDate': 'yes', '#text': '2006-09-10'}

	9/1/1984

	{'@encoding': 'edtf', '@keyDate': 'yes', '#text': '1984-09-01'}

	1/1/1994

	{'@encoding': 'edtf', '@keyDate': 'yes', '#text': '1994-01-01'}

	4/1/1979

	{'@encoding': 'edtf', '@keyDate': 'yes', '#text': '1979-04-01'}

	10/12/2003

	{'@encoding': 'edtf', '@keyDate': 'yes', '#text': '2003-10-12'}

	9/7/2009

	{'@encoding': 'edtf', '@keyDate': 'yes', '#text': '2009-09-07'}

	11/22/2001

	{'@encoding': 'edtf', '@keyDate': 'yes', '#text': '2001-11-22'}

	9/6/2006

	{'@encoding': 'edtf', '@keyDate': 'yes', '#text': '2006-09-06'}

	10/20/2009

	{'@encoding': 'edtf', '@keyDate': 'yes', '#text': '2009-10-20'}

	10/23/2010

	{'@encoding': 'edtf', '@keyDate': 'yes', '#text': '2010-10-23'}

	10/20/2006

	{'@encoding': 'edtf', '@keyDate': 'yes', '#text': '2006-10-20'}

	10/3/2006

	{'@encoding': 'edtf', '@keyDate': 'yes', '#text': '2006-10-03'}

	10/22/2006

	{'@encoding': 'edtf', '@keyDate': 'yes', '#text': '2006-10-22'}

	10/25/2006

	{'@encoding': 'edtf', '@keyDate': 'yes', '#text': '2006-10-25'}

	10/5/2006

	{'@encoding': 'edtf', '@keyDate': 'yes', '#text': '2006-10-05'}

	10/24/2006

	{'@encoding': 'edtf', '@keyDate': 'yes', '#text': '2006-10-24'}

	10/1/2006

	{'@encoding': 'edtf', '@keyDate': 'yes', '#text': '2006-10-01'}

	4/1/1951

	{'@encoding': 'edtf', '@keyDate': 'yes', '#text': '1951-04-01'}

	4/1/1981

	{'@encoding': 'edtf', '@keyDate': 'yes', '#text': '1981-04-01'}

	4/2/2007

	{'@encoding': 'edtf', '@keyDate': 'yes', '#text': '2007-04-02'}

	8/19/2008

	{'@encoding': 'edtf', '@keyDate': 'yes', '#text': '2008-08-19'}

	5/1/2008

	{'@encoding': 'edtf', '@keyDate': 'yes', '#text': '2008-05-01'}

	1/3/2009

	{'@encoding': 'edtf', '@keyDate': 'yes', '#text': '2009-01-03'}

	5/3/2003

	{'@encoding': 'edtf', '@keyDate': 'yes', '#text': '2003-05-03'}

	5/11/2010

	{'@encoding': 'edtf', '@keyDate': 'yes', '#text': '2010-05-11'}

	3/23/2009

	{'@encoding': 'edtf', '@keyDate': 'yes', '#text': '2009-03-23'}

	4/3/2007

	{'@encoding': 'edtf', '@keyDate': 'yes', '#text': '2007-04-03'}

	3/22/2009

	{'@encoding': 'edtf', '@keyDate': 'yes', '#text': '2009-03-22'}

	3/20/2009

	{'@encoding': 'edtf', '@keyDate': 'yes', '#text': '2009-03-20'}

	4/1/2009

	{'@encoding': 'edtf', '@keyDate': 'yes', '#text': '2009-04-01'}

	3/22/2008

	{'@encoding': 'edtf', '@keyDate': 'yes', '#text': '2008-03-22'}

	10/1/2009

	{'@encoding': 'edtf', '@keyDate': 'yes', '#text': '2009-10-01'}

	11/6/2008

	{'@encoding': 'edtf', '@keyDate': 'yes', '#text': '2008-11-06'}

	10/28/2009

	{'@encoding': 'edtf', '@keyDate': 'yes', '#text': '2009-10-28'}

	11/1/2009

	{'@encoding': 'edtf', '@keyDate': 'yes', '#text': '2009-11-01'}

	10/26/2009

	{'@encoding': 'edtf', '@keyDate': 'yes', '#text': '2009-10-26'}

	10/29/2009

	{'@encoding': 'edtf', '@keyDate': 'yes', '#text': '2009-10-29'}

	10/30/2009

	{'@encoding': 'edtf', '@keyDate': 'yes', '#text': '2009-10-30'}

	11/9/2008

	{'@encoding': 'edtf', '@keyDate': 'yes', '#text': '2008-11-09'}

	11/8/2009

	{'@encoding': 'edtf', '@keyDate': 'yes', '#text': '2009-11-08'}

	3/10/2009

	{'@encoding': 'edtf', '@keyDate': 'yes', '#text': '2009-03-10'}

	2/1/2009

	{'@encoding': 'edtf', '@keyDate': 'yes', '#text': '2009-02-01'}

	2/2/2009

	{'@encoding': 'edtf', '@keyDate': 'yes', '#text': '2009-02-02'}

	2/3/2009

	{'@encoding': 'edtf', '@keyDate': 'yes', '#text': '2009-02-03'}

	2/4/2009

	{'@encoding': 'edtf', '@keyDate': 'yes', '#text': '2009-02-04'}

	11/12/2009

	{'@encoding': 'edtf', '@keyDate': 'yes', '#text': '2009-11-12'}

	12/1/2009

	{'@encoding': 'edtf', '@keyDate': 'yes', '#text': '2009-12-01'}

	11/2/2009

	{'@encoding': 'edtf', '@keyDate': 'yes', '#text': '2009-11-02'}

	11/3/2009

	{'@encoding': 'edtf', '@keyDate': 'yes', '#text': '2009-11-03'}

	11/4/2009

	{'@encoding': 'edtf', '@keyDate': 'yes', '#text': '2009-11-04'}

	11/9/2009

	{'@encoding': 'edtf', '@keyDate': 'yes', '#text': '2009-11-09'}

	11/17/2009

	{'@encoding': 'edtf', '@keyDate': 'yes', '#text': '2009-11-17'}

	12/8/2009

	{'@encoding': 'edtf', '@keyDate': 'yes', '#text': '2009-12-08'}

	11/18/2010

	{'@encoding': 'edtf', '@keyDate': 'yes', '#text': '2010-11-18'}

	11/11/2010

	{'@encoding': 'edtf', '@keyDate': 'yes', '#text': '2010-11-11'}

	11/14/2010

	{'@encoding': 'edtf', '@keyDate': 'yes', '#text': '2010-11-14'}

	3/1/2000

	{'@encoding': 'edtf', '@keyDate': 'yes', '#text': '2000-03-01'}

	2/1/2002

	{'@encoding': 'edtf', '@keyDate': 'yes', '#text': '2002-02-01'}

	3/18/2005

	{'@encoding': 'edtf', '@keyDate': 'yes', '#text': '2005-03-18'}

	3/1/1996

	{'@encoding': 'edtf', '@keyDate': 'yes', '#text': '1996-03-01'}

	3/1/1982

	{'@encoding': 'edtf', '@keyDate': 'yes', '#text': '1982-03-01'}

	3/1/1991

	{'@encoding': 'edtf', '@keyDate': 'yes', '#text': '1991-03-01'}

	3/2/1991

	{'@encoding': 'edtf', '@keyDate': 'yes', '#text': '1991-03-02'}

	3/1/2001

	{'@encoding': 'edtf', '@keyDate': 'yes', '#text': '2001-03-01'}

	3/1/1986

	{'@encoding': 'edtf', '@keyDate': 'yes', '#text': '1986-03-01'}

	4/8/2006

	{'@encoding': 'edtf', '@keyDate': 'yes', '#text': '2006-04-08'}

	3/22/2003

	{'@encoding': 'edtf', '@keyDate': 'yes', '#text': '2003-03-22'}

	4/1/2000

	{'@encoding': 'edtf', '@keyDate': 'yes', '#text': '2000-04-01'}

	3/20/1998

	{'@encoding': 'edtf', '@keyDate': 'yes', '#text': '1998-03-20'}

	3/1/1994

	{'@encoding': 'edtf', '@keyDate': 'yes', '#text': '1994-03-01'}

	4/9/2006

	{'@encoding': 'edtf', '@keyDate': 'yes', '#text': '2006-04-09'}

	4/18/2007

	{'@encoding': 'edtf', '@keyDate': 'yes', '#text': '2007-04-18'}

	3/1/1997

	{'@encoding': 'edtf', '@keyDate': 'yes', '#text': '1997-03-01'}

	4/23/2001

	{'@encoding': 'edtf', '@keyDate': 'yes', '#text': '2001-04-23'}

	4/1/1987

	{'@encoding': 'edtf', '@keyDate': 'yes', '#text': '1987-04-01'}

	3/1/1998

	{'@encoding': 'edtf', '@keyDate': 'yes', '#text': '1998-03-01'}

	3/23/2001

	{'@encoding': 'edtf', '@keyDate': 'yes', '#text': '2001-03-23'}

	3/19/2002

	{'@encoding': 'edtf', '@keyDate': 'yes', '#text': '2002-03-19'}

	5/1/1983

	{'@encoding': 'edtf', '@keyDate': 'yes', '#text': '1983-05-01'}

	6/8/2006

	{'@encoding': 'edtf', '@keyDate': 'yes', '#text': '2006-06-08'}

	10/2/2008

	{'@encoding': 'edtf', '@keyDate': 'yes', '#text': '2008-10-02'}

	10/30/2008

	{'@encoding': 'edtf', '@keyDate': 'yes', '#text': '2008-10-30'}

	6/1/2002

	{'@encoding': 'edtf', '@keyDate': 'yes', '#text': '2002-06-01'}

	8/16/2008

	{'@encoding': 'edtf', '@keyDate': 'yes', '#text': '2008-08-16'}

	7/20/2008

	{'@encoding': 'edtf', '@keyDate': 'yes', '#text': '2008-07-20'}

	8/23/2008

	{'@encoding': 'edtf', '@keyDate': 'yes', '#text': '2008-08-23'}

	5/20/2006

	{'@encoding': 'edtf', '@keyDate': 'yes', '#text': '2006-05-20'}

	5/4/2006

	{'@encoding': 'edtf', '@keyDate': 'yes', '#text': '2006-05-04'}

	5/22/2006

	{'@encoding': 'edtf', '@keyDate': 'yes', '#text': '2006-05-22'}

	5/23/2006

	{'@encoding': 'edtf', '@keyDate': 'yes', '#text': '2006-05-23'}

	5/21/2006

	{'@encoding': 'edtf', '@keyDate': 'yes', '#text': '2006-05-21'}

	2/1/1958

	{'@encoding': 'edtf', '@keyDate': 'yes', '#text': '1958-02-01'}

	9/14/2006

	{'@encoding': 'edtf', '@keyDate': 'yes', '#text': '2006-09-14'}

	10/25/2007

	{'@encoding': 'edtf', '@keyDate': 'yes', '#text': '2007-10-25'}

	10/30/2007

	{'@encoding': 'edtf', '@keyDate': 'yes', '#text': '2007-10-30'}

	10/10/2006

	{'@encoding': 'edtf', '@keyDate': 'yes', '#text': '2006-10-10'}

	8/5/2009

	{'@encoding': 'edtf', '@keyDate': 'yes', '#text': '2009-08-05'}

	5/8/2009

	{'@encoding': 'edtf', '@keyDate': 'yes', '#text': '2009-05-08'}

	7/13/2003

	{'@encoding': 'edtf', '@keyDate': 'yes', '#text': '2003-07-13'}

	10/8/2009

	{'@encoding': 'edtf', '@keyDate': 'yes', '#text': '2009-10-08'}

	11/16/2008

	{'@encoding': 'edtf', '@keyDate': 'yes', '#text': '2008-11-16'}

	6/2/2004

	{'@encoding': 'edtf', '@keyDate': 'yes', '#text': '2004-06-02'}

	10/3/1998

	{'@encoding': 'edtf', '@keyDate': 'yes', '#text': '1998-10-03'}

	9/3/2006

	{'@encoding': 'edtf', '@keyDate': 'yes', '#text': '2006-09-03'}

	9/9/2003

	{'@encoding': 'edtf', '@keyDate': 'yes', '#text': '2003-09-09'}

	9/13/2003

	{'@encoding': 'edtf', '@keyDate': 'yes', '#text': '2003-09-13'}

	9/18/2003

	{'@encoding': 'edtf', '@keyDate': 'yes', '#text': '2003-09-18'}

	7/7/2006

	{'@encoding': 'edtf', '@keyDate': 'yes', '#text': '2006-07-07'}

	8/23/2006

	{'@encoding': 'edtf', '@keyDate': 'yes', '#text': '2006-08-23'}

	3/7/2008

	{'@encoding': 'edtf', '@keyDate': 'yes', '#text': '2008-03-07'}

	3/7/2009

	{'@encoding': 'edtf', '@keyDate': 'yes', '#text': '2009-03-07'}

	8/6/2004

	{'@encoding': 'edtf', '@keyDate': 'yes', '#text': '2004-08-06'}

	8/2/2004

	{'@encoding': 'edtf', '@keyDate': 'yes', '#text': '2004-08-02'}

	5/18/2006

	{'@encoding': 'edtf', '@keyDate': 'yes', '#text': '2006-05-18'}

	9/12/2004

	{'@encoding': 'edtf', '@keyDate': 'yes', '#text': '2004-09-12'}

	8/16/2004

	{'@encoding': 'edtf', '@keyDate': 'yes', '#text': '2004-08-16'}

	5/1/2002

	{'@encoding': 'edtf', '@keyDate': 'yes', '#text': '2002-05-01'}

	3/20/2010

	{'@encoding': 'edtf', '@keyDate': 'yes', '#text': '2010-03-20'}

	3/11/2010

	{'@encoding': 'edtf', '@keyDate': 'yes', '#text': '2010-03-11'}

	3/9/2010

	{'@encoding': 'edtf', '@keyDate': 'yes', '#text': '2010-03-09'}

	5/1/2009

	{'@encoding': 'edtf', '@keyDate': 'yes', '#text': '2009-05-01'}

	2/28/2006

	{'@encoding': 'edtf', '@keyDate': 'yes', '#text': '2006-02-28'}

	2/24/2006

	{'@encoding': 'edtf', '@keyDate': 'yes', '#text': '2006-02-24'}

	2/26/2006

	{'@encoding': 'edtf', '@keyDate': 'yes', '#text': '2006-02-26'}

	6/1/1992

	{'@encoding': 'edtf', '@keyDate': 'yes', '#text': '1992-06-01'}

	8/1/1997

	{'@encoding': 'edtf', '@keyDate': 'yes', '#text': '1997-08-01'}

	6/8/2002

	{'@encoding': 'edtf', '@keyDate': 'yes', '#text': '2002-06-08'}

	7/4/2002

	{'@encoding': 'edtf', '@keyDate': 'yes', '#text': '2002-07-04'}

	4/30/2008

	{'@encoding': 'edtf', '@keyDate': 'yes', '#text': '2008-04-30'}

	5/3/2009

	{'@encoding': 'edtf', '@keyDate': 'yes', '#text': '2009-05-03'}

	5/16/2009

	{'@encoding': 'edtf', '@keyDate': 'yes', '#text': '2009-05-16'}

	5/24/2008

	{'@encoding': 'edtf', '@keyDate': 'yes', '#text': '2008-05-24'}

	6/2/2008

	{'@encoding': 'edtf', '@keyDate': 'yes', '#text': '2008-06-02'}

	8/4/2001

	{'@encoding': 'edtf', '@keyDate': 'yes', '#text': '2001-08-04'}

	9/2/2001

	{'@encoding': 'edtf', '@keyDate': 'yes', '#text': '2001-09-02'}

	9/2/2004

	{'@encoding': 'edtf', '@keyDate': 'yes', '#text': '2004-09-02'}

	6/14/2006

	{'@encoding': 'edtf', '@keyDate': 'yes', '#text': '2006-06-14'}

	10/12/2005

	{'@encoding': 'edtf', '@keyDate': 'yes', '#text': '2005-10-12'}

	6/30/2004

	{'@encoding': 'edtf', '@keyDate': 'yes', '#text': '2004-06-30'}

	8/15/2001

	{'@encoding': 'edtf', '@keyDate': 'yes', '#text': '2001-08-15'}

	7/29/2007

	{'@encoding': 'edtf', '@keyDate': 'yes', '#text': '2007-07-29'}

	10/4/2003

	{'@encoding': 'edtf', '@keyDate': 'yes', '#text': '2003-10-04'}

	7/3/2010

	{'@encoding': 'edtf', '@keyDate': 'yes', '#text': '2010-07-03'}

	3/24/2004

	{'@encoding': 'edtf', '@keyDate': 'yes', '#text': '2004-03-24'}

	4/3/2004

	{'@encoding': 'edtf', '@keyDate': 'yes', '#text': '2004-04-03'}

	4/5/2010

	{'@encoding': 'edtf', '@keyDate': 'yes', '#text': '2010-04-05'}

	4/17/2005

	{'@encoding': 'edtf', '@keyDate': 'yes', '#text': '2005-04-17'}

	10/1/2003

	{'@encoding': 'edtf', '@keyDate': 'yes', '#text': '2003-10-01'}

	11/2/2003

	{'@encoding': 'edtf', '@keyDate': 'yes', '#text': '2003-11-02'}

	10/23/2003

	{'@encoding': 'edtf', '@keyDate': 'yes', '#text': '2003-10-23'}

	2/14/2009

	{'@encoding': 'edtf', '@keyDate': 'yes', '#text': '2009-02-14'}

	4/17/2010

	{'@encoding': 'edtf', '@keyDate': 'yes', '#text': '2010-04-17'}

	1/4/2009

	{'@encoding': 'edtf', '@keyDate': 'yes', '#text': '2009-01-04'}

	6/1/2003

	{'@encoding': 'edtf', '@keyDate': 'yes', '#text': '2003-06-01'}

	7/9/2009

	{'@encoding': 'edtf', '@keyDate': 'yes', '#text': '2009-07-09'}

	1/26/2009

	{'@encoding': 'edtf', '@keyDate': 'yes', '#text': '2009-01-26'}

	3/1/2009

	{'@encoding': 'edtf', '@keyDate': 'yes', '#text': '2009-03-01'}

	3/17/2009

	{'@encoding': 'edtf', '@keyDate': 'yes', '#text': '2009-03-17'}

	11/1/2010

	{'@encoding': 'edtf', '@keyDate': 'yes', '#text': '2010-11-01'}

	5/20/1999

	{'@encoding': 'edtf', '@keyDate': 'yes', '#text': '1999-05-20'}

	5/1/1951

	{'@encoding': 'edtf', '@keyDate': 'yes', '#text': '1951-05-01'}

	8/1/1999

	{'@encoding': 'edtf', '@keyDate': 'yes', '#text': '1999-08-01'}

	9/4/2000

	{'@encoding': 'edtf', '@keyDate': 'yes', '#text': '2000-09-04'}

	10/20/2005

	{'@encoding': 'edtf', '@keyDate': 'yes', '#text': '2005-10-20'}

	9/30/2006

	{'@encoding': 'edtf', '@keyDate': 'yes', '#text': '2006-09-30'}

	12/1/1983

	{'@encoding': 'edtf', '@keyDate': 'yes', '#text': '1983-12-01'}

	5/10/2008

	{'@encoding': 'edtf', '@keyDate': 'yes', '#text': '2008-05-10'}

	7/2/2005

	{'@encoding': 'edtf', '@keyDate': 'yes', '#text': '2005-07-02'}

	6/21/2008

	{'@encoding': 'edtf', '@keyDate': 'yes', '#text': '2008-06-21'}

	7/9/2005

	{'@encoding': 'edtf', '@keyDate': 'yes', '#text': '2005-07-09'}

	7/3/2008

	{'@encoding': 'edtf', '@keyDate': 'yes', '#text': '2008-07-03'}

	7/1/2008

	{'@encoding': 'edtf', '@keyDate': 'yes', '#text': '2008-07-01'}

	6/18/2008

	{'@encoding': 'edtf', '@keyDate': 'yes', '#text': '2008-06-18'}

	6/20/2008

	{'@encoding': 'edtf', '@keyDate': 'yes', '#text': '2008-06-20'}

	6/19/2008

	{'@encoding': 'edtf', '@keyDate': 'yes', '#text': '2008-06-19'}

	5/26/2006

	{'@encoding': 'edtf', '@keyDate': 'yes', '#text': '2006-05-26'}

	6/23/2005

	{'@encoding': 'edtf', '@keyDate': 'yes', '#text': '2005-06-23'}

	5/28/2006

	{'@encoding': 'edtf', '@keyDate': 'yes', '#text': '2006-05-28'}

	7/6/2010

	{'@encoding': 'edtf', '@keyDate': 'yes', '#text': '2010-07-06'}

	6/13/2009

	{'@encoding': 'edtf', '@keyDate': 'yes', '#text': '2009-06-13'}

	7/19/2005

	{'@encoding': 'edtf', '@keyDate': 'yes', '#text': '2005-07-19'}

	6/15/2006

	{'@encoding': 'edtf', '@keyDate': 'yes', '#text': '2006-06-15'}

	8/18/2007

	{'@encoding': 'edtf', '@keyDate': 'yes', '#text': '2007-08-18'}

	8/17/2007

	{'@encoding': 'edtf', '@keyDate': 'yes', '#text': '2007-08-17'}

	6/11/2009

	{'@encoding': 'edtf', '@keyDate': 'yes', '#text': '2009-06-11'}

	8/26/2007

	{'@encoding': 'edtf', '@keyDate': 'yes', '#text': '2007-08-26'}

	6/30/2005

	{'@encoding': 'edtf', '@keyDate': 'yes', '#text': '2005-06-30'}

	6/14/2008

	{'@encoding': 'edtf', '@keyDate': 'yes', '#text': '2008-06-14'}

	8/11/2007

	{'@encoding': 'edtf', '@keyDate': 'yes', '#text': '2007-08-11'}

	7/6/2006

	{'@encoding': 'edtf', '@keyDate': 'yes', '#text': '2006-07-06'}

	7/15/2008

	{'@encoding': 'edtf', '@keyDate': 'yes', '#text': '2008-07-15'}

	8/2/2008

	{'@encoding': 'edtf', '@keyDate': 'yes', '#text': '2008-08-02'}

	10/3/2007

	{'@encoding': 'edtf', '@keyDate': 'yes', '#text': '2007-10-03'}

	9/30/2007

	{'@encoding': 'edtf', '@keyDate': 'yes', '#text': '2007-09-30'}

	10/13/2007

	{'@encoding': 'edtf', '@keyDate': 'yes', '#text': '2007-10-13'}

	1/2/2007

	{'@encoding': 'edtf', '@keyDate': 'yes', '#text': '2007-01-02'}

	4/5/2004

	{'@encoding': 'edtf', '@keyDate': 'yes', '#text': '2004-04-05'}

	9/7/2003

	{'@encoding': 'edtf', '@keyDate': 'yes', '#text': '2003-09-07'}

	2/1/2004

	{'@encoding': 'edtf', '@keyDate': 'yes', '#text': '2004-02-01'}

	4/15/2003

	{'@encoding': 'edtf', '@keyDate': 'yes', '#text': '2003-04-15'}

	5/8/2005

	{'@encoding': 'edtf', '@keyDate': 'yes', '#text': '2005-05-08'}

	7/19/2008

	{'@encoding': 'edtf', '@keyDate': 'yes', '#text': '2008-07-19'}

	7/10/2008

	{'@encoding': 'edtf', '@keyDate': 'yes', '#text': '2008-07-10'}

	5/2/2008

	{'@encoding': 'edtf', '@keyDate': 'yes', '#text': '2008-05-02'}

	9/20/2008

	{'@encoding': 'edtf', '@keyDate': 'yes', '#text': '2008-09-20'}

	4/2/1999

	{'@encoding': 'edtf', '@keyDate': 'yes', '#text': '1999-04-02'}

	5/17/2008

	{'@encoding': 'edtf', '@keyDate': 'yes', '#text': '2008-05-17'}

	2/8/2007

	{'@encoding': 'edtf', '@keyDate': 'yes', '#text': '2007-02-08'}

	3/1/1961

	{'@encoding': 'edtf', '@keyDate': 'yes', '#text': '1961-03-01'}

	4/15/2010

	{'@encoding': 'edtf', '@keyDate': 'yes', '#text': '2010-04-15'}

	2/1/1972

	{'@encoding': 'edtf', '@keyDate': 'yes', '#text': '1972-02-01'}

	5/20/2004

	{'@encoding': 'edtf', '@keyDate': 'yes', '#text': '2004-05-20'}

	6/16/2004

	{'@encoding': 'edtf', '@keyDate': 'yes', '#text': '2004-06-16'}

	9/1/2006

	{'@encoding': 'edtf', '@keyDate': 'yes', '#text': '2006-09-01'}

	6/1/1953

	{'@encoding': 'edtf', '@keyDate': 'yes', '#text': '1953-06-01'}

	8/1/1954

	{'@encoding': 'edtf', '@keyDate': 'yes', '#text': '1954-08-01'}

	6/1/1971

	{'@encoding': 'edtf', '@keyDate': 'yes', '#text': '1971-06-01'}

	5/1/1972

	{'@encoding': 'edtf', '@keyDate': 'yes', '#text': '1972-05-01'}

	4/2/1961

	{'@encoding': 'edtf', '@keyDate': 'yes', '#text': '1961-04-02'}

	5/1/1979

	{'@encoding': 'edtf', '@keyDate': 'yes', '#text': '1979-05-01'}

	7/1/1978

	{'@encoding': 'edtf', '@keyDate': 'yes', '#text': '1978-07-01'}

	2/1/1979

	{'@encoding': 'edtf', '@keyDate': 'yes', '#text': '1979-02-01'}

	3/1/1979

	{'@encoding': 'edtf', '@keyDate': 'yes', '#text': '1979-03-01'}

	8/30/2004

	{'@encoding': 'edtf', '@keyDate': 'yes', '#text': '2004-08-30'}

	5/25/2008

	{'@encoding': 'edtf', '@keyDate': 'yes', '#text': '2008-05-25'}

	8/14/2008

	{'@encoding': 'edtf', '@keyDate': 'yes', '#text': '2008-08-14'}

	5/26/2007

	{'@encoding': 'edtf', '@keyDate': 'yes', '#text': '2007-05-26'}

	6/3/2006

	{'@encoding': 'edtf', '@keyDate': 'yes', '#text': '2006-06-03'}

	8/21/2010

	{'@encoding': 'edtf', '@keyDate': 'yes', '#text': '2010-08-21'}

	11/2/2008

	{'@encoding': 'edtf', '@keyDate': 'yes', '#text': '2008-11-02'}

	6/16/2009

	{'@encoding': 'edtf', '@keyDate': 'yes', '#text': '2009-06-16'}

	6/21/1980

	{'@encoding': 'edtf', '@keyDate': 'yes', '#text': '1980-06-21'}

	3/1/1984

	{'@encoding': 'edtf', '@keyDate': 'yes', '#text': '1984-03-01'}

	1/1/1955

	{'@encoding': 'edtf', '@keyDate': 'yes', '#text': '1955-01-01'}

	8/1/1983

	{'@encoding': 'edtf', '@keyDate': 'yes', '#text': '1983-08-01'}

	8/1/1994

	{'@encoding': 'edtf', '@keyDate': 'yes', '#text': '1994-08-01'}

	8/24/1999

	{'@encoding': 'edtf', '@keyDate': 'yes', '#text': '1999-08-24'}

	6/29/2003

	{'@encoding': 'edtf', '@keyDate': 'yes', '#text': '2003-06-29'}

	8/1/2000

	{'@encoding': 'edtf', '@keyDate': 'yes', '#text': '2000-08-01'}

	7/1/1981

	{'@encoding': 'edtf', '@keyDate': 'yes', '#text': '1981-07-01'}

	7/1/1965

	{'@encoding': 'edtf', '@keyDate': 'yes', '#text': '1965-07-01'}

	9/1/1969

	{'@encoding': 'edtf', '@keyDate': 'yes', '#text': '1969-09-01'}

	8/1/2002

	{'@encoding': 'edtf', '@keyDate': 'yes', '#text': '2002-08-01'}

	9/1/1954

	{'@encoding': 'edtf', '@keyDate': 'yes', '#text': '1954-09-01'}

	9/29/2007

	{'@encoding': 'edtf', '@keyDate': 'yes', '#text': '2007-09-29'}

	8/19/2000

	{'@encoding': 'edtf', '@keyDate': 'yes', '#text': '2000-08-19'}

	7/27/2002

	{'@encoding': 'edtf', '@keyDate': 'yes', '#text': '2002-07-27'}

	8/1/1995

	{'@encoding': 'edtf', '@keyDate': 'yes', '#text': '1995-08-01'}

	7/6/2003

	{'@encoding': 'edtf', '@keyDate': 'yes', '#text': '2003-07-06'}

	9/1/2000

	{'@encoding': 'edtf', '@keyDate': 'yes', '#text': '2000-09-01'}

	8/15/1999

	{'@encoding': 'edtf', '@keyDate': 'yes', '#text': '1999-08-15'}

	10/13/1955

	{'@encoding': 'edtf', '@keyDate': 'yes', '#text': '1955-10-13'}

	7/1/1974

	{'@encoding': 'edtf', '@keyDate': 'yes', '#text': '1974-07-01'}

	3/24/2010

	{'@encoding': 'edtf', '@keyDate': 'yes', '#text': '2010-03-24'}

	3/30/2010

	{'@encoding': 'edtf', '@keyDate': 'yes', '#text': '2010-03-30'}

	3/27/2010

	{'@encoding': 'edtf', '@keyDate': 'yes', '#text': '2010-03-27'}

	4/29/2010

	{'@encoding': 'edtf', '@keyDate': 'yes', '#text': '2010-04-29'}

	4/10/2010

	{'@encoding': 'edtf', '@keyDate': 'yes', '#text': '2010-04-10'}

	7/3/2006

	{'@encoding': 'edtf', '@keyDate': 'yes', '#text': '2006-07-03'}

	6/18/2005

	{'@encoding': 'edtf', '@keyDate': 'yes', '#text': '2005-06-18'}

	7/1/1999

	{'@encoding': 'edtf', '@keyDate': 'yes', '#text': '1999-07-01'}

	4/13/2006

	{'@encoding': 'edtf', '@keyDate': 'yes', '#text': '2006-04-13'}

	5/22/2007

	{'@encoding': 'edtf', '@keyDate': 'yes', '#text': '2007-05-22'}

	6/27/2006

	{'@encoding': 'edtf', '@keyDate': 'yes', '#text': '2006-06-27'}

	5/13/2007

	{'@encoding': 'edtf', '@keyDate': 'yes', '#text': '2007-05-13'}

	5/11/2007

	{'@encoding': 'edtf', '@keyDate': 'yes', '#text': '2007-05-11'}

	4/15/2008

	{'@encoding': 'edtf', '@keyDate': 'yes', '#text': '2008-04-15'}

	3/29/2007

	{'@encoding': 'edtf', '@keyDate': 'yes', '#text': '2007-03-29'}

	10/1/1996

	{'@encoding': 'edtf', '@keyDate': 'yes', '#text': '1996-10-01'}

	7/1/1986

	{'@encoding': 'edtf', '@keyDate': 'yes', '#text': '1986-07-01'}

	7/3/2009

	{'@encoding': 'edtf', '@keyDate': 'yes', '#text': '2009-07-03'}

	7/4/2009

	{'@encoding': 'edtf', '@keyDate': 'yes', '#text': '2009-07-04'}

	7/26/2003

	{'@encoding': 'edtf', '@keyDate': 'yes', '#text': '2003-07-26'}

	7/28/2003

	{'@encoding': 'edtf', '@keyDate': 'yes', '#text': '2003-07-28'}

	6/2/2006

	{'@encoding': 'edtf', '@keyDate': 'yes', '#text': '2006-06-02'}

	5/19/2009

	{'@encoding': 'edtf', '@keyDate': 'yes', '#text': '2009-05-19'}

	4/5/2009

	{'@encoding': 'edtf', '@keyDate': 'yes', '#text': '2009-04-05'}

	4/11/2010

	{'@encoding': 'edtf', '@keyDate': 'yes', '#text': '2010-04-11'}

	4/1/2006

	{'@encoding': 'edtf', '@keyDate': 'yes', '#text': '2006-04-01'}

	3/30/2009

	{'@encoding': 'edtf', '@keyDate': 'yes', '#text': '2009-03-30'}

	4/2/2010

	{'@encoding': 'edtf', '@keyDate': 'yes', '#text': '2010-04-02'}

	4/4/2010

	{'@encoding': 'edtf', '@keyDate': 'yes', '#text': '2010-04-04'}

	4/7/2010

	{'@encoding': 'edtf', '@keyDate': 'yes', '#text': '2010-04-07'}

	6/10/2006

	{'@encoding': 'edtf', '@keyDate': 'yes', '#text': '2006-06-10'}

	6/6/2006

	{'@encoding': 'edtf', '@keyDate': 'yes', '#text': '2006-06-06'}

	6/3/2009

	{'@encoding': 'edtf', '@keyDate': 'yes', '#text': '2009-06-03'}

	5/30/2010

	{'@encoding': 'edtf', '@keyDate': 'yes', '#text': '2010-05-30'}

	7/10/2010

	{'@encoding': 'edtf', '@keyDate': 'yes', '#text': '2010-07-10'}

	11/24/2005

	{'@encoding': 'edtf', '@keyDate': 'yes', '#text': '2005-11-24'}

	5/1/2006

	{'@encoding': 'edtf', '@keyDate': 'yes', '#text': '2006-05-01'}

	3/25/2007

	{'@encoding': 'edtf', '@keyDate': 'yes', '#text': '2007-03-25'}

	3/1/2002

	{'@encoding': 'edtf', '@keyDate': 'yes', '#text': '2002-03-01'}

	5/19/2006

	{'@encoding': 'edtf', '@keyDate': 'yes', '#text': '2006-05-19'}

	5/22/2008

	{'@encoding': 'edtf', '@keyDate': 'yes', '#text': '2008-05-22'}

	5/21/2008

	{'@encoding': 'edtf', '@keyDate': 'yes', '#text': '2008-05-21'}

	5/22/2005

	{'@encoding': 'edtf', '@keyDate': 'yes', '#text': '2005-05-22'}

	5/29/2005

	{'@encoding': 'edtf', '@keyDate': 'yes', '#text': '2005-05-29'}

	5/28/2005

	{'@encoding': 'edtf', '@keyDate': 'yes', '#text': '2005-05-28'}

	3/2/2008

	{'@encoding': 'edtf', '@keyDate': 'yes', '#text': '2008-03-02'}

	6/1/2005

	{'@encoding': 'edtf', '@keyDate': 'yes', '#text': '2005-06-01'}

	5/1/1997

	{'@encoding': 'edtf', '@keyDate': 'yes', '#text': '1997-05-01'}

	5/13/2005

	{'@encoding': 'edtf', '@keyDate': 'yes', '#text': '2005-05-13'}

	7/15/2010

	{'@encoding': 'edtf', '@keyDate': 'yes', '#text': '2010-07-15'}

	7/11/2010

	{'@encoding': 'edtf', '@keyDate': 'yes', '#text': '2010-07-11'}

	10/10/2010

	{'@encoding': 'edtf', '@keyDate': 'yes', '#text': '2010-10-10'}

	10/17/2010

	{'@encoding': 'edtf', '@keyDate': 'yes', '#text': '2010-10-17'}

	10/24/2010

	{'@encoding': 'edtf', '@keyDate': 'yes', '#text': '2010-10-24'}

	10/25/2010

	{'@encoding': 'edtf', '@keyDate': 'yes', '#text': '2010-10-25'}

	10/29/2010

	{'@encoding': 'edtf', '@keyDate': 'yes', '#text': '2010-10-29'}

	10/31/2010

	{'@encoding': 'edtf', '@keyDate': 'yes', '#text': '2010-10-31'}

	11/2/2010

	{'@encoding': 'edtf', '@keyDate': 'yes', '#text': '2010-11-02'}

	5/13/2008

	{'@encoding': 'edtf', '@keyDate': 'yes', '#text': '2008-05-13'}

	2/22/2010

	{'@encoding': 'edtf', '@keyDate': 'yes', '#text': '2010-02-22'}

	2/28/2010

	{'@encoding': 'edtf', '@keyDate': 'yes', '#text': '2010-02-28'}

	10/6/2002

	{'@encoding': 'edtf', '@keyDate': 'yes', '#text': '2002-10-06'}

	9/17/2006

	{'@encoding': 'edtf', '@keyDate': 'yes', '#text': '2006-09-17'}

	10/5/2003

	{'@encoding': 'edtf', '@keyDate': 'yes', '#text': '2003-10-05'}

	4/1/1965

	{'@encoding': 'edtf', '@keyDate': 'yes', '#text': '1965-04-01'}

	4/1/1964

	{'@encoding': 'edtf', '@keyDate': 'yes', '#text': '1964-04-01'}

	6/1/2004

	{'@encoding': 'edtf', '@keyDate': 'yes', '#text': '2004-06-01'}

	1/1/2000

	{'@encoding': 'edtf', '@keyDate': 'yes', '#text': '2000-01-01'}

	10/20/2001

	{'@encoding': 'edtf', '@keyDate': 'yes', '#text': '2001-10-20'}

	10/1/1995

	{'@encoding': 'edtf', '@keyDate': 'yes', '#text': '1995-10-01'}

	10/1/1974

	{'@encoding': 'edtf', '@keyDate': 'yes', '#text': '1974-10-01'}

	12/1/1990

	{'@encoding': 'edtf', '@keyDate': 'yes', '#text': '1990-12-01'}

	11/23/2000

	{'@encoding': 'edtf', '@keyDate': 'yes', '#text': '2000-11-23'}

	11/1/1994

	{'@encoding': 'edtf', '@keyDate': 'yes', '#text': '1994-11-01'}

	1/1/1985

	{'@encoding': 'edtf', '@keyDate': 'yes', '#text': '1985-01-01'}

	10/1/1964

	{'@encoding': 'edtf', '@keyDate': 'yes', '#text': '1964-10-01'}

	9/1/1979

	{'@encoding': 'edtf', '@keyDate': 'yes', '#text': '1979-09-01'}

	11/1/1970

	{'@encoding': 'edtf', '@keyDate': 'yes', '#text': '1970-11-01'}

	6/3/1997

	{'@encoding': 'edtf', '@keyDate': 'yes', '#text': '1997-06-03'}

	3/17/2005

	{'@encoding': 'edtf', '@keyDate': 'yes', '#text': '2005-03-17'}

	10/11/2001

	{'@encoding': 'edtf', '@keyDate': 'yes', '#text': '2001-10-11'}

	2/1/2000

	{'@encoding': 'edtf', '@keyDate': 'yes', '#text': '2000-02-01'}

	2/24/2000

	{'@encoding': 'edtf', '@keyDate': 'yes', '#text': '2000-02-24'}

	4/1/1998

	{'@encoding': 'edtf', '@keyDate': 'yes', '#text': '1998-04-01'}

	6/1/1963

	{'@encoding': 'edtf', '@keyDate': 'yes', '#text': '1963-06-01'}

	1/9/1900

	{'@encoding': 'edtf', '@keyDate': 'yes', '#text': '1900-01-09'}

	11/1/1990

	{'@encoding': 'edtf', '@keyDate': 'yes', '#text': '1990-11-01'}

	3/1/1967

	{'@encoding': 'edtf', '@keyDate': 'yes', '#text': '1967-03-01'}

	10/20/1962

	{'@encoding': 'edtf', '@keyDate': 'yes', '#text': '1962-10-20'}

	7/31/2008

	{'@encoding': 'edtf', '@keyDate': 'yes', '#text': '2008-07-31'}

	6/14/2009

	{'@encoding': 'edtf', '@keyDate': 'yes', '#text': '2009-06-14'}

	7/14/2005

	{'@encoding': 'edtf', '@keyDate': 'yes', '#text': '2005-07-14'}

	5/23/2009

	{'@encoding': 'edtf', '@keyDate': 'yes', '#text': '2009-05-23'}

	5/30/2009

	{'@encoding': 'edtf', '@keyDate': 'yes', '#text': '2009-05-30'}

	3/25/2003

	{'@encoding': 'edtf', '@keyDate': 'yes', '#text': '2003-03-25'}

	4/1/2001

	{'@encoding': 'edtf', '@keyDate': 'yes', '#text': '2001-04-01'}

	5/26/1953

	{'@encoding': 'edtf', '@keyDate': 'yes', '#text': '1953-05-26'}

	10/17/1999

	{'@encoding': 'edtf', '@keyDate': 'yes', '#text': '1999-10-17'}

	3/27/2000

	{'@encoding': 'edtf', '@keyDate': 'yes', '#text': '2000-03-27'}

	4/7/2005

	{'@encoding': 'edtf', '@keyDate': 'yes', '#text': '2005-04-07'}

	4/29/2006

	{'@encoding': 'edtf', '@keyDate': 'yes', '#text': '2006-04-29'}

	3/25/2000

	{'@encoding': 'edtf', '@keyDate': 'yes', '#text': '2000-03-25'}

	2/6/1999

	{'@encoding': 'edtf', '@keyDate': 'yes', '#text': '1999-02-06'}

	2/14/1998

	{'@encoding': 'edtf', '@keyDate': 'yes', '#text': '1998-02-14'}

	3/1/1958

	{'@encoding': 'edtf', '@keyDate': 'yes', '#text': '1958-03-01'}

	7/14/2001

	{'@encoding': 'edtf', '@keyDate': 'yes', '#text': '2001-07-14'}

	7/28/2001

	{'@encoding': 'edtf', '@keyDate': 'yes', '#text': '2001-07-28'}

	6/26/2003

	{'@encoding': 'edtf', '@keyDate': 'yes', '#text': '2003-06-26'}

	6/21/2003

	{'@encoding': 'edtf', '@keyDate': 'yes', '#text': '2003-06-21'}

	10/1/1999

	{'@encoding': 'edtf', '@keyDate': 'yes', '#text': '1999-10-01'}

	1/28/1999

	{'@encoding': 'edtf', '@keyDate': 'yes', '#text': '1999-01-28'}

	5/1/2001

	{'@encoding': 'edtf', '@keyDate': 'yes', '#text': '2001-05-01'}

	11/6/2004

	{'@encoding': 'edtf', '@keyDate': 'yes', '#text': '2004-11-06'}

	3/24/2007

	{'@encoding': 'edtf', '@keyDate': 'yes', '#text': '2007-03-24'}

	6/20/1989

	{'@encoding': 'edtf', '@keyDate': 'yes', '#text': '1989-06-20'}

	6/1/1983

	{'@encoding': 'edtf', '@keyDate': 'yes', '#text': '1983-06-01'}

	9/5/1998

	{'@encoding': 'edtf', '@keyDate': 'yes', '#text': '1998-09-05'}

	9/1/1999

	{'@encoding': 'edtf', '@keyDate': 'yes', '#text': '1999-09-01'}

	9/10/2000

	{'@encoding': 'edtf', '@keyDate': 'yes', '#text': '2000-09-10'}

	9/7/2000

	{'@encoding': 'edtf', '@keyDate': 'yes', '#text': '2000-09-07'}

	10/1/2000

	{'@encoding': 'edtf', '@keyDate': 'yes', '#text': '2000-10-01'}

	10/1/1982

	{'@encoding': 'edtf', '@keyDate': 'yes', '#text': '1982-10-01'}

	9/12/1998

	{'@encoding': 'edtf', '@keyDate': 'yes', '#text': '1998-09-12'}

	11/1/1982

	{'@encoding': 'edtf', '@keyDate': 'yes', '#text': '1982-11-01'}

	4/1/1972

	{'@encoding': 'edtf', '@keyDate': 'yes', '#text': '1972-04-01'}

	3/23/1963

	{'@encoding': 'edtf', '@keyDate': 'yes', '#text': '1963-03-23'}

	5/9/1999

	{'@encoding': 'edtf', '@keyDate': 'yes', '#text': '1999-05-09'}

	8/19/1989

	{'@encoding': 'edtf', '@keyDate': 'yes', '#text': '1989-08-19'}

	3/1/1995

	{'@encoding': 'edtf', '@keyDate': 'yes', '#text': '1995-03-01'}

	3/14/1999

	{'@encoding': 'edtf', '@keyDate': 'yes', '#text': '1999-03-14'}

	9/27/2005

	{'@encoding': 'edtf', '@keyDate': 'yes', '#text': '2005-09-27'}

	3/1/1990

	{'@encoding': 'edtf', '@keyDate': 'yes', '#text': '1990-03-01'}

	3/1/1992

	{'@encoding': 'edtf', '@keyDate': 'yes', '#text': '1992-03-01'}

	2/1/1990

	{'@encoding': 'edtf', '@keyDate': 'yes', '#text': '1990-02-01'}

	5/1/1957

	{'@encoding': 'edtf', '@keyDate': 'yes', '#text': '1957-05-01'}

	5/1/1969

	{'@encoding': 'edtf', '@keyDate': 'yes', '#text': '1969-05-01'}

	4/1/1966

	{'@encoding': 'edtf', '@keyDate': 'yes', '#text': '1966-04-01'}

	5/18/2008

	{'@encoding': 'edtf', '@keyDate': 'yes', '#text': '2008-05-18'}

	11/20/2010

	{'@encoding': 'edtf', '@keyDate': 'yes', '#text': '2010-11-20'}

	3/3/2008

	{'@encoding': 'edtf', '@keyDate': 'yes', '#text': '2008-03-03'}

	3/29/2008

	{'@encoding': 'edtf', '@keyDate': 'yes', '#text': '2008-03-29'}

	5/1/2005

	{'@encoding': 'edtf', '@keyDate': 'yes', '#text': '2005-05-01'}

	7/16/2005

	{'@encoding': 'edtf', '@keyDate': 'yes', '#text': '2005-07-16'}

	7/1/2000

	{'@encoding': 'edtf', '@keyDate': 'yes', '#text': '2000-07-01'}

	7/14/2000

	{'@encoding': 'edtf', '@keyDate': 'yes', '#text': '2000-07-14'}

	7/1/2001

	{'@encoding': 'edtf', '@keyDate': 'yes', '#text': '2001-07-01'}

	7/10/2001

	{'@encoding': 'edtf', '@keyDate': 'yes', '#text': '2001-07-10'}

	7/22/2001

	{'@encoding': 'edtf', '@keyDate': 'yes', '#text': '2001-07-22'}

	8/2/2003

	{'@encoding': 'edtf', '@keyDate': 'yes', '#text': '2003-08-02'}

	9/1/1997

	{'@encoding': 'edtf', '@keyDate': 'yes', '#text': '1997-09-01'}

	8/3/2002

	{'@encoding': 'edtf', '@keyDate': 'yes', '#text': '2002-08-03'}

	6/12/2006

	{'@encoding': 'edtf', '@keyDate': 'yes', '#text': '2006-06-12'}

	5/23/2008

	{'@encoding': 'edtf', '@keyDate': 'yes', '#text': '2008-05-23'}

	9/18/2008

	{'@encoding': 'edtf', '@keyDate': 'yes', '#text': '2008-09-18'}

	9/11/2008

	{'@encoding': 'edtf', '@keyDate': 'yes', '#text': '2008-09-11'}

	9/4/2008

	{'@encoding': 'edtf', '@keyDate': 'yes', '#text': '2008-09-04'}

	9/14/2008

	{'@encoding': 'edtf', '@keyDate': 'yes', '#text': '2008-09-14'}

	8/31/2008

	{'@encoding': 'edtf', '@keyDate': 'yes', '#text': '2008-08-31'}

	9/7/2008

	{'@encoding': 'edtf', '@keyDate': 'yes', '#text': '2008-09-07'}

	9/16/2008

	{'@encoding': 'edtf', '@keyDate': 'yes', '#text': '2008-09-16'}

	5/11/2011

	{'@encoding': 'edtf', '@keyDate': 'yes', '#text': '2011-05-11'}

	5/1/1999

	{'@encoding': 'edtf', '@keyDate': 'yes', '#text': '1999-05-01'}

	7/1/2002

	{'@encoding': 'edtf', '@keyDate': 'yes', '#text': '2002-07-01'}

	7/14/2007

	{'@encoding': 'edtf', '@keyDate': 'yes', '#text': '2007-07-14'}

	8/1/1978

	{'@encoding': 'edtf', '@keyDate': 'yes', '#text': '1978-08-01'}

	10/7/2000

	{'@encoding': 'edtf', '@keyDate': 'yes', '#text': '2000-10-07'}

	8/19/1999

	{'@encoding': 'edtf', '@keyDate': 'yes', '#text': '1999-08-19'}

	4/1/1999

	{'@encoding': 'edtf', '@keyDate': 'yes', '#text': '1999-04-01'}

	9/1/1974

	{'@encoding': 'edtf', '@keyDate': 'yes', '#text': '1974-09-01'}

	11/22/1963

	{'@encoding': 'edtf', '@keyDate': 'yes', '#text': '1963-11-22'}

	7/1/1997

	{'@encoding': 'edtf', '@keyDate': 'yes', '#text': '1997-07-01'}

	8/26/2010

	{'@encoding': 'edtf', '@keyDate': 'yes', '#text': '2010-08-26'}

	8/27/2010

	{'@encoding': 'edtf', '@keyDate': 'yes', '#text': '2010-08-27'}

	8/26/2009

	{'@encoding': 'edtf', '@keyDate': 'yes', '#text': '2009-08-26'}

	4/30/2009

	{'@encoding': 'edtf', '@keyDate': 'yes', '#text': '2009-04-30'}

	5/19/2007

	{'@encoding': 'edtf', '@keyDate': 'yes', '#text': '2007-05-19'}

	11/11/2008

	{'@encoding': 'edtf', '@keyDate': 'yes', '#text': '2008-11-11'}

	11/18/2006

	{'@encoding': 'edtf', '@keyDate': 'yes', '#text': '2006-11-18'}

	4/14/2009

	{'@encoding': 'edtf', '@keyDate': 'yes', '#text': '2009-04-14'}

	5/1/2010

	{'@encoding': 'edtf', '@keyDate': 'yes', '#text': '2010-05-01'}

	4/28/2010

	{'@encoding': 'edtf', '@keyDate': 'yes', '#text': '2010-04-28'}

	4/26/2009

	{'@encoding': 'edtf', '@keyDate': 'yes', '#text': '2009-04-26'}

	8/28/2010

	{'@encoding': 'edtf', '@keyDate': 'yes', '#text': '2010-08-28'}

	9/5/2010

	{'@encoding': 'edtf', '@keyDate': 'yes', '#text': '2010-09-05'}

	9/23/2010

	{'@encoding': 'edtf', '@keyDate': 'yes', '#text': '2010-09-23'}

	9/28/2010

	{'@encoding': 'edtf', '@keyDate': 'yes', '#text': '2010-09-28'}

	9/30/2010

	{'@encoding': 'edtf', '@keyDate': 'yes', '#text': '2010-09-30'}

	10/5/2010

	{'@encoding': 'edtf', '@keyDate': 'yes', '#text': '2010-10-05'}

	4/15/2009

	{'@encoding': 'edtf', '@keyDate': 'yes', '#text': '2009-04-15'}

	5/16/2008

	{'@encoding': 'edtf', '@keyDate': 'yes', '#text': '2008-05-16'}

	1/12/2009

	{'@encoding': 'edtf', '@keyDate': 'yes', '#text': '2009-01-12'}

	5/8/2008

	{'@encoding': 'edtf', '@keyDate': 'yes', '#text': '2008-05-08'}

	3/7/2010

	{'@encoding': 'edtf', '@keyDate': 'yes', '#text': '2010-03-07'}

	2/10/2010

	{'@encoding': 'edtf', '@keyDate': 'yes', '#text': '2010-02-10'}

	2/5/2010

	{'@encoding': 'edtf', '@keyDate': 'yes', '#text': '2010-02-05'}

	7/1/1983

	{'@encoding': 'edtf', '@keyDate': 'yes', '#text': '1983-07-01'}

	6/19/2000

	{'@encoding': 'edtf', '@keyDate': 'yes', '#text': '2000-06-19'}

	6/1/1965

	{'@encoding': 'edtf', '@keyDate': 'yes', '#text': '1965-06-01'}

	9/2/2008

	{'@encoding': 'edtf', '@keyDate': 'yes', '#text': '2008-09-02'}

	4/2/2009

	{'@encoding': 'edtf', '@keyDate': 'yes', '#text': '2009-04-02'}

	9/21/2008

	{'@encoding': 'edtf', '@keyDate': 'yes', '#text': '2008-09-21'}

	10/5/2008

	{'@encoding': 'edtf', '@keyDate': 'yes', '#text': '2008-10-05'}

	9/30/2008

	{'@encoding': 'edtf', '@keyDate': 'yes', '#text': '2008-09-30'}

	10/9/2008

	{'@encoding': 'edtf', '@keyDate': 'yes', '#text': '2008-10-09'}

	[1951-2012?]

	{'@encoding': 'edtf', '@keyDate': 'yes', '@point': 'end', '#text': '2012'}

	{'@encoding': 'edtf', '@keyDate': 'yes', '@point': 'start', '@qualifier': 'inferred', '#text': '1951'}

	circa 1996

	{'@encoding': 'edtf', '@keyDate': 'yes', '@qualifier': 'approximate', '#text': '1996'}

	1998 November

	{'@encoding': 'edtf', '@keyDate': 'yes', '#text': '1998-11'}

	1994 October 13

	{'@encoding': 'edtf', '@keyDate': 'yes', '#text': '1994-10-13'}

	1994 August 12

	{'@encoding': 'edtf', '@keyDate': 'yes', '#text': '1994-07-12'}

	1994 December 30

	{'@encoding': 'edtf', '@keyDate': 'yes', '#text': '1994-12-30'}

	circa 1983

	{'@encoding': 'edtf', '@keyDate': 'yes', '@qualifier': 'approximate', '#text': '1983'}

	circa 2000

	{'@encoding': 'edtf', '@keyDate': 'yes', '@qualifier': 'approximate', '#text': '2000'}

	circa 1979

	{'@encoding': 'edtf', '@keyDate': 'yes', '@qualifier': 'approximate', '#text': '1979'}

	circa 1998

	{'@encoding': 'edtf', '@keyDate': 'yes', '@qualifier': 'approximate', '#text': '1998'}

	circa 2005

	{'@encoding': 'edtf', '@keyDate': 'yes', '@qualifier': 'approximate', '#text': '2005'}

	1993 October 26

	{'@encoding': 'edtf', '@keyDate': 'yes', '#text': '1993-10-26'}

	1993 September 16

	{'@encoding': 'edtf', '@keyDate': 'yes', '#text': '1993-09-16'}

	1994 December 8

	{'@encoding': 'edtf', '@keyDate': 'yes', '#text': '1994-12-08'}

	circa 2006

	{'@encoding': 'edtf', '@keyDate': 'yes', '@qualifier': 'approximate', '#text': '2006'}

	1995 October 4

	{'@encoding': 'edtf', '@keyDate': 'yes', '#text': '1995-10-04'}

	circa 1973

	{'@encoding': 'edtf', '@keyDate': 'yes', '@qualifier': 'approximate', '#text': '1973'}

	1994 August 24

	{'@encoding': 'edtf', '@keyDate': 'yes', '#text': '1994-07-24'}

	2007 May 25

	{'@encoding': 'edtf', '@keyDate': 'yes', '#text': '2007-05-25'}

	1994 October 7

	{'@encoding': 'edtf', '@keyDate': 'yes', '#text': '1994-10-07'}

	circa 1975

	{'@encoding': 'edtf', '@keyDate': 'yes', '@qualifier': 'approximate', '#text': '1975'}

	1993 May 3

	{'@encoding': 'edtf', '@keyDate': 'yes', '#text': '1993-05-03'}

	1993 July 28

	{'@encoding': 'edtf', '@keyDate': 'yes', '#text': '1993-07-28'}

	1993 April 5

	{'@encoding': 'edtf', '@keyDate': 'yes', '#text': '1993-04-05'}

	1993 April 15

	{'@encoding': 'edtf', '@keyDate': 'yes', '#text': '1993-04-15'}

	1993 February 9

	{'@encoding': 'edtf', '@keyDate': 'yes', '#text': '1993-02-09'}

	1992 October 5

	{'@encoding': 'edtf', '@keyDate': 'yes', '#text': '1992-10-05'}

	1993 October 28

	{'@encoding': 'edtf', '@keyDate': 'yes', '#text': '1993-10-28'}

	1993 September 9

	{'@encoding': 'edtf', '@keyDate': 'yes', '#text': '1993-09-09'}

	1992 April 1

	{'@encoding': 'edtf', '@keyDate': 'yes', '#text': '1992-04-01'}

	circa 1965

	1969 February

	{'@encoding': 'edtf', '@keyDate': 'yes', '#text': '1969-02'}

	{'@encoding': 'edtf', '@keyDate': 'yes', '@qualifier': 'approximate', '#text': '1968'}

	2007 May 9

	{'@encoding': 'edtf', '@keyDate': 'yes', '#text': '2007-05-09'}

	2009 March 8

	{'@encoding': 'edtf', '@keyDate': 'yes', '#text': '2009-03-08'}

	circa 1962

	{'@encoding': 'edtf', '@keyDate': 'yes', '@qualifier': 'approximate', '#text': '1962'}

	1995 March 5

	{'@encoding': 'edtf', '@keyDate': 'yes', '#text': '1995-03-05'}

	1994 March

	{'@encoding': 'edtf', '@keyDate': 'yes', '#text': '1994-03'}

	{'@encoding': 'edtf', '@keyDate': 'yes', '@qualifier': 'approximate', '#text': '1970'}

	circa 1990

	{'@encoding': 'edtf', '@keyDate': 'yes', '@qualifier': 'approximate', '#text': '1990'}

	circa 2003

	{'@encoding': 'edtf', '@keyDate': 'yes', '@qualifier': 'approximate', '#text': '2003'}

	{'@encoding': 'edtf', '@keyDate': 'yes', '@qualifier': 'approximate', '#text': '1960'}

	circa 1980

	{'@encoding': 'edtf', '@keyDate': 'yes', '@qualifier': 'approximate', '#text': '1980'}

	circa 1995

	{'@encoding': 'edtf', '@keyDate': 'yes', '@qualifier': 'approximate', '#text': '1995'}

	circa 2010

	{'@encoding': 'edtf', '@keyDate': 'yes', '@qualifier': 'approximate', '#text': '2010'}

	circa 1988

	{'@encoding': 'edtf', '@keyDate': 'yes', '@qualifier': 'approximate', '#text': '1988'}

	circa 1997

	{'@encoding': 'edtf', '@keyDate': 'yes', '@qualifier': 'approximate', '#text': '1997'}

	circa 1986

	{'@encoding': 'edtf', '@keyDate': 'yes', '@qualifier': 'approximate', '#text': '1986'}

	circa 1978

	{'@encoding': 'edtf', '@keyDate': 'yes', '@qualifier': 'approximate', '#text': '1978'}

	circa 1959

	{'@encoding': 'edtf', '@keyDate': 'yes', '@qualifier': 'approximate', '#text': '1959'}

	circa 2007

	{'@encoding': 'edtf', '@keyDate': 'yes', '@qualifier': 'approximate', '#text': '2007'}

	circa 1964

	{'@encoding': 'edtf', '@keyDate': 'yes', '@qualifier': 'approximate', '#text': '1964'}

	circa 2011

	{'@encoding': 'edtf', '@keyDate': 'yes', '@qualifier': 'approximate', '#text': '2011'}

	circa 19565

	{'@encoding': 'edtf', '@keyDate': 'yes', '@qualifier': 'approximate', '#text': '1956'}

	circa 1972

	{'@encoding': 'edtf', '@keyDate': 'yes', '@qualifier': 'approximate', '#text': '1972'}

	circa 1985

	{'@encoding': 'edtf', '@keyDate': 'yes', '@qualifier': 'approximate', '#text': '1985'}

	circa 1994

	{'@encoding': 'edtf', '@keyDate': 'yes', '@qualifier': 'approximate', '#text': '1994'}

	circa 1992

	{'@encoding': 'edtf', '@keyDate': 'yes', '@qualifier': 'approximate', '#text': '1992'}

	circa 1967

	{'@encoding': 'edtf', '@keyDate': 'yes', '@qualifier': 'approximate', '#text': '1967'}

	circa 1961

	{'@encoding': 'edtf', '@keyDate': 'yes', '@qualifier': 'approximate', '#text': '1961'}

	circa 1993

	{'@encoding': 'edtf', '@keyDate': 'yes', '@qualifier': 'approximate', '#text': '1993'}

	circa 1984

	{'@encoding': 'edtf', '@keyDate': 'yes', '@qualifier': 'approximate', '#text': '1984'}

	1994 February 23

	{'@encoding': 'edtf', '@keyDate': 'yes', '#text': '1994-02-23'}

	1994 June 22

	{'@encoding': 'edtf', '@keyDate': 'yes', '#text': '1994-06-22'}

	circa 1969

	{'@encoding': 'edtf', '@keyDate': 'yes', '@qualifier': 'approximate', '#text': '1969'}

	1993 January 4

	{'@encoding': 'edtf', '@keyDate': 'yes', '#text': '1993-01-04'}

	circa 2004

	{'@encoding': 'edtf', '@keyDate': 'yes', '@qualifier': 'approximate', '#text': '2004'}

	circa 1987

	{'@encoding': 'edtf', '@keyDate': 'yes', '@qualifier': 'approximate', '#text': '1987'}

	circa 1991

	{'@encoding': 'edtf', '@keyDate': 'yes', '@qualifier': 'approximate', '#text': '1991'}

	1994 March 2

	{'@encoding': 'edtf', '@keyDate': 'yes', '#text': '1994-03-02'}

	1995 August 8

	{'@encoding': 'edtf', '@keyDate': 'yes', '#text': '1995-07-08'}

	2007 July 24

	{'@encoding': 'edtf', '@keyDate': 'yes', '#text': '2007-07-24'}

	1969 November 29

	{'@encoding': 'edtf', '@keyDate': 'yes', '#text': '1969-11-29'}

	1971 December 4

	1971 September 18

	{'@encoding': 'edtf', '@keyDate': 'yes', '#text': '1971-09-18'}

	1967 December 2

	{'@encoding': 'edtf', '@keyDate': 'yes', '#text': '1967-12-02'}

	1980 October 25

	{'@encoding': 'edtf', '@keyDate': 'yes', '#text': '1980-10-25'}

	circa 1955

	{'@encoding': 'edtf', '@keyDate': 'yes', '@qualifier': 'approximate', '#text': '1955'}

	{'@encoding': 'edtf', '@keyDate': 'yes', '@qualifier': 'approximate', '#text': '1950'}

	circa 1989

	{'@encoding': 'edtf', '@keyDate': 'yes', '@qualifier': 'approximate', '#text': '1989'}

	circa 1958

	{'@encoding': 'edtf', '@keyDate': 'yes', '@qualifier': 'approximate', '#text': '1958'}

	circa 1963

	{'@encoding': 'edtf', '@keyDate': 'yes', '@qualifier': 'approximate', '#text': '1963'}

	circa 1976

	{'@encoding': 'edtf', '@keyDate': 'yes', '@qualifier': 'approximate', '#text': '1976'}

	circa 1956

	circa 2001-2011

	{'@encoding': 'edtf', '@keyDate': 'yes', '@point': 'end', '#text': '2011'}

	{'@encoding': 'edtf', '@keyDate': 'yes', '@point': 'start', '@qualifier': 'approximate', '#text': '2001'}

	circa 1966

	{'@encoding': 'edtf', '@keyDate': 'yes', '@qualifier': 'approximate', '#text': '1966'}

	circa 1981

	{'@encoding': 'edtf', '@keyDate': 'yes', '@qualifier': 'approximate', '#text': '1981'}

	circa 1974

	{'@encoding': 'edtf', '@keyDate': 'yes', '@qualifier': 'approximate', '#text': '1974'}

	circa 2002

	{'@encoding': 'edtf', '@keyDate': 'yes', '@qualifier': 'approximate', '#text': '2002'}

	circa 2001

	{'@encoding': 'edtf', '@keyDate': 'yes', '@qualifier': 'approximate', '#text': '2001'}

	1944-03-02

	{'@encoding': 'edtf', '@keyDate': 'yes', '#text': '1944-03-02'}

	Circa 1950s

	{'@encoding': 'edtf', '@keyDate': 'yes', '@point': 'end', '@qualifier': 'approximate', '#text': '1959'}

	{'@encoding': 'edtf', '@keyDate': 'yes', '@point': 'end', '@qualifier': 'inferred', '#text': '1955'}

	1946-09-04

	{'@encoding': 'edtf', '@keyDate': 'yes', '#text': '1946-09-04'}

	Circa 1940s

	{'@encoding': 'edtf', '@keyDate': 'yes', '@point': 'end', '@qualifier': 'approximate', '#text': '1949'}

	1943-08-09

	{'@encoding': 'edtf', '@keyDate': 'yes', '#text': '1943-08-09'}

	1944-04-24

	{'@encoding': 'edtf', '@keyDate': 'yes', '#text': '1944-04-24'}

	1943-08-02

	{'@encoding': 'edtf', '@keyDate': 'yes', '#text': '1943-08-02'}

	1944-08-19

	{'@encoding': 'edtf', '@keyDate': 'yes', '#text': '1944-08-19'}

	1943-06-29

	{'@encoding': 'edtf', '@keyDate': 'yes', '#text': '1943-06-29'}

	1944-04-01

	{'@encoding': 'edtf', '@keyDate': 'yes', '#text': '1944-04-01'}

	1944-03-08

	{'@encoding': 'edtf', '@keyDate': 'yes', '#text': '1944-03-08'}

	1944-03-14

	{'@encoding': 'edtf', '@keyDate': 'yes', '#text': '1944-03-14'}

	1944-03-30

	{'@encoding': 'edtf', '@keyDate': 'yes', '#text': '1944-03-30'}

	1941-11-03

	{'@encoding': 'edtf', '@keyDate': 'yes', '#text': '1941-11-03'}

	1945-01-29

	{'@encoding': 'edtf', '@keyDate': 'yes', '#text': '1945-01-29'}

	1943-07-01

	1944-03-09

	{'@encoding': 'edtf', '@keyDate': 'yes', '#text': '1944-03-09'}

	1912-07-03

	Circa 1912

	{'@encoding': 'edtf', '@keyDate': 'yes', '@qualifier': 'approximate', '#text': '1912'}

	1912-02-28

	{'@encoding': 'edtf', '@keyDate': 'yes', '#text': '1912-02-28'}

	1909-01-20

	{'@encoding': 'edtf', '@keyDate': 'yes', '#text': '1909-01-20'}

	1912-09-24

	{'@encoding': 'edtf', '@keyDate': 'yes', '#text': '1912-09-24'}

	Circa 1910

	1944-08-22

	{'@encoding': 'edtf', '@keyDate': 'yes', '#text': '1944-08-22'}

	1926-08-19

	{'@encoding': 'edtf', '@keyDate': 'yes', '#text': '1926-08-19'}

	1916-08-24

	{'@encoding': 'edtf', '@keyDate': 'yes', '#text': '1916-08-24'}

	1820-04-30

	{'@encoding': 'edtf', '@keyDate': 'yes', '#text': '1820-04-30'}

	1820-10-31

	{'@encoding': 'edtf', '@keyDate': 'yes', '#text': '1820-10-31'}

	1820-05-31

	{'@encoding': 'edtf', '@keyDate': 'yes', '#text': '1820-05-31'}

	1820-09-30

	{'@encoding': 'edtf', '@keyDate': 'yes', '#text': '1820-09-30'}

	1820-08-31

	{'@encoding': 'edtf', '@keyDate': 'yes', '#text': '1820-08-31'}

	1820-07-31

	{'@encoding': 'edtf', '@keyDate': 'yes', '#text': '1820-07-31'}

	1820-06-30

	{'@encoding': 'edtf', '@keyDate': 'yes', '#text': '1820-06-30'}

	{'@encoding': 'edtf', '@keyDate': 'yes', '#text': '1907-01-01'}

	{'@encoding': 'edtf', '@keyDate': 'yes', '#text': '1912-01-01'}

	{'@encoding': 'edtf', '@keyDate': 'yes', '#text': '1915-01-01'}

	{'@encoding': 'edtf', '@keyDate': 'yes', '#text': '1911-01-01'}

	{'@encoding': 'edtf', '@keyDate': 'yes', '#text': '1916-01-01'}

	{'@encoding': 'edtf', '@keyDate': 'yes', '#text': '1914-01-01'}

	{'@encoding': 'edtf', '@keyDate': 'yes', '#text': '1913-01-01'}

	{'@encoding': 'edtf', '@keyDate': 'yes', '#text': '1922-01-01'}

	{'@encoding': 'edtf', '@keyDate': 'yes', '#text': '1936-01-01'}

	{'@encoding': 'edtf', '@keyDate': 'yes', '#text': '1918-01-01'}

	{'@qualifier': 'inferred', '#text': '1955'}

	April 16, 1961

	{'@encoding': 'edtf', '@keyDate': 'yes', '#text': '1961-04-16'}

	April 16, 1959

	{'@encoding': 'edtf', '@keyDate': 'yes', '#text': '1959-04-16'}

	{'@qualifier': 'inferred', '#text': '1959'}

	April 14, 1958

	{'@encoding': 'edtf', '@keyDate': 'yes', '#text': '1958-04-14'}

	October 29, 1957

	{'@encoding': 'edtf', '@keyDate': 'yes', '#text': '1957-10-29'}

	January 12, 1959

	{'@encoding': 'edtf', '@keyDate': 'yes', '#text': '1959-01-12'}

	April 13, 1959

	{'@encoding': 'edtf', '@keyDate': 'yes', '#text': '1959-04-13'}

	January 14, 1954

	{'@encoding': 'edtf', '@keyDate': 'yes', '#text': '1954-01-14'}

	March 25, 1957

	{'@encoding': 'edtf', '@keyDate': 'yes', '#text': '1957-03-25'}

	March 4, 1958

	{'@encoding': 'edtf', '@keyDate': 'yes', '#text': '1958-03-04'}

	May 15, 1954

	{'@encoding': 'edtf', '@keyDate': 'yes', '#text': '1954-05-15'}

	{'@qualifier': 'approximate', '#text': 'circa 1960'}

	March 16,1960

	{'@encoding': 'edtf', '@keyDate': 'yes', '#text': '1960-03-16'}

	{'@qualifier': 'approximate', '#text': 'circa 1955'}

	{'@qualifier': 'inferred', '#text': '1956'}

	August 29, 1959

	{'@encoding': 'edtf', '@keyDate': 'yes', '#text': '1959-08-29'}

	{'@qualifier': 'approximate', '#text': '1955'}

	{'@qualifier': 'approximate', '#text': '1956'}

	{'@qualifier': 'inferred', '#text': '1961'}

	{'@qualifier': 'inferred', '#text': '1950'}

	{'@encoding': 'edtf', '@keyDate': 'yes', '#text': '1951-03'}

	{'@qualifier': 'inferred', '#text': 'March 1951'}

	April 27, 1959

	{'@encoding': 'edtf', '@keyDate': 'yes', '#text': '1959-04-27'}

	March 24, 1951

	{'@encoding': 'edtf', '@keyDate': 'yes', '#text': '1951-03-24'}

	November 20, 1950

	{'@encoding': 'edtf', '@keyDate': 'yes', '#text': '1950-11-20'}

	{'@qualifier': 'inferred', '#text': '1951'}

	{'@qualifier': 'inferred', '#text': 'circa 1952'}

	{'@qualifier': 'approximate', '#text': '1950'}

	June 18, 1951

	{'@encoding': 'edtf', '@keyDate': 'yes', '#text': '1951-06-18'}

	{'@qualifier': 'inferred', '#text': 'circa 1954'}

	March 10, 1950

	{'@encoding': 'edtf', '@keyDate': 'yes', '#text': '1950-03-10'}

	April 22, 1950

	{'@encoding': 'edtf', '@keyDate': 'yes', '#text': '1950-04-22'}

	January 22, 1951

	{'@encoding': 'edtf', '@keyDate': 'yes', '#text': '1951-01-22'}

	May 6, 1950

	{'@encoding': 'edtf', '@keyDate': 'yes', '#text': '1950-05-06'}

	January 27, 1951

	{'@encoding': 'edtf', '@keyDate': 'yes', '#text': '1951-01-27'}

	September 19, 1950

	{'@encoding': 'edtf', '@keyDate': 'yes', '#text': '1950-09-19'}

	March 22, 1951

	{'@encoding': 'edtf', '@keyDate': 'yes', '#text': '1951-03-22'}

	October 29, 1951

	{'@encoding': 'edtf', '@keyDate': 'yes', '#text': '1951-10-29'}

	July 26, 1954

	{'@encoding': 'edtf', '@keyDate': 'yes', '#text': '1954-07-26'}

	{'@qualifier': 'inferred', '#text': 'circa 1953'}

	October 28, 1955

	{'@encoding': 'edtf', '@keyDate': 'yes', '#text': '1955-10-28'}

	May 13, 1950

	{'@encoding': 'edtf', '@keyDate': 'yes', '#text': '1950-05-13'}

	March 23, 1951

	{'@encoding': 'edtf', '@keyDate': 'yes', '#text': '1951-03-23'}

	October 4, 1950

	{'@encoding': 'edtf', '@keyDate': 'yes', '#text': '1950-10-04'}

	December 20, 1954

	{'@encoding': 'edtf', '@keyDate': 'yes', '#text': '1954-12-20'}

	{'@encoding': 'edtf', '@keyDate': 'yes', '@point': 'start', '#text': '1954-11-20'}

	{'@encoding': 'edtf', '@keyDate': 'yes', '@point': 'start', '#text': '2015-04-25'}

	{'@encoding': 'edtf', '@keyDate': 'yes', '@point': 'start', '#text': '2015-09-04'}

	{'@encoding': 'edtf', '@keyDate': 'yes', '@point': 'start', '#text': '1924-10-18'}

	{'@encoding': 'edtf', '@keyDate': 'yes', '@point': 'start', '#text': '1933-10-21'}

	{'@encoding': 'edtf', '@keyDate': 'yes', '@point': 'start', '#text': '2014-08-30'}

	{'@encoding': 'edtf', '@keyDate': 'yes', '@point': 'start', '#text': '1933-10-07'}

	{'@encoding': 'edtf', '@keyDate': 'yes', '@point': 'start', '#text': '1933-09-30'}

	{'@encoding': 'edtf', '@keyDate': 'yes', '@point': 'start', '#text': '2015-01-02'}

	{'@encoding': 'edtf', '@keyDate': 'yes', '@point': 'start', '#text': '2014-11-22'}

	{'@encoding': 'edtf', '@keyDate': 'yes', '@point': 'start', '#text': '2014-11-15'}

	{'@encoding': 'edtf', '@keyDate': 'yes', '@point': 'start', '#text': '2014-10-25'}

	{'@encoding': 'edtf', '@keyDate': 'yes', '@point': 'start', '#text': '1939-11-18'}

	{'@encoding': 'edtf', '@keyDate': 'yes', '@point': 'start', '#text': '2014-10-11'}

	{'@encoding': 'edtf', '@keyDate': 'yes', '@point': 'start', '#text': '2014-10-04'}

	{'@encoding': 'edtf', '@keyDate': 'yes', '@point': 'start', '#text': '2014-09-06'}

	{'@encoding': 'edtf', '@keyDate': 'yes', '@point': 'start', '#text': '2014-08-31'}

	{'@encoding': 'edtf', '@keyDate': 'yes', '@point': 'start', '#text': '2013-11-09'}

	{'@encoding': 'edtf', '@keyDate': 'yes', '@point': 'start', '#text': '1914-10-10'}

	{'@encoding': 'edtf', '@keyDate': 'yes', '@point': 'start', '#text': '2013-10-19'}

	{'@encoding': 'edtf', '@keyDate': 'yes', '@point': 'start', '#text': '2013-10-05'}

	{'@encoding': 'edtf', '@keyDate': 'yes', '@point': 'start', '#text': '1913-10-18'}

	{'@encoding': 'edtf', '@keyDate': 'yes', '@point': 'start', '#text': '2013-09-28'}

	{'@encoding': 'edtf', '@keyDate': 'yes', '@point': 'start', '#text': '1939-01-02'}

	{'@encoding': 'edtf', '@keyDate': 'yes', '@point': 'start', '#text': '2013-09-07'}

	{'@encoding': 'edtf', '@keyDate': 'yes', '@point': 'start', '#text': '2013-08-31'}

	{'@encoding': 'edtf', '@keyDate': 'yes', '@point': 'start', '#text': '1938-10-29'}

	{'@encoding': 'edtf', '@keyDate': 'yes', '@point': 'start', '#text': '2009-12-31'}

	{'@encoding': 'edtf', '@keyDate': 'yes', '@point': 'start', '#text': '1992-09-01'}

	{'@encoding': 'edtf', '@keyDate': 'yes', '@point': 'start', '#text': '1970-09-01'}

	{'@encoding': 'edtf', '@keyDate': 'yes', '@point': 'start', '#text': '1966-09-01'}

	{'@encoding': 'edtf', '@keyDate': 'yes', '@point': 'start', '#text': '1969-09-01'}

	{'@encoding': 'edtf', '@keyDate': 'yes', '@point': 'start', '#text': '2003-08-30'}

	{'@encoding': 'edtf', '@keyDate': 'yes', '@point': 'start', '#text': '1938-10-08'}

	{'@encoding': 'edtf', '@keyDate': 'yes', '@point': 'start', '#text': '1973-12-29'}

	{'@encoding': 'edtf', '@keyDate': 'yes', '@point': 'start', '#text': '1972-12-30'}

	{'@encoding': 'edtf', '@keyDate': 'yes', '@point': 'start', '#text': '1971-01-01'}

	{'@encoding': 'edtf', '@keyDate': 'yes', '@point': 'start', '#text': '1971-12-20'}

	{'@encoding': 'edtf', '@keyDate': 'yes', '@point': 'start', '#text': '1909-11-25'}

	{'@encoding': 'edtf', '@keyDate': 'yes', '@point': 'start', '#text': '1938-09-24'}

	{'@encoding': 'edtf', '@keyDate': 'yes', '@point': 'start', '#text': '1937-11-13'}

	{'@encoding': 'edtf', '@keyDate': 'yes', '@point': 'start', '#text': '1937-11-06'}

	{'@encoding': 'edtf', '@keyDate': 'yes', '@point': 'start', '#text': '1909-10-30'}

	{'@encoding': 'edtf', '@keyDate': 'yes', '@point': 'start', '#text': '1937-10-30'}

	{'@encoding': 'edtf', '@keyDate': 'yes', '@point': 'start', '#text': '1937-10-16'}

	{'@encoding': 'edtf', '@keyDate': 'yes', '@point': 'start', '#text': '1937-10-09'}

	{'@encoding': 'edtf', '@keyDate': 'yes', '@point': 'start', '#text': '1909-10-02'}

	{'@encoding': 'edtf', '@keyDate': 'yes', '@point': 'start', '#text': '1937-10-02'}

	{'@encoding': 'edtf', '@keyDate': 'yes', '@point': 'start', '#text': '1936-11-21'}

	{'@encoding': 'edtf', '@keyDate': 'yes', '@point': 'start', '#text': '1935-10-19'}

	{'@encoding': 'edtf', '@keyDate': 'yes', '@point': 'start', '#text': '1935-10-05'}

	{'@encoding': 'edtf', '@keyDate': 'yes', '@point': 'start', '#text': '1935-09-27'}

	{'@encoding': 'edtf', '@keyDate': 'yes', '@point': 'start', '#text': '1904-11-12'}

	{'@encoding': 'edtf', '@keyDate': 'yes', '@point': 'start', '#text': '1969-11-29'}

	{'@encoding': 'edtf', '@keyDate': 'yes', '@point': 'start', '#text': '1932-11-24'}

	{'@encoding': 'edtf', '@keyDate': 'yes', '@point': 'start', '#text': '1969-10-11'}

	{'@encoding': 'edtf', '@keyDate': 'yes', '@point': 'start', '#text': '1929-10-12'}

	{'@encoding': 'edtf', '@keyDate': 'yes', '@point': 'start', '#text': '1968-11-23'}

	{'@encoding': 'edtf', '@keyDate': 'yes', '@point': 'start', '#text': '1968-11-16'}

	{'@encoding': 'edtf', '@keyDate': 'yes', '@point': 'start', '#text': '1968-09-28'}

	{'@encoding': 'edtf', '@keyDate': 'yes', '@point': 'start', '#text': '1968-09-14'}

	{'@encoding': 'edtf', '@keyDate': 'yes', '@point': 'start', '#text': '1932-11-05'}

	{'@encoding': 'edtf', '@keyDate': 'yes', '@point': 'start', '#text': '1968-01-01'}

	{'@encoding': 'edtf', '@keyDate': 'yes', '@point': 'start', '#text': '1967-12-02'}

	{'@encoding': 'edtf', '@keyDate': 'yes', '@point': 'start', '#text': '1967-10-28'}

	{'@encoding': 'edtf', '@keyDate': 'yes', '@point': 'start', '#text': '1967-10-14'}

	{'@encoding': 'edtf', '@keyDate': 'yes', '@point': 'start', '#text': '1967-09-30'}

	{'@encoding': 'edtf', '@keyDate': 'yes', '@point': 'start', '#text': '1966-10-29'}

	{'@encoding': 'edtf', '@keyDate': 'yes', '@point': 'start', '#text': '1932-10-29'}

	{'@encoding': 'edtf', '@keyDate': 'yes', '@point': 'start', '#text': '1966-10-15'}

	{'@encoding': 'edtf', '@keyDate': 'yes', '@point': 'start', '#text': '1966-10-01'}

	{'@encoding': 'edtf', '@keyDate': 'yes', '@point': 'start', '#text': '1963-10-26'}

	{'@encoding': 'edtf', '@keyDate': 'yes', '@point': 'start', '#text': '1963-10-12'}

	{'@encoding': 'edtf', '@keyDate': 'yes', '@point': 'start', '#text': '1963-09-28'}

	{'@encoding': 'edtf', '@keyDate': 'yes', '@point': 'start', '#text': '1932-10-22'}

	{'@encoding': 'edtf', '@keyDate': 'yes', '@point': 'start', '#text': '1962-11-24'}

	{'@encoding': 'edtf', '@keyDate': 'yes', '@point': 'start', '#text': '1962-11-17'}

	{'@encoding': 'edtf', '@keyDate': 'yes', '@point': 'start', '#text': '1962-11-10'}

	{'@encoding': 'edtf', '@keyDate': 'yes', '@point': 'start', '#text': '1962-10-27'}

	{'@encoding': 'edtf', '@keyDate': 'yes', '@point': 'start', '#text': '1962-10-20'}

	{'@encoding': 'edtf', '@keyDate': 'yes', '@point': 'start', '#text': '1961-12-02'}

	{'@encoding': 'edtf', '@keyDate': 'yes', '@point': 'start', '#text': '1932-10-08'}

	{'@encoding': 'edtf', '@keyDate': 'yes', '@point': 'start', '#text': '1961-10-28'}

	{'@encoding': 'edtf', '@keyDate': 'yes', '@point': 'start', '#text': '1961-10-14'}

	{'@encoding': 'edtf', '@keyDate': 'yes', '@point': 'start', '#text': '1929-09-28'}

	{'@encoding': 'edtf', '@keyDate': 'yes', '@point': 'start', '#text': '1961-10-07'}

	{'@encoding': 'edtf', '@keyDate': 'yes', '@point': 'start', '#text': '1960-11-19'}

	{'@encoding': 'edtf', '@keyDate': 'yes', '@point': 'start', '#text': '1960-11-12'}

	{'@encoding': 'edtf', '@keyDate': 'yes', '@point': 'start', '#text': '1960-10-29'}

	{'@encoding': 'edtf', '@keyDate': 'yes', '@point': 'start', '#text': '1932-10-01'}

	{'@encoding': 'edtf', '@keyDate': 'yes', '@point': 'start', '#text': '1960-10-15'}

	{'@encoding': 'edtf', '@keyDate': 'yes', '@point': 'start', '#text': '1960-10-08'}

	{'@encoding': 'edtf', '@keyDate': 'yes', '@point': 'start', '#text': '1959-11-07'}

	{'@encoding': 'edtf', '@keyDate': 'yes', '@point': 'start', '#text': '1959-10-10'}

	{'@encoding': 'edtf', '@keyDate': 'yes', '@point': 'start', '#text': '1959-10-03'}

	{'@encoding': 'edtf', '@keyDate': 'yes', '@point': 'start', '#text': '1958-11-22'}

	{'@encoding': 'edtf', '@keyDate': 'yes', '@point': 'start', '#text': '1958-11-08'}

	{'@encoding': 'edtf', '@keyDate': 'yes', '@point': 'start', '#text': '1931-11-14'}

	{'@encoding': 'edtf', '@keyDate': 'yes', '@point': 'start', '#text': '1958-11-01'}

	{'@encoding': 'edtf', '@keyDate': 'yes', '@point': 'start', '#text': '1958-10-25'}

	{'@encoding': 'edtf', '@keyDate': 'yes', '@point': 'start', '#text': '1979-09-01'}

	{'@encoding': 'edtf', '@keyDate': 'yes', '@point': 'start', '#text': '1979-12-31'}

	{'@encoding': 'edtf', '@keyDate': 'yes', '@point': 'start', '#text': '1979-12-01'}

	{'@encoding': 'edtf', '@keyDate': 'yes', '@point': 'start', '#text': '1979-11-10'}

	{'@encoding': 'edtf', '@keyDate': 'yes', '@point': 'start', '#text': '1979-11-03'}

	{'@encoding': 'edtf', '@keyDate': 'yes', '@point': 'start', '#text': '1957-11-30'}

	{'@encoding': 'edtf', '@keyDate': 'yes', '@point': 'start', '#text': '1979-10-13'}

	{'@encoding': 'edtf', '@keyDate': 'yes', '@point': 'start', '#text': '1979-09-29'}

	{'@encoding': 'edtf', '@keyDate': 'yes', '@point': 'start', '#text': '1979-09-22'}

	{'@encoding': 'edtf', '@keyDate': 'yes', '@point': 'start', '#text': '1978-09-01'}

	{'@encoding': 'edtf', '@keyDate': 'yes', '@point': 'start', '#text': '1978-11-18'}

	{'@encoding': 'edtf', '@keyDate': 'yes', '@point': 'start', '#text': '1957-11-09'}

	{'@encoding': 'edtf', '@keyDate': 'yes', '@point': 'start', '#text': '1978-11-11'}

	{'@encoding': 'edtf', '@keyDate': 'yes', '@point': 'start', '#text': '1978-11-04'}

	{'@encoding': 'edtf', '@keyDate': 'yes', '@point': 'start', '#text': '1978-10-28'}

	{'@encoding': 'edtf', '@keyDate': 'yes', '@point': 'start', '#text': '1978-10-21'}

	{'@encoding': 'edtf', '@keyDate': 'yes', '@point': 'start', '#text': '1978-10-07'}

	{'@encoding': 'edtf', '@keyDate': 'yes', '@point': 'start', '#text': '1978-09-23'}

	{'@encoding': 'edtf', '@keyDate': 'yes', '@point': 'start', '#text': '1978-09-16'}

	{'@encoding': 'edtf', '@keyDate': 'yes', '@point': 'start', '#text': '1957-10-05'}

	{'@encoding': 'edtf', '@keyDate': 'yes', '@point': 'start', '#text': '1977-09-01'}

	{'@encoding': 'edtf', '@keyDate': 'yes', '@point': 'start', '#text': '1977-11-26'}

	{'@encoding': 'edtf', '@keyDate': 'yes', '@point': 'start', '#text': '1977-11-05'}

	{'@encoding': 'edtf', '@keyDate': 'yes', '@point': 'start', '#text': '1931-10-31'}

	{'@encoding': 'edtf', '@keyDate': 'yes', '@point': 'start', '#text': '1977-10-08'}

	{'@encoding': 'edtf', '@keyDate': 'yes', '@point': 'start', '#text': '1977-10-01'}

	{'@encoding': 'edtf', '@keyDate': 'yes', '@point': 'start', '#text': '1977-09-24'}

	{'@encoding': 'edtf', '@keyDate': 'yes', '@point': 'start', '#text': '1956-11-24'}

	{'@encoding': 'edtf', '@keyDate': 'yes', '@point': 'start', '#text': '1977-09-17'}

	{'@encoding': 'edtf', '@keyDate': 'yes', '@point': 'start', '#text': '1931-10-17'}

	{'@encoding': 'edtf', '@keyDate': 'yes', '@point': 'start', '#text': '1977-09-10'}

	{'@encoding': 'edtf', '@keyDate': 'yes', '@point': 'start', '#text': '1976-09-01'}

	{'@encoding': 'edtf', '@keyDate': 'yes', '@point': 'start', '#text': '1976-11-13'}

	{'@encoding': 'edtf', '@keyDate': 'yes', '@point': 'start', '#text': '1976-10-23'}

	{'@encoding': 'edtf', '@keyDate': 'yes', '@point': 'start', '#text': '1976-10-16'}

	{'@encoding': 'edtf', '@keyDate': 'yes', '@point': 'start', '#text': '1956-11-17'}

	{'@encoding': 'edtf', '@keyDate': 'yes', '@point': 'start', '#text': '1976-10-02'}

	{'@encoding': 'edtf', '@keyDate': 'yes', '@point': 'start', '#text': '1976-09-18'}

	{'@encoding': 'edtf', '@keyDate': 'yes', '@point': 'start', '#text': '1976-09-11'}

	{'@encoding': 'edtf', '@keyDate': 'yes', '@point': 'start', '#text': '1975-09-01'}

	{'@encoding': 'edtf', '@keyDate': 'yes', '@point': 'start', '#text': '1975-11-08'}

	{'@encoding': 'edtf', '@keyDate': 'yes', '@point': 'start', '#text': '1975-10-25'}

	{'@encoding': 'edtf', '@keyDate': 'yes', '@point': 'start', '#text': '1956-11-03'}

	{'@encoding': 'edtf', '@keyDate': 'yes', '@point': 'start', '#text': '1975-09-27'}

	{'@encoding': 'edtf', '@keyDate': 'yes', '@point': 'start', '#text': '1975-09-13'}

	{'@encoding': 'edtf', '@keyDate': 'yes', '@point': 'start', '#text': '1974-09-01'}

	{'@encoding': 'edtf', '@keyDate': 'yes', '@point': 'start', '#text': '1974-12-16'}

	{'@encoding': 'edtf', '@keyDate': 'yes', '@point': 'start', '#text': '1974-11-23'}

	{'@encoding': 'edtf', '@keyDate': 'yes', '@point': 'start', '#text': '1974-11-16'}

	{'@encoding': 'edtf', '@keyDate': 'yes', '@point': 'start', '#text': '1974-10-05'}

	{'@encoding': 'edtf', '@keyDate': 'yes', '@point': 'start', '#text': '1974-09-21'}

	{'@encoding': 'edtf', '@keyDate': 'yes', '@point': 'start', '#text': '1956-10-20'}

	{'@encoding': 'edtf', '@keyDate': 'yes', '@point': 'start', '#text': '1974-09-07'}

	{'@encoding': 'edtf', '@keyDate': 'yes', '@point': 'start', '#text': '1973-09-01'}

	{'@encoding': 'edtf', '@keyDate': 'yes', '@point': 'start', '#text': '1973-10-27'}

	{'@encoding': 'edtf', '@keyDate': 'yes', '@point': 'start', '#text': '1973-10-06'}

	{'@encoding': 'edtf', '@keyDate': 'yes', '@point': 'start', '#text': '1973-09-29'}

	{'@encoding': 'edtf', '@keyDate': 'yes', '@point': 'start', '#text': '1973-09-15'}

	{'@encoding': 'edtf', '@keyDate': 'yes', '@point': 'start', '#text': '1956-10-13'}

	{'@encoding': 'edtf', '@keyDate': 'yes', '@point': 'start', '#text': '1972-09-01'}

	{'@encoding': 'edtf', '@keyDate': 'yes', '@point': 'start', '#text': '1972-11-25'}

	{'@encoding': 'edtf', '@keyDate': 'yes', '@point': 'start', '#text': '1972-11-18'}

	{'@encoding': 'edtf', '@keyDate': 'yes', '@point': 'start', '#text': '1972-10-28'}

	{'@encoding': 'edtf', '@keyDate': 'yes', '@point': 'start', '#text': '1972-10-21'}

	{'@encoding': 'edtf', '@keyDate': 'yes', '@point': 'start', '#text': '1955-11-26'}

	{'@encoding': 'edtf', '@keyDate': 'yes', '@point': 'start', '#text': '1972-09-23'}

	{'@encoding': 'edtf', '@keyDate': 'yes', '@point': 'start', '#text': '1971-12-04'}

	{'@encoding': 'edtf', '@keyDate': 'yes', '@point': 'start', '#text': '1971-11-27'}

	{'@encoding': 'edtf', '@keyDate': 'yes', '@point': 'start', '#text': '1971-11-06'}

	{'@encoding': 'edtf', '@keyDate': 'yes', '@point': 'start', '#text': '1971-10-30'}

	{'@encoding': 'edtf', '@keyDate': 'yes', '@point': 'start', '#text': '1971-10-23'}

	{'@encoding': 'edtf', '@keyDate': 'yes', '@point': 'start', '#text': '1955-11-11'}

	{'@encoding': 'edtf', '@keyDate': 'yes', '@point': 'start', '#text': '1955-11-05'}

	{'@encoding': 'edtf', '@keyDate': 'yes', '@point': 'start', '#text': '1971-10-09'}

	{'@encoding': 'edtf', '@keyDate': 'yes', '@point': 'start', '#text': '1971-09-25'}

	{'@encoding': 'edtf', '@keyDate': 'yes', '@point': 'start', '#text': '1971-09-18'}

	{'@encoding': 'edtf', '@keyDate': 'yes', '@point': 'start', '#text': '1970-12-05'}

	{'@encoding': 'edtf', '@keyDate': 'yes', '@point': 'start', '#text': '1970-10-31'}

	{'@encoding': 'edtf', '@keyDate': 'yes', '@point': 'start', '#text': '1970-10-24'}

	{'@encoding': 'edtf', '@keyDate': 'yes', '@point': 'start', '#text': '1970-10-03'}

	{'@encoding': 'edtf', '@keyDate': 'yes', '@point': 'start', '#text': '1955-10-08'}

	{'@encoding': 'edtf', '@keyDate': 'yes', '@point': 'start', '#text': '1970-09-19'}

	{'@encoding': 'edtf', '@keyDate': 'yes', '@point': 'start', '#text': '1999-11-06'}

	{'@encoding': 'edtf', '@keyDate': 'yes', '@point': 'start', '#text': '1999-10-30'}

	{'@encoding': 'edtf', '@keyDate': 'yes', '@point': 'start', '#text': '1999-10-09'}

	{'@encoding': 'edtf', '@keyDate': 'yes', '@point': 'start', '#text': '1999-10-02'}

	{'@encoding': 'edtf', '@keyDate': 'yes', '@point': 'start', '#text': '1955-10-01'}

	{'@encoding': 'edtf', '@keyDate': 'yes', '@point': 'start', '#text': '1999-09-25'}

	{'@encoding': 'edtf', '@keyDate': 'yes', '@point': 'start', '#text': '1999-09-04'}

	{'@encoding': 'edtf', '@keyDate': 'yes', '@point': 'start', '#text': '1999-09-01'}

	{'@encoding': 'edtf', '@keyDate': 'yes', '@point': 'start', '#text': '1955-09-24'}

	{'@encoding': 'edtf', '@keyDate': 'yes', '@point': 'start', '#text': '1999-04-24'}

	{'@encoding': 'edtf', '@keyDate': 'yes', '@point': 'start', '#text': '1999-01-04'}

	{'@encoding': 'edtf', '@keyDate': 'yes', '@point': 'start', '#text': '1998-09-01'}

	{'@encoding': 'edtf', '@keyDate': 'yes', '@point': 'start', '#text': '1998-12-05'}

	{'@encoding': 'edtf', '@keyDate': 'yes', '@point': 'start', '#text': '1998-11-21'}

	{'@encoding': 'edtf', '@keyDate': 'yes', '@point': 'start', '#text': '1954-11-13'}

	{'@encoding': 'edtf', '@keyDate': 'yes', '@point': 'start', '#text': '1998-11-14'}

	{'@encoding': 'edtf', '@keyDate': 'yes', '@point': 'start', '#text': '1998-11-07'}

	{'@encoding': 'edtf', '@keyDate': 'yes', '@point': 'start', '#text': '1998-10-24'}

	{'@encoding': 'edtf', '@keyDate': 'yes', '@point': 'start', '#text': '1998-09-26'}

	{'@encoding': 'edtf', '@keyDate': 'yes', '@point': 'start', '#text': '1931-10-10'}

	{'@encoding': 'edtf', '@keyDate': 'yes', '@point': 'start', '#text': '1998-09-19'}

	{'@encoding': 'edtf', '@keyDate': 'yes', '@point': 'start', '#text': '1954-10-30'}

	{'@encoding': 'edtf', '@keyDate': 'yes', '@point': 'start', '#text': '1998-01-02'}

	{'@encoding': 'edtf', '@keyDate': 'yes', '@point': 'start', '#text': '1997-08-29'}

	{'@encoding': 'edtf', '@keyDate': 'yes', '@point': 'start', '#text': '1997-12-06'}

	{'@encoding': 'edtf', '@keyDate': 'yes', '@point': 'start', '#text': '1997-11-29'}

	{'@encoding': 'edtf', '@keyDate': 'yes', '@point': 'start', '#text': '1954-10-23'}

	{'@encoding': 'edtf', '@keyDate': 'yes', '@point': 'start', '#text': '1997-11-08'}

	{'@encoding': 'edtf', '@keyDate': 'yes', '@point': 'start', '#text': '1997-11-01'}

	{'@encoding': 'edtf', '@keyDate': 'yes', '@point': 'start', '#text': '1997-10-11'}

	{'@encoding': 'edtf', '@keyDate': 'yes', '@point': 'start', '#text': '1997-10-04'}

	{'@encoding': 'edtf', '@keyDate': 'yes', '@point': 'start', '#text': '1997-04-19'}

	{'@encoding': 'edtf', '@keyDate': 'yes', '@point': 'start', '#text': '1954-10-16'}

	{'@encoding': 'edtf', '@keyDate': 'yes', '@point': 'start', '#text': '1997-01-01'}

	{'@encoding': 'edtf', '@keyDate': 'yes', '@point': 'start', '#text': '1996-12-07'}

	{'@encoding': 'edtf', '@keyDate': 'yes', '@point': 'start', '#text': '1996-11-23'}

	{'@encoding': 'edtf', '@keyDate': 'yes', '@point': 'start', '#text': '1996-11-16'}

	{'@encoding': 'edtf', '@keyDate': 'yes', '@point': 'start', '#text': '1996-10-26'}

	{'@encoding': 'edtf', '@keyDate': 'yes', '@point': 'start', '#text': '1996-09-21'}

	{'@encoding': 'edtf', '@keyDate': 'yes', '@point': 'start', '#text': '1954-10-09'}

	{'@encoding': 'edtf', '@keyDate': 'yes', '@point': 'start', '#text': '1996-09-07'}

	{'@encoding': 'edtf', '@keyDate': 'yes', '@point': 'start', '#text': '1996-08-31'}

	{'@encoding': 'edtf', '@keyDate': 'yes', '@point': 'start', '#text': '1996-08-30'}

	{'@encoding': 'edtf', '@keyDate': 'yes', '@point': 'start', '#text': '1996-01-01'}

	{'@encoding': 'edtf', '@keyDate': 'yes', '@point': 'start', '#text': '1953-11-28'}

	{'@encoding': 'edtf', '@keyDate': 'yes', '@point': 'start', '#text': '1995-12-02'}

	{'@encoding': 'edtf', '@keyDate': 'yes', '@point': 'start', '#text': '1995-11-25'}

	{'@encoding': 'edtf', '@keyDate': 'yes', '@point': 'start', '#text': '1995-11-04'}

	{'@encoding': 'edtf', '@keyDate': 'yes', '@point': 'start', '#text': '1995-10-28'}

	{'@encoding': 'edtf', '@keyDate': 'yes', '@point': 'start', '#text': '1995-09-30'}

	{'@encoding': 'edtf', '@keyDate': 'yes', '@point': 'start', '#text': '1953-11-07'}

	{'@encoding': 'edtf', '@keyDate': 'yes', '@point': 'start', '#text': '1995-09-23'}

	{'@encoding': 'edtf', '@keyDate': 'yes', '@point': 'start', '#text': '1931-10-03'}

	{'@encoding': 'edtf', '@keyDate': 'yes', '@point': 'start', '#text': '1995-09-09'}

	{'@encoding': 'edtf', '@keyDate': 'yes', '@point': 'start', '#text': '1995-09-02'}

	{'@encoding': 'edtf', '@keyDate': 'yes', '@point': 'start', '#text': '1995-09-01'}

	{'@encoding': 'edtf', '@keyDate': 'yes', '@point': 'start', '#text': '1994-12-30'}

	{'@encoding': 'edtf', '@keyDate': 'yes', '@point': 'start', '#text': '1953-10-24'}

	{'@encoding': 'edtf', '@keyDate': 'yes', '@point': 'start', '#text': '1994-11-19'}

	{'@encoding': 'edtf', '@keyDate': 'yes', '@point': 'start', '#text': '1994-11-12'}

	{'@encoding': 'edtf', '@keyDate': 'yes', '@point': 'start', '#text': '1994-10-15'}

	{'@encoding': 'edtf', '@keyDate': 'yes', '@point': 'start', '#text': '1994-10-08'}

	{'@encoding': 'edtf', '@keyDate': 'yes', '@point': 'start', '#text': '1994-10-01'}

	{'@encoding': 'edtf', '@keyDate': 'yes', '@point': 'start', '#text': '1953-10-10'}

	{'@encoding': 'edtf', '@keyDate': 'yes', '@point': 'start', '#text': '1994-09-17'}

	{'@encoding': 'edtf', '@keyDate': 'yes', '@point': 'start', '#text': '1994-09-01'}

	{'@encoding': 'edtf', '@keyDate': 'yes', '@point': 'start', '#text': '1994-01-01'}

	{'@encoding': 'edtf', '@keyDate': 'yes', '@point': 'start', '#text': '1993-11-27'}

	{'@encoding': 'edtf', '@keyDate': 'yes', '@point': 'start', '#text': '1953-10-03'}

	{'@encoding': 'edtf', '@keyDate': 'yes', '@point': 'start', '#text': '1993-11-06'}

	{'@encoding': 'edtf', '@keyDate': 'yes', '@point': 'start', '#text': '1993-10-30'}

	{'@encoding': 'edtf', '@keyDate': 'yes', '@point': 'start', '#text': '1993-10-02'}

	{'@encoding': 'edtf', '@keyDate': 'yes', '@point': 'start', '#text': '1993-09-25'}

	{'@encoding': 'edtf', '@keyDate': 'yes', '@point': 'start', '#text': '1993-09-11'}

	{'@encoding': 'edtf', '@keyDate': 'yes', '@point': 'start', '#text': '1953-09-26'}

	{'@encoding': 'edtf', '@keyDate': 'yes', '@point': 'start', '#text': '1993-09-04'}

	{'@encoding': 'edtf', '@keyDate': 'yes', '@point': 'start', '#text': '1993-09-01'}

	{'@encoding': 'edtf', '@keyDate': 'yes', '@point': 'start', '#text': '1993-01-01'}

	{'@encoding': 'edtf', '@keyDate': 'yes', '@point': 'start', '#text': '1992-11-21'}

	{'@encoding': 'edtf', '@keyDate': 'yes', '@point': 'start', '#text': '1952-11-22'}

	{'@encoding': 'edtf', '@keyDate': 'yes', '@point': 'start', '#text': '1992-10-17'}

	{'@encoding': 'edtf', '@keyDate': 'yes', '@point': 'start', '#text': '1992-10-10'}

	{'@encoding': 'edtf', '@keyDate': 'yes', '@point': 'start', '#text': '1992-09-26'}

	{'@encoding': 'edtf', '@keyDate': 'yes', '@point': 'start', '#text': '1992-09-19'}

	{'@encoding': 'edtf', '@keyDate': 'yes', '@point': 'start', '#text': '1931-09-26'}

	{'@encoding': 'edtf', '@keyDate': 'yes', '@point': 'start', '#text': '1992-09-05'}

	{'@encoding': 'edtf', '@keyDate': 'yes', '@point': 'start', '#text': '1952-11-15'}

	{'@encoding': 'edtf', '@keyDate': 'yes', '@point': 'start', '#text': '1992-01-01'}

	{'@encoding': 'edtf', '@keyDate': 'yes', '@point': 'start', '#text': '1991-11-30'}

	{'@encoding': 'edtf', '@keyDate': 'yes', '@point': 'start', '#text': '1991-11-16'}

	{'@encoding': 'edtf', '@keyDate': 'yes', '@point': 'start', '#text': '1991-11-02'}

	{'@encoding': 'edtf', '@keyDate': 'yes', '@point': 'start', '#text': '1991-09-28'}

	{'@encoding': 'edtf', '@keyDate': 'yes', '@point': 'start', '#text': '1952-11-01'}

	{'@encoding': 'edtf', '@keyDate': 'yes', '@point': 'start', '#text': '1991-09-21'}

	{'@encoding': 'edtf', '@keyDate': 'yes', '@point': 'start', '#text': '1991-09-14'}

	{'@encoding': 'edtf', '@keyDate': 'yes', '@point': 'start', '#text': '1991-09-01'}

	{'@encoding': 'edtf', '@keyDate': 'yes', '@point': 'start', '#text': '1991-01-01'}

	{'@encoding': 'edtf', '@keyDate': 'yes', '@point': 'start', '#text': '1990-11-24'}

	{'@encoding': 'edtf', '@keyDate': 'yes', '@point': 'start', '#text': '1952-10-25'}

	{'@encoding': 'edtf', '@keyDate': 'yes', '@point': 'start', '#text': '1990-11-10'}

	{'@encoding': 'edtf', '@keyDate': 'yes', '@point': 'start', '#text': '1990-11-03'}

	{'@encoding': 'edtf', '@keyDate': 'yes', '@point': 'start', '#text': '1990-10-20'}

	{'@encoding': 'edtf', '@keyDate': 'yes', '@point': 'start', '#text': '1990-10-13'}

	{'@encoding': 'edtf', '@keyDate': 'yes', '@point': 'start', '#text': '1990-09-15'}

	{'@encoding': 'edtf', '@keyDate': 'yes', '@point': 'start', '#text': '1990-09-01'}

	{'@encoding': 'edtf', '@keyDate': 'yes', '@point': 'start', '#text': '1952-10-18'}

	{'@encoding': 'edtf', '@keyDate': 'yes', '@point': 'start', '#text': '1990-08-31'}

	{'@encoding': 'edtf', '@keyDate': 'yes', '@point': 'start', '#text': '1990-01-01'}

	{'@encoding': 'edtf', '@keyDate': 'yes', '@point': 'start', '#text': '1989-09-01'}

	{'@encoding': 'edtf', '@keyDate': 'yes', '@point': 'start', '#text': '1989-12-02'}

	{'@encoding': 'edtf', '@keyDate': 'yes', '@point': 'start', '#text': '1952-10-11'}

	{'@encoding': 'edtf', '@keyDate': 'yes', '@point': 'start', '#text': '1989-11-18'}

	{'@encoding': 'edtf', '@keyDate': 'yes', '@point': 'start', '#text': '1989-11-11'}

	{'@encoding': 'edtf', '@keyDate': 'yes', '@point': 'start', '#text': '1989-10-07'}

	{'@encoding': 'edtf', '@keyDate': 'yes', '@point': 'start', '#text': '1989-09-30'}

	{'@encoding': 'edtf', '@keyDate': 'yes', '@point': 'start', '#text': '1989-09-16'}

	{'@encoding': 'edtf', '@keyDate': 'yes', '@point': 'start', '#text': '1952-01-01'}

	{'@encoding': 'edtf', '@keyDate': 'yes', '@point': 'start', '#text': '1989-09-02'}

	{'@encoding': 'edtf', '@keyDate': 'yes', '@point': 'start', '#text': '1988-11-19'}

	{'@encoding': 'edtf', '@keyDate': 'yes', '@point': 'start', '#text': '1930-11-27'}

	{'@encoding': 'edtf', '@keyDate': 'yes', '@point': 'start', '#text': '1988-09-10'}

	{'@encoding': 'edtf', '@keyDate': 'yes', '@point': 'start', '#text': '1988-09-01'}

	{'@encoding': 'edtf', '@keyDate': 'yes', '@point': 'start', '#text': '1988-01-02'}

	{'@encoding': 'edtf', '@keyDate': 'yes', '@point': 'start', '#text': '1987-08-29'}

	{'@encoding': 'edtf', '@keyDate': 'yes', '@point': 'start', '#text': '1987-09-05'}

	{'@encoding': 'edtf', '@keyDate': 'yes', '@point': 'start', '#text': '1951-12-01'}

	{'@encoding': 'edtf', '@keyDate': 'yes', '@point': 'start', '#text': '1986-09-01'}

	{'@encoding': 'edtf', '@keyDate': 'yes', '@point': 'start', '#text': '1986-11-22'}

	{'@encoding': 'edtf', '@keyDate': 'yes', '@point': 'start', '#text': '1986-11-08'}

	{'@encoding': 'edtf', '@keyDate': 'yes', '@point': 'start', '#text': '1986-10-18'}

	{'@encoding': 'edtf', '@keyDate': 'yes', '@point': 'start', '#text': '1951-11-10'}

	{'@encoding': 'edtf', '@keyDate': 'yes', '@point': 'start', '#text': '1986-10-11'}

	{'@encoding': 'edtf', '@keyDate': 'yes', '@point': 'start', '#text': '1986-10-04'}

	{'@encoding': 'edtf', '@keyDate': 'yes', '@point': 'start', '#text': '1986-09-13'}

	{'@encoding': 'edtf', '@keyDate': 'yes', '@point': 'start', '#text': '1986-09-06'}

	{'@encoding': 'edtf', '@keyDate': 'yes', '@point': 'start', '#text': '1986-01-01'}

	{'@encoding': 'edtf', '@keyDate': 'yes', '@point': 'start', '#text': '1951-10-27'}

	{'@encoding': 'edtf', '@keyDate': 'yes', '@point': 'start', '#text': '1985-09-01'}

	{'@encoding': 'edtf', '@keyDate': 'yes', '@point': 'start', '#text': '1985-11-30'}

	{'@encoding': 'edtf', '@keyDate': 'yes', '@point': 'start', '#text': '1951-10-13'}

	{'@encoding': 'edtf', '@keyDate': 'yes', '@point': 'start', '#text': '1985-11-16'}

	{'@encoding': 'edtf', '@keyDate': 'yes', '@point': 'start', '#text': '1985-11-02'}

	{'@encoding': 'edtf', '@keyDate': 'yes', '@point': 'start', '#text': '1985-10-26'}

	{'@encoding': 'edtf', '@keyDate': 'yes', '@point': 'start', '#text': '1985-10-05'}

	{'@encoding': 'edtf', '@keyDate': 'yes', '@point': 'start', '#text': '1985-09-28'}

	{'@encoding': 'edtf', '@keyDate': 'yes', '@point': 'start', '#text': '1951-10-06'}

	{'@encoding': 'edtf', '@keyDate': 'yes', '@point': 'start', '#text': '1985-09-14'}

	{'@encoding': 'edtf', '@keyDate': 'yes', '@point': 'start', '#text': '1984-08-31'}

	{'@encoding': 'edtf', '@keyDate': 'yes', '@point': 'start', '#text': '1984-12-22'}

	{'@encoding': 'edtf', '@keyDate': 'yes', '@point': 'start', '#text': '1984-11-24'}

	{'@encoding': 'edtf', '@keyDate': 'yes', '@point': 'start', '#text': '1984-11-10'}

	{'@encoding': 'edtf', '@keyDate': 'yes', '@point': 'start', '#text': '1951-09-29'}

	{'@encoding': 'edtf', '@keyDate': 'yes', '@point': 'start', '#text': '1984-10-20'}

	{'@encoding': 'edtf', '@keyDate': 'yes', '@point': 'start', '#text': '1984-10-13'}

	{'@encoding': 'edtf', '@keyDate': 'yes', '@point': 'start', '#text': '1984-09-22'}

	{'@encoding': 'edtf', '@keyDate': 'yes', '@point': 'start', '#text': '1984-09-15'}

	{'@encoding': 'edtf', '@keyDate': 'yes', '@point': 'start', '#text': '1984-09-01'}

	{'@encoding': 'edtf', '@keyDate': 'yes', '@point': 'start', '#text': '1950-11-25'}

	{'@encoding': 'edtf', '@keyDate': 'yes', '@point': 'start', '#text': '1983-09-01'}

	{'@encoding': 'edtf', '@keyDate': 'yes', '@point': 'start', '#text': '1983-12-17'}

	{'@encoding': 'edtf', '@keyDate': 'yes', '@point': 'start', '#text': '1983-11-12'}

	{'@encoding': 'edtf', '@keyDate': 'yes', '@point': 'start', '#text': '1983-10-22'}

	{'@encoding': 'edtf', '@keyDate': 'yes', '@point': 'start', '#text': '1983-10-08'}

	{'@encoding': 'edtf', '@keyDate': 'yes', '@point': 'start', '#text': '1950-11-18'}

	{'@encoding': 'edtf', '@keyDate': 'yes', '@point': 'start', '#text': '1930-10-11'}

	{'@encoding': 'edtf', '@keyDate': 'yes', '@point': 'start', '#text': '1983-10-01'}

	{'@encoding': 'edtf', '@keyDate': 'yes', '@point': 'start', '#text': '1983-09-24'}

	{'@encoding': 'edtf', '@keyDate': 'yes', '@point': 'start', '#text': '1983-09-10'}

	{'@encoding': 'edtf', '@keyDate': 'yes', '@point': 'start', '#text': '1983-09-03'}

	{'@encoding': 'edtf', '@keyDate': 'yes', '@point': 'start', '#text': '1982-09-01'}

	{'@encoding': 'edtf', '@keyDate': 'yes', '@point': 'start', '#text': '1950-11-11'}

	{'@encoding': 'edtf', '@keyDate': 'yes', '@point': 'start', '#text': '1982-12-31'}

	{'@encoding': 'edtf', '@keyDate': 'yes', '@point': 'start', '#text': '1982-11-06'}

	{'@encoding': 'edtf', '@keyDate': 'yes', '@point': 'start', '#text': '1982-10-16'}

	{'@encoding': 'edtf', '@keyDate': 'yes', '@point': 'start', '#text': '1982-10-02'}

	{'@encoding': 'edtf', '@keyDate': 'yes', '@point': 'start', '#text': '1982-09-11'}

	{'@encoding': 'edtf', '@keyDate': 'yes', '@point': 'start', '#text': '1950-11-04'}

	{'@encoding': 'edtf', '@keyDate': 'yes', '@point': 'start', '#text': '1982-09-04'}

	{'@encoding': 'edtf', '@keyDate': 'yes', '@point': 'start', '#text': '1981-09-01'}

	{'@encoding': 'edtf', '@keyDate': 'yes', '@point': 'start', '#text': '1981-12-13'}

	{'@encoding': 'edtf', '@keyDate': 'yes', '@point': 'start', '#text': '1981-11-28'}

	{'@encoding': 'edtf', '@keyDate': 'yes', '@point': 'start', '#text': '1981-11-07'}

	{'@encoding': 'edtf', '@keyDate': 'yes', '@point': 'start', '#text': '1950-10-28'}

	{'@encoding': 'edtf', '@keyDate': 'yes', '@point': 'start', '#text': '1981-10-10'}

	{'@encoding': 'edtf', '@keyDate': 'yes', '@point': 'start', '#text': '1981-09-26'}

	{'@encoding': 'edtf', '@keyDate': 'yes', '@point': 'start', '#text': '1981-09-19'}

	{'@encoding': 'edtf', '@keyDate': 'yes', '@point': 'start', '#text': '1980-09-01'}

	{'@encoding': 'edtf', '@keyDate': 'yes', '@point': 'start', '#text': '1980-11-15'}

	{'@encoding': 'edtf', '@keyDate': 'yes', '@point': 'start', '#text': '1950-10-21'}

	{'@encoding': 'edtf', '@keyDate': 'yes', '@point': 'start', '#text': '1980-11-01'}

	{'@encoding': 'edtf', '@keyDate': 'yes', '@point': 'start', '#text': '1980-10-25'}

	{'@encoding': 'edtf', '@keyDate': 'yes', '@point': 'start', '#text': '1980-10-18'}

	{'@encoding': 'edtf', '@keyDate': 'yes', '@point': 'start', '#text': '1928-10-27'}

	{'@encoding': 'edtf', '@keyDate': 'yes', '@point': 'start', '#text': '1980-09-20'}

	{'@encoding': 'edtf', '@keyDate': 'yes', '@point': 'start', '#text': '1980-09-13'}

	{'@encoding': 'edtf', '@keyDate': 'yes', '@point': 'start', '#text': '1950-10-14'}

	{'@encoding': 'edtf', '@keyDate': 'yes', '@point': 'start', '#text': '2013-04-20'}

	{'@encoding': 'edtf', '@keyDate': 'yes', '@point': 'start', '#text': '2012-08-30'}

	{'@encoding': 'edtf', '@keyDate': 'yes', '@point': 'start', '#text': '1950-09-23'}

	{'@encoding': 'edtf', '@keyDate': 'yes', '@point': 'start', '#text': '2012-11-10'}

	{'@encoding': 'edtf', '@keyDate': 'yes', '@point': 'start', '#text': '2012-10-20'}

	{'@encoding': 'edtf', '@keyDate': 'yes', '@point': 'start', '#text': '2012-09-08'}

	{'@encoding': 'edtf', '@keyDate': 'yes', '@point': 'start', '#text': '2011-11-19'}

	{'@encoding': 'edtf', '@keyDate': 'yes', '@point': 'start', '#text': '2011-11-05'}

	{'@encoding': 'edtf', '@keyDate': 'yes', '@point': 'start', '#text': '1949-11-26'}

	{'@encoding': 'edtf', '@keyDate': 'yes', '@point': 'start', '#text': '2011-10-29'}

	{'@encoding': 'edtf', '@keyDate': 'yes', '@point': 'start', '#text': '2011-10-15'}

	{'@encoding': 'edtf', '@keyDate': 'yes', '@point': 'start', '#text': '2011-10-08'}

	{'@encoding': 'edtf', '@keyDate': 'yes', '@point': 'start', '#text': '1934-12-08'}

	{'@encoding': 'edtf', '@keyDate': 'yes', '@point': 'start', '#text': '2011-10-01'}

	{'@encoding': 'edtf', '@keyDate': 'yes', '@point': 'start', '#text': '1949-11-05'}

	{'@encoding': 'edtf', '@keyDate': 'yes', '@point': 'start', '#text': '2011-09-10'}

	{'@encoding': 'edtf', '@keyDate': 'yes', '@point': 'start', '#text': '2011-09-03'}

	{'@encoding': 'edtf', '@keyDate': 'yes', '@point': 'start', '#text': '1949-10-22'}

	{'@encoding': 'edtf', '@keyDate': 'yes', '@point': 'start', '#text': '2011-09-01'}

	{'@encoding': 'edtf', '@keyDate': 'yes', '@point': 'start', '#text': '2011-04-16'}

	{'@encoding': 'edtf', '@keyDate': 'yes', '@point': 'start', '#text': '2010-12-30'}

	{'@encoding': 'edtf', '@keyDate': 'yes', '@point': 'start', '#text': '2010-11-13'}

	{'@encoding': 'edtf', '@keyDate': 'yes', '@point': 'start', '#text': '2010-10-23'}

	{'@encoding': 'edtf', '@keyDate': 'yes', '@point': 'start', '#text': '2010-09-25'}

	{'@encoding': 'edtf', '@keyDate': 'yes', '@point': 'start', '#text': '2010-09-18'}

	{'@encoding': 'edtf', '@keyDate': 'yes', '@point': 'start', '#text': '2010-09-11'}

	{'@encoding': 'edtf', '@keyDate': 'yes', '@point': 'start', '#text': '2010-09-01'}

	{'@encoding': 'edtf', '@keyDate': 'yes', '@point': 'start', '#text': '1949-10-08'}

	{'@encoding': 'edtf', '@keyDate': 'yes', '@point': 'start', '#text': '2010-04-17'}

	{'@encoding': 'edtf', '@keyDate': 'yes', '@point': 'start', '#text': '2009-09-01'}

	{'@encoding': 'edtf', '@keyDate': 'yes', '@point': 'start', '#text': '1949-10-01'}

	{'@encoding': 'edtf', '@keyDate': 'yes', '@point': 'start', '#text': '2009-11-21'}

	{'@encoding': 'edtf', '@keyDate': 'yes', '@point': 'start', '#text': '2009-11-07'}

	{'@encoding': 'edtf', '@keyDate': 'yes', '@point': 'start', '#text': '2009-10-31'}

	{'@encoding': 'edtf', '@keyDate': 'yes', '@point': 'start', '#text': '2009-10-10'}

	{'@encoding': 'edtf', '@keyDate': 'yes', '@point': 'start', '#text': '2009-10-03'}

	{'@encoding': 'edtf', '@keyDate': 'yes', '@point': 'start', '#text': '2009-09-26'}

	{'@encoding': 'edtf', '@keyDate': 'yes', '@point': 'start', '#text': '2009-09-12'}

	{'@encoding': 'edtf', '@keyDate': 'yes', '@point': 'start', '#text': '2009-09-05'}

	{'@encoding': 'edtf', '@keyDate': 'yes', '@point': 'start', '#text': '2009-04-18'}

	{'@encoding': 'edtf', '@keyDate': 'yes', '@point': 'start', '#text': '1949-09-24'}

	{'@encoding': 'edtf', '@keyDate': 'yes', '@point': 'start', '#text': '2008-12-06'}

	{'@encoding': 'edtf', '@keyDate': 'yes', '@point': 'start', '#text': '2008-10-25'}

	{'@encoding': 'edtf', '@keyDate': 'yes', '@point': 'start', '#text': '2008-10-18'}

	{'@encoding': 'edtf', '@keyDate': 'yes', '@point': 'start', '#text': '2008-10-04'}

	{'@encoding': 'edtf', '@keyDate': 'yes', '@point': 'start', '#text': '1948-11-20'}

	{'@encoding': 'edtf', '@keyDate': 'yes', '@point': 'start', '#text': '2008-09-20'}

	{'@encoding': 'edtf', '@keyDate': 'yes', '@point': 'start', '#text': '1927-10-15'}

	{'@encoding': 'edtf', '@keyDate': 'yes', '@point': 'start', '#text': '2008-09-13'}

	{'@encoding': 'edtf', '@keyDate': 'yes', '@point': 'start', '#text': '2008-09-01'}

	{'@encoding': 'edtf', '@keyDate': 'yes', '@point': 'start', '#text': '2008-01-01'}

	{'@encoding': 'edtf', '@keyDate': 'yes', '@point': 'start', '#text': '1934-11-10'}

	{'@encoding': 'edtf', '@keyDate': 'yes', '@point': 'start', '#text': '1948-10-30'}

	{'@encoding': 'edtf', '@keyDate': 'yes', '@point': 'start', '#text': '2007-12-01'}

	{'@encoding': 'edtf', '@keyDate': 'yes', '@point': 'start', '#text': '2007-11-17'}

	{'@encoding': 'edtf', '@keyDate': 'yes', '@point': 'start', '#text': '2007-11-10'}

	{'@encoding': 'edtf', '@keyDate': 'yes', '@point': 'start', '#text': '1948-10-23'}

	{'@encoding': 'edtf', '@keyDate': 'yes', '@point': 'start', '#text': '2007-11-03'}

	{'@encoding': 'edtf', '@keyDate': 'yes', '@point': 'start', '#text': '2007-10-27'}

	{'@encoding': 'edtf', '@keyDate': 'yes', '@point': 'start', '#text': '2007-10-06'}

	{'@encoding': 'edtf', '@keyDate': 'yes', '@point': 'start', '#text': '2007-09-22'}

	{'@encoding': 'edtf', '@keyDate': 'yes', '@point': 'start', '#text': '1948-10-16'}

	{'@encoding': 'edtf', '@keyDate': 'yes', '@point': 'start', '#text': '2007-09-08'}

	{'@encoding': 'edtf', '@keyDate': 'yes', '@point': 'start', '#text': '2007-09-01'}

	{'@encoding': 'edtf', '@keyDate': 'yes', '@point': 'start', '#text': '2007-03-31'}

	{'@encoding': 'edtf', '@keyDate': 'yes', '@point': 'start', '#text': '2007-01-01'}

	{'@encoding': 'edtf', '@keyDate': 'yes', '@point': 'start', '#text': '1948-10-09'}

	{'@encoding': 'edtf', '@keyDate': 'yes', '@point': 'start', '#text': '2006-12-02'}

	{'@encoding': 'edtf', '@keyDate': 'yes', '@point': 'start', '#text': '2006-11-25'}

	{'@encoding': 'edtf', '@keyDate': 'yes', '@point': 'start', '#text': '2006-11-04'}

	{'@encoding': 'edtf', '@keyDate': 'yes', '@point': 'start', '#text': '2006-10-21'}

	{'@encoding': 'edtf', '@keyDate': 'yes', '@point': 'start', '#text': '2006-09-23'}

	{'@encoding': 'edtf', '@keyDate': 'yes', '@point': 'start', '#text': '1948-09-25'}

	{'@encoding': 'edtf', '@keyDate': 'yes', '@point': 'start', '#text': '2006-09-16'}

	{'@encoding': 'edtf', '@keyDate': 'yes', '@point': 'start', '#text': '2006-09-09'}

	{'@encoding': 'edtf', '@keyDate': 'yes', '@point': 'start', '#text': '2006-09-02'}

	{'@encoding': 'edtf', '@keyDate': 'yes', '@point': 'start', '#text': '1934-10-27'}

	{'@encoding': 'edtf', '@keyDate': 'yes', '@point': 'start', '#text': '2006-09-01'}

	{'@encoding': 'edtf', '@keyDate': 'yes', '@point': 'start', '#text': '1947-11-15'}

	{'@encoding': 'edtf', '@keyDate': 'yes', '@point': 'start', '#text': '2006-04-08'}

	{'@encoding': 'edtf', '@keyDate': 'yes', '@point': 'start', '#text': '2005-11-12'}

	{'@encoding': 'edtf', '@keyDate': 'yes', '@point': 'start', '#text': '2005-10-29'}

	{'@encoding': 'edtf', '@keyDate': 'yes', '@point': 'start', '#text': '2005-10-08'}

	{'@encoding': 'edtf', '@keyDate': 'yes', '@point': 'start', '#text': '1926-11-06'}

	{'@encoding': 'edtf', '@keyDate': 'yes', '@point': 'start', '#text': '2005-10-01'}

	{'@encoding': 'edtf', '@keyDate': 'yes', '@point': 'start', '#text': '1947-10-25'}

	{'@encoding': 'edtf', '@keyDate': 'yes', '@point': 'start', '#text': '2005-09-03'}

	{'@encoding': 'edtf', '@keyDate': 'yes', '@point': 'start', '#text': '2005-09-01'}

	{'@encoding': 'edtf', '@keyDate': 'yes', '@point': 'start', '#text': '2005-01-01'}

	{'@encoding': 'edtf', '@keyDate': 'yes', '@point': 'start', '#text': '2004-12-04'}

	{'@encoding': 'edtf', '@keyDate': 'yes', '@point': 'start', '#text': '2004-11-27'}

	{'@encoding': 'edtf', '@keyDate': 'yes', '@point': 'start', '#text': '1947-10-11'}

	{'@encoding': 'edtf', '@keyDate': 'yes', '@point': 'start', '#text': '2004-11-06'}

	{'@encoding': 'edtf', '@keyDate': 'yes', '@point': 'start', '#text': '2004-10-23'}

	{'@encoding': 'edtf', '@keyDate': 'yes', '@point': 'start', '#text': '2004-10-02'}

	{'@encoding': 'edtf', '@keyDate': 'yes', '@point': 'start', '#text': '2004-09-25'}

	{'@encoding': 'edtf', '@keyDate': 'yes', '@point': 'start', '#text': '2004-09-18'}

	{'@encoding': 'edtf', '@keyDate': 'yes', '@point': 'start', '#text': '2004-09-05'}

	{'@encoding': 'edtf', '@keyDate': 'yes', '@point': 'start', '#text': '1947-10-04'}

	{'@encoding': 'edtf', '@keyDate': 'yes', '@point': 'start', '#text': '2004-09-01'}

	{'@encoding': 'edtf', '@keyDate': 'yes', '@point': 'start', '#text': '2004-04-17'}

	{'@encoding': 'edtf', '@keyDate': 'yes', '@point': 'start', '#text': '2004-01-02'}

	{'@encoding': 'edtf', '@keyDate': 'yes', '@point': 'start', '#text': '2003-11-22'}

	{'@encoding': 'edtf', '@keyDate': 'yes', '@point': 'start', '#text': '2003-11-15'}

	{'@encoding': 'edtf', '@keyDate': 'yes', '@point': 'start', '#text': '1934-09-29'}

	{'@encoding': 'edtf', '@keyDate': 'yes', '@point': 'start', '#text': '1946-11-23'}

	{'@encoding': 'edtf', '@keyDate': 'yes', '@point': 'start', '#text': '2003-11-01'}

	{'@encoding': 'edtf', '@keyDate': 'yes', '@point': 'start', '#text': '2003-10-11'}

	{'@encoding': 'edtf', '@keyDate': 'yes', '@point': 'start', '#text': '2003-09-27'}

	{'@encoding': 'edtf', '@keyDate': 'yes', '@point': 'start', '#text': '2003-09-06'}

	{'@encoding': 'edtf', '@keyDate': 'yes', '@point': 'start', '#text': '1946-11-02'}

	{'@encoding': 'edtf', '@keyDate': 'yes', '@point': 'start', '#text': '2002-12-31'}

	{'@encoding': 'edtf', '@keyDate': 'yes', '@point': 'start', '#text': '2002-11-30'}

	{'@encoding': 'edtf', '@keyDate': 'yes', '@point': 'start', '#text': '1946-10-26'}

	{'@encoding': 'edtf', '@keyDate': 'yes', '@point': 'start', '#text': '2002-11-09'}

	{'@encoding': 'edtf', '@keyDate': 'yes', '@point': 'start', '#text': '2002-10-26'}

	{'@encoding': 'edtf', '@keyDate': 'yes', '@point': 'start', '#text': '2002-10-05'}

	{'@encoding': 'edtf', '@keyDate': 'yes', '@point': 'start', '#text': '2002-09-28'}

	{'@encoding': 'edtf', '@keyDate': 'yes', '@point': 'start', '#text': '1946-10-19'}

	{'@encoding': 'edtf', '@keyDate': 'yes', '@point': 'start', '#text': '2002-09-21'}

	{'@encoding': 'edtf', '@keyDate': 'yes', '@point': 'start', '#text': '2002-09-07'}

	{'@encoding': 'edtf', '@keyDate': 'yes', '@point': 'start', '#text': '2002-08-30'}

	{'@encoding': 'edtf', '@keyDate': 'yes', '@point': 'start', '#text': '1946-10-12'}

	{'@encoding': 'edtf', '@keyDate': 'yes', '@point': 'start', '#text': '2002-01-02'}

	{'@encoding': 'edtf', '@keyDate': 'yes', '@point': 'start', '#text': '2002-01-01'}

	{'@encoding': 'edtf', '@keyDate': 'yes', '@point': 'start', '#text': '2001-12-08'}

	{'@encoding': 'edtf', '@keyDate': 'yes', '@point': 'start', '#text': '2001-11-10'}

	{'@encoding': 'edtf', '@keyDate': 'yes', '@point': 'start', '#text': '1946-09-28'}

	{'@encoding': 'edtf', '@keyDate': 'yes', '@point': 'start', '#text': '2001-10-27'}

	{'@encoding': 'edtf', '@keyDate': 'yes', '@point': 'start', '#text': '2001-10-06'}

	{'@encoding': 'edtf', '@keyDate': 'yes', '@point': 'start', '#text': '2001-09-29'}

	{'@encoding': 'edtf', '@keyDate': 'yes', '@point': 'start', '#text': '2001-09-01'}

	{'@encoding': 'edtf', '@keyDate': 'yes', '@point': 'start', '#text': '1945-12-01'}

	{'@encoding': 'edtf', '@keyDate': 'yes', '@point': 'start', '#text': '1934-01-01'}

	{'@encoding': 'edtf', '@keyDate': 'yes', '@point': 'start', '#text': '2001-01-01'}

	{'@encoding': 'edtf', '@keyDate': 'yes', '@point': 'start', '#text': '1945-11-03'}

	{'@encoding': 'edtf', '@keyDate': 'yes', '@point': 'start', '#text': '2000-11-18'}

	{'@encoding': 'edtf', '@keyDate': 'yes', '@point': 'start', '#text': '2000-11-11'}

	{'@encoding': 'edtf', '@keyDate': 'yes', '@point': 'start', '#text': '1945-10-27'}

	{'@encoding': 'edtf', '@keyDate': 'yes', '@point': 'start', '#text': '2000-10-21'}

	{'@encoding': 'edtf', '@keyDate': 'yes', '@point': 'start', '#text': '2000-09-23'}

	{'@encoding': 'edtf', '@keyDate': 'yes', '@point': 'start', '#text': '2000-09-16'}

	{'@encoding': 'edtf', '@keyDate': 'yes', '@point': 'start', '#text': '2000-09-02'}

	{'@encoding': 'edtf', '@keyDate': 'yes', '@point': 'start', '#text': '1945-10-13'}

	{'@encoding': 'edtf', '@keyDate': 'yes', '@point': 'start', '#text': '2000-09-01'}

	{'@encoding': 'edtf', '@keyDate': 'yes', '@point': 'start', '#text': '2000-01-02'}

	{'@encoding': 'edtf', '@keyDate': 'yes', '@point': 'start', '#text': '1945-10-06'}

	{'@encoding': 'edtf', '@keyDate': 'yes', '@point': 'start', '#text': '1969-11-08'}

	{'@encoding': 'edtf', '@keyDate': 'yes', '@point': 'start', '#text': '1968-10-19'}

	{'@encoding': 'edtf', '@keyDate': 'yes', '@point': 'start', '#text': '1967-11-11'}

	{'@encoding': 'edtf', '@keyDate': 'yes', '@point': 'start', '#text': '1966-11-05'}

	{'@encoding': 'edtf', '@keyDate': 'yes', '@point': 'start', '#text': '1945-09-29'}

	{'@encoding': 'edtf', '@keyDate': 'yes', '@point': 'start', '#text': '1964-10-17'}

	{'@encoding': 'edtf', '@keyDate': 'yes', '@point': 'start', '#text': '1963-09-21'}

	{'@encoding': 'edtf', '@keyDate': 'yes', '@point': 'start', '#text': '1962-11-03'}

	{'@encoding': 'edtf', '@keyDate': 'yes', '@point': 'start', '#text': '1961-11-11'}

	{'@encoding': 'edtf', '@keyDate': 'yes', '@point': 'start', '#text': '1961-09-30'}

	{'@encoding': 'edtf', '@keyDate': 'yes', '@point': 'start', '#text': '1960-10-22'}

	{'@encoding': 'edtf', '@keyDate': 'yes', '@point': 'start', '#text': '1945-01-01'}

	{'@encoding': 'edtf', '@keyDate': 'yes', '@point': 'start', '#text': '1959-10-24'}

	{'@encoding': 'edtf', '@keyDate': 'yes', '@point': 'start', '#text': '1958-11-15'}

	{'@encoding': 'edtf', '@keyDate': 'yes', '@point': 'start', '#text': '1958-10-18'}

	{'@encoding': 'edtf', '@keyDate': 'yes', '@point': 'start', '#text': '1957-09-28'}

	{'@encoding': 'edtf', '@keyDate': 'yes', '@point': 'start', '#text': '1956-10-27'}

	{'@encoding': 'edtf', '@keyDate': 'yes', '@point': 'start', '#text': '1944-11-18'}

	{'@encoding': 'edtf', '@keyDate': 'yes', '@point': 'start', '#text': '1971-09-01'}

	{'@encoding': 'edtf', '@keyDate': 'yes', '@point': 'start', '#text': '1933-12-09'}

	{'@encoding': 'edtf', '@keyDate': 'yes', '@point': 'start', '#text': '1944-10-28'}

	{'@encoding': 'edtf', '@keyDate': 'yes', '@point': 'start', '#text': '1944-10-21'}

	{'@encoding': 'edtf', '@keyDate': 'yes', '@point': 'start', '#text': '1944-10-14'}

	{'@encoding': 'edtf', '@keyDate': 'yes', '@point': 'start', '#text': '1944-09-30'}

	{'@encoding': 'edtf', '@keyDate': 'yes', '@point': 'start', '#text': '1941-10-18'}

	{'@encoding': 'edtf', '@keyDate': 'yes', '@point': 'start', '#text': '1941-01-01'}

	{'@encoding': 'edtf', '@keyDate': 'yes', '@point': 'start', '#text': '1933-10-28'}

	{'@encoding': 'edtf', '@keyDate': 'yes', '@point': 'start', '#text': '1940-01-01'}

	{'@encoding': 'edtf', '@keyDate': 'yes', '@point': 'start', '#text': '1955-10-22'}

	02/26/09

	{'@encoding': 'edtf', '@keyDate': 'yes', '#text': '1909-02-26'}

	3/2/1925

	2/17/1925

	6/1/1925

	6/4/1925

	9/16/1925

	7/11/1925

	7/9/1925

	7/10/1925

	[1925]

	10/9/1924

	5/16/1925

	5/28/1925

	5/26/1925

	5/14/1925

	5/21/1925

	5/15/1925

	1/18/1925

	5/27/1925

	5/29/1925

	3/12/1981

	7/21/1960

	6/22/1925

	6/24/1925

	6/29/1925

	6/17/1925

	6/16/1925

	6/23/1925

	6/13/1925

	6/12/1925

	6/11/1925

	6/1925

	6/9/1925

	6/8/1925

	6/7/1925

	6/6/1925

	6/5/1925

	1925-06-

	6/15/1925

	6/10/1925

	6/26/1925

	5/30/1925

	6/27/1925

	6/25/1925

	6/21/1925

	6/20/1925

	6/19/1925

	6/18/1925

	8/6/1925

	8/1/1925

	8/15/1925

	8/10/1925

	8/3/1925

	8/4/1925

	8/20/1926

	9/5/1925

	8/17/1925

	8/19/1926

	8/19/1925

	8/29/1925

	8/25/1925

	8/24/1926

	7/3/1925

	6/30/1925

	7/22/1925

	7/31/1925

	7/6/1925

	7/27/1925

	7/28/1925

	7/23/1925

	7/30/1925

	7/29/1925

	7/5/1925

	7/7/1925

	7/20/1925

	7/1/1925

	7/17/1925

	7/15/1925

	7/21/1925

	7/14/1925

	7/18/1925

	7/12/1925

	7/13/1925

	7/2/1925

	6/3/1925

	7/8/1925

	7/24/1924

	7/4/1925

	6/28/1925

	12/20/1923

	3/17/1925

	2/7/1925

	[1916]

	6/26/2019

	8/20/1925

	10/8/1925

	6/6/1926

	12/16/1925

	[1935]

	3/13/1925

	3/5/2027

	3/19/1926

	3/16/1926

	1/6/1925

	1/2/1926

	9/1/1925

	9/8/1925

	10/7/1925

	9/9/1925

	9/15/1925

	8/30/1925

	9/4/1925

	4/12/1940

	2/5/1925

	1925-07-

	1/15/1924

	12/12/1973

	9/17/1923

	5/24/1922

	4/21/1925

	5/25/1925

	5/1/1925

	5/24/1925

	1925-02-

	[1925-07]

	1925-09-

	8/9/2025

	1/8/1926

	7/26/1960

	7/28/1960

	[1960]

	11/30/1961

	[1975]

	5/18/1925

	8/8/1925

	6/2/1925

	4/23/1934

	5/20/1925

	1/29/1926

	7/16/1925

	3/21/1925

	4/22/1925

	1/20/1922

	5/31/1925

	4/28/1925

	10/9/1943

	{'@encoding': 'edtf', '@keyDate': 'yes', '#text': '1943-10-09'}

	10/16/1943

	{'@encoding': 'edtf', '@keyDate': 'yes', '#text': '1943-10-16'}

	10/23/1943

	{'@encoding': 'edtf', '@keyDate': 'yes', '#text': '1943-10-23'}

	10/30/1943

	{'@encoding': 'edtf', '@keyDate': 'yes', '#text': '1943-10-30'}

	11/6/1943

	11/13/1943

	{'@encoding': 'edtf', '@keyDate': 'yes', '#text': '1943-11-13'}

	11/22/1943

	{'@encoding': 'edtf', '@keyDate': 'yes', '#text': '1943-11-22'}

	11/27/1943

	{'@encoding': 'edtf', '@keyDate': 'yes', '#text': '1943-11-27'}

	12/4/1943

	{'@encoding': 'edtf', '@keyDate': 'yes', '#text': '1943-12-04'}

	12/11/1943

	{'@encoding': 'edtf', '@keyDate': 'yes', '#text': '1943-12-11'}

	12/18/1943

	{'@encoding': 'edtf', '@keyDate': 'yes', '#text': '1943-12-18'}

	12/25/1943

	{'@encoding': 'edtf', '@keyDate': 'yes', '#text': '1943-12-25'}

	1/1/1944

	{'@encoding': 'edtf', '@keyDate': 'yes', '#text': '1944-01-01'}

	1/8/1944

	{'@encoding': 'edtf', '@keyDate': 'yes', '#text': '1944-01-08'}

	1/15/1944

	{'@encoding': 'edtf', '@keyDate': 'yes', '#text': '1944-01-15'}

	1/22/1944

	{'@encoding': 'edtf', '@keyDate': 'yes', '#text': '1944-01-22'}

	1/29/1944

	{'@encoding': 'edtf', '@keyDate': 'yes', '#text': '1944-01-29'}

	2/5/1944

	{'@encoding': 'edtf', '@keyDate': 'yes', '#text': '1944-02-05'}

	2/12/1944

	{'@encoding': 'edtf', '@keyDate': 'yes', '#text': '1944-02-12'}

	2/19/1944

	{'@encoding': 'edtf', '@keyDate': 'yes', '#text': '1944-02-19'}

	2/26/1944

	{'@encoding': 'edtf', '@keyDate': 'yes', '#text': '1944-02-26'}

	3/4/1944

	{'@encoding': 'edtf', '@keyDate': 'yes', '#text': '1944-03-04'}

	3/11/1944

	{'@encoding': 'edtf', '@keyDate': 'yes', '#text': '1944-03-11'}

	3/18/1944

	{'@encoding': 'edtf', '@keyDate': 'yes', '#text': '1944-03-18'}

	3/25/1944

	{'@encoding': 'edtf', '@keyDate': 'yes', '#text': '1944-03-25'}

	4/29/1944

	{'@encoding': 'edtf', '@keyDate': 'yes', '#text': '1944-04-29'}


Total distinct values: 7081
