
Unique values in metadata.mods.originInfo field:

	{'place': {'@supplied': 'yes', 'placeTerm': {'@type': 'text', '#text': 'Knoxville (Tenn.)'}}, 'publisher': 'University of Tennessee (System). National Alumni Association', 'dateCreated': ['1/1/1917', {'@encoding': 'edtf', '@keyDate': 'yes', '#text': '1917-01-01'}]}

	{'place': {'@supplied': 'yes', 'placeTerm': {'@type': 'text', '#text': 'Knoxville (Tenn.)'}}, 'publisher': 'University of Tennessee (System). National Alumni Association', 'dateCreated': ['4/1/1917', {'@encoding': 'edtf', '@keyDate': 'yes', '#text': '1917-04-01'}]}

	{'place': {'@supplied': 'yes', 'placeTerm': {'@type': 'text', '#text': 'Knoxville (Tenn.)'}}, 'publisher': 'University of Tennessee (System). National Alumni Association', 'dateCreated': ['7/1/1917', {'@encoding': 'edtf', '@keyDate': 'yes', '#text': '1917-07-01'}]}

	{'place': {'@supplied': 'yes', 'placeTerm': {'@type': 'text', '#text': 'Knoxville (Tenn.)'}}, 'publisher': 'University of Tennessee (System). National Alumni Association', 'dateCreated': ['10/1/1917', {'@encoding': 'edtf', '@keyDate': 'yes', '#text': '1917-10-01'}]}

	{'place': {'@supplied': 'yes', 'placeTerm': {'@type': 'text', '#text': 'Knoxville (Tenn.)'}}, 'publisher': 'University of Tennessee (System). National Alumni Association', 'dateCreated': ['1918', {'@encoding': 'edtf', '@keyDate': 'yes', '#text': '1918'}]}

	{'place': {'@supplied': 'yes', 'placeTerm': {'@type': 'text', '#text': 'Knoxville (Tenn.)'}}, 'publisher': 'University of Tennessee (System). National Alumni Association', 'dateCreated': ['7/1/1918', {'@encoding': 'edtf', '@keyDate': 'yes', '#text': '1918-07-01'}]}

	{'place': {'@supplied': 'yes', 'placeTerm': {'@type': 'text', '#text': 'Knoxville (Tenn.)'}}, 'publisher': 'University of Tennessee (System). National Alumni Association', 'dateCreated': ['1/1/1919', {'@encoding': 'edtf', '@keyDate': 'yes', '#text': '1919-01-01'}]}

	{'place': {'@supplied': 'yes', 'placeTerm': {'@type': 'text', '#text': 'Knoxville (Tenn.)'}}, 'publisher': 'University of Tennessee (System). National Alumni Association', 'dateCreated': ['4/1/1919', {'@encoding': 'edtf', '@keyDate': 'yes', '#text': '1919-04-01'}]}

	{'place': {'@supplied': 'yes', 'placeTerm': {'@type': 'text', '#text': 'Knoxville (Tenn.)'}}, 'publisher': 'University of Tennessee (System). National Alumni Association', 'dateCreated': ['7/1/1919', {'@encoding': 'edtf', '@keyDate': 'yes', '#text': '1919-07-01'}]}

	{'place': {'@supplied': 'yes', 'placeTerm': {'@type': 'text', '#text': 'Knoxville (Tenn.)'}}, 'publisher': 'University of Tennessee (System). National Alumni Association', 'dateCreated': ['1919', {'@encoding': 'edtf', '@keyDate': 'yes', '#text': '1919'}]}

	{'place': {'@supplied': 'yes', 'placeTerm': {'@type': 'text', '#text': 'Knoxville (Tenn.)'}}, 'publisher': 'University of Tennessee (System). National Alumni Association', 'dateCreated': ['1/1/1920', {'@encoding': 'edtf', '@keyDate': 'yes', '#text': '1920-01-01'}]}

	{'place': {'@supplied': 'yes', 'placeTerm': {'@type': 'text', '#text': 'Knoxville (Tenn.)'}}, 'publisher': 'University of Tennessee (System). National Alumni Association', 'dateCreated': ['1920', {'@encoding': 'edtf', '@keyDate': 'yes', '#text': '1920'}]}

	{'place': {'@supplied': 'yes', 'placeTerm': {'@type': 'text', '#text': 'Knoxville (Tenn.)'}}, 'publisher': 'University of Tennessee (System). National Alumni Association', 'dateCreated': ['10/1/1920', {'@encoding': 'edtf', '@keyDate': 'yes', '#text': '1920-10-01'}]}

	{'place': {'@supplied': 'yes', 'placeTerm': {'@type': 'text', '#text': 'Knoxville (Tenn.)'}}, 'publisher': 'University of Tennessee (System). National Alumni Association', 'dateCreated': ['1921', {'@encoding': 'edtf', '@keyDate': 'yes', '#text': '1921'}]}

	{'place': {'@supplied': 'yes', 'placeTerm': {'@type': 'text', '#text': 'Knoxville (Tenn.)'}}, 'publisher': 'University of Tennessee (System). National Alumni Association', 'dateCreated': ['4/1/1921', {'@encoding': 'edtf', '@keyDate': 'yes', '#text': '1921-04-01'}]}

	{'place': {'@supplied': 'yes', 'placeTerm': {'@type': 'text', '#text': 'Knoxville (Tenn.)'}}, 'publisher': 'University of Tennessee (System). National Alumni Association', 'dateCreated': ['7/1/1921', {'@encoding': 'edtf', '@keyDate': 'yes', '#text': '1921-07-01'}]}

	{'place': {'@supplied': 'yes', 'placeTerm': {'@type': 'text', '#text': 'Knoxville (Tenn.)'}}, 'publisher': 'University of Tennessee (System). National Alumni Association', 'dateCreated': ['10/1/1921', {'@encoding': 'edtf', '@keyDate': 'yes', '#text': '1921-10-01'}]}

	{'place': {'@supplied': 'yes', 'placeTerm': {'@type': 'text', '#text': 'Knoxville (Tenn.)'}}, 'publisher': 'University of Tennessee (System). National Alumni Association', 'dateCreated': ['1922', {'@encoding': 'edtf', '@keyDate': 'yes', '#text': '1922'}]}

	{'place': {'@supplied': 'yes', 'placeTerm': {'@type': 'text', '#text': 'Knoxville (Tenn.)'}}, 'publisher': 'University of Tennessee (System). National Alumni Association', 'dateCreated': ['7/1/1922', {'@encoding': 'edtf', '@keyDate': 'yes', '#text': '1922-07-01'}]}

	{'place': {'@supplied': 'yes', 'placeTerm': {'@type': 'text', '#text': 'Knoxville (Tenn.)'}}, 'publisher': 'University of Tennessee (System). National Alumni Association', 'dateCreated': ['1923', {'@encoding': 'edtf', '@keyDate': 'yes', '#text': '1923'}]}

	{'place': {'@supplied': 'yes', 'placeTerm': {'@type': 'text', '#text': 'Knoxville (Tenn.)'}}, 'publisher': 'University of Tennessee (System). National Alumni Association', 'dateCreated': ['4/1/1923', {'@encoding': 'edtf', '@keyDate': 'yes', '#text': '1923-04-01'}]}

	{'place': {'@supplied': 'yes', 'placeTerm': {'@type': 'text', '#text': 'Knoxville (Tenn.)'}}, 'publisher': 'University of Tennessee (System). National Alumni Association', 'dateCreated': ['7/1/1923', {'@encoding': 'edtf', '@keyDate': 'yes', '#text': '1923-07-01'}]}

	{'place': {'@supplied': 'yes', 'placeTerm': {'@type': 'text', '#text': 'Knoxville (Tenn.)'}}, 'publisher': 'University of Tennessee (System). National Alumni Association', 'dateCreated': ['1924', {'@encoding': 'edtf', '@keyDate': 'yes', '#text': '1924'}]}

	{'place': {'@supplied': 'yes', 'placeTerm': {'@type': 'text', '#text': 'Knoxville (Tenn.)'}}, 'publisher': 'University of Tennessee (System). National Alumni Association', 'dateCreated': ['1925', {'@encoding': 'edtf', '@keyDate': 'yes', '#text': '1925'}]}

	{'place': {'@supplied': 'yes', 'placeTerm': {'@type': 'text', '#text': 'Knoxville (Tenn.)'}}, 'publisher': 'University of Tennessee (System). National Alumni Association', 'dateCreated': ['4/1/1925', {'@encoding': 'edtf', '@keyDate': 'yes', '#text': '1925-04-01'}]}

	{'place': {'@supplied': 'yes', 'placeTerm': {'@type': 'text', '#text': 'Knoxville (Tenn.)'}}, 'publisher': 'University of Tennessee (System). National Alumni Association', 'dateCreated': ['1/1/1926', {'@encoding': 'edtf', '@keyDate': 'yes', '#text': '1926-01-01'}]}

	{'place': {'@supplied': 'yes', 'placeTerm': {'@type': 'text', '#text': 'Knoxville (Tenn.)'}}, 'publisher': 'University of Tennessee (System). National Alumni Association', 'dateCreated': ['4/1/1926', {'@encoding': 'edtf', '@keyDate': 'yes', '#text': '1926-04-01'}]}

	{'place': {'@supplied': 'yes', 'placeTerm': {'@type': 'text', '#text': 'Knoxville (Tenn.)'}}, 'publisher': 'University of Tennessee (System). National Alumni Association', 'dateCreated': ['1926', {'@encoding': 'edtf', '@keyDate': 'yes', '#text': '1926'}]}

	{'place': {'@supplied': 'yes', 'placeTerm': {'@type': 'text', '#text': 'Knoxville (Tenn.)'}}, 'publisher': 'University of Tennessee (System). National Alumni Association', 'dateCreated': ['1/1/1927', {'@encoding': 'edtf', '@keyDate': 'yes', '#text': '1927-01-01'}]}

	{'place': {'@supplied': 'yes', 'placeTerm': {'@type': 'text', '#text': 'Knoxville (Tenn.)'}}, 'publisher': 'University of Tennessee (System). National Alumni Association', 'dateCreated': ['3/1/1927', {'@encoding': 'edtf', '@keyDate': 'yes', '#text': '1927-03-01'}]}

	{'place': {'@supplied': 'yes', 'placeTerm': {'@type': 'text', '#text': 'Knoxville (Tenn.)'}}, 'publisher': 'University of Tennessee (System). National Alumni Association', 'dateCreated': ['1927', {'@encoding': 'edtf', '@keyDate': 'yes', '#text': '1927'}]}

	{'place': {'@supplied': 'yes', 'placeTerm': {'@type': 'text', '#text': 'Knoxville (Tenn.)'}}, 'publisher': 'University of Tennessee (System). National Alumni Association', 'dateCreated': ['1/1/1928', {'@encoding': 'edtf', '@keyDate': 'yes', '#text': '1928-01-01'}]}

	{'place': {'@supplied': 'yes', 'placeTerm': {'@type': 'text', '#text': 'Knoxville (Tenn.)'}}, 'publisher': 'University of Tennessee (System). National Alumni Association', 'dateCreated': ['1928', {'@encoding': 'edtf', '@keyDate': 'yes', '#text': '1928'}]}

	{'place': {'@supplied': 'yes', 'placeTerm': {'@type': 'text', '#text': 'Knoxville (Tenn.)'}}, 'publisher': 'University of Tennessee (System). National Alumni Association', 'dateCreated': ['5/1/1928', {'@encoding': 'edtf', '@keyDate': 'yes', '#text': '1928-05-01'}]}

	{'place': {'@supplied': 'yes', 'placeTerm': {'@type': 'text', '#text': 'Knoxville (Tenn.)'}}, 'publisher': 'University of Tennessee (System). National Alumni Association', 'dateCreated': ['7/2/1928', {'@encoding': 'edtf', '@keyDate': 'yes', '#text': '1928-07-02'}]}

	{'place': {'@supplied': 'yes', 'placeTerm': {'@type': 'text', '#text': 'Knoxville (Tenn.)'}}, 'publisher': 'University of Tennessee (System). National Alumni Association', 'dateCreated': ['11/1/1928', {'@encoding': 'edtf', '@keyDate': 'yes', '#text': '1928-11-01'}]}

	{'place': {'@supplied': 'yes', 'placeTerm': {'@type': 'text', '#text': 'Knoxville (Tenn.)'}}, 'publisher': 'University of Tennessee (System). National Alumni Association', 'dateCreated': ['1/1/1929', {'@encoding': 'edtf', '@keyDate': 'yes', '#text': '1929-01-01'}]}

	{'place': {'@supplied': 'yes', 'placeTerm': {'@type': 'text', '#text': 'Knoxville (Tenn.)'}}, 'publisher': 'University of Tennessee (System). National Alumni Association', 'dateCreated': ['1929', {'@encoding': 'edtf', '@keyDate': 'yes', '#text': '1929'}]}

	{'place': {'@supplied': 'yes', 'placeTerm': {'@type': 'text', '#text': 'Knoxville (Tenn.)'}}, 'publisher': 'University of Tennessee (System). National Alumni Association', 'dateCreated': ['7/1/1929', {'@encoding': 'edtf', '@keyDate': 'yes', '#text': '1929-07-01'}]}

	{'place': {'@supplied': 'yes', 'placeTerm': {'@type': 'text', '#text': 'Knoxville (Tenn.)'}}, 'publisher': 'University of Tennessee (System). National Alumni Association', 'dateCreated': ['1940', {'@encoding': 'edtf', '@keyDate': 'yes', '#text': '1940'}]}

	{'place': {'@supplied': 'yes', 'placeTerm': {'@type': 'text', '#text': 'Knoxville (Tenn.)'}}, 'publisher': 'University of Tennessee (System). National Alumni Association', 'dateCreated': ['5/1/1940', {'@encoding': 'edtf', '@keyDate': 'yes', '#text': '1940-05-01'}]}

	{'place': {'@supplied': 'yes', 'placeTerm': {'@type': 'text', '#text': 'Knoxville (Tenn.)'}}, 'publisher': 'University of Tennessee (System). National Alumni Association', 'dateCreated': ['2/1/1941', {'@encoding': 'edtf', '@keyDate': 'yes', '#text': '1941-02-01'}]}

	{'place': {'@supplied': 'yes', 'placeTerm': {'@type': 'text', '#text': 'Knoxville (Tenn.)'}}, 'publisher': 'University of Tennessee (System). National Alumni Association', 'dateCreated': ['1941', {'@encoding': 'edtf', '@keyDate': 'yes', '#text': '1941'}]}

	{'place': {'@supplied': 'yes', 'placeTerm': {'@type': 'text', '#text': 'Knoxville (Tenn.)'}}, 'publisher': 'University of Tennessee (System). National Alumni Association', 'dateCreated': ['1942', {'@encoding': 'edtf', '@keyDate': 'yes', '#text': '1942'}]}

	{'place': {'@supplied': 'yes', 'placeTerm': {'@type': 'text', '#text': 'Knoxville (Tenn.)'}}, 'publisher': 'University of Tennessee (System). National Alumni Association', 'dateCreated': ['7/1/1942', {'@encoding': 'edtf', '@keyDate': 'yes', '#text': '1942-07-01'}]}

	{'place': {'@supplied': 'yes', 'placeTerm': {'@type': 'text', '#text': 'Knoxville (Tenn.)'}}, 'publisher': 'University of Tennessee (System). National Alumni Association', 'dateCreated': ['1943', {'@encoding': 'edtf', '@keyDate': 'yes', '#text': '1943'}]}

	{'place': {'@supplied': 'yes', 'placeTerm': {'@type': 'text', '#text': 'Knoxville (Tenn.)'}}, 'publisher': 'University of Tennessee (System). National Alumni Association', 'dateCreated': ['7/1/1943', {'@encoding': 'edtf', '@keyDate': 'yes', '#text': '1943-07-01'}]}

	{'place': {'@supplied': 'yes', 'placeTerm': {'@type': 'text', '#text': 'Knoxville (Tenn.)'}}, 'publisher': 'University of Tennessee (System). National Alumni Association', 'dateCreated': ['1944', {'@encoding': 'edtf', '@keyDate': 'yes', '#text': '1944'}]}

	{'place': {'@supplied': 'yes', 'placeTerm': {'@type': 'text', '#text': 'Knoxville (Tenn.)'}}, 'publisher': 'University of Tennessee (System). National Alumni Association', 'dateCreated': ['1944 Summer', {'@encoding': 'edtf', '@keyDate': 'yes', '#text': '1944-22'}]}

	{'place': {'@supplied': 'yes', 'placeTerm': {'@type': 'text', '#text': 'Knoxville (Tenn.)'}}, 'publisher': 'University of Tennessee (System). National Alumni Association', 'dateCreated': ['1945', {'@encoding': 'edtf', '@keyDate': 'yes', '#text': '1945'}]}

	{'place': {'@supplied': 'yes', 'placeTerm': {'@type': 'text', '#text': 'Knoxville (Tenn.)'}}, 'publisher': 'University of Tennessee (System). National Alumni Association', 'dateCreated': ['1945 Summer', {'@encoding': 'edtf', '@keyDate': 'yes', '#text': '1945-22'}]}

	{'place': {'@supplied': 'yes', 'placeTerm': {'@type': 'text', '#text': 'Knoxville (Tenn.)'}}, 'publisher': 'University of Tennessee (System). National Alumni Association', 'dateCreated': ['1946', {'@encoding': 'edtf', '@keyDate': 'yes', '#text': '1946'}]}

	{'place': {'@supplied': 'yes', 'placeTerm': {'@type': 'text', '#text': 'Knoxville (Tenn.)'}}, 'publisher': 'University of Tennessee (System). National Alumni Association', 'dateCreated': ['1946 Spring', {'@encoding': 'edtf', '@keyDate': 'yes', '#text': '1946-21'}]}

	{'place': {'@supplied': 'yes', 'placeTerm': {'@type': 'text', '#text': 'Knoxville (Tenn.)'}}, 'publisher': 'University of Tennessee (System). National Alumni Association', 'dateCreated': ['1946 Summer', {'@encoding': 'edtf', '@keyDate': 'yes', '#text': '1946-22'}]}

	{'place': {'@supplied': 'yes', 'placeTerm': {'@type': 'text', '#text': 'Knoxville (Tenn.)'}}, 'publisher': 'University of Tennessee (System). National Alumni Association', 'dateCreated': ['1946 Autumn', {'@encoding': 'edtf', '@keyDate': 'yes', '#text': '1946-23'}]}

	{'place': {'@supplied': 'yes', 'placeTerm': {'@type': 'text', '#text': 'Knoxville (Tenn.)'}}, 'publisher': 'University of Tennessee (System). National Alumni Association', 'dateCreated': ['1947', {'@encoding': 'edtf', '@keyDate': 'yes', '#text': '1947'}]}

	{'place': {'@supplied': 'yes', 'placeTerm': {'@type': 'text', '#text': 'Knoxville (Tenn.)'}}, 'publisher': 'University of Tennessee (System). National Alumni Association', 'dateCreated': ['6/1/1947', {'@encoding': 'edtf', '@keyDate': 'yes', '#text': '1947-06-01'}]}

	{'place': {'@supplied': 'yes', 'placeTerm': {'@type': 'text', '#text': 'Knoxville (Tenn.)'}}, 'publisher': 'University of Tennessee (System). National Alumni Association', 'dateCreated': ['1948 Spring', {'@encoding': 'edtf', '@keyDate': 'yes', '#text': '1948-21'}]}

	{'place': {'@supplied': 'yes', 'placeTerm': {'@type': 'text', '#text': 'Knoxville (Tenn.)'}}, 'publisher': 'University of Tennessee (System). National Alumni Association', 'dateCreated': ['1948', {'@encoding': 'edtf', '@keyDate': 'yes', '#text': '1948'}]}

	{'place': {'@supplied': 'yes', 'placeTerm': {'@type': 'text', '#text': 'Knoxville (Tenn.)'}}, 'publisher': 'University of Tennessee (System). National Alumni Association', 'dateCreated': ['1949 Winter', {'@encoding': 'edtf', '@keyDate': 'yes', '#text': '1949-24'}]}

	{'place': {'@supplied': 'yes', 'placeTerm': {'@type': 'text', '#text': 'Knoxville (Tenn.)'}}, 'publisher': 'University of Tennessee (System). National Alumni Association', 'dateCreated': ['1949', {'@encoding': 'edtf', '@keyDate': 'yes', '#text': '1949'}]}

	{'place': {'@supplied': 'yes', 'placeTerm': {'@type': 'text', '#text': 'Knoxville (Tenn.)'}}, 'publisher': 'University of Tennessee (System). National Alumni Association', 'dateCreated': ['1949 Autumn-1950 Winter', {'@encoding': 'edtf', '@keyDate': 'yes', '#text': '1949-23'}]}

	{'place': {'@supplied': 'yes', 'placeTerm': {'@type': 'text', '#text': 'Knoxville (Tenn.)'}}, 'publisher': 'University of Tennessee (System). National Alumni Association', 'dateCreated': ['1950', {'@encoding': 'edtf', '@keyDate': 'yes', '#text': '1950'}]}

	{'place': {'@supplied': 'yes', 'placeTerm': {'@type': 'text', '#text': 'Knoxville (Tenn.)'}}, 'publisher': 'University of Tennessee (System). National Alumni Association', 'dateCreated': ['1951 Winter', {'@encoding': 'edtf', '@keyDate': 'yes', '#text': '1951-24'}]}

	{'place': {'@supplied': 'yes', 'placeTerm': {'@type': 'text', '#text': 'Knoxville (Tenn.)'}}, 'publisher': 'University of Tennessee (System). National Alumni Association', 'dateCreated': ['1951', {'@encoding': 'edtf', '@keyDate': 'yes', '#text': '1951'}]}

	{'place': {'@supplied': 'yes', 'placeTerm': {'@type': 'text', '#text': 'Knoxville (Tenn.)'}}, 'publisher': 'University of Tennessee (System). National Alumni Association', 'dateCreated': ['1952', {'@encoding': 'edtf', '@keyDate': 'yes', '#text': '1952'}]}

	{'place': {'@supplied': 'yes', 'placeTerm': {'@type': 'text', '#text': 'Knoxville (Tenn.)'}}, 'publisher': 'University of Tennessee (System). National Alumni Association', 'dateCreated': ['1952 Summer', {'@encoding': 'edtf', '@keyDate': 'yes', '#text': '1952-22'}]}

	{'place': {'@supplied': 'yes', 'placeTerm': {'@type': 'text', '#text': 'Knoxville (Tenn.)'}}, 'publisher': 'University of Tennessee (System). National Alumni Association', 'dateCreated': ['1952 Autumn', {'@encoding': 'edtf', '@keyDate': 'yes', '#text': '1952-23'}]}

	{'place': {'@supplied': 'yes', 'placeTerm': {'@type': 'text', '#text': 'Knoxville (Tenn.)'}}, 'publisher': 'University of Tennessee (System). National Alumni Association', 'dateCreated': ['1952 Winter', {'@encoding': 'edtf', '@keyDate': 'yes', '#text': '1952-24'}]}

	{'place': {'@supplied': 'yes', 'placeTerm': {'@type': 'text', '#text': 'Knoxville (Tenn.)'}}, 'publisher': 'University of Tennessee (System). National Alumni Association', 'dateCreated': ['1953 Spring', {'@encoding': 'edtf', '@keyDate': 'yes', '#text': '1953-21'}]}

	{'place': {'@supplied': 'yes', 'placeTerm': {'@type': 'text', '#text': 'Knoxville (Tenn.)'}}, 'publisher': 'University of Tennessee (System). National Alumni Association', 'dateCreated': ['1953', {'@encoding': 'edtf', '@keyDate': 'yes', '#text': '1953'}]}

	{'place': {'@supplied': 'yes', 'placeTerm': {'@type': 'text', '#text': 'Knoxville (Tenn.)'}}, 'publisher': 'University of Tennessee (System). National Alumni Association', 'dateCreated': ['1954', {'@encoding': 'edtf', '@keyDate': 'yes', '#text': '1954'}]}

	{'place': {'@supplied': 'yes', 'placeTerm': {'@type': 'text', '#text': 'Knoxville (Tenn.)'}}, 'publisher': 'University of Tennessee (System). National Alumni Association', 'dateCreated': ['1954 Summer', {'@encoding': 'edtf', '@keyDate': 'yes', '#text': '1954-22'}]}

	{'place': {'@supplied': 'yes', 'placeTerm': {'@type': 'text', '#text': 'Knoxville (Tenn.)'}}, 'publisher': 'University of Tennessee (System). National Alumni Association', 'dateCreated': ['1954 Winter', {'@encoding': 'edtf', '@keyDate': 'yes', '#text': '1954-24'}]}

	{'place': {'@supplied': 'yes', 'placeTerm': {'@type': 'text', '#text': 'Knoxville (Tenn.)'}}, 'publisher': 'University of Tennessee (System). National Alumni Association', 'dateCreated': ['1955 Spring', {'@encoding': 'edtf', '@keyDate': 'yes', '#text': '1955-21'}]}

	{'place': {'@supplied': 'yes', 'placeTerm': {'@type': 'text', '#text': 'Knoxville (Tenn.)'}}, 'publisher': 'University of Tennessee (System). National Alumni Association', 'dateCreated': ['1955', {'@encoding': 'edtf', '@keyDate': 'yes', '#text': '1955'}]}

	{'place': {'@supplied': 'yes', 'placeTerm': {'@type': 'text', '#text': 'Knoxville (Tenn.)'}}, 'publisher': 'University of Tennessee (System). National Alumni Association', 'dateCreated': ['1956', {'@encoding': 'edtf', '@keyDate': 'yes', '#text': '1956'}]}

	{'place': {'@supplied': 'yes', 'placeTerm': {'@type': 'text', '#text': 'Knoxville (Tenn.)'}}, 'publisher': 'University of Tennessee (System). National Alumni Association', 'dateCreated': ['1957', {'@encoding': 'edtf', '@keyDate': 'yes', '#text': '1957'}]}

	{'place': {'@supplied': 'yes', 'placeTerm': {'@type': 'text', '#text': 'Knoxville (Tenn.)'}}, 'publisher': 'University of Tennessee (System). National Alumni Association', 'dateCreated': ['1957 Summer', {'@encoding': 'edtf', '@keyDate': 'yes', '#text': '1957-22'}]}

	{'place': {'@supplied': 'yes', 'placeTerm': {'@type': 'text', '#text': 'Knoxville (Tenn.)'}}, 'publisher': 'University of Tennessee (System). National Alumni Association', 'dateCreated': ['1957 Autumn', {'@encoding': 'edtf', '@keyDate': 'yes', '#text': '1957-23'}]}

	{'place': {'@supplied': 'yes', 'placeTerm': {'@type': 'text', '#text': 'Knoxville (Tenn.)'}}, 'publisher': 'University of Tennessee (System). National Alumni Association', 'dateCreated': ['1958 Spring', {'@encoding': 'edtf', '@keyDate': 'yes', '#text': '1958-21'}]}

	{'place': {'@supplied': 'yes', 'placeTerm': {'@type': 'text', '#text': 'Knoxville (Tenn.)'}}, 'publisher': 'University of Tennessee (System). National Alumni Association', 'dateCreated': ['1958 Summer', {'@encoding': 'edtf', '@keyDate': 'yes', '#text': '1958-22'}]}

	{'place': {'@supplied': 'yes', 'placeTerm': {'@type': 'text', '#text': 'Knoxville (Tenn.)'}}, 'publisher': 'University of Tennessee (System). National Alumni Association', 'dateCreated': ['1958', {'@encoding': 'edtf', '@keyDate': 'yes', '#text': '1958'}]}

	{'place': {'@supplied': 'yes', 'placeTerm': {'@type': 'text', '#text': 'Knoxville (Tenn.)'}}, 'publisher': 'University of Tennessee (System). National Alumni Association', 'dateCreated': ['1958 Winter', {'@encoding': 'edtf', '@keyDate': 'yes', '#text': '1958-24'}]}

	{'place': {'@supplied': 'yes', 'placeTerm': {'@type': 'text', '#text': 'Knoxville (Tenn.)'}}, 'publisher': 'University of Tennessee (System). National Alumni Association', 'dateCreated': ['1959 Spring', {'@encoding': 'edtf', '@keyDate': 'yes', '#text': '1959-21'}]}

	{'place': {'@supplied': 'yes', 'placeTerm': {'@type': 'text', '#text': 'Knoxville (Tenn.)'}}, 'publisher': 'University of Tennessee (System). National Alumni Association', 'dateCreated': ['1959 Summer', {'@encoding': 'edtf', '@keyDate': 'yes', '#text': '1959-22'}]}

	{'place': {'@supplied': 'yes', 'placeTerm': {'@type': 'text', '#text': 'Knoxville (Tenn.)'}}, 'publisher': 'University of Tennessee (System). National Alumni Association', 'dateCreated': ['1959', {'@encoding': 'edtf', '@keyDate': 'yes', '#text': '1959'}]}

	{'place': {'@supplied': 'yes', 'placeTerm': {'@type': 'text', '#text': 'Knoxville (Tenn.)'}}, 'publisher': 'University of Tennessee (System). National Alumni Association', 'dateCreated': ['1959 Winter', {'@encoding': 'edtf', '@keyDate': 'yes', '#text': '1959-24'}]}

	{'place': {'@supplied': 'yes', 'placeTerm': {'@type': 'text', '#text': 'Knoxville (Tenn.)'}}, 'publisher': 'University of Tennessee (System). National Alumni Association', 'dateCreated': ['1960', {'@encoding': 'edtf', '@keyDate': 'yes', '#text': '1960'}]}

	{'place': {'@supplied': 'yes', 'placeTerm': {'@type': 'text', '#text': 'Knoxville (Tenn.)'}}, 'publisher': 'University of Tennessee (System). National Alumni Association', 'dateCreated': ['1960 Summer', {'@encoding': 'edtf', '@keyDate': 'yes', '#text': '1960-22'}]}

	{'place': {'@supplied': 'yes', 'placeTerm': {'@type': 'text', '#text': 'Knoxville (Tenn.)'}}, 'publisher': 'University of Tennessee (System). National Alumni Association', 'dateCreated': ['1960 Winter', {'@encoding': 'edtf', '@keyDate': 'yes', '#text': '1960-24'}]}

	{'place': {'@supplied': 'yes', 'placeTerm': {'@type': 'text', '#text': 'Knoxville (Tenn.)'}}, 'publisher': 'University of Tennessee (System). National Alumni Association', 'dateCreated': ['1961', {'@encoding': 'edtf', '@keyDate': 'yes', '#text': '1961'}]}

	{'place': {'@supplied': 'yes', 'placeTerm': {'@type': 'text', '#text': 'Knoxville (Tenn.)'}}, 'publisher': 'University of Tennessee (System). National Alumni Association', 'dateCreated': ['1961 Summer', {'@encoding': 'edtf', '@keyDate': 'yes', '#text': '1961-22'}]}

	{'place': {'@supplied': 'yes', 'placeTerm': {'@type': 'text', '#text': 'Knoxville (Tenn.)'}}, 'publisher': 'University of Tennessee (System). National Alumni Association', 'dateCreated': ['1962 Spring', {'@encoding': 'edtf', '@keyDate': 'yes', '#text': '1962-21'}]}

	{'place': {'@supplied': 'yes', 'placeTerm': {'@type': 'text', '#text': 'Knoxville (Tenn.)'}}, 'publisher': 'University of Tennessee (System). National Alumni Association', 'dateCreated': ['1962 Summer', {'@encoding': 'edtf', '@keyDate': 'yes', '#text': '1962-22'}]}

	{'place': {'@supplied': 'yes', 'placeTerm': {'@type': 'text', '#text': 'Knoxville (Tenn.)'}}, 'publisher': 'University of Tennessee (System). National Alumni Association', 'dateCreated': ['1962', {'@encoding': 'edtf', '@keyDate': 'yes', '#text': '1962'}]}

	{'place': {'@supplied': 'yes', 'placeTerm': {'@type': 'text', '#text': 'Knoxville (Tenn.)'}}, 'publisher': 'University of Tennessee (System). National Alumni Association', 'dateCreated': ['1962 Winter', {'@encoding': 'edtf', '@keyDate': 'yes', '#text': '1962-24'}]}

	{'place': {'@supplied': 'yes', 'placeTerm': {'@type': 'text', '#text': 'Knoxville (Tenn.)'}}, 'publisher': 'University of Tennessee (System). National Alumni Association', 'dateCreated': ['1963', {'@encoding': 'edtf', '@keyDate': 'yes', '#text': '1963'}]}

	{'place': {'@supplied': 'yes', 'placeTerm': {'@type': 'text', '#text': 'Knoxville (Tenn.)'}}, 'publisher': 'University of Tennessee (System). National Alumni Association', 'dateCreated': ['1963 Summer', {'@encoding': 'edtf', '@keyDate': 'yes', '#text': '1963-22'}]}

	{'place': {'@supplied': 'yes', 'placeTerm': {'@type': 'text', '#text': 'Knoxville (Tenn.)'}}, 'publisher': 'University of Tennessee (System). National Alumni Association', 'dateCreated': ['1964', {'@encoding': 'edtf', '@keyDate': 'yes', '#text': '1964'}]}

	{'place': {'@supplied': 'yes', 'placeTerm': {'@type': 'text', '#text': 'Knoxville (Tenn.)'}}, 'publisher': 'University of Tennessee (System). National Alumni Association', 'dateCreated': ['1964 Summer', {'@encoding': 'edtf', '@keyDate': 'yes', '#text': '1964-22'}]}

	{'place': {'@supplied': 'yes', 'placeTerm': {'@type': 'text', '#text': 'Knoxville (Tenn.)'}}, 'publisher': 'University of Tennessee (System). National Alumni Association', 'dateCreated': ['1964 Winter', {'@encoding': 'edtf', '@keyDate': 'yes', '#text': '1964-24'}]}

	{'place': {'@supplied': 'yes', 'placeTerm': {'@type': 'text', '#text': 'Knoxville (Tenn.)'}}, 'publisher': 'University of Tennessee (System). National Alumni Association', 'dateCreated': ['1965', {'@encoding': 'edtf', '@keyDate': 'yes', '#text': '1965'}]}

	{'place': {'@supplied': 'yes', 'placeTerm': {'@type': 'text', '#text': 'Knoxville (Tenn.)'}}, 'publisher': 'University of Tennessee (System). National Alumni Association', 'dateCreated': ['1965 Summer', {'@encoding': 'edtf', '@keyDate': 'yes', '#text': '1965-22'}]}

	{'place': {'@supplied': 'yes', 'placeTerm': {'@type': 'text', '#text': 'Knoxville (Tenn.)'}}, 'publisher': 'University of Tennessee (System). National Alumni Association', 'dateCreated': ['2/1/1966', {'@encoding': 'edtf', '@keyDate': 'yes', '#text': '1966-02-01'}]}

	{'place': {'@supplied': 'yes', 'placeTerm': {'@type': 'text', '#text': 'Knoxville (Tenn.)'}}, 'publisher': 'University of Tennessee (System). National Alumni Association', 'dateCreated': ['1966', {'@encoding': 'edtf', '@keyDate': 'yes', '#text': '1966'}]}

	{'place': {'@supplied': 'yes', 'placeTerm': {'@type': 'text', '#text': 'Knoxville (Tenn.)'}}, 'publisher': 'University of Tennessee (System). National Alumni Association', 'dateCreated': ['6/1/1966', {'@encoding': 'edtf', '@keyDate': 'yes', '#text': '1966-06-01'}]}

	{'place': {'@supplied': 'yes', 'placeTerm': {'@type': 'text', '#text': 'Knoxville (Tenn.)'}}, 'publisher': 'University of Tennessee (System). National Alumni Association', 'dateCreated': ['1967', {'@encoding': 'edtf', '@keyDate': 'yes', '#text': '1967'}]}

	{'place': {'@supplied': 'yes', 'placeTerm': {'@type': 'text', '#text': 'Knoxville (Tenn.)'}}, 'publisher': 'University of Tennessee (System). National Alumni Association', 'dateCreated': ['6/1/1967', {'@encoding': 'edtf', '@keyDate': 'yes', '#text': '1967-06-01'}]}

	{'place': {'@supplied': 'yes', 'placeTerm': {'@type': 'text', '#text': 'Knoxville (Tenn.)'}}, 'publisher': 'University of Tennessee (System). National Alumni Association', 'dateCreated': ['1968', {'@encoding': 'edtf', '@keyDate': 'yes', '#text': '1968'}]}

	{'place': {'@supplied': 'yes', 'placeTerm': {'@type': 'text', '#text': 'Knoxville (Tenn.)'}}, 'publisher': 'University of Tennessee (System). National Alumni Association', 'dateCreated': ['6/1/1968', {'@encoding': 'edtf', '@keyDate': 'yes', '#text': '1968-06-01'}]}

	{'place': {'@supplied': 'yes', 'placeTerm': {'@type': 'text', '#text': 'Knoxville (Tenn.)'}}, 'publisher': 'University of Tennessee (System). National Alumni Association', 'dateCreated': ['12/1/1968', {'@encoding': 'edtf', '@keyDate': 'yes', '#text': '1968-12-01'}]}

	{'place': {'@supplied': 'yes', 'placeTerm': {'@type': 'text', '#text': 'Knoxville (Tenn.)'}}, 'publisher': 'University of Tennessee (System). National Alumni Association', 'dateCreated': ['1969', {'@encoding': 'edtf', '@keyDate': 'yes', '#text': '1969'}]}

	{'place': {'@supplied': 'yes', 'placeTerm': {'@type': 'text', '#text': 'Knoxville (Tenn.)'}}, 'publisher': 'University of Tennessee (System). National Alumni Association', 'dateCreated': ['4/1/1969', {'@encoding': 'edtf', '@keyDate': 'yes', '#text': '1969-04-01'}]}

	{'place': {'@supplied': 'yes', 'placeTerm': {'@type': 'text', '#text': 'Knoxville (Tenn.)'}}, 'publisher': 'University of Tennessee (System). National Alumni Association', 'dateCreated': ['6/1/1969', {'@encoding': 'edtf', '@keyDate': 'yes', '#text': '1969-06-01'}]}

	{'place': {'@supplied': 'yes', 'placeTerm': {'@type': 'text', '#text': 'Knoxville (Tenn.)'}}, 'publisher': 'University of Tennessee (System). National Alumni Association', 'dateCreated': ['2/1/1970', {'@encoding': 'edtf', '@keyDate': 'yes', '#text': '1970-02-01'}]}

	{'place': {'@supplied': 'yes', 'placeTerm': {'@type': 'text', '#text': 'Knoxville (Tenn.)'}}, 'publisher': 'University of Tennessee (System). National Alumni Association', 'dateCreated': ['4/1/1970', {'@encoding': 'edtf', '@keyDate': 'yes', '#text': '1970-04-01'}]}

	{'place': {'@supplied': 'yes', 'placeTerm': {'@type': 'text', '#text': 'Knoxville (Tenn.)'}}, 'publisher': 'University of Tennessee (System). National Alumni Association', 'dateCreated': ['6/1/1970', {'@encoding': 'edtf', '@keyDate': 'yes', '#text': '1970-06-01'}]}

	{'place': {'@supplied': 'yes', 'placeTerm': {'@type': 'text', '#text': 'Knoxville (Tenn.)'}}, 'publisher': 'University of Tennessee (System). National Alumni Association', 'dateCreated': ['1970', {'@encoding': 'edtf', '@keyDate': 'yes', '#text': '1970'}]}

	{'place': {'@supplied': 'yes', 'placeTerm': {'@type': 'text', '#text': 'Knoxville (Tenn.)'}}, 'publisher': 'University of Tennessee (System). National Alumni Association', 'dateCreated': ['12/1/1970', {'@encoding': 'edtf', '@keyDate': 'yes', '#text': '1970-12-01'}]}

	{'place': {'@supplied': 'yes', 'placeTerm': {'@type': 'text', '#text': 'Knoxville (Tenn.)'}}, 'publisher': 'University of Tennessee (System). National Alumni Association', 'dateCreated': ['2/1/1971', {'@encoding': 'edtf', '@keyDate': 'yes', '#text': '1971-02-01'}]}

	{'place': {'@supplied': 'yes', 'placeTerm': {'@type': 'text', '#text': 'Knoxville (Tenn.)'}}, 'publisher': 'University of Tennessee (System). National Alumni Association', 'dateCreated': ['1971', {'@encoding': 'edtf', '@keyDate': 'yes', '#text': '1971'}]}

	{'place': {'@supplied': 'yes', 'placeTerm': {'@type': 'text', '#text': 'Knoxville (Tenn.)'}}, 'publisher': 'University of Tennessee (System). National Alumni Association', 'dateCreated': ['10/1/1971', {'@encoding': 'edtf', '@keyDate': 'yes', '#text': '1971-10-01'}]}

	{'place': {'@supplied': 'yes', 'placeTerm': {'@type': 'text', '#text': 'Knoxville (Tenn.)'}}, 'publisher': 'University of Tennessee (System). National Alumni Association', 'dateCreated': ['1972', {'@encoding': 'edtf', '@keyDate': 'yes', '#text': '1972'}]}

	{'place': {'@supplied': 'yes', 'placeTerm': {'@type': 'text', '#text': 'Knoxville (Tenn.)'}}, 'publisher': 'University of Tennessee (System). National Alumni Association', 'dateCreated': ['6/1/1972', {'@encoding': 'edtf', '@keyDate': 'yes', '#text': '1972-06-01'}]}

	{'place': {'@supplied': 'yes', 'placeTerm': {'@type': 'text', '#text': 'Knoxville (Tenn.)'}}, 'publisher': 'University of Tennessee (System). National Alumni Association', 'dateCreated': ['2/1/1973', {'@encoding': 'edtf', '@keyDate': 'yes', '#text': '1973-02-01'}]}

	{'place': {'@supplied': 'yes', 'placeTerm': {'@type': 'text', '#text': 'Knoxville (Tenn.)'}}, 'publisher': 'University of Tennessee (System). National Alumni Association', 'dateCreated': ['4/1/1973', {'@encoding': 'edtf', '@keyDate': 'yes', '#text': '1973-04-01'}]}

	{'place': {'@supplied': 'yes', 'placeTerm': {'@type': 'text', '#text': 'Knoxville (Tenn.)'}}, 'publisher': 'University of Tennessee (System). National Alumni Association', 'dateCreated': ['1973', {'@encoding': 'edtf', '@keyDate': 'yes', '#text': '1973'}]}

	{'place': {'@supplied': 'yes', 'placeTerm': {'@type': 'text', '#text': 'Knoxville (Tenn.)'}}, 'publisher': 'University of Tennessee (System). National Alumni Association', 'dateCreated': ['10/1/1973', {'@encoding': 'edtf', '@keyDate': 'yes', '#text': '1973-10-01'}]}

	{'place': {'@supplied': 'yes', 'placeTerm': {'@type': 'text', '#text': 'Knoxville (Tenn.)'}}, 'publisher': 'University of Tennessee (System). National Alumni Association', 'dateCreated': ['1974', {'@encoding': 'edtf', '@keyDate': 'yes', '#text': '1974'}]}

	{'place': {'@supplied': 'yes', 'placeTerm': {'@type': 'text', '#text': 'Knoxville (Tenn.)'}}, 'publisher': 'University of Tennessee (System). National Alumni Association', 'dateCreated': ['1974 Summer', {'@encoding': 'edtf', '@keyDate': 'yes', '#text': '1974-22'}]}

	{'place': {'@supplied': 'yes', 'placeTerm': {'@type': 'text', '#text': 'Knoxville (Tenn.)'}}, 'publisher': 'University of Tennessee (System). National Alumni Association', 'dateCreated': ['1975', {'@encoding': 'edtf', '@keyDate': 'yes', '#text': '1975'}]}

	{'place': {'@supplied': 'yes', 'placeTerm': {'@type': 'text', '#text': 'Knoxville (Tenn.)'}}, 'publisher': 'University of Tennessee (System). National Alumni Association', 'dateCreated': ['1975 Autumn', {'@encoding': 'edtf', '@keyDate': 'yes', '#text': '1975-23'}]}

	{'place': {'@supplied': 'yes', 'placeTerm': {'@type': 'text', '#text': 'Knoxville (Tenn.)'}}, 'publisher': 'University of Tennessee (System). National Alumni Association', 'dateCreated': ['1976', {'@encoding': 'edtf', '@keyDate': 'yes', '#text': '1976'}]}

	{'place': {'@supplied': 'yes', 'placeTerm': {'@type': 'text', '#text': 'Knoxville (Tenn.)'}}, 'publisher': 'University of Tennessee (System). National Alumni Association', 'dateCreated': ['1977', {'@encoding': 'edtf', '@keyDate': 'yes', '#text': '1977'}]}

	{'place': {'@supplied': 'yes', 'placeTerm': {'@type': 'text', '#text': 'Knoxville (Tenn.)'}}, 'publisher': 'University of Tennessee (System). National Alumni Association', 'dateCreated': ['1977 Spring', {'@encoding': 'edtf', '@keyDate': 'yes', '#text': '1977-21'}]}

	{'place': {'@supplied': 'yes', 'placeTerm': {'@type': 'text', '#text': 'Knoxville (Tenn.)'}}, 'publisher': 'University of Tennessee (System). National Alumni Association', 'dateCreated': ['1977 Summer', {'@encoding': 'edtf', '@keyDate': 'yes', '#text': '1977-22'}]}

	{'place': {'@supplied': 'yes', 'placeTerm': {'@type': 'text', '#text': 'Knoxville (Tenn.)'}}, 'publisher': 'University of Tennessee (System). National Alumni Association', 'dateCreated': ['1978 Winter', {'@encoding': 'edtf', '@keyDate': 'yes', '#text': '1978-24'}]}

	{'place': {'@supplied': 'yes', 'placeTerm': {'@type': 'text', '#text': 'Knoxville (Tenn.)'}}, 'publisher': 'University of Tennessee (System). National Alumni Association', 'dateCreated': ['1978', {'@encoding': 'edtf', '@keyDate': 'yes', '#text': '1978'}]}

	{'place': {'@supplied': 'yes', 'placeTerm': {'@type': 'text', '#text': 'Knoxville (Tenn.)'}}, 'publisher': 'University of Tennessee (System). National Alumni Association', 'dateCreated': ['1978 Summer', {'@encoding': 'edtf', '@keyDate': 'yes', '#text': '1978-22'}]}

	{'place': {'@supplied': 'yes', 'placeTerm': {'@type': 'text', '#text': 'Knoxville (Tenn.)'}}, 'publisher': 'University of Tennessee (System). National Alumni Association', 'dateCreated': ['1979', {'@encoding': 'edtf', '@keyDate': 'yes', '#text': '1979'}]}

	{'place': {'@supplied': 'yes', 'placeTerm': {'@type': 'text', '#text': 'Knoxville (Tenn.)'}}, 'publisher': 'University of Tennessee (System). National Alumni Association', 'dateCreated': ['1980', {'@encoding': 'edtf', '@keyDate': 'yes', '#text': '1980'}]}

	{'place': {'@supplied': 'yes', 'placeTerm': {'@type': 'text', '#text': 'Knoxville (Tenn.)'}}, 'publisher': 'University of Tennessee (System). National Alumni Association', 'dateCreated': ['1981 Winter', {'@encoding': 'edtf', '@keyDate': 'yes', '#text': '1981-24'}]}

	{'place': {'@supplied': 'yes', 'placeTerm': {'@type': 'text', '#text': 'Knoxville (Tenn.)'}}, 'publisher': 'University of Tennessee (System). National Alumni Association', 'dateCreated': ['1981 Spring', {'@encoding': 'edtf', '@keyDate': 'yes', '#text': '1981-21'}]}

	{'place': {'@supplied': 'yes', 'placeTerm': {'@type': 'text', '#text': 'Knoxville (Tenn.)'}}, 'publisher': 'University of Tennessee (System). National Alumni Association', 'dateCreated': ['1981', {'@encoding': 'edtf', '@keyDate': 'yes', '#text': '1981'}]}

	{'place': {'@supplied': 'yes', 'placeTerm': {'@type': 'text', '#text': 'Knoxville (Tenn.)'}}, 'publisher': 'University of Tennessee (System). National Alumni Association', 'dateCreated': ['1981 Autumn', {'@encoding': 'edtf', '@keyDate': 'yes', '#text': '1981-23'}]}

	{'place': {'@supplied': 'yes', 'placeTerm': {'@type': 'text', '#text': 'Knoxville (Tenn.)'}}, 'publisher': 'University of Tennessee (System). National Alumni Association', 'dateCreated': ['1982', {'@encoding': 'edtf', '@keyDate': 'yes', '#text': '1982'}]}

	{'place': {'@supplied': 'yes', 'placeTerm': {'@type': 'text', '#text': 'Knoxville (Tenn.)'}}, 'publisher': 'University of Tennessee (System). National Alumni Association', 'dateCreated': ['1983', {'@encoding': 'edtf', '@keyDate': 'yes', '#text': '1983'}]}

	{'place': {'@supplied': 'yes', 'placeTerm': {'@type': 'text', '#text': 'Knoxville (Tenn.)'}}, 'publisher': 'University of Tennessee (System). National Alumni Association', 'dateCreated': ['1983 Spring', {'@encoding': 'edtf', '@keyDate': 'yes', '#text': '1983-21'}]}

	{'place': {'@supplied': 'yes', 'placeTerm': {'@type': 'text', '#text': 'Knoxville (Tenn.)'}}, 'publisher': 'University of Tennessee (System). National Alumni Association', 'dateCreated': ['1983 Autumn', {'@encoding': 'edtf', '@keyDate': 'yes', '#text': '1983-23'}]}

	{'place': {'@supplied': 'yes', 'placeTerm': {'@type': 'text', '#text': 'Knoxville (Tenn.)'}}, 'publisher': 'University of Tennessee (System). National Alumni Association', 'dateCreated': ['1984', {'@encoding': 'edtf', '@keyDate': 'yes', '#text': '1984'}]}

	{'place': {'@supplied': 'yes', 'placeTerm': {'@type': 'text', '#text': 'Knoxville (Tenn.)'}}, 'publisher': 'University of Tennessee (System). National Alumni Association', 'dateCreated': ['1984 Summer', {'@encoding': 'edtf', '@keyDate': 'yes', '#text': '1984-22'}]}

	{'place': {'@supplied': 'yes', 'placeTerm': {'@type': 'text', '#text': 'Knoxville (Tenn.)'}}, 'publisher': 'University of Tennessee (System). National Alumni Association', 'dateCreated': ['1984 Autumn', {'@encoding': 'edtf', '@keyDate': 'yes', '#text': '1984-23'}]}

	{'place': {'@supplied': 'yes', 'placeTerm': {'@type': 'text', '#text': 'Knoxville (Tenn.)'}}, 'publisher': 'University of Tennessee (System). National Alumni Association', 'dateCreated': ['1985', {'@encoding': 'edtf', '@keyDate': 'yes', '#text': '1985'}]}

	{'place': {'@supplied': 'yes', 'placeTerm': {'@type': 'text', '#text': 'Knoxville (Tenn.)'}}, 'publisher': 'University of Tennessee (System). National Alumni Association', 'dateCreated': ['1985 Spring', {'@encoding': 'edtf', '@keyDate': 'yes', '#text': '1985-21'}]}

	{'place': {'@supplied': 'yes', 'placeTerm': {'@type': 'text', '#text': 'Knoxville (Tenn.)'}}, 'publisher': 'University of Tennessee (System). National Alumni Association', 'dateCreated': ['1985 Summer', {'@encoding': 'edtf', '@keyDate': 'yes', '#text': '1985-22'}]}

	{'place': {'@supplied': 'yes', 'placeTerm': {'@type': 'text', '#text': 'Knoxville (Tenn.)'}}, 'publisher': 'University of Tennessee (System). National Alumni Association', 'dateCreated': ['1986', {'@encoding': 'edtf', '@keyDate': 'yes', '#text': '1986'}]}

	{'place': {'@supplied': 'yes', 'placeTerm': {'@type': 'text', '#text': 'Knoxville (Tenn.)'}}, 'publisher': 'University of Tennessee (System). National Alumni Association', 'dateCreated': ['1986 Spring', {'@encoding': 'edtf', '@keyDate': 'yes', '#text': '1986-21'}]}

	{'place': {'@supplied': 'yes', 'placeTerm': {'@type': 'text', '#text': 'Knoxville (Tenn.)'}}, 'publisher': 'University of Tennessee (System). National Alumni Association', 'dateCreated': ['1987 Winter', {'@encoding': 'edtf', '@keyDate': 'yes', '#text': '1987-24'}]}

	{'place': {'@supplied': 'yes', 'placeTerm': {'@type': 'text', '#text': 'Knoxville (Tenn.)'}}, 'publisher': 'University of Tennessee (System). National Alumni Association', 'dateCreated': ['1987', {'@encoding': 'edtf', '@keyDate': 'yes', '#text': '1987'}]}

	{'place': {'@supplied': 'yes', 'placeTerm': {'@type': 'text', '#text': 'Knoxville (Tenn.)'}}, 'publisher': 'University of Tennessee (System). National Alumni Association', 'dateCreated': ['1988 Winter', {'@encoding': 'edtf', '@keyDate': 'yes', '#text': '1988-24'}]}

	{'place': {'@supplied': 'yes', 'placeTerm': {'@type': 'text', '#text': 'Knoxville (Tenn.)'}}, 'publisher': 'University of Tennessee (System). National Alumni Association', 'dateCreated': ['1988', {'@encoding': 'edtf', '@keyDate': 'yes', '#text': '1988'}]}

	{'place': {'@supplied': 'yes', 'placeTerm': {'@type': 'text', '#text': 'Knoxville (Tenn.)'}}, 'publisher': 'University of Tennessee (System). National Alumni Association', 'dateCreated': ['1989', {'@encoding': 'edtf', '@keyDate': 'yes', '#text': '1989'}]}

	{'place': {'@supplied': 'yes', 'placeTerm': {'@type': 'text', '#text': 'Knoxville (Tenn.)'}}, 'publisher': 'University of Tennessee (System). National Alumni Association', 'dateCreated': ['1989 Spring', {'@encoding': 'edtf', '@keyDate': 'yes', '#text': '1989-21'}]}

	{'place': {'@supplied': 'yes', 'placeTerm': {'@type': 'text', '#text': 'Knoxville (Tenn.)'}}, 'publisher': 'University of Tennessee (System). National Alumni Association', 'dateCreated': ['1990', {'@encoding': 'edtf', '@keyDate': 'yes', '#text': '1990'}]}

	{'place': {'@supplied': 'yes', 'placeTerm': {'@type': 'text', '#text': 'Knoxville (Tenn.)'}}, 'publisher': 'University of Tennessee (System). National Alumni Association', 'dateCreated': ['1990 Summer', {'@encoding': 'edtf', '@keyDate': 'yes', '#text': '1990-22'}]}

	{'place': {'@supplied': 'yes', 'placeTerm': {'@type': 'text', '#text': 'Knoxville (Tenn.)'}}, 'publisher': 'University of Tennessee (System). National Alumni Association', 'dateCreated': ['1990 Autumn', {'@encoding': 'edtf', '@keyDate': 'yes', '#text': '1990-23'}]}

	{'place': {'@supplied': 'yes', 'placeTerm': {'@type': 'text', '#text': 'Knoxville (Tenn.)'}}, 'publisher': 'University of Tennessee (System). National Alumni Association', 'dateCreated': ['1991 Winter', {'@encoding': 'edtf', '@keyDate': 'yes', '#text': '1991-24'}]}

	{'place': {'@supplied': 'yes', 'placeTerm': {'@type': 'text', '#text': 'Knoxville (Tenn.)'}}, 'publisher': 'University of Tennessee (System). National Alumni Association', 'dateCreated': ['1991', {'@encoding': 'edtf', '@keyDate': 'yes', '#text': '1991'}]}

	{'place': {'@supplied': 'yes', 'placeTerm': {'@type': 'text', '#text': 'Knoxville (Tenn.)'}}, 'publisher': 'University of Tennessee (System). National Alumni Association', 'dateCreated': ['1992', {'@encoding': 'edtf', '@keyDate': 'yes', '#text': '1992'}]}

	{'place': {'@supplied': 'yes', 'placeTerm': {'@type': 'text', '#text': 'Knoxville (Tenn.)'}}, 'publisher': 'University of Tennessee (System). National Alumni Association', 'dateCreated': ['1992 Spring', {'@encoding': 'edtf', '@keyDate': 'yes', '#text': '1992-21'}]}

	{'place': {'@supplied': 'yes', 'placeTerm': {'@type': 'text', '#text': 'Knoxville (Tenn.)'}}, 'publisher': 'University of Tennessee (System). National Alumni Association', 'dateCreated': ['1993', {'@encoding': 'edtf', '@keyDate': 'yes', '#text': '1993'}]}

	{'place': {'@supplied': 'yes', 'placeTerm': {'@type': 'text', '#text': 'Knoxville (Tenn.)'}}, 'publisher': 'University of Tennessee (System). National Alumni Association', 'dateCreated': ['1993 Spring', {'@encoding': 'edtf', '@keyDate': 'yes', '#text': '1993-21'}]}

	{'place': {'@supplied': 'yes', 'placeTerm': {'@type': 'text', '#text': 'Knoxville (Tenn.)'}}, 'publisher': 'University of Tennessee (System). National Alumni Association', 'dateCreated': ['1994', {'@encoding': 'edtf', '@keyDate': 'yes', '#text': '1994'}]}

	{'place': {'@supplied': 'yes', 'placeTerm': {'@type': 'text', '#text': 'Knoxville (Tenn.)'}}, 'publisher': 'University of Tennessee (System). National Alumni Association', 'dateCreated': ['1994 Autumn', {'@encoding': 'edtf', '@keyDate': 'yes', '#text': '1994-23'}]}

	{'place': {'@supplied': 'yes', 'placeTerm': {'@type': 'text', '#text': 'Knoxville (Tenn.)'}}, 'publisher': 'University of Tennessee (System). National Alumni Association', 'dateCreated': ['1995', {'@encoding': 'edtf', '@keyDate': 'yes', '#text': '1995'}]}

	{'place': {'@supplied': 'yes', 'placeTerm': {'@type': 'text', '#text': 'Knoxville (Tenn.)'}}, 'publisher': 'University of Tennessee (System). National Alumni Association', 'dateCreated': ['1995 Summer', {'@encoding': 'edtf', '@keyDate': 'yes', '#text': '1995-22'}]}

	{'place': {'@supplied': 'yes', 'placeTerm': {'@type': 'text', '#text': 'Knoxville (Tenn.)'}}, 'publisher': 'University of Tennessee (System). National Alumni Association', 'dateCreated': ['1996 Winter', {'@encoding': 'edtf', '@keyDate': 'yes', '#text': '1996-24'}]}

	{'place': {'@supplied': 'yes', 'placeTerm': {'@type': 'text', '#text': 'Knoxville (Tenn.)'}}, 'publisher': 'University of Tennessee (System). National Alumni Association', 'dateCreated': ['1996', {'@encoding': 'edtf', '@keyDate': 'yes', '#text': '1996'}]}

	{'place': {'@supplied': 'yes', 'placeTerm': {'@type': 'text', '#text': 'Knoxville (Tenn.)'}}, 'publisher': 'University of Tennessee (System). National Alumni Association', 'dateCreated': ['1996 Autumn', {'@encoding': 'edtf', '@keyDate': 'yes', '#text': '1996-23'}]}

	{'place': {'@supplied': 'yes', 'placeTerm': {'@type': 'text', '#text': 'Knoxville (Tenn.)'}}, 'publisher': 'University of Tennessee (System). National Alumni Association', 'dateCreated': ['1997', {'@encoding': 'edtf', '@keyDate': 'yes', '#text': '1997'}]}

	{'place': {'@supplied': 'yes', 'placeTerm': {'@type': 'text', '#text': 'Knoxville (Tenn.)'}}, 'publisher': 'University of Tennessee (System). National Alumni Association', 'dateCreated': ['1997 Autumn', {'@encoding': 'edtf', '@keyDate': 'yes', '#text': '1997-23'}]}

	{'place': {'@supplied': 'yes', 'placeTerm': {'@type': 'text', '#text': 'Knoxville (Tenn.)'}}, 'publisher': 'University of Tennessee (System). National Alumni Association', 'dateCreated': ['1998', {'@encoding': 'edtf', '@keyDate': 'yes', '#text': '1998'}]}

	{'place': {'@supplied': 'yes', 'placeTerm': {'@type': 'text', '#text': 'Knoxville (Tenn.)'}}, 'publisher': 'University of Tennessee (System). National Alumni Association', 'dateCreated': ['1998 Spring', {'@encoding': 'edtf', '@keyDate': 'yes', '#text': '1998-21'}]}

	{'place': {'@supplied': 'yes', 'placeTerm': {'@type': 'text', '#text': 'Knoxville (Tenn.)'}}, 'publisher': 'University of Tennessee (System). National Alumni Association', 'dateCreated': ['1998 Autumn', {'@encoding': 'edtf', '@keyDate': 'yes', '#text': '1998-23'}]}

	{'place': {'@supplied': 'yes', 'placeTerm': {'@type': 'text', '#text': 'Knoxville (Tenn.)'}}, 'publisher': 'University of Tennessee (System). National Alumni Association', 'dateCreated': ['1999', {'@encoding': 'edtf', '@keyDate': 'yes', '#text': '1999'}]}

	{'place': {'@supplied': 'yes', 'placeTerm': {'@type': 'text', '#text': 'Knoxville (Tenn.)'}}, 'publisher': 'University of Tennessee (System). National Alumni Association', 'dateCreated': ['1999 Autumn', {'@encoding': 'edtf', '@keyDate': 'yes', '#text': '1999-23'}]}

	{'place': {'@supplied': 'yes', 'placeTerm': {'@type': 'text', '#text': 'Knoxville (Tenn.)'}}, 'publisher': 'University of Tennessee (System). National Alumni Association', 'dateCreated': ['2000', {'@encoding': 'edtf', '@keyDate': 'yes', '#text': '2000'}]}

	{'place': {'@supplied': 'yes', 'placeTerm': {'@type': 'text', '#text': 'Knoxville (Tenn.)'}}, 'publisher': 'University of Tennessee (System). National Alumni Association', 'dateCreated': ['2000 Spring', {'@encoding': 'edtf', '@keyDate': 'yes', '#text': '2000-21'}]}

	{'place': {'@supplied': 'yes', 'placeTerm': {'@type': 'text', '#text': 'Knoxville (Tenn.)'}}, 'publisher': 'University of Tennessee (System). National Alumni Association', 'dateCreated': ['2001 Winter', {'@encoding': 'edtf', '@keyDate': 'yes', '#text': '2001-24'}]}

	{'place': {'@supplied': 'yes', 'placeTerm': {'@type': 'text', '#text': 'Knoxville (Tenn.)'}}, 'publisher': 'University of Tennessee (System). National Alumni Association', 'dateCreated': ['2001 Spring', {'@encoding': 'edtf', '@keyDate': 'yes', '#text': '2001-21'}]}

	{'place': {'@supplied': 'yes', 'placeTerm': {'@type': 'text', '#text': 'Knoxville (Tenn.)'}}, 'publisher': 'University of Tennessee (System). National Alumni Association', 'dateCreated': ['2001 Summer', {'@encoding': 'edtf', '@keyDate': 'yes', '#text': '2001-22'}]}

	{'place': {'@supplied': 'yes', 'placeTerm': {'@type': 'text', '#text': 'Knoxville (Tenn.)'}}, 'publisher': 'University of Tennessee (System). National Alumni Association', 'dateCreated': ['2001', {'@encoding': 'edtf', '@keyDate': 'yes', '#text': '2001'}]}

	{'place': {'@supplied': 'yes', 'placeTerm': {'@type': 'text', '#text': 'Knoxville (Tenn.)'}}, 'publisher': 'University of Tennessee (System). National Alumni Association', 'dateCreated': ['2002 Winter', {'@encoding': 'edtf', '@keyDate': 'yes', '#text': '2002-24'}]}

	{'place': {'@supplied': 'yes', 'placeTerm': {'@type': 'text', '#text': 'Knoxville (Tenn.)'}}, 'publisher': 'University of Tennessee (System). National Alumni Association', 'dateCreated': ['2002 Spring', {'@encoding': 'edtf', '@keyDate': 'yes', '#text': '2002-21'}]}

	{'place': {'@supplied': 'yes', 'placeTerm': {'@type': 'text', '#text': 'Knoxville (Tenn.)'}}, 'publisher': 'University of Tennessee (System). National Alumni Association', 'dateCreated': ['2002', {'@encoding': 'edtf', '@keyDate': 'yes', '#text': '2002'}]}

	{'place': {'@supplied': 'yes', 'placeTerm': {'@type': 'text', '#text': 'Knoxville (Tenn.)'}}, 'publisher': 'University of Tennessee (System). National Alumni Association', 'dateCreated': ['2003 Winter', {'@encoding': 'edtf', '@keyDate': 'yes', '#text': '2003-24'}]}

	{'place': {'@supplied': 'yes', 'placeTerm': {'@type': 'text', '#text': 'Knoxville (Tenn.)'}}, 'publisher': 'University of Tennessee (System). National Alumni Association', 'dateCreated': ['2003', {'@encoding': 'edtf', '@keyDate': 'yes', '#text': '2003'}]}

	{'place': {'@supplied': 'yes', 'placeTerm': {'@type': 'text', '#text': 'Knoxville (Tenn.)'}}, 'publisher': 'University of Tennessee (System). National Alumni Association', 'dateCreated': ['2003 Summer', {'@encoding': 'edtf', '@keyDate': 'yes', '#text': '2003-22'}]}

	{'place': {'@supplied': 'yes', 'placeTerm': {'@type': 'text', '#text': 'Knoxville (Tenn.)'}}, 'publisher': 'University of Tennessee (System). National Alumni Association', 'dateCreated': ['2003 Autumn', {'@encoding': 'edtf', '@keyDate': 'yes', '#text': '2003-23'}]}

	{'place': {'@supplied': 'yes', 'placeTerm': {'@type': 'text', '#text': 'Knoxville (Tenn.)'}}, 'publisher': 'University of Tennessee (System). National Alumni Association', 'dateCreated': ['2004', {'@encoding': 'edtf', '@keyDate': 'yes', '#text': '2004'}]}

	{'place': {'@supplied': 'yes', 'placeTerm': {'@type': 'text', '#text': 'Knoxville (Tenn.)'}}, 'publisher': 'University of Tennessee (System). National Alumni Association', 'dateCreated': ['2005 Winter', {'@encoding': 'edtf', '@keyDate': 'yes', '#text': '2005-24'}]}

	{'place': {'@supplied': 'yes', 'placeTerm': {'@type': 'text', '#text': 'Knoxville (Tenn.)'}}, 'publisher': 'University of Tennessee (System). National Alumni Association', 'dateCreated': ['2005', {'@encoding': 'edtf', '@keyDate': 'yes', '#text': '2005'}]}

	{'place': {'@supplied': 'yes', 'placeTerm': {'@type': 'text', '#text': 'Knoxville (Tenn.)'}}, 'publisher': 'University of Tennessee (System). National Alumni Association', 'dateCreated': ['2005 Summer', {'@encoding': 'edtf', '@keyDate': 'yes', '#text': '2005-22'}]}

	{'place': {'@supplied': 'yes', 'placeTerm': {'@type': 'text', '#text': 'Knoxville (Tenn.)'}}, 'publisher': 'University of Tennessee (System). National Alumni Association', 'dateCreated': ['2005 Autumn', {'@encoding': 'edtf', '@keyDate': 'yes', '#text': '2005-23'}]}

	{'place': {'@supplied': 'yes', 'placeTerm': {'@type': 'text', '#text': 'Knoxville (Tenn.)'}}, 'publisher': 'University of Tennessee (System). National Alumni Association', 'dateCreated': ['2006', {'@encoding': 'edtf', '@keyDate': 'yes', '#text': '2006'}]}

	{'place': {'@supplied': 'yes', 'placeTerm': {'@type': 'text', '#text': 'Knoxville (Tenn.)'}}, 'publisher': 'University of Tennessee (System). National Alumni Association', 'dateCreated': ['2006 Summer', {'@encoding': 'edtf', '@keyDate': 'yes', '#text': '2006-22'}]}

	{'place': {'@supplied': 'yes', 'placeTerm': {'@type': 'text', '#text': 'Knoxville (Tenn.)'}}, 'publisher': 'University of Tennessee (System). National Alumni Association', 'dateCreated': ['2006 Autumn', {'@encoding': 'edtf', '@keyDate': 'yes', '#text': '2006-23'}]}

	{'place': {'@supplied': 'yes', 'placeTerm': {'@type': 'text', '#text': 'Knoxville (Tenn.)'}}, 'publisher': 'University of Tennessee (System). National Alumni Association', 'dateCreated': ['2007', {'@encoding': 'edtf', '@keyDate': 'yes', '#text': '2007'}]}

	{'place': {'@supplied': 'yes', 'placeTerm': {'@type': 'text', '#text': 'Knoxville (Tenn.)'}}, 'publisher': 'University of Tennessee (System). National Alumni Association', 'dateCreated': ['2007 Autumn', {'@encoding': 'edtf', '@keyDate': 'yes', '#text': '2007-23'}]}

	{'place': {'@supplied': 'yes', 'placeTerm': {'@type': 'text', '#text': 'Knoxville (Tenn.)'}}, 'publisher': 'University of Tennessee (System). National Alumni Association', 'dateCreated': ['2008', {'@encoding': 'edtf', '@keyDate': 'yes', '#text': '2008'}]}

	{'place': {'@supplied': 'yes', 'placeTerm': {'@type': 'text', '#text': 'Knoxville (Tenn.)'}}, 'publisher': 'University of Tennessee (System). National Alumni Association', 'dateCreated': ['2008 Summer', {'@encoding': 'edtf', '@keyDate': 'yes', '#text': '2008-22'}]}

	{'place': {'@supplied': 'yes', 'placeTerm': {'@type': 'text', '#text': 'Knoxville (Tenn.)'}}, 'publisher': 'University of Tennessee (System). National Alumni Association', 'dateCreated': ['2008 Autumn', {'@encoding': 'edtf', '@keyDate': 'yes', '#text': '2008-23'}]}

	{'place': {'@supplied': 'yes', 'placeTerm': {'@type': 'text', '#text': 'Knoxville (Tenn.)'}}, 'publisher': 'University of Tennessee (System). National Alumni Association', 'dateCreated': ['2009 Winter', {'@encoding': 'edtf', '@keyDate': 'yes', '#text': '2009-24'}]}

	{'place': {'@supplied': 'yes', 'placeTerm': {'@type': 'text', '#text': 'Knoxville (Tenn.)'}}, 'publisher': 'University of Tennessee (System). National Alumni Association', 'dateCreated': ['2009', {'@encoding': 'edtf', '@keyDate': 'yes', '#text': '2009'}]}

	{'place': {'@supplied': 'yes', 'placeTerm': {'@type': 'text', '#text': 'Knoxville (Tenn.)'}}, 'publisher': 'University of Tennessee (System). National Alumni Association', 'dateCreated': ['2009 Autumn', {'@encoding': 'edtf', '@keyDate': 'yes', '#text': '2009-23'}]}

	{'place': {'@supplied': 'yes', 'placeTerm': {'@type': 'text', '#text': 'Knoxville (Tenn.)'}}, 'publisher': 'University of Tennessee (System). National Alumni Association', 'dateCreated': ['2010', {'@encoding': 'edtf', '@keyDate': 'yes', '#text': '2010'}]}

	{'place': {'@supplied': 'yes', 'placeTerm': {'@type': 'text', '#text': 'Knoxville (Tenn.)'}}, 'publisher': 'University of Tennessee (System). National Alumni Association', 'dateCreated': ['2011', {'@encoding': 'edtf', '@keyDate': 'yes', '#text': '2011'}]}

	{'place': {'@supplied': 'yes', 'placeTerm': {'@type': 'text', '#text': 'Knoxville (Tenn.)'}}, 'publisher': 'University of Tennessee (System). National Alumni Association', 'dateCreated': ['2012', {'@encoding': 'edtf', '@keyDate': 'yes', '#text': '2012'}]}

	{'place': {'@supplied': 'yes', 'placeTerm': {'@type': 'text', '#text': 'Knoxville (Tenn.)'}}, 'publisher': 'University of Tennessee (System). National Alumni Association', 'dateCreated': ['2012 Summer', {'@encoding': 'edtf', '@keyDate': 'yes', '#text': '2012-22'}]}

	{'place': {'@supplied': 'yes', 'placeTerm': {'@type': 'text', '#text': 'Knoxville (Tenn.)'}}, 'publisher': 'University of Tennessee (System). National Alumni Association', 'dateCreated': ['2013 Winter', {'@encoding': 'edtf', '@keyDate': 'yes', '#text': '2013-24'}]}

	{'place': {'@supplied': 'yes', 'placeTerm': {'@type': 'text', '#text': 'Knoxville (Tenn.)'}}, 'publisher': 'University of Tennessee (System). National Alumni Association', 'dateCreated': ['2013', {'@encoding': 'edtf', '@keyDate': 'yes', '#text': '2013'}]}

	{'place': {'@supplied': 'yes', 'placeTerm': {'@type': 'text', '#text': 'Knoxville (Tenn.)'}}, 'publisher': 'University of Tennessee (System). National Alumni Association', 'dateCreated': ['2014', {'@encoding': 'edtf', '@keyDate': 'yes', '#text': '2014'}]}

	{'place': {'@supplied': 'yes', 'placeTerm': {'@type': 'text', '#text': 'Knoxville (Tenn.)'}}, 'publisher': 'University of Tennessee (System). National Alumni Association', 'dateCreated': ['2014 Spring', {'@encoding': 'edtf', '@keyDate': 'yes', '#text': '2014-21'}]}

	{'place': {'@supplied': 'yes', 'placeTerm': {'@type': 'text', '#text': 'Knoxville (Tenn.)'}}, 'publisher': 'University of Tennessee (System). National Alumni Association', 'dateCreated': ['1930', {'@encoding': 'edtf', '@keyDate': 'yes', '#text': '1930'}]}

	{'place': {'@supplied': 'yes', 'placeTerm': {'@type': 'text', '#text': 'Knoxville (Tenn.)'}}, 'publisher': 'University of Tennessee (System). National Alumni Association', 'dateCreated': ['1931', {'@encoding': 'edtf', '@keyDate': 'yes', '#text': '1931'}]}

	{'place': {'@supplied': 'yes', 'placeTerm': {'@type': 'text', '#text': 'Knoxville (Tenn.)'}}, 'publisher': 'University of Tennessee (System). National Alumni Association', 'dateCreated': ['4/1/1932', {'@encoding': 'edtf', '@keyDate': 'yes', '#text': '1932-04-01'}]}

	{'place': {'@supplied': 'yes', 'placeTerm': {'@type': 'text', '#text': 'Knoxville (Tenn.)'}}, 'publisher': 'University of Tennessee (System). National Alumni Association', 'dateCreated': ['1932', {'@encoding': 'edtf', '@keyDate': 'yes', '#text': '1932'}]}

	{'place': {'@supplied': 'yes', 'placeTerm': {'@type': 'text', '#text': 'Knoxville (Tenn.)'}}, 'publisher': 'University of Tennessee (System). National Alumni Association', 'dateCreated': ['1933', {'@encoding': 'edtf', '@keyDate': 'yes', '#text': '1933'}]}

	{'place': {'@supplied': 'yes', 'placeTerm': {'@type': 'text', '#text': 'Knoxville (Tenn.)'}}, 'publisher': 'University of Tennessee (System). National Alumni Association', 'dateCreated': ['1/1/1934', {'@encoding': 'edtf', '@keyDate': 'yes', '#text': '1934-01-01'}]}

	{'place': {'@supplied': 'yes', 'placeTerm': {'@type': 'text', '#text': 'Knoxville (Tenn.)'}}, 'publisher': 'University of Tennessee (System). National Alumni Association', 'dateCreated': ['7/1/1934', {'@encoding': 'edtf', '@keyDate': 'yes', '#text': '1934-07-01'}]}

	{'place': {'@supplied': 'yes', 'placeTerm': {'@type': 'text', '#text': 'Knoxville (Tenn.)'}}, 'publisher': 'University of Tennessee (System). National Alumni Association', 'dateCreated': ['1934 Autumn', {'@encoding': 'edtf', '@keyDate': 'yes', '#text': '1934-23'}]}

	{'place': {'@supplied': 'yes', 'placeTerm': {'@type': 'text', '#text': 'Knoxville (Tenn.)'}}, 'publisher': 'University of Tennessee (System). National Alumni Association', 'dateCreated': ['1/1/1935', {'@encoding': 'edtf', '@keyDate': 'yes', '#text': '1935-01-01'}]}

	{'place': {'@supplied': 'yes', 'placeTerm': {'@type': 'text', '#text': 'Knoxville (Tenn.)'}}, 'publisher': 'University of Tennessee (System). National Alumni Association', 'dateCreated': ['1935', {'@encoding': 'edtf', '@keyDate': 'yes', '#text': '1935'}]}

	{'place': {'@supplied': 'yes', 'placeTerm': {'@type': 'text', '#text': 'Knoxville (Tenn.)'}}, 'publisher': 'University of Tennessee (System). National Alumni Association', 'dateCreated': ['9/1/1935', {'@encoding': 'edtf', '@keyDate': 'yes', '#text': '1935-09-01'}]}

	{'place': {'@supplied': 'yes', 'placeTerm': {'@type': 'text', '#text': 'Knoxville (Tenn.)'}}, 'publisher': 'University of Tennessee (System). National Alumni Association', 'dateCreated': ['1936 Spring', {'@encoding': 'edtf', '@keyDate': 'yes', '#text': '1936-21'}]}

	{'place': {'@supplied': 'yes', 'placeTerm': {'@type': 'text', '#text': 'Knoxville (Tenn.)'}}, 'publisher': 'University of Tennessee (System). National Alumni Association', 'dateCreated': ['1936', {'@encoding': 'edtf', '@keyDate': 'yes', '#text': '1936'}]}

	{'place': {'@supplied': 'yes', 'placeTerm': {'@type': 'text', '#text': 'Knoxville (Tenn.)'}}, 'publisher': 'University of Tennessee (System). National Alumni Association', 'dateCreated': ['1937 Winter', {'@encoding': 'edtf', '@keyDate': 'yes', '#text': '1937-24'}]}

	{'place': {'@supplied': 'yes', 'placeTerm': {'@type': 'text', '#text': 'Knoxville (Tenn.)'}}, 'publisher': 'University of Tennessee (System). National Alumni Association', 'dateCreated': ['1937 Spring', {'@encoding': 'edtf', '@keyDate': 'yes', '#text': '1937-21'}]}

	{'place': {'@supplied': 'yes', 'placeTerm': {'@type': 'text', '#text': 'Knoxville (Tenn.)'}}, 'publisher': 'University of Tennessee (System). National Alumni Association', 'dateCreated': ['1937', {'@encoding': 'edtf', '@keyDate': 'yes', '#text': '1937'}]}

	{'place': {'@supplied': 'yes', 'placeTerm': {'@type': 'text', '#text': 'Knoxville (Tenn.)'}}, 'publisher': 'University of Tennessee (System). National Alumni Association', 'dateCreated': ['10/1/1937', {'@encoding': 'edtf', '@keyDate': 'yes', '#text': '1937-10-01'}]}

	{'place': {'@supplied': 'yes', 'placeTerm': {'@type': 'text', '#text': 'Knoxville (Tenn.)'}}, 'publisher': 'University of Tennessee (System). National Alumni Association', 'dateCreated': ['1938', {'@encoding': 'edtf', '@keyDate': 'yes', '#text': '1938'}]}

	{'place': {'@supplied': 'yes', 'placeTerm': {'@type': 'text', '#text': 'Knoxville (Tenn.)'}}, 'publisher': 'University of Tennessee (System). National Alumni Association', 'dateCreated': ['1939', {'@encoding': 'edtf', '@keyDate': 'yes', '#text': '1939'}]}

	{'place': {'@supplied': 'yes', 'placeTerm': {'@type': 'text', '#text': 'Knoxville (Tenn.)'}}, 'publisher': 'University of Tennessee (System). National Alumni Association', 'dateCreated': ['5/1/1939', {'@encoding': 'edtf', '@keyDate': 'yes', '#text': '1939-05-01'}]}

	{'place': {'@supplied': 'yes', 'placeTerm': {'@type': 'text', '#text': 'Knoxville (Tenn.)'}}, 'publisher': 'University of Tennessee (System). National Alumni Association', 'dateCreated': ['8/1/1939', {'@encoding': 'edtf', '@keyDate': 'yes', '#text': '1939-08-01'}]}

	{'place': {'@supplied': 'yes', 'placeTerm': {'@type': 'text', '#text': 'Knoxville (Tenn.)'}}, 'publisher': 'University of Tennessee (System). National Alumni Association', 'dateCreated': ['10/1/1939', {'@encoding': 'edtf', '@keyDate': 'yes', '#text': '1939-10-01'}]}

	{'dateCreated': ['1934', {'@encoding': 'edtf', '@keyDate': 'yes', '#text': '1934'}]}

	{'dateCreated': ['Unknown', {'@encoding': 'edtf', '@keyDate': 'yes', '@point': 'start', '@qualifier': 'inferred', '#text': '1923'}, {'@encoding': 'edtf', '@keyDate': 'yes', '@point': 'end', '#text': '2010'}]}

	{'dateCreated': ['1925', {'@encoding': 'edtf', '@keyDate': 'yes', '#text': '1925'}]}

	{'dateCreated': ['1974-06-07', {'@encoding': 'edtf', '@keyDate': 'yes', '#text': '1974-06-07'}]}

	{'dateCreated': ['1923', {'@encoding': 'edtf', '@keyDate': 'yes', '#text': '1923'}]}

	{'dateCreated': ['1926', {'@encoding': 'edtf', '@keyDate': 'yes', '#text': '1926'}]}

	{'dateCreated': ['1932', {'@encoding': 'edtf', '@keyDate': 'yes', '#text': '1932'}]}

	{'dateCreated': ['1975-07-14', {'@encoding': 'edtf', '@keyDate': 'yes', '#text': '1975-07-14'}]}

	{'place': {'@supplied': 'yes', 'placeTerm': {'@type': 'text', '@valueURI': '', '#text': 'Knoxville (Tenn.)'}}, 'publisher': 'University of Tennessee', 'dateCreated': ['10/9/1943', {'@encoding': 'edtf', '@keyDate': 'yes', '#text': '1943-10-09'}]}

	{'place': {'@supplied': 'yes', 'placeTerm': {'@type': 'text', '@valueURI': '', '#text': 'Knoxville (Tenn.)'}}, 'publisher': 'University of Tennessee', 'dateCreated': ['10/16/1943', {'@encoding': 'edtf', '@keyDate': 'yes', '#text': '1943-10-16'}]}

	{'place': {'@supplied': 'yes', 'placeTerm': {'@type': 'text', '@valueURI': '', '#text': 'Knoxville (Tenn.)'}}, 'publisher': 'University of Tennessee', 'dateCreated': ['10/23/1943', {'@encoding': 'edtf', '@keyDate': 'yes', '#text': '1943-10-23'}]}

	{'place': {'@supplied': 'yes', 'placeTerm': {'@type': 'text', '@valueURI': '', '#text': 'Knoxville (Tenn.)'}}, 'publisher': 'University of Tennessee', 'dateCreated': ['10/30/1943', {'@encoding': 'edtf', '@keyDate': 'yes', '#text': '1943-10-30'}]}

	{'place': {'@supplied': 'yes', 'placeTerm': {'@type': 'text', '@valueURI': '', '#text': 'Knoxville (Tenn.)'}}, 'publisher': 'University of Tennessee', 'dateCreated': ['11/6/1943', {'@encoding': 'edtf', '@keyDate': 'yes', '#text': '1943-11-06'}]}

	{'place': {'@supplied': 'yes', 'placeTerm': {'@type': 'text', '@valueURI': '', '#text': 'Knoxville (Tenn.)'}}, 'publisher': 'University of Tennessee', 'dateCreated': ['11/13/1943', {'@encoding': 'edtf', '@keyDate': 'yes', '#text': '1943-11-13'}]}

	{'place': {'@supplied': 'yes', 'placeTerm': {'@type': 'text', '@valueURI': '', '#text': 'Knoxville (Tenn.)'}}, 'publisher': 'University of Tennessee', 'dateCreated': ['11/22/1943', {'@encoding': 'edtf', '@keyDate': 'yes', '#text': '1943-11-22'}]}

	{'place': {'@supplied': 'yes', 'placeTerm': {'@type': 'text', '@valueURI': '', '#text': 'Knoxville (Tenn.)'}}, 'publisher': 'University of Tennessee', 'dateCreated': ['11/27/1943', {'@encoding': 'edtf', '@keyDate': 'yes', '#text': '1943-11-27'}]}

	{'place': {'@supplied': 'yes', 'placeTerm': {'@type': 'text', '@valueURI': '', '#text': 'Knoxville (Tenn.)'}}, 'publisher': 'University of Tennessee', 'dateCreated': ['12/4/1943', {'@encoding': 'edtf', '@keyDate': 'yes', '#text': '1943-12-04'}]}

	{'place': {'@supplied': 'yes', 'placeTerm': {'@type': 'text', '@valueURI': '', '#text': 'Knoxville (Tenn.)'}}, 'publisher': 'University of Tennessee', 'dateCreated': ['12/11/1943', {'@encoding': 'edtf', '@keyDate': 'yes', '#text': '1943-12-11'}]}

	{'place': {'@supplied': 'yes', 'placeTerm': {'@type': 'text', '@valueURI': '', '#text': 'Knoxville (Tenn.)'}}, 'publisher': 'University of Tennessee', 'dateCreated': ['12/18/1943', {'@encoding': 'edtf', '@keyDate': 'yes', '#text': '1943-12-18'}]}

	{'place': {'@supplied': 'yes', 'placeTerm': {'@type': 'text', '@valueURI': '', '#text': 'Knoxville (Tenn.)'}}, 'publisher': 'University of Tennessee', 'dateCreated': ['12/25/1943', {'@encoding': 'edtf', '@keyDate': 'yes', '#text': '1943-12-25'}]}

	{'place': {'@supplied': 'yes', 'placeTerm': {'@type': 'text', '@valueURI': '', '#text': 'Knoxville (Tenn.)'}}, 'publisher': 'University of Tennessee', 'dateCreated': ['1/1/1944', {'@encoding': 'edtf', '@keyDate': 'yes', '#text': '1944-01-01'}]}

	{'place': {'@supplied': 'yes', 'placeTerm': {'@type': 'text', '@valueURI': '', '#text': 'Knoxville (Tenn.)'}}, 'publisher': 'University of Tennessee', 'dateCreated': ['1/8/1944', {'@encoding': 'edtf', '@keyDate': 'yes', '#text': '1944-01-08'}]}

	{'place': {'@supplied': 'yes', 'placeTerm': {'@type': 'text', '@valueURI': '', '#text': 'Knoxville (Tenn.)'}}, 'publisher': 'University of Tennessee', 'dateCreated': ['1/15/1944', {'@encoding': 'edtf', '@keyDate': 'yes', '#text': '1944-01-15'}]}

	{'place': {'@supplied': 'yes', 'placeTerm': {'@type': 'text', '@valueURI': '', '#text': 'Knoxville (Tenn.)'}}, 'publisher': 'University of Tennessee', 'dateCreated': ['1/22/1944', {'@encoding': 'edtf', '@keyDate': 'yes', '#text': '1944-01-22'}]}

	{'place': {'@supplied': 'yes', 'placeTerm': {'@type': 'text', '@valueURI': '', '#text': 'Knoxville (Tenn.)'}}, 'publisher': 'University of Tennessee', 'dateCreated': ['1/29/1944', {'@encoding': 'edtf', '@keyDate': 'yes', '#text': '1944-01-29'}]}

	{'place': {'@supplied': 'yes', 'placeTerm': {'@type': 'text', '@valueURI': '', '#text': 'Knoxville (Tenn.)'}}, 'publisher': 'University of Tennessee', 'dateCreated': ['2/5/1944', {'@encoding': 'edtf', '@keyDate': 'yes', '#text': '1944-02-05'}]}

	{'place': {'@supplied': 'yes', 'placeTerm': {'@type': 'text', '@valueURI': '', '#text': 'Knoxville (Tenn.)'}}, 'publisher': 'University of Tennessee', 'dateCreated': ['2/12/1944', {'@encoding': 'edtf', '@keyDate': 'yes', '#text': '1944-02-12'}]}

	{'place': {'@supplied': 'yes', 'placeTerm': {'@type': 'text', '@valueURI': '', '#text': 'Knoxville (Tenn.)'}}, 'publisher': 'University of Tennessee', 'dateCreated': ['2/19/1944', {'@encoding': 'edtf', '@keyDate': 'yes', '#text': '1944-02-19'}]}

	{'place': {'@supplied': 'yes', 'placeTerm': {'@type': 'text', '@valueURI': '', '#text': 'Knoxville (Tenn.)'}}, 'publisher': 'University of Tennessee', 'dateCreated': ['2/26/1944', {'@encoding': 'edtf', '@keyDate': 'yes', '#text': '1944-02-26'}]}

	{'place': {'@supplied': 'yes', 'placeTerm': {'@type': 'text', '@valueURI': '', '#text': 'Knoxville (Tenn.)'}}, 'publisher': 'University of Tennessee', 'dateCreated': ['3/4/1944', {'@encoding': 'edtf', '@keyDate': 'yes', '#text': '1944-03-04'}]}

	{'place': {'@supplied': 'yes', 'placeTerm': {'@type': 'text', '@valueURI': '', '#text': 'Knoxville (Tenn.)'}}, 'publisher': 'University of Tennessee', 'dateCreated': ['3/11/1944', {'@encoding': 'edtf', '@keyDate': 'yes', '#text': '1944-03-11'}]}

	{'place': {'@supplied': 'yes', 'placeTerm': {'@type': 'text', '@valueURI': '', '#text': 'Knoxville (Tenn.)'}}, 'publisher': 'University of Tennessee', 'dateCreated': ['3/18/1944', {'@encoding': 'edtf', '@keyDate': 'yes', '#text': '1944-03-18'}]}

	{'place': {'@supplied': 'yes', 'placeTerm': {'@type': 'text', '@valueURI': '', '#text': 'Knoxville (Tenn.)'}}, 'publisher': 'University of Tennessee', 'dateCreated': ['3/25/1944', {'@encoding': 'edtf', '@keyDate': 'yes', '#text': '1944-03-25'}]}

	{'place': {'@supplied': 'yes', 'placeTerm': {'@type': 'text', '@valueURI': '', '#text': 'Knoxville (Tenn.)'}}, 'publisher': 'University of Tennessee', 'dateCreated': ['4/29/1944', {'@encoding': 'edtf', '@keyDate': 'yes', '#text': '1944-04-29'}]}

	{'dateCreated': ['1958-1963', {'@encoding': 'edtf', '@keyDate': 'yes', '#text': '1958'}]}

	{'dateCreated': ['1962', {'@encoding': 'edtf', '@keyDate': 'yes', '#text': '1962'}]}

	{'dateCreated': ['1962, 1973', {'@encoding': 'edtf', '@keyDate': 'yes', '#text': '1962'}]}

	{'dateCreated': ['1958-1962', {'@encoding': 'edtf', '@keyDate': 'yes', '#text': '1958'}]}

	{'dateCreated': ['1969-1970', {'@encoding': 'edtf', '@keyDate': 'yes', '#text': '1969'}]}

	{'dateCreated': ['1958, 1961-1962', {'@encoding': 'edtf', '@keyDate': 'yes', '#text': '1958'}]}

	{'dateCreated': ['1963', {'@encoding': 'edtf', '@keyDate': 'yes', '#text': '1963'}]}

	{'dateCreated': ['1965, 1968, 1991', {'@encoding': 'edtf', '@keyDate': 'yes', '#text': '1965'}]}

	{'dateCreated': ['1968-1969', {'@encoding': 'edtf', '@keyDate': 'yes', '#text': '1968'}]}

	{'dateCreated': ['1968-1970', {'@encoding': 'edtf', '@keyDate': 'yes', '#text': '1968'}]}

	{'dateCreated': ['1969-06-18', {'@encoding': 'edtf', '@keyDate': 'yes'}]}

	{'dateCreated': ['1970', {'@encoding': 'edtf', '@keyDate': 'yes', '#text': '1970-06-11'}]}

	{'dateCreated': ['undated', {'@encoding': 'edtf', '@keyDate': 'yes', '@qualifier': 'inferred', '#text': '1839'}]}

	{'dateCreated': ['1971', {'@encoding': 'edtf', '@keyDate': 'yes', '#text': '1971'}]}

	{'dateCreated': ['1966-1967, 1976', {'@encoding': 'edtf', '@keyDate': 'yes', '#text': '1966'}]}

	{'dateCreated': ['1966-1968', {'@encoding': 'edtf', '@keyDate': 'yes', '#text': '1966'}]}

	{'dateCreated': ['1977 July', {'@encoding': 'edtf', '@keyDate': 'yes', '#text': '1977-07'}]}

	{'dateCreated': ['1965-1966', {'@encoding': 'edtf', '@keyDate': 'yes', '#text': '1965'}]}

	{'dateCreated': ['1966', {'@encoding': 'edtf', '@keyDate': 'yes', '#text': '1966'}]}

	{'dateCreated': ['1966, 1979', {'@encoding': 'edtf', '@keyDate': 'yes', '#text': '1966'}]}

	{'dateCreated': ['1967', {'@encoding': 'edtf', '@keyDate': 'yes', '#text': '1967'}]}

	{'dateCreated': ['1967', {'@encoding': 'edtf', '@keyDate': 'yes', '#text': '1967-06-11'}]}

	{'dateCreated': ['1973', {'@encoding': 'edtf', '@keyDate': 'yes', '#text': '1973'}]}

	{'dateCreated': ['1974', {'@encoding': 'edtf', '@keyDate': 'yes', '#text': '1974'}]}

	{'dateCreated': ['1961', {'@encoding': 'edtf', '@keyDate': 'yes', '#text': '1961'}]}

	{'dateCreated': ['1961, 1981', {'@encoding': 'edtf', '@keyDate': 'yes', '#text': '1961'}]}

	{'dateCreated': ['1966 June', {'@encoding': 'edtf', '@keyDate': 'yes', '#text': '1966-06'}]}

	{'dateCreated': ['1968', {'@encoding': 'edtf', '@keyDate': 'yes', '#text': '1968'}]}

	{'dateCreated': ['1958 (summer)', {'@encoding': 'edtf', '@keyDate': 'yes', '#text': '1958-22'}]}

	{'dateCreated': ['1959 (summer)', {'@encoding': 'edtf', '@keyDate': 'yes', '#text': '1959-22'}]}

	{'dateCreated': ['1961 (summer)', {'@encoding': 'edtf', '@keyDate': 'yes', '#text': '1961-22'}]}

	{'dateCreated': ['1962 (summer)', {'@encoding': 'edtf', '@keyDate': 'yes', '#text': '1962-22'}]}

	{'dateCreated': ['1963 (summer)', {'@encoding': 'edtf', '@keyDate': 'yes', '#text': '1963-22'}]}

	{'dateCreated': ['1965', {'@encoding': 'edtf', '@keyDate': 'yes', '#text': '1965'}]}

	{'dateCreated': ['1956, 1958', {'@encoding': 'edtf', '@keyDate': 'yes', '#text': '1956'}]}

	{'dateCreated': ['1970 October 18', {'@encoding': 'edtf', '@keyDate': 'yes', '#text': '1970-10-18'}]}

	{'dateCreated': ['1970', {'@encoding': 'edtf', '@keyDate': 'yes', '#text': '1970'}]}

	{'dateCreated': ['1970-1971', {'@encoding': 'edtf', '@keyDate': 'yes', '#text': '1970'}]}

	{'dateCreated': ['1964-1974', {'@encoding': 'edtf', '@keyDate': 'yes', '#text': '1964'}]}

	{'dateCreated': ['1969', {'@encoding': 'edtf', '@keyDate': 'yes', '#text': '1969'}]}

	{'dateCreated': ['undated', {'@encoding': 'edtf', '@keyDate': 'yes', '#text': '1965-08-2'}]}

	{'dateCreated': ['1965 (circa)', {'@encoding': 'edtf', '@keyDate': 'yes', '@qualifier': 'approximate', '#text': '1965'}]}

	{'dateCreated': ['1965, 1966', {'@encoding': 'edtf', '@keyDate': 'yes', '#text': '1965'}]}

	{'dateCreated': ['1965-1966, 1984-1985', {'@encoding': 'edtf', '@keyDate': 'yes', '#text': '1965'}]}

	{'dateCreated': ['1965-1974', {'@encoding': 'edtf', '@keyDate': 'yes', '#text': '1974'}]}

	{'dateCreated': ['1965-1969, 1970-1975, 1981-1987, 1991', {'@encoding': 'edtf', '@keyDate': 'yes', '#text': '1965'}]}

	{'dateCreated': ['1957-1963', {'@encoding': 'edtf', '@keyDate': 'yes', '#text': '1957'}]}

	{'dateCreated': ['unknown', {'@encoding': 'edtf', '@keyDate': 'yes', '@qualifier': 'inferred', '#text': '1730'}]}

	{'dateCreated': ['circa 1900', {'@encoding': 'edtf', '@keyDate': 'yes', '@qualifier': 'approximate', '#text': '1900'}]}

	{'dateCreated': ['1901', {'@encoding': 'edtf', '@keyDate': 'yes', '#text': '1901'}]}

	{'dateCreated': ['circa 1925', {'@encoding': 'edtf', '@keyDate': 'yes', '@qualifier': 'approximate', '#text': '1925'}]}

	{'dateCreated': ['circa 1931', {'@encoding': 'edtf', '@keyDate': 'yes', '@qualifier': 'approximate', '#text': '1931'}]}

	{'dateCreated': ['circa 1932', {'@encoding': 'edtf', '@keyDate': 'yes', '@qualifier': 'approximate', '#text': '1932'}]}

	{'dateCreated': ['circa 1930s', {'@encoding': 'edtf', '@keyDate': 'yes', '@qualifier': 'approximate', '#text': '1930'}]}

	{'dateCreated': ['1871?', {'@encoding': 'edtf', '@keyDate': 'yes', '@qualifier': 'questionable', '#text': '1871'}]}

	{'dateCreated': ['1917?', {'@encoding': 'edtf', '@keyDate': 'yes', '@qualifier': 'questionable', '#text': '1917'}]}

	{'dateCreated': ['1885', {'@encoding': 'edtf', '@keyDate': 'yes', '#text': '1885'}]}

	{'dateCreated': ['early 1900s', {'@encoding': 'edtf', '@keyDate': 'yes', '@qualifier': 'approximate', '#text': '1900'}]}

	{'dateCreated': ['1888', {'@encoding': 'edtf', '@keyDate': 'yes', '#text': '1888'}]}

	{'dateCreated': ['1910', {'@encoding': 'edtf', '@keyDate': 'yes', '#text': '1910'}]}

	{'dateCreated': ['1891', {'@encoding': 'edtf', '@keyDate': 'yes', '#text': '1891'}]}

	{'dateCreated': ['1916', {'@encoding': 'edtf', '@keyDate': 'yes', '#text': '1916'}]}

	{'dateCreated': ['1869-1870', {'@encoding': 'edtf', '@keyDate': 'yes', '#text': '1869'}]}

	{'dateCreated': ['ca. 1875', {'@encoding': 'edtf', '@keyDate': 'yes', '@qualifier': 'approximate', '#text': '1875'}]}

	{'dateCreated': ['ca. 1868', {'@encoding': 'edtf', '@keyDate': 'yes', '@qualifier': 'approximate', '#text': '1868'}]}

	{'dateCreated': ['1936', {'@encoding': 'edtf', '@keyDate': 'yes', '#text': '1936'}]}

	{'dateCreated': ['1842', {'@encoding': 'edtf', '@keyDate': 'yes', '#text': '1842'}]}

	{'dateCreated': ['1921', {'@encoding': 'edtf', '@keyDate': 'yes', '#text': '1921'}]}

	{'dateCreated': ['ca. 1795', {'@encoding': 'edtf', '@keyDate': 'yes', '@qualifier': 'approximate', '#text': '1795'}]}

	{'dateCreated': ['1915', {'@encoding': 'edtf', '@keyDate': 'yes', '#text': '1915'}]}

	{'dateCreated': ['ca. 1850', {'@encoding': 'edtf', '@keyDate': 'yes', '@qualifier': 'approximate', '#text': '1850'}]}

	{'dateCreated': ['1896', {'@encoding': 'edtf', '@keyDate': 'yes', '#text': '1896'}]}

	{'dateCreated': ['1851', {'@encoding': 'edtf', '@keyDate': 'yes', '#text': '1851'}]}

	{'dateCreated': ['1847', {'@encoding': 'edtf', '@keyDate': 'yes', '#text': '1847'}]}

	{'dateCreated': ['ca. 1915', {'@encoding': 'edtf', '@keyDate': 'yes', '@qualifier': 'approximate', '#text': '1915'}]}

	{'dateCreated': ['ca. 1819-1824', {'@encoding': 'edtf', '@keyDate': 'yes', '@qualifier': 'approximate', '#text': '1819'}]}

	{'dateCreated': ['1833-1835', {'@encoding': 'edtf', '@keyDate': 'yes', '#text': '1833'}]}

	{'dateCreated': ['ca. 1890', {'@encoding': 'edtf', '@keyDate': 'yes', '@qualifier': 'approximate', '#text': '1890'}]}

	{'dateCreated': ['pre-1900', {'@encoding': 'edtf', '@keyDate': 'yes', '@qualifier': 'inferred', '#text': '1700'}]}

	{'dateCreated': ['ca. 1910', {'@encoding': 'edtf', '@keyDate': 'yes', '@qualifier': 'approximate', '#text': '1910'}]}

	{'dateCreated': ['ca. 1901', {'@encoding': 'edtf', '@keyDate': 'yes', '@qualifier': 'approximate', '#text': '1901'}]}

	{'dateCreated': ['Unknown', {'@encoding': 'edtf', '@keyDate': 'yes', '@qualifier': 'inferred', '#text': '1870'}]}

	{'dateCreated': ['1905-1910', {'@encoding': 'edtf', '@keyDate': 'yes', '#text': '1905'}]}

	{'dateCreated': ['ca. 1905', {'@encoding': 'edtf', '@keyDate': 'yes', '@qualifier': 'approximate', '#text': '1905'}]}

	{'dateCreated': ['Unknown', {'@encoding': 'edtf', '@keyDate': 'yes', '@qualifier': 'inferred', '#text': '1902'}]}

	{'dateCreated': ['1786', {'@encoding': 'edtf', '@keyDate': 'yes', '#text': '1786'}]}

	{'dateCreated': ['1808', {'@encoding': 'edtf', '@keyDate': 'yes', '#text': '1808'}]}

	{'dateCreated': ['1904', {'@encoding': 'edtf', '@keyDate': 'yes', '#text': '1904'}]}

	{'dateCreated': ['1924?', {'@encoding': 'edtf', '@keyDate': 'yes', '@qualifier': 'questionable', '#text': '1924'}]}

	{'dateCreated': ['1834?', {'@encoding': 'edtf', '@keyDate': 'yes', '@qualifier': 'questionable', '#text': '1834'}]}

	{'dateCreated': ['early 1900s', {'@encoding': 'edtf', '@keyDate': 'yes', '#text': '1900'}]}

	{'dateCreated': ['1856', {'@encoding': 'edtf', '@keyDate': 'yes', '#text': '1856'}]}

	{'dateCreated': ['1793', {'@encoding': 'edtf', '@keyDate': 'yes', '#text': '1793'}]}

	{'dateCreated': ['ca. 1900', {'@encoding': 'edtf', '@keyDate': 'yes', '@qualifier': 'approximate', '#text': '1900'}]}

	{'dateCreated': ['1886', {'@encoding': 'edtf', '@keyDate': 'yes', '#text': '1886'}]}

	{'dateCreated': ['1842?', {'@encoding': 'edtf', '@keyDate': 'yes', '@qualifier': 'questionable', '#text': '1842'}]}

	{'dateCreated': ['1794', {'@encoding': 'edtf', '@keyDate': 'yes', '#text': '1794'}]}

	{'dateCreated': ['1874-1877', {'@encoding': 'edtf', '@keyDate': 'yes', '#text': '1874'}]}

	{'dateCreated': ['1802', {'@encoding': 'edtf', '@keyDate': 'yes', '#text': '1802'}]}

	{'dateCreated': ['pre-1910', {'@encoding': 'edtf', '@keyDate': 'yes', '@qualifier': 'questionable', '#text': '1700'}]}

	{'dateCreated': ['perhaps as early as the 1860s', {'@encoding': 'edtf', '@keyDate': 'yes', '@qualifier': 'questionable', '#text': '1860'}]}

	{'dateCreated': ['1850', {'@encoding': 'edtf', '@keyDate': 'yes', '#text': '1850'}]}

	{'dateCreated': ['1877', {'@encoding': 'edtf', '@keyDate': 'yes', '#text': '1877'}]}

	{'dateCreated': ['1920s?', {'@encoding': 'edtf', '@keyDate': 'yes', '@qualifier': 'questionable', '#text': '1920'}]}

	{'dateCreated': ['prior to 1860', {'@encoding': 'edtf', '@keyDate': 'yes', '@qualifier': 'questionable', '#text': '1700'}]}

	{'dateCreated': ['1930s', {'@encoding': 'edtf', '@keyDate': 'yes', '#text': '1930'}]}

	{'dateCreated': ['1917', {'@encoding': 'edtf', '@keyDate': 'yes', '#text': '1917'}]}

	{'dateCreated': ['Unknown', {'@encoding': 'edtf', '@keyDate': 'yes', '@qualifier': 'inferred', '#text': '1800'}]}

	{'dateCreated': ['ca. 1920', {'@encoding': 'edtf', '@keyDate': 'yes', '@qualifier': 'approximate', '#text': '1920'}]}

	{'dateCreated': ['1850s', {'@encoding': 'edtf', '@keyDate': 'yes', '#text': '1850'}]}

	{'dateCreated': ['1887', {'@encoding': 'edtf', '@keyDate': 'yes', '#text': '1887'}]}

	{'dateCreated': ['1902', {'@encoding': 'edtf', '@keyDate': 'yes', '#text': '1902'}]}

	{'dateCreated': ['1840s-1870s', {'@encoding': 'edtf', '@keyDate': 'yes', '#text': '1840'}]}

	{'dateCreated': ['about 1930', {'@encoding': 'edtf', '@keyDate': 'yes', '@qualifier': 'approximate', '#text': '1930'}]}

	{'dateCreated': ['before 1890', {'@encoding': 'edtf', '@keyDate': 'yes', '@qualifier': 'questionable', '#text': '1700'}]}

	{'dateCreated': ['19th century', {'@encoding': 'edtf', '@keyDate': 'yes', '@qualifier': 'approximate', '#text': '1800'}]}

	{'dateCreated': ['1895', {'@encoding': 'edtf', '@keyDate': 'yes', '#text': '1895'}]}

	{'dateCreated': ['ca. 1876', {'@encoding': 'edtf', '@keyDate': 'yes', '@qualifier': 'approximate', '#text': '1876'}]}

	{'dateCreated': ['ca. 1916-1917', {'@encoding': 'edtf', '@keyDate': 'yes', '@qualifier': 'approximate', '#text': '1916'}]}

	{'dateCreated': ['1931?', {'@encoding': 'edtf', '@keyDate': 'yes', '@qualifier': 'questionable', '#text': '1931'}]}

	{'dateCreated': ['ca. 1900-1908', {'@encoding': 'edtf', '@keyDate': 'yes', '@qualifier': 'approximate', '#text': '1900'}]}

	{'dateCreated': ['Unknown', {'@encoding': 'edtf', '@keyDate': 'yes', '@qualifier': 'inferred', '#text': '1890'}]}

	{'dateCreated': ['ca. 1874', {'@encoding': 'edtf', '@keyDate': 'yes', '@qualifier': 'approximate', '#text': '1874'}]}

	{'dateCreated': ['ca. 1870', {'@encoding': 'edtf', '@keyDate': 'yes', '@qualifier': 'approximate', '#text': '1870'}]}

	{'dateCreated': ['ca. 1914', {'@encoding': 'edtf', '@keyDate': 'yes', '@qualifier': 'approximate', '#text': '1914'}]}

	{'dateCreated': ['1940s', {'@encoding': 'edtf', '@keyDate': 'yes', '@qualifier': 'approximate', '#text': '1940'}]}

	{'dateCreated': ['1874', {'@encoding': 'edtf', '@keyDate': 'yes', '#text': '1874'}]}

	{'dateCreated': ['1940s?', {'@encoding': 'edtf', '@keyDate': 'yes', '@qualifier': 'inferred', '#text': '1940'}]}

	{'dateCreated': ['1880s', {'@encoding': 'edtf', '@keyDate': 'yes', '@qualifier': 'approximate', '#text': '1880'}]}

	{'dateCreated': ['from 1937 to 1946', {'@encoding': 'edtf', '@keyDate': 'yes', '#text': '1937'}]}

	{'dateCreated': ['1880s', {'@encoding': 'edtf', '@keyDate': 'yes', '#text': '1880'}]}

	{'dateCreated': ['1907', {'@encoding': 'edtf', '@keyDate': 'yes', '#text': '1907'}]}

	{'dateCreated': ['1925?', {'@encoding': 'edtf', '@keyDate': 'yes', '@qualifier': 'questionable', '#text': '1925'}]}

	{'dateCreated': ['ca.1900', {'@encoding': 'edtf', '@keyDate': 'yes', '@qualifier': 'approximate', '#text': '1900'}]}

	{'place': {'@supplied': 'yes', 'placeTerm': {'@type': 'text', '@valueURI': 'http://id.loc.gov/authorities/names/n79109786', '#text': 'Knoxville (Tenn.)'}}, 'dateCreated': ['[1951-2012?]', {'@encoding': 'edtf', '@keyDate': 'yes', '@point': 'start', '@qualifier': 'inferred', '#text': '1951'}, {'@encoding': 'edtf', '@keyDate': 'yes', '@point': 'end', '#text': '2012'}]}

	{'place': {'@supplied': 'yes', 'placeTerm': {'@type': 'text', '@valueURI': 'http://id.loc.gov/authorities/names/n79109786', '#text': 'Knoxville (Tenn.)'}}, 'dateCreated': ['circa 1996', {'@encoding': 'edtf', '@keyDate': 'yes', '@qualifier': 'approximate', '#text': '1996'}]}

	{'place': {'@supplied': 'yes', 'placeTerm': {'@type': 'text', '@valueURI': 'http://id.loc.gov/authorities/names/n79109786', '#text': 'Knoxville (Tenn.)'}}, 'dateCreated': ['1998 November', {'@encoding': 'edtf', '@keyDate': 'yes', '#text': '1998-11'}]}

	{'place': {'@supplied': 'yes', 'placeTerm': {'@type': 'text', '@valueURI': 'http://id.loc.gov/authorities/names/n79109786', '#text': 'Knoxville (Tenn.)'}}, 'dateCreated': ['1998', {'@encoding': 'edtf', '@keyDate': 'yes', '#text': '1998'}]}

	{'place': {'@supplied': 'yes', 'placeTerm': {'@type': 'text', '@valueURI': 'http://id.loc.gov/authorities/names/n79109786', '#text': 'Knoxville (Tenn.)'}}, 'dateCreated': ['1994 October 13', {'@encoding': 'edtf', '@keyDate': 'yes', '#text': '1994-10-13'}]}

	{'place': {'@supplied': 'yes', 'placeTerm': {'@type': 'text', '@valueURI': 'http://id.loc.gov/authorities/names/n79109786', '#text': 'Knoxville (Tenn.)'}}, 'dateCreated': ['1996', {'@encoding': 'edtf', '@keyDate': 'yes', '#text': '1996'}]}

	{'place': {'@supplied': 'yes', 'placeTerm': {'@type': 'text', '@valueURI': 'http://id.loc.gov/authorities/names/n79109786', '#text': 'Knoxville (Tenn.)'}}, 'dateCreated': ['1994 August 12', {'@encoding': 'edtf', '@keyDate': 'yes', '#text': '1994-07-12'}]}

	{'place': {'@supplied': 'yes', 'placeTerm': {'@type': 'text', '@valueURI': 'http://id.loc.gov/authorities/names/n79109786', '#text': 'Knoxville (Tenn.)'}}, 'dateCreated': ['1994 December 30', {'@encoding': 'edtf', '@keyDate': 'yes', '#text': '1994-12-30'}]}

	{'place': {'@supplied': 'yes', 'placeTerm': {'@type': 'text', '@valueURI': 'http://id.loc.gov/authorities/names/n79109786', '#text': 'Knoxville (Tenn.)'}}, 'dateCreated': ['circa 1983', {'@encoding': 'edtf', '@keyDate': 'yes', '@qualifier': 'approximate', '#text': '1983'}]}

	{'place': {'@supplied': 'yes', 'placeTerm': {'@type': 'text', '@valueURI': 'http://id.loc.gov/authorities/names/n79109786', '#text': 'Knoxville (Tenn.)'}}, 'dateCreated': ['circa 2000', {'@encoding': 'edtf', '@keyDate': 'yes', '@qualifier': 'approximate', '#text': '2000'}]}

	{'place': {'@supplied': 'yes', 'placeTerm': {'@type': 'text', '@valueURI': 'http://id.loc.gov/authorities/names/n79109786', '#text': 'Knoxville (Tenn.)'}}, 'dateCreated': ['circa 1979', {'@encoding': 'edtf', '@keyDate': 'yes', '@qualifier': 'approximate', '#text': '1979'}]}

	{'place': {'@supplied': 'yes', 'placeTerm': {'@type': 'text', '@valueURI': 'http://id.loc.gov/authorities/names/n79109786', '#text': 'Knoxville (Tenn.)'}}, 'dateCreated': ['circa 1998', {'@encoding': 'edtf', '@keyDate': 'yes', '@qualifier': 'approximate', '#text': '1998'}]}

	{'place': {'@supplied': 'yes', 'placeTerm': {'@type': 'text', '@valueURI': 'http://id.loc.gov/authorities/names/n79109786', '#text': 'Knoxville (Tenn.)'}}, 'dateCreated': ['circa 2005', {'@encoding': 'edtf', '@keyDate': 'yes', '@qualifier': 'approximate', '#text': '2005'}]}

	{'place': {'@supplied': 'yes', 'placeTerm': {'@type': 'text', '@valueURI': 'http://id.loc.gov/authorities/names/n79109786', '#text': 'Knoxville (Tenn.)'}}, 'dateCreated': ['1986', {'@encoding': 'edtf', '@keyDate': 'yes', '#text': '1986'}]}

	{'place': {'@supplied': 'yes', 'placeTerm': {'@type': 'text', '@valueURI': 'http://id.loc.gov/authorities/names/n79109786', '#text': 'Knoxville (Tenn.)'}}, 'dateCreated': ['1978', {'@encoding': 'edtf', '@keyDate': 'yes', '#text': '1978'}]}

	{'place': {'@supplied': 'yes', 'placeTerm': {'@type': 'text', '@valueURI': 'http://id.loc.gov/authorities/names/n79109786', '#text': 'Knoxville (Tenn.)'}}, 'dateCreated': ['1993 October 26', {'@encoding': 'edtf', '@keyDate': 'yes', '#text': '1993-10-26'}]}

	{'place': {'@supplied': 'yes', 'placeTerm': {'@type': 'text', '@valueURI': 'http://id.loc.gov/authorities/names/n79109786', '#text': 'Knoxville (Tenn.)'}}, 'dateCreated': ['1971', {'@encoding': 'edtf', '@keyDate': 'yes', '#text': '1971'}]}

	{'place': {'@supplied': 'yes', 'placeTerm': {'@type': 'text', '@valueURI': 'http://id.loc.gov/authorities/names/n79109786', '#text': 'Knoxville (Tenn.)'}}, 'dateCreated': ['1993 September 16', {'@encoding': 'edtf', '@keyDate': 'yes', '#text': '1993-09-16'}]}

	{'place': {'@supplied': 'yes', 'placeTerm': {'@type': 'text', '@valueURI': 'http://id.loc.gov/authorities/names/n79109786', '#text': 'Knoxville (Tenn.)'}}, 'dateCreated': ['1994 December 8', {'@encoding': 'edtf', '@keyDate': 'yes', '#text': '1994-12-08'}]}

	{'place': {'@supplied': 'yes', 'placeTerm': {'@type': 'text', '@valueURI': 'http://id.loc.gov/authorities/names/n79109786', '#text': 'Knoxville (Tenn.)'}}, 'dateCreated': ['circa 2006', {'@encoding': 'edtf', '@keyDate': 'yes', '@qualifier': 'approximate', '#text': '2006'}]}

	{'place': {'@supplied': 'yes', 'placeTerm': {'@type': 'text', '@valueURI': 'http://id.loc.gov/authorities/names/n79109786', '#text': 'Knoxville (Tenn.)'}}, 'dateCreated': ['1995 October 4', {'@encoding': 'edtf', '@keyDate': 'yes', '#text': '1995-10-04'}]}

	{'place': {'@supplied': 'yes', 'placeTerm': {'@type': 'text', '@valueURI': 'http://id.loc.gov/authorities/names/n79109786', '#text': 'Knoxville (Tenn.)'}}, 'dateCreated': ['circa 1973', {'@encoding': 'edtf', '@keyDate': 'yes', '@qualifier': 'approximate', '#text': '1973'}]}

	{'place': {'@supplied': 'yes', 'placeTerm': {'@type': 'text', '@valueURI': 'http://id.loc.gov/authorities/names/n79109786', '#text': 'Knoxville (Tenn.)'}}, 'dateCreated': ['1994 August 24', {'@encoding': 'edtf', '@keyDate': 'yes', '#text': '1994-07-24'}]}

	{'place': {'@supplied': 'yes', 'placeTerm': {'@type': 'text', '@valueURI': 'http://id.loc.gov/authorities/names/n79109786', '#text': 'Knoxville (Tenn.)'}}, 'dateCreated': ['2007 May 25', {'@encoding': 'edtf', '@keyDate': 'yes', '#text': '2007-05-25'}]}

	{'place': {'@supplied': 'yes', 'placeTerm': {'@type': 'text', '@valueURI': 'http://id.loc.gov/authorities/names/n79109786', '#text': 'Knoxville (Tenn.)'}}, 'dateCreated': ['1994 October 7', {'@encoding': 'edtf', '@keyDate': 'yes', '#text': '1994-10-07'}]}

	{'place': {'@supplied': 'yes', 'placeTerm': {'@type': 'text', '@valueURI': 'http://id.loc.gov/authorities/names/n79109786', '#text': 'Knoxville (Tenn.)'}}, 'dateCreated': ['2003', {'@encoding': 'edtf', '@keyDate': 'yes', '#text': '2003'}]}

	{'place': {'@supplied': 'yes', 'placeTerm': {'@type': 'text', '@valueURI': 'http://id.loc.gov/authorities/names/n79109786', '#text': 'Knoxville (Tenn.)'}}, 'dateCreated': ['circa 1975', {'@encoding': 'edtf', '@keyDate': 'yes', '@qualifier': 'approximate', '#text': '1975'}]}

	{'place': {'@supplied': 'yes', 'placeTerm': {'@type': 'text', '@valueURI': 'http://id.loc.gov/authorities/names/n79109786', '#text': 'Knoxville (Tenn.)'}}, 'dateCreated': ['1993 May 3', {'@encoding': 'edtf', '@keyDate': 'yes', '#text': '1993-05-03'}]}

	{'place': {'@supplied': 'yes', 'placeTerm': {'@type': 'text', '@valueURI': 'http://id.loc.gov/authorities/names/n79109786', '#text': 'Knoxville (Tenn.)'}}, 'dateCreated': ['1993 July 28', {'@encoding': 'edtf', '@keyDate': 'yes', '#text': '1993-07-28'}]}

	{'place': {'@supplied': 'yes', 'placeTerm': {'@type': 'text', '@valueURI': 'http://id.loc.gov/authorities/names/n79109786', '#text': 'Knoxville (Tenn.)'}}, 'dateCreated': ['1993 April 5', {'@encoding': 'edtf', '@keyDate': 'yes', '#text': '1993-04-05'}]}

	{'place': {'@supplied': 'yes', 'placeTerm': {'@type': 'text', '@valueURI': 'http://id.loc.gov/authorities/names/n79109786', '#text': 'Knoxville (Tenn.)'}}, 'dateCreated': ['1993 April 15', {'@encoding': 'edtf', '@keyDate': 'yes', '#text': '1993-04-15'}]}

	{'place': {'@supplied': 'yes', 'placeTerm': {'@type': 'text', '@valueURI': 'http://id.loc.gov/authorities/names/n79109786', '#text': 'Knoxville (Tenn.)'}}, 'dateCreated': ['1993 February 9', {'@encoding': 'edtf', '@keyDate': 'yes', '#text': '1993-02-09'}]}

	{'place': {'@supplied': 'yes', 'placeTerm': {'@type': 'text', '@valueURI': 'http://id.loc.gov/authorities/names/n79109786', '#text': 'Knoxville (Tenn.)'}}, 'dateCreated': ['1992 October 5', {'@encoding': 'edtf', '@keyDate': 'yes', '#text': '1992-10-05'}]}

	{'place': {'@supplied': 'yes', 'placeTerm': {'@type': 'text', '@valueURI': 'http://id.loc.gov/authorities/names/n79109786', '#text': 'Knoxville (Tenn.)'}}, 'dateCreated': ['2004', {'@encoding': 'edtf', '@keyDate': 'yes', '#text': '2004'}]}

	{'place': {'@supplied': 'yes', 'placeTerm': {'@type': 'text', '@valueURI': 'http://id.loc.gov/authorities/names/n79109786', '#text': 'Knoxville (Tenn.)'}}, 'dateCreated': ['1980', {'@encoding': 'edtf', '@keyDate': 'yes', '#text': '1980'}]}

	{'place': {'@supplied': 'yes', 'placeTerm': {'@type': 'text', '@valueURI': 'http://id.loc.gov/authorities/names/n79109786', '#text': 'Knoxville (Tenn.)'}}, 'dateCreated': ['1993 October 28', {'@encoding': 'edtf', '@keyDate': 'yes', '#text': '1993-10-28'}]}

	{'place': {'@supplied': 'yes', 'placeTerm': {'@type': 'text', '@valueURI': 'http://id.loc.gov/authorities/names/n79109786', '#text': 'Knoxville (Tenn.)'}}, 'dateCreated': ['1981', {'@encoding': 'edtf', '@keyDate': 'yes', '#text': '1981'}]}

	{'place': {'@supplied': 'yes', 'placeTerm': {'@type': 'text', '@valueURI': 'http://id.loc.gov/authorities/names/n79109786', '#text': 'Knoxville (Tenn.)'}}, 'dateCreated': ['2008', {'@encoding': 'edtf', '@keyDate': 'yes', '#text': '2008'}]}

	{'place': {'@supplied': 'yes', 'placeTerm': {'@type': 'text', '@valueURI': 'http://id.loc.gov/authorities/names/n79109786', '#text': 'Knoxville (Tenn.)'}}, 'dateCreated': ['1993 September 9', {'@encoding': 'edtf', '@keyDate': 'yes', '#text': '1993-09-09'}]}

	{'place': {'@supplied': 'yes', 'placeTerm': {'@type': 'text', '@valueURI': 'http://id.loc.gov/authorities/names/n79109786', '#text': 'Knoxville (Tenn.)'}}, 'dateCreated': ['1992 April 1', {'@encoding': 'edtf', '@keyDate': 'yes', '#text': '1992-04-01'}]}

	{'place': {'@supplied': 'yes', 'placeTerm': {'@type': 'text', '@valueURI': 'http://id.loc.gov/authorities/names/n79109786', '#text': 'Knoxville (Tenn.)'}}, 'dateCreated': ['circa 1965', {'@encoding': 'edtf', '@keyDate': 'yes', '@qualifier': 'approximate', '#text': '1965'}]}

	{'place': {'@supplied': 'yes', 'placeTerm': {'@type': 'text', '@valueURI': 'http://id.loc.gov/authorities/names/n79109786', '#text': 'Knoxville (Tenn.)'}}, 'dateCreated': ['1969 February', {'@encoding': 'edtf', '@keyDate': 'yes', '#text': '1969-02'}]}

	{'place': {'@supplied': 'yes', 'placeTerm': {'@type': 'text', '@valueURI': 'http://id.loc.gov/authorities/names/n79109786', '#text': 'Knoxville (Tenn.)'}}, 'dateCreated': ['circa 1968', {'@encoding': 'edtf', '@keyDate': 'yes', '@qualifier': 'approximate', '#text': '1968'}]}

	{'place': {'@supplied': 'yes', 'placeTerm': {'@type': 'text', '@valueURI': 'http://id.loc.gov/authorities/names/n79109786', '#text': 'Knoxville (Tenn.)'}}, 'dateCreated': ['2007 May 9', {'@encoding': 'edtf', '@keyDate': 'yes', '#text': '2007-05-09'}]}

	{'place': {'@supplied': 'yes', 'placeTerm': {'@type': 'text', '@valueURI': 'http://id.loc.gov/authorities/names/n79109786', '#text': 'Knoxville (Tenn.)'}}, 'dateCreated': ['2009 March 8', {'@encoding': 'edtf', '@keyDate': 'yes', '#text': '2009-03-08'}]}

	{'place': {'@supplied': 'yes', 'placeTerm': {'@type': 'text', '@valueURI': 'http://id.loc.gov/authorities/names/n79109786', '#text': 'Knoxville (Tenn.)'}}, 'dateCreated': ['circa 1962', {'@encoding': 'edtf', '@keyDate': 'yes', '@qualifier': 'approximate', '#text': '1962'}]}

	{'place': {'@supplied': 'yes', 'placeTerm': {'@type': 'text', '@valueURI': 'http://id.loc.gov/authorities/names/n79109786', '#text': 'Knoxville (Tenn.)'}}, 'dateCreated': ['1995 March 5', {'@encoding': 'edtf', '@keyDate': 'yes', '#text': '1995-03-05'}]}

	{'place': {'@supplied': 'yes', 'placeTerm': {'@type': 'text', '@valueURI': 'http://id.loc.gov/authorities/names/n79109786', '#text': 'Knoxville (Tenn.)'}}, 'dateCreated': ['1994 March', {'@encoding': 'edtf', '@keyDate': 'yes', '#text': '1994-03'}]}

	{'place': {'@supplied': 'yes', 'placeTerm': {'@type': 'text', '@valueURI': 'http://id.loc.gov/authorities/names/n79109786', '#text': 'Knoxville (Tenn.)'}}, 'dateCreated': ['1989', {'@encoding': 'edtf', '@keyDate': 'yes', '#text': '1989'}]}

	{'place': {'@supplied': 'yes', 'placeTerm': {'@type': 'text', '@valueURI': 'http://id.loc.gov/authorities/names/n79109786', '#text': 'Knoxville (Tenn.)'}}, 'dateCreated': ['1967', {'@encoding': 'edtf', '@keyDate': 'yes', '#text': '1967'}]}

	{'place': {'@supplied': 'yes', 'placeTerm': {'@type': 'text', '@valueURI': 'http://id.loc.gov/authorities/names/n79109786', '#text': 'Knoxville (Tenn.)'}}, 'dateCreated': ['1969', {'@encoding': 'edtf', '@keyDate': 'yes', '#text': '1969'}]}

	{'place': {'@supplied': 'yes', 'placeTerm': {'@type': 'text', '@valueURI': 'http://id.loc.gov/authorities/names/n79109786', '#text': 'Knoxville (Tenn.)'}}, 'dateCreated': ['1992', {'@encoding': 'edtf', '@keyDate': 'yes', '#text': '1992'}]}

	{'place': {'@supplied': 'yes', 'placeTerm': {'@type': 'text', '@valueURI': 'http://id.loc.gov/authorities/names/n79109786', '#text': 'Knoxville (Tenn.)'}}, 'dateCreated': ['2007', {'@encoding': 'edtf', '@keyDate': 'yes', '#text': '2007'}]}

	{'place': {'@supplied': 'yes', 'placeTerm': {'@type': 'text', '@valueURI': 'http://id.loc.gov/authorities/names/n79109786', '#text': 'Knoxville (Tenn.)'}}, 'dateCreated': ['1995', {'@encoding': 'edtf', '@keyDate': 'yes', '#text': '1995'}]}

	{'place': {'@supplied': 'yes', 'placeTerm': {'@type': 'text', '@valueURI': 'http://id.loc.gov/authorities/names/n79109786', '#text': 'Knoxville (Tenn.)'}}, 'dateCreated': ['1994', {'@encoding': 'edtf', '@keyDate': 'yes', '#text': '1994'}]}

	{'place': {'@supplied': 'yes', 'placeTerm': {'@type': 'text', '@valueURI': 'http://id.loc.gov/authorities/names/n79109786', '#text': 'Knoxville (Tenn.)'}}, 'dateCreated': ['1993', {'@encoding': 'edtf', '@keyDate': 'yes', '#text': '1993'}]}

	{'place': {'@supplied': 'yes', 'placeTerm': {'@type': 'text', '@valueURI': 'http://id.loc.gov/authorities/names/n79109786', '#text': 'Knoxville (Tenn.)'}}, 'dateCreated': ['2010', {'@encoding': 'edtf', '@keyDate': 'yes', '#text': '2010'}]}

	{'place': {'@supplied': 'yes', 'placeTerm': {'@type': 'text', '@valueURI': 'http://id.loc.gov/authorities/names/n79109786', '#text': 'Knoxville (Tenn.)'}}, 'dateCreated': ['2005', {'@encoding': 'edtf', '@keyDate': 'yes', '#text': '2005'}]}

	{'place': {'@supplied': 'yes', 'placeTerm': {'@type': 'text', '@valueURI': 'http://id.loc.gov/authorities/names/n79109786', '#text': 'Knoxville (Tenn.)'}}, 'dateCreated': ['1968', {'@encoding': 'edtf', '@keyDate': 'yes', '#text': '1968'}]}

	{'place': {'@supplied': 'yes', 'placeTerm': {'@type': 'text', '@valueURI': 'http://id.loc.gov/authorities/names/n79109786', '#text': 'Knoxville (Tenn.)'}}, 'dateCreated': ['2006', {'@encoding': 'edtf', '@keyDate': 'yes', '#text': '2006'}]}

	{'place': {'@supplied': 'yes', 'placeTerm': {'@type': 'text', '@valueURI': 'http://id.loc.gov/authorities/names/n79109786', '#text': 'Knoxville (Tenn.)'}}, 'dateCreated': ['1997', {'@encoding': 'edtf', '@keyDate': 'yes', '#text': '1997'}]}

	{'place': {'@supplied': 'yes', 'placeTerm': {'@type': 'text', '@valueURI': 'http://id.loc.gov/authorities/names/n79109786', '#text': 'Knoxville (Tenn.)'}}, 'dateCreated': ['1966', {'@encoding': 'edtf', '@keyDate': 'yes', '#text': '1966'}]}

	{'place': {'@supplied': 'yes', 'placeTerm': {'@type': 'text', '@valueURI': 'http://id.loc.gov/authorities/names/n79109786', '#text': 'Knoxville (Tenn.)'}}, 'dateCreated': ['1970', {'@encoding': 'edtf', '@keyDate': 'yes', '#text': '1970'}]}

	{'place': {'@supplied': 'yes', 'placeTerm': {'@type': 'text', '@valueURI': 'http://id.loc.gov/authorities/names/n79109786', '#text': 'Knoxville (Tenn.)'}}, 'dateCreated': ['circa 1970', {'@encoding': 'edtf', '@keyDate': 'yes', '@qualifier': 'approximate', '#text': '1970'}]}

	{'place': {'@supplied': 'yes', 'placeTerm': {'@type': 'text', '@valueURI': 'http://id.loc.gov/authorities/names/n79109786', '#text': 'Knoxville (Tenn.)'}}, 'dateCreated': ['circa 1990', {'@encoding': 'edtf', '@keyDate': 'yes', '@qualifier': 'approximate', '#text': '1990'}]}

	{'place': {'@supplied': 'yes', 'placeTerm': {'@type': 'text', '@valueURI': 'http://id.loc.gov/authorities/names/n79109786', '#text': 'Knoxville (Tenn.)'}}, 'dateCreated': ['circa 2003', {'@encoding': 'edtf', '@keyDate': 'yes', '@qualifier': 'approximate', '#text': '2003'}]}

	{'place': {'@supplied': 'yes', 'placeTerm': {'@type': 'text', '@valueURI': 'http://id.loc.gov/authorities/names/n79109786', '#text': 'Knoxville (Tenn.)'}}, 'dateCreated': ['circa 1960', {'@encoding': 'edtf', '@keyDate': 'yes', '@qualifier': 'approximate', '#text': '1960'}]}

	{'place': {'@supplied': 'yes', 'placeTerm': {'@type': 'text', '@valueURI': 'http://id.loc.gov/authorities/names/n79109786', '#text': 'Knoxville (Tenn.)'}}, 'dateCreated': ['1962', {'@encoding': 'edtf', '@keyDate': 'yes', '#text': '1962'}]}

	{'place': {'@supplied': 'yes', 'placeTerm': {'@type': 'text', '@valueURI': 'http://id.loc.gov/authorities/names/n79109786', '#text': 'Knoxville (Tenn.)'}}, 'dateCreated': ['circa 1980', {'@encoding': 'edtf', '@keyDate': 'yes', '@qualifier': 'approximate', '#text': '1980'}]}

	{'place': {'@supplied': 'yes', 'placeTerm': {'@type': 'text', '@valueURI': 'http://id.loc.gov/authorities/names/n79109786', '#text': 'Knoxville (Tenn.)'}}, 'dateCreated': ['2000', {'@encoding': 'edtf', '@keyDate': 'yes', '#text': '2000'}]}

	{'place': {'@supplied': 'yes', 'placeTerm': {'@type': 'text', '@valueURI': 'http://id.loc.gov/authorities/names/n79109786', '#text': 'Knoxville (Tenn.)'}}, 'dateCreated': ['1982', {'@encoding': 'edtf', '@keyDate': 'yes', '#text': '1982'}]}

	{'place': {'@supplied': 'yes', 'placeTerm': {'@type': 'text', '@valueURI': 'http://id.loc.gov/authorities/names/n79109786', '#text': 'Knoxville (Tenn.)'}}, 'dateCreated': ['1987', {'@encoding': 'edtf', '@keyDate': 'yes', '#text': '1987'}]}

	{'place': {'@supplied': 'yes', 'placeTerm': {'@type': 'text', '@valueURI': 'http://id.loc.gov/authorities/names/n79109786', '#text': 'Knoxville (Tenn.)'}}, 'dateCreated': ['circa 1995', {'@encoding': 'edtf', '@keyDate': 'yes', '@qualifier': 'approximate', '#text': '1995'}]}

	{'place': {'@supplied': 'yes', 'placeTerm': {'@type': 'text', '@valueURI': 'http://id.loc.gov/authorities/names/n79109786', '#text': 'Knoxville (Tenn.)'}}, 'dateCreated': ['circa 2010', {'@encoding': 'edtf', '@keyDate': 'yes', '@qualifier': 'approximate', '#text': '2010'}]}

	{'place': {'@supplied': 'yes', 'placeTerm': {'@type': 'text', '@valueURI': 'http://id.loc.gov/authorities/names/n79109786', '#text': 'Knoxville (Tenn.)'}}, 'dateCreated': ['1976', {'@encoding': 'edtf', '@keyDate': 'yes', '#text': '1976'}]}

	{'place': {'@supplied': 'yes', 'placeTerm': {'@type': 'text', '@valueURI': 'http://id.loc.gov/authorities/names/n79109786', '#text': 'Knoxville (Tenn.)'}}, 'dateCreated': ['2009', {'@encoding': 'edtf', '@keyDate': 'yes', '#text': '2009'}]}

	{'place': {'@supplied': 'yes', 'placeTerm': {'@type': 'text', '@valueURI': 'http://id.loc.gov/authorities/names/n79109786', '#text': 'Knoxville (Tenn.)'}}, 'dateCreated': ['circa 1988', {'@encoding': 'edtf', '@keyDate': 'yes', '@qualifier': 'approximate', '#text': '1988'}]}

	{'place': {'@supplied': 'yes', 'placeTerm': {'@type': 'text', '@valueURI': 'http://id.loc.gov/authorities/names/n79109786', '#text': 'Knoxville (Tenn.)'}}, 'dateCreated': ['1979', {'@encoding': 'edtf', '@keyDate': 'yes', '#text': '1979'}]}

	{'place': {'@supplied': 'yes', 'placeTerm': {'@type': 'text', '@valueURI': 'http://id.loc.gov/authorities/names/n79109786', '#text': 'Knoxville (Tenn.)'}}, 'dateCreated': ['2001', {'@encoding': 'edtf', '@keyDate': 'yes', '#text': '2001'}]}

	{'place': {'@supplied': 'yes', 'placeTerm': {'@type': 'text', '@valueURI': 'http://id.loc.gov/authorities/names/n79109786', '#text': 'Knoxville (Tenn.)'}}, 'dateCreated': ['1956', {'@encoding': 'edtf', '@keyDate': 'yes', '#text': '1956'}]}

	{'place': {'@supplied': 'yes', 'placeTerm': {'@type': 'text', '@valueURI': 'http://id.loc.gov/authorities/names/n79109786', '#text': 'Knoxville (Tenn.)'}}, 'dateCreated': ['1999', {'@encoding': 'edtf', '@keyDate': 'yes', '#text': '1999'}]}

	{'place': {'@supplied': 'yes', 'placeTerm': {'@type': 'text', '@valueURI': 'http://id.loc.gov/authorities/names/n79109786', '#text': 'Knoxville (Tenn.)'}}, 'dateCreated': ['1972', {'@encoding': 'edtf', '@keyDate': 'yes', '#text': '1972'}]}

	{'place': {'@supplied': 'yes', 'placeTerm': {'@type': 'text', '@valueURI': 'http://id.loc.gov/authorities/names/n79109786', '#text': 'Knoxville (Tenn.)'}}, 'dateCreated': ['circa 1997', {'@encoding': 'edtf', '@keyDate': 'yes', '@qualifier': 'approximate', '#text': '1997'}]}

	{'place': {'@supplied': 'yes', 'placeTerm': {'@type': 'text', '@valueURI': 'http://id.loc.gov/authorities/names/n79109786', '#text': 'Knoxville (Tenn.)'}}, 'dateCreated': ['1965', {'@encoding': 'edtf', '@keyDate': 'yes', '#text': '1965'}]}

	{'place': {'@supplied': 'yes', 'placeTerm': {'@type': 'text', '@valueURI': 'http://id.loc.gov/authorities/names/n79109786', '#text': 'Knoxville (Tenn.)'}}, 'dateCreated': ['1961', {'@encoding': 'edtf', '@keyDate': 'yes', '#text': '1961'}]}

	{'place': {'@supplied': 'yes', 'placeTerm': {'@type': 'text', '@valueURI': 'http://id.loc.gov/authorities/names/n79109786', '#text': 'Knoxville (Tenn.)'}}, 'dateCreated': ['1959', {'@encoding': 'edtf', '@keyDate': 'yes', '#text': '1959'}]}

	{'place': {'@supplied': 'yes', 'placeTerm': {'@type': 'text', '@valueURI': 'http://id.loc.gov/authorities/names/n79109786', '#text': 'Knoxville (Tenn.)'}}, 'dateCreated': ['circa 1986', {'@encoding': 'edtf', '@keyDate': 'yes', '@qualifier': 'approximate', '#text': '1986'}]}

	{'place': {'@supplied': 'yes', 'placeTerm': {'@type': 'text', '@valueURI': 'http://id.loc.gov/authorities/names/n79109786', '#text': 'Knoxville (Tenn.)'}}, 'dateCreated': ['circa 1978', {'@encoding': 'edtf', '@keyDate': 'yes', '@qualifier': 'approximate', '#text': '1978'}]}

	{'place': {'@supplied': 'yes', 'placeTerm': {'@type': 'text', '@valueURI': 'http://id.loc.gov/authorities/names/n79109786', '#text': 'Knoxville (Tenn.)'}}, 'dateCreated': ['circa 1959', {'@encoding': 'edtf', '@keyDate': 'yes', '@qualifier': 'approximate', '#text': '1959'}]}

	{'place': {'@supplied': 'yes', 'placeTerm': {'@type': 'text', '@valueURI': 'http://id.loc.gov/authorities/names/n79109786', '#text': 'Knoxville (Tenn.)'}}, 'dateCreated': ['circa 2007', {'@encoding': 'edtf', '@keyDate': 'yes', '@qualifier': 'approximate', '#text': '2007'}]}

	{'place': {'@supplied': 'yes', 'placeTerm': {'@type': 'text', '@valueURI': 'http://id.loc.gov/authorities/names/n79109786', '#text': 'Knoxville (Tenn.)'}}, 'dateCreated': ['circa 1964', {'@encoding': 'edtf', '@keyDate': 'yes', '@qualifier': 'approximate', '#text': '1964'}]}

	{'place': {'@supplied': 'yes', 'placeTerm': {'@type': 'text', '@valueURI': 'http://id.loc.gov/authorities/names/n79109786', '#text': 'Knoxville (Tenn.)'}}, 'dateCreated': ['circa 2011', {'@encoding': 'edtf', '@keyDate': 'yes', '@qualifier': 'approximate', '#text': '2011'}]}

	{'place': {'@supplied': 'yes', 'placeTerm': {'@type': 'text', '@valueURI': 'http://id.loc.gov/authorities/names/n79109786', '#text': 'Knoxville (Tenn.)'}}, 'dateCreated': ['1963', {'@encoding': 'edtf', '@keyDate': 'yes', '#text': '1963'}]}

	{'place': {'@supplied': 'yes', 'placeTerm': {'@type': 'text', '@valueURI': 'http://id.loc.gov/authorities/names/n79109786', '#text': 'Knoxville (Tenn.)'}}, 'dateCreated': ['1951', {'@encoding': 'edtf', '@keyDate': 'yes', '#text': '1951'}]}

	{'place': {'@supplied': 'yes', 'placeTerm': {'@type': 'text', '@valueURI': 'http://id.loc.gov/authorities/names/n79109786', '#text': 'Knoxville (Tenn.)'}}, 'dateCreated': ['circa 19565', {'@encoding': 'edtf', '@keyDate': 'yes', '@qualifier': 'approximate', '#text': '1956'}]}

	{'place': {'@supplied': 'yes', 'placeTerm': {'@type': 'text', '@valueURI': 'http://id.loc.gov/authorities/names/n79109786', '#text': 'Knoxville (Tenn.)'}}, 'dateCreated': ['1973', {'@encoding': 'edtf', '@keyDate': 'yes', '#text': '1973'}]}

	{'place': {'@supplied': 'yes', 'placeTerm': {'@type': 'text', '@valueURI': 'http://id.loc.gov/authorities/names/n79109786', '#text': 'Knoxville (Tenn.)'}}, 'dateCreated': ['circa 1972', {'@encoding': 'edtf', '@keyDate': 'yes', '@qualifier': 'approximate', '#text': '1972'}]}

	{'place': {'@supplied': 'yes', 'placeTerm': {'@type': 'text', '@valueURI': 'http://id.loc.gov/authorities/names/n79109786', '#text': 'Knoxville (Tenn.)'}}, 'dateCreated': ['2002', {'@encoding': 'edtf', '@keyDate': 'yes', '#text': '2002'}]}

	{'place': {'@supplied': 'yes', 'placeTerm': {'@type': 'text', '@valueURI': 'http://id.loc.gov/authorities/names/n79109786', '#text': 'Knoxville (Tenn.)'}}, 'dateCreated': ['circa 1985', {'@encoding': 'edtf', '@keyDate': 'yes', '@qualifier': 'approximate', '#text': '1985'}]}

	{'place': {'@supplied': 'yes', 'placeTerm': {'@type': 'text', '@valueURI': 'http://id.loc.gov/authorities/names/n79109786', '#text': 'Knoxville (Tenn.)'}}, 'dateCreated': ['1991', {'@encoding': 'edtf', '@keyDate': 'yes', '#text': '1991'}]}

	{'place': {'@supplied': 'yes', 'placeTerm': {'@type': 'text', '@valueURI': 'http://id.loc.gov/authorities/names/n79109786', '#text': 'Knoxville (Tenn.)'}}, 'dateCreated': ['circa 1994', {'@encoding': 'edtf', '@keyDate': 'yes', '@qualifier': 'approximate', '#text': '1994'}]}

	{'place': {'@supplied': 'yes', 'placeTerm': {'@type': 'text', '@valueURI': 'http://id.loc.gov/authorities/names/n79109786', '#text': 'Knoxville (Tenn.)'}}, 'dateCreated': ['circa 1992', {'@encoding': 'edtf', '@keyDate': 'yes', '@qualifier': 'approximate', '#text': '1992'}]}

	{'place': {'@supplied': 'yes', 'placeTerm': {'@type': 'text', '@valueURI': 'http://id.loc.gov/authorities/names/n79109786', '#text': 'Knoxville (Tenn.)'}}, 'dateCreated': ['circa 1967', {'@encoding': 'edtf', '@keyDate': 'yes', '@qualifier': 'approximate', '#text': '1967'}]}

	{'place': {'@supplied': 'yes', 'placeTerm': {'@type': 'text', '@valueURI': 'http://id.loc.gov/authorities/names/n79109786', '#text': 'Knoxville (Tenn.)'}}, 'dateCreated': ['circa 1961', {'@encoding': 'edtf', '@keyDate': 'yes', '@qualifier': 'approximate', '#text': '1961'}]}

	{'place': {'@supplied': 'yes', 'placeTerm': {'@type': 'text', '@valueURI': 'http://id.loc.gov/authorities/names/n79109786', '#text': 'Knoxville (Tenn.)'}}, 'dateCreated': ['circa 1993', {'@encoding': 'edtf', '@keyDate': 'yes', '@qualifier': 'approximate', '#text': '1993'}]}

	{'place': {'@supplied': 'yes', 'placeTerm': {'@type': 'text', '@valueURI': 'http://id.loc.gov/authorities/names/n79109786', '#text': 'Knoxville (Tenn.)'}}, 'dateCreated': ['circa 1984', {'@encoding': 'edtf', '@keyDate': 'yes', '@qualifier': 'approximate', '#text': '1984'}]}

	{'place': {'@supplied': 'yes', 'placeTerm': {'@type': 'text', '@valueURI': 'http://id.loc.gov/authorities/names/n79109786', '#text': 'Knoxville (Tenn.)'}}, 'dateCreated': ['1994 February 23', {'@encoding': 'edtf', '@keyDate': 'yes', '#text': '1994-02-23'}]}

	{'place': {'@supplied': 'yes', 'placeTerm': {'@type': 'text', '@valueURI': 'http://id.loc.gov/authorities/names/n79109786', '#text': 'Knoxville (Tenn.)'}}, 'dateCreated': ['1994 June 22', {'@encoding': 'edtf', '@keyDate': 'yes', '#text': '1994-06-22'}]}

	{'place': {'@supplied': 'yes', 'placeTerm': {'@type': 'text', '@valueURI': 'http://id.loc.gov/authorities/names/n79109786', '#text': 'Knoxville (Tenn.)'}}, 'dateCreated': ['circa 1969', {'@encoding': 'edtf', '@keyDate': 'yes', '@qualifier': 'approximate', '#text': '1969'}]}

	{'place': {'@supplied': 'yes', 'placeTerm': {'@type': 'text', '@valueURI': 'http://id.loc.gov/authorities/names/n79109786', '#text': 'Knoxville (Tenn.)'}}, 'dateCreated': ['1993 January 4', {'@encoding': 'edtf', '@keyDate': 'yes', '#text': '1993-01-04'}]}

	{'place': {'@supplied': 'yes', 'placeTerm': {'@type': 'text', '@valueURI': 'http://id.loc.gov/authorities/names/n79109786', '#text': 'Knoxville (Tenn.)'}}, 'dateCreated': ['1984', {'@encoding': 'edtf', '@keyDate': 'yes', '#text': '1984'}]}

	{'place': {'@supplied': 'yes', 'placeTerm': {'@type': 'text', '@valueURI': 'http://id.loc.gov/authorities/names/n79109786', '#text': 'Knoxville (Tenn.)'}}, 'dateCreated': ['circa 2004', {'@encoding': 'edtf', '@keyDate': 'yes', '@qualifier': 'approximate', '#text': '2004'}]}

	{'place': {'@supplied': 'yes', 'placeTerm': {'@type': 'text', '@valueURI': 'http://id.loc.gov/authorities/names/n79109786', '#text': 'Knoxville (Tenn.)'}}, 'dateCreated': ['circa 1987', {'@encoding': 'edtf', '@keyDate': 'yes', '@qualifier': 'approximate', '#text': '1987'}]}

	{'place': {'@supplied': 'yes', 'placeTerm': {'@type': 'text', '@valueURI': 'http://id.loc.gov/authorities/names/n79109786', '#text': 'Knoxville (Tenn.)'}}, 'dateCreated': ['circa 1991', {'@encoding': 'edtf', '@keyDate': 'yes', '@qualifier': 'approximate', '#text': '1991'}]}

	{'place': {'@supplied': 'yes', 'placeTerm': {'@type': 'text', '@valueURI': 'http://id.loc.gov/authorities/names/n79109786', '#text': 'Knoxville (Tenn.)'}}, 'dateCreated': ['1964', {'@encoding': 'edtf', '@keyDate': 'yes', '#text': '1964'}]}

	{'place': {'@supplied': 'yes', 'placeTerm': {'@type': 'text', '@valueURI': 'http://id.loc.gov/authorities/names/n79109786', '#text': 'Knoxville (Tenn.)'}}, 'dateCreated': ['1994 March 2', {'@encoding': 'edtf', '@keyDate': 'yes', '#text': '1994-03-02'}]}

	{'place': {'@supplied': 'yes', 'placeTerm': {'@type': 'text', '@valueURI': 'http://id.loc.gov/authorities/names/n79109786', '#text': 'Knoxville (Tenn.)'}}, 'dateCreated': ['1995 August 8', {'@encoding': 'edtf', '@keyDate': 'yes', '#text': '1995-07-08'}]}

	{'place': {'@supplied': 'yes', 'placeTerm': {'@type': 'text', '@valueURI': 'http://id.loc.gov/authorities/names/n79109786', '#text': 'Knoxville (Tenn.)'}}, 'dateCreated': ['2007 July 24', {'@encoding': 'edtf', '@keyDate': 'yes', '#text': '2007-07-24'}]}

	{'place': {'@supplied': 'yes', 'placeTerm': {'@type': 'text', '@valueURI': 'http://id.loc.gov/authorities/names/n79109786', '#text': 'Knoxville (Tenn.)'}}, 'dateCreated': ['1969 November 29', {'@encoding': 'edtf', '@keyDate': 'yes', '#text': '1969-11-29'}]}

	{'place': {'@supplied': 'yes', 'placeTerm': {'@type': 'text', '@valueURI': 'http://id.loc.gov/authorities/names/n79109786', '#text': 'Knoxville (Tenn.)'}}, 'dateCreated': ['1971 December 4', {'@encoding': 'edtf', '@keyDate': 'yes', '#text': '1971-12-04'}]}

	{'place': {'@supplied': 'yes', 'placeTerm': {'@type': 'text', '@valueURI': 'http://id.loc.gov/authorities/names/n79109786', '#text': 'Knoxville (Tenn.)'}}, 'dateCreated': ['1971 September 18', {'@encoding': 'edtf', '@keyDate': 'yes', '#text': '1971-09-18'}]}

	{'place': {'@supplied': 'yes', 'placeTerm': {'@type': 'text', '@valueURI': 'http://id.loc.gov/authorities/names/n79109786', '#text': 'Knoxville (Tenn.)'}}, 'dateCreated': ['1967 December 2', {'@encoding': 'edtf', '@keyDate': 'yes', '#text': '1967-12-02'}]}

	{'place': {'@supplied': 'yes', 'placeTerm': {'@type': 'text', '@valueURI': 'http://id.loc.gov/authorities/names/n79109786', '#text': 'Knoxville (Tenn.)'}}, 'dateCreated': ['1980 October 25', {'@encoding': 'edtf', '@keyDate': 'yes', '#text': '1980-10-25'}]}

	{'place': {'@supplied': 'yes', 'placeTerm': {'@type': 'text', '@valueURI': 'http://id.loc.gov/authorities/names/n79109786', '#text': 'Knoxville (Tenn.)'}}, 'dateCreated': ['1983', {'@encoding': 'edtf', '@keyDate': 'yes', '#text': '1983'}]}

	{'place': {'@supplied': 'yes', 'placeTerm': {'@type': 'text', '@valueURI': 'http://id.loc.gov/authorities/names/n79109786', '#text': 'Knoxville (Tenn.)'}}, 'dateCreated': ['circa 1955', {'@encoding': 'edtf', '@keyDate': 'yes', '@qualifier': 'approximate', '#text': '1955'}]}

	{'place': {'@supplied': 'yes', 'placeTerm': {'@type': 'text', '@valueURI': 'http://id.loc.gov/authorities/names/n79109786', '#text': 'Knoxville (Tenn.)'}}, 'dateCreated': ['circa 1950', {'@encoding': 'edtf', '@keyDate': 'yes', '@qualifier': 'approximate', '#text': '1950'}]}

	{'place': {'@supplied': 'yes', 'placeTerm': {'@type': 'text', '@valueURI': 'http://id.loc.gov/authorities/names/n79109786', '#text': 'Knoxville (Tenn.)'}}, 'dateCreated': ['1977', {'@encoding': 'edtf', '@keyDate': 'yes', '#text': '1977'}]}

	{'place': {'@supplied': 'yes', 'placeTerm': {'@type': 'text', '@valueURI': 'http://id.loc.gov/authorities/names/n79109786', '#text': 'Knoxville (Tenn.)'}}, 'dateCreated': ['circa 1989', {'@encoding': 'edtf', '@keyDate': 'yes', '@qualifier': 'approximate', '#text': '1989'}]}

	{'place': {'@supplied': 'yes', 'placeTerm': {'@type': 'text', '@valueURI': 'http://id.loc.gov/authorities/names/n79109786', '#text': 'Knoxville (Tenn.)'}}, 'dateCreated': ['1990', {'@encoding': 'edtf', '@keyDate': 'yes', '#text': '1990'}]}

	{'place': {'@supplied': 'yes', 'placeTerm': {'@type': 'text', '@valueURI': 'http://id.loc.gov/authorities/names/n79109786', '#text': 'Knoxville (Tenn.)'}}, 'dateCreated': ['circa 1958', {'@encoding': 'edtf', '@keyDate': 'yes', '@qualifier': 'approximate', '#text': '1958'}]}

	{'place': {'@supplied': 'yes', 'placeTerm': {'@type': 'text', '@valueURI': 'http://id.loc.gov/authorities/names/n79109786', '#text': 'Knoxville (Tenn.)'}}, 'dateCreated': ['circa 1963', {'@encoding': 'edtf', '@keyDate': 'yes', '@qualifier': 'approximate', '#text': '1963'}]}

	{'place': {'@supplied': 'yes', 'placeTerm': {'@type': 'text', '@valueURI': 'http://id.loc.gov/authorities/names/n79109786', '#text': 'Knoxville (Tenn.)'}}, 'dateCreated': ['circa 1976', {'@encoding': 'edtf', '@keyDate': 'yes', '@qualifier': 'approximate', '#text': '1976'}]}

	{'place': {'@supplied': 'yes', 'placeTerm': {'@type': 'text', '@valueURI': 'http://id.loc.gov/authorities/names/n79109786', '#text': 'Knoxville (Tenn.)'}}, 'dateCreated': ['circa 1956', {'@encoding': 'edtf', '@keyDate': 'yes', '@qualifier': 'approximate', '#text': '1956'}]}

	{'place': {'@supplied': 'yes', 'placeTerm': {'@type': 'text', '@valueURI': 'http://id.loc.gov/authorities/names/n79109786', '#text': 'Knoxville (Tenn.)'}}, 'dateCreated': ['circa 2001-2011', {'@encoding': 'edtf', '@keyDate': 'yes', '@point': 'start', '@qualifier': 'approximate', '#text': '2001'}, {'@encoding': 'edtf', '@keyDate': 'yes', '@point': 'end', '#text': '2011'}]}

	{'place': {'@supplied': 'yes', 'placeTerm': {'@type': 'text', '@valueURI': 'http://id.loc.gov/authorities/names/n79109786', '#text': 'Knoxville (Tenn.)'}}, 'dateCreated': ['circa 1966', {'@encoding': 'edtf', '@keyDate': 'yes', '@qualifier': 'approximate', '#text': '1966'}]}

	{'place': {'@supplied': 'yes', 'placeTerm': {'@type': 'text', '@valueURI': 'http://id.loc.gov/authorities/names/n79109786', '#text': 'Knoxville (Tenn.)'}}, 'dateCreated': ['circa 1981', {'@encoding': 'edtf', '@keyDate': 'yes', '@qualifier': 'approximate', '#text': '1981'}]}

	{'place': {'@supplied': 'yes', 'placeTerm': {'@type': 'text', '@valueURI': 'http://id.loc.gov/authorities/names/n79109786', '#text': 'Knoxville (Tenn.)'}}, 'dateCreated': ['circa 1974', {'@encoding': 'edtf', '@keyDate': 'yes', '@qualifier': 'approximate', '#text': '1974'}]}

	{'place': {'@supplied': 'yes', 'placeTerm': {'@type': 'text', '@valueURI': 'http://id.loc.gov/authorities/names/n79109786', '#text': 'Knoxville (Tenn.)'}}, 'dateCreated': ['circa 2002', {'@encoding': 'edtf', '@keyDate': 'yes', '@qualifier': 'approximate', '#text': '2002'}]}

	{'place': {'@supplied': 'yes', 'placeTerm': {'@type': 'text', '@valueURI': 'http://id.loc.gov/authorities/names/n79109786', '#text': 'Knoxville (Tenn.)'}}, 'dateCreated': ['circa 2001', {'@encoding': 'edtf', '@keyDate': 'yes', '@qualifier': 'approximate', '#text': '2001'}]}

	{'place': {'@supplied': 'yes', 'placeTerm': {'@type': 'text', '@valueURI': 'http://id.loc.gov/authorities/names/n79109786', '#text': 'Knoxville (Tenn.)'}}, 'dateCreated': ['1958', {'@encoding': 'edtf', '@keyDate': 'yes', '#text': '1958'}]}

	{'place': {'@supplied': 'yes', 'placeTerm': {'@type': 'text', '@valueURI': 'http://id.loc.gov/authorities/names/n79109786', '#text': 'Knoxville (Tenn.)'}}, 'dateCreated': ['1974', {'@encoding': 'edtf', '@keyDate': 'yes', '#text': '1974'}]}

	{'place': {'@supplied': 'yes', 'placeTerm': {'@type': 'text', '@valueURI': 'http://id.loc.gov/authorities/names/n79109786', '#text': 'Knoxville (Tenn.)'}}, 'dateCreated': ['1975', {'@encoding': 'edtf', '@keyDate': 'yes', '#text': '1975'}]}

	{'place': {'@supplied': 'yes', 'placeTerm': {'@type': 'text', '@valueURI': 'http://id.loc.gov/authorities/names/n79109786', '#text': 'Knoxville (Tenn.)'}}, 'dateCreated': ['1960', {'@encoding': 'edtf', '@keyDate': 'yes', '#text': '1960'}]}

	{'dateCreated': ['Undated', {'@encoding': 'edtf', '@keyDate': 'yes', '@point': 'start', '@qualifier': 'inferred', '#text': '1940'}, {'@encoding': 'edtf', '@keyDate': 'yes', '@point': 'end', '#text': '1969'}]}

	{'dateCreated': ['1959-10-26', {'@encoding': 'edtf', '@keyDate': 'yes', '#text': '1959-10-26'}]}

	{'dateCreated': ['1953-06', {'@encoding': 'edtf', '@keyDate': 'yes', '#text': '1953-06'}]}

	{'dateCreated': ['1953-09-28', {'@encoding': 'edtf', '@keyDate': 'yes', '#text': '1953-09-28'}]}

	{'dateCreated': ['1957-08-28', {'@encoding': 'edtf', '@keyDate': 'yes', '#text': '1957-08-28'}]}

	{'dateCreated': ['1950-09-28', {'@encoding': 'edtf', '@keyDate': 'yes', '#text': '1950-09-28'}]}

	{'dateCreated': ['1954-08-25', {'@encoding': 'edtf', '@keyDate': 'yes', '#text': '1954-08-25'}]}

	{'dateCreated': ['1968-10', {'@encoding': 'edtf', '@keyDate': 'yes', '#text': '1968-10'}]}

	{'dateCreated': ['1960-06-10', {'@encoding': 'edtf', '@keyDate': 'yes', '#text': '1960-06-10'}]}

	{'dateCreated': ['1954-10-31', {'@encoding': 'edtf', '@keyDate': 'yes', '#text': '1954-10-31'}]}

	{'dateCreated': ['1956-10-22', {'@encoding': 'edtf', '@keyDate': 'yes', '#text': '1956-10-22'}]}

	{'dateCreated': ['1958-10-24', {'@encoding': 'edtf', '@keyDate': 'yes', '#text': '1958-10-24'}]}

	{'dateCreated': ['1964-01', {'@encoding': 'edtf', '@keyDate': 'yes', '#text': '1964-01'}]}

	{'dateCreated': ['1973-01', {'@encoding': 'edtf', '@keyDate': 'yes', '#text': '1973-01'}]}

	{'dateCreated': ['1954-03-02', {'@encoding': 'edtf', '@keyDate': 'yes', '#text': '1954-03-02'}]}

	{'dateCreated': ['1960-11-05', {'@encoding': 'edtf', '@keyDate': 'yes', '#text': '1960-11-05'}]}

	{'dateCreated': ['1956-12-14', {'@encoding': 'edtf', '@keyDate': 'yes', '#text': '1956-12-14'}]}

	{'dateCreated': ['1954-10-15', {'@encoding': 'edtf', '@keyDate': 'yes', '#text': '1954-10-15'}]}

	{'dateCreated': ['1953-09-27', {'@encoding': 'edtf', '@keyDate': 'yes', '#text': '1953-09-27'}]}

	{'dateCreated': ['1954-06-01', {'@encoding': 'edtf', '@keyDate': 'yes', '#text': '1954-06-01'}]}

	{'dateCreated': ['1958-11-07', {'@encoding': 'edtf', '@keyDate': 'yes', '#text': '1958-11-07'}]}

	{'dateCreated': ['1957-10-20', {'@encoding': 'edtf', '@keyDate': 'yes', '#text': '1957-10-20'}]}

	{'dateCreated': ['1959-09-28', {'@encoding': 'edtf', '@keyDate': 'yes', '#text': '1959-09-28'}]}

	{'dateCreated': ['1960-10-27', {'@encoding': 'edtf', '@keyDate': 'yes', '#text': '1960-10-27'}]}

	{'dateCreated': ['1954-10-25', {'@encoding': 'edtf', '@keyDate': 'yes', '#text': '1954-10-25'}]}

	{'dateCreated': ['1953-01', {'@encoding': 'edtf', '@keyDate': 'yes', '#text': '1953-01'}]}

	{'dateCreated': ['1960-03', {'@encoding': 'edtf', '@keyDate': 'yes', '#text': '1960-03'}]}

	{'dateCreated': ['1972-05-22', {'@encoding': 'edtf', '@keyDate': 'yes', '#text': '1972-05-22'}]}

	{'dateCreated': ['1952-10-05', {'@encoding': 'edtf', '@keyDate': 'yes', '#text': '1952-10-05'}]}

	{'dateCreated': ['1958-03-16', {'@encoding': 'edtf', '@keyDate': 'yes', '#text': '1958-03-16'}]}

	{'dateCreated': ['1953-02', {'@encoding': 'edtf', '@keyDate': 'yes', '#text': '1953-02'}]}

	{'dateCreated': ['1959-09-27', {'@encoding': 'edtf', '@keyDate': 'yes', '#text': '1959-09-27'}]}

	{'dateCreated': ['1955-10-25', {'@encoding': 'edtf', '@keyDate': 'yes', '#text': '1955-10-25'}]}

	{'dateCreated': ['1954-02-05', {'@encoding': 'edtf', '@keyDate': 'yes', '#text': '1954-02-05'}]}

	{'dateCreated': [None, {'@encoding': 'edtf', '@keyDate': 'yes'}]}

	{'dateCreated': ['1952', {'@encoding': 'edtf', '@keyDate': 'yes', '#text': '1952'}]}

	{'dateCreated': ['1954-05-16', {'@encoding': 'edtf', '@keyDate': 'yes', '#text': '1954-05-16'}]}

	{'dateCreated': ['1958-10-29', {'@encoding': 'edtf', '@keyDate': 'yes', '#text': '1958-10-29'}]}

	{'dateCreated': ['1952-09', {'@encoding': 'edtf', '@keyDate': 'yes', '#text': '1952-09'}]}

	{'dateCreated': ['1958-10-15', {'@encoding': 'edtf', '@keyDate': 'yes', '#text': '1958-10-15'}]}

	{'dateCreated': ['1958-10-23', {'@encoding': 'edtf', '@keyDate': 'yes', '#text': '1958-10-23'}]}

	{'dateCreated': ['1954-06-15', {'@encoding': 'edtf', '@keyDate': 'yes', '#text': '1954-06-15'}]}

	{'dateCreated': ['1957-06-12', {'@encoding': 'edtf', '@keyDate': 'yes', '#text': '1957-06-12'}]}

	{'dateCreated': ['1959-10-15', {'@encoding': 'edtf', '@keyDate': 'yes', '#text': '1959-10-15'}]}

	{'dateCreated': ['1953-10-03', {'@encoding': 'edtf', '@keyDate': 'yes', '#text': '1953-10-03'}]}

	{'dateCreated': ['1954-10-27', {'@encoding': 'edtf', '@keyDate': 'yes', '#text': '1954-10-27'}]}

	{'dateCreated': ['1960-10-05', {'@encoding': 'edtf', '@keyDate': 'yes', '#text': '1960-10-05'}]}

	{'dateCreated': ['1954-10-30', {'@encoding': 'edtf', '@keyDate': 'yes', '#text': '1954-10-30'}]}

	{'dateCreated': ['1959-10-01', {'@encoding': 'edtf', '@keyDate': 'yes', '#text': '1959-10-01'}]}

	{'dateCreated': ['1956-06-12', {'@encoding': 'edtf', '@keyDate': 'yes', '#text': '1956-06-12'}]}

	{'dateCreated': ['1960-11-03', {'@encoding': 'edtf', '@keyDate': 'yes', '#text': '1960-11-03'}]}

	{'dateCreated': ['1962-10', {'@encoding': 'edtf', '@keyDate': 'yes', '#text': '1962-10'}]}

	{'dateCreated': ['1956-10-29', {'@encoding': 'edtf', '@keyDate': 'yes', '#text': '1956-10-29'}]}

	{'dateCreated': ['1954-10-28', {'@encoding': 'edtf', '@keyDate': 'yes', '#text': '1954-10-28'}]}

	{'dateCreated': ['1957-06-02', {'@encoding': 'edtf', '@keyDate': 'yes', '#text': '1957-06-02'}]}

	{'dateCreated': ['1966-10', {'@encoding': 'edtf', '@keyDate': 'yes', '#text': '1966-10'}]}

	{'dateCreated': ['1958-11-25', {'@encoding': 'edtf', '@keyDate': 'yes', '#text': '1958-11-25'}]}

	{'dateCreated': ['1956-10-31', {'@encoding': 'edtf', '@keyDate': 'yes', '#text': '1956-10-31'}]}

	{'dateCreated': ['1953-10-18', {'@encoding': 'edtf', '@keyDate': 'yes', '#text': '1953-10-18'}]}

	{'dateCreated': ['1958-10-22', {'@encoding': 'edtf', '@keyDate': 'yes', '#text': '1958-10-22'}]}

	{'dateCreated': ['1954-01-22', {'@encoding': 'edtf', '@keyDate': 'yes', '#text': '1954-01-22'}]}

	{'dateCreated': ['1954-01-08', {'@encoding': 'edtf', '@keyDate': 'yes', '#text': '1954-01-08'}]}

	{'dateCreated': ['1957-10-18', {'@encoding': 'edtf', '@keyDate': 'yes', '#text': '1957-10-18'}]}

	{'dateCreated': ['1953-11-27', {'@encoding': 'edtf', '@keyDate': 'yes', '#text': '1953-11-27'}]}

	{'dateCreated': ['1955-10-16', {'@encoding': 'edtf', '@keyDate': 'yes', '#text': '1955-10-16'}]}

	{'dateCreated': ['1960-04-22', {'@encoding': 'edtf', '@keyDate': 'yes', '#text': '1960-04-22'}]}

	{'dateCreated': ['1964-10', {'@encoding': 'edtf', '@keyDate': 'yes', '#text': '1964-10'}]}

	{'dateCreated': ['1953-06-08', {'@encoding': 'edtf', '@keyDate': 'yes', '#text': '1953-06-08'}]}

	{'dateCreated': ['1959-11-04', {'@encoding': 'edtf', '@keyDate': 'yes', '#text': '1959-11-04'}]}

	{'dateCreated': ['1954-07-10', {'@encoding': 'edtf', '@keyDate': 'yes', '#text': '1954-07-10'}]}

	{'dateCreated': ['1957-01-17', {'@encoding': 'edtf', '@keyDate': 'yes', '#text': '1957-01-17'}]}

	{'dateCreated': ['1959-05', {'@encoding': 'edtf', '@keyDate': 'yes', '#text': '1959-05'}]}

	{'dateCreated': ['1954-06-16', {'@encoding': 'edtf', '@keyDate': 'yes', '#text': '1954-06-16'}]}

	{'dateCreated': ['1960-10-20', {'@encoding': 'edtf', '@keyDate': 'yes', '#text': '1960-10-20'}]}

	{'dateCreated': ['1959-04', {'@encoding': 'edtf', '@keyDate': 'yes', '#text': '1959-04'}]}

	{'dateCreated': ['1953-10-20', {'@encoding': 'edtf', '@keyDate': 'yes', '#text': '1953-10-20'}]}

	{'dateCreated': ['1953-10-23', {'@encoding': 'edtf', '@keyDate': 'yes', '#text': '1953-10-23'}]}

	{'dateCreated': ['1954-04-05', {'@encoding': 'edtf', '@keyDate': 'yes', '#text': '1954-04-05'}]}

	{'dateCreated': ['1956-10-24', {'@encoding': 'edtf', '@keyDate': 'yes', '#text': '1956-10-24'}]}

	{'dateCreated': ['1957-06-28', {'@encoding': 'edtf', '@keyDate': 'yes', '#text': '1957-06-28'}]}

	{'dateCreated': ['1953-10-22', {'@encoding': 'edtf', '@keyDate': 'yes', '#text': '1953-10-22'}]}

	{'dateCreated': ['1953-10-19', {'@encoding': 'edtf', '@keyDate': 'yes', '#text': '1953-10-19'}]}

	{'dateCreated': ['1954-04-02', {'@encoding': 'edtf', '@keyDate': 'yes', '#text': '1954-04-02'}]}

	{'dateCreated': ['1958-11-09', {'@encoding': 'edtf', '@keyDate': 'yes', '#text': '1958-11-09'}]}

	{'dateCreated': ['1955-10-29', {'@encoding': 'edtf', '@keyDate': 'yes', '#text': '1955-10-29'}]}

	{'dateCreated': ['1953-10-17', {'@encoding': 'edtf', '@keyDate': 'yes', '#text': '1953-10-17'}]}

	{'dateCreated': ['1954-08-22', {'@encoding': 'edtf', '@keyDate': 'yes', '#text': '1954-08-22'}]}

	{'dateCreated': ['1954-11-03', {'@encoding': 'edtf', '@keyDate': 'yes', '#text': '1954-11-03'}]}

	{'dateCreated': ['1957-12-10', {'@encoding': 'edtf', '@keyDate': 'yes', '#text': '1957-12-10'}]}

	{'dateCreated': ['1954-10-06', {'@encoding': 'edtf', '@keyDate': 'yes', '#text': '1954-10-06'}]}

	{'dateCreated': ['1956-06-28', {'@encoding': 'edtf', '@keyDate': 'yes', '#text': '1956-06-28'}]}

	{'dateCreated': ['1959-10-27', {'@encoding': 'edtf', '@keyDate': 'yes', '#text': '1959-10-27'}]}

	{'dateCreated': ['1954-10-01', {'@encoding': 'edtf', '@keyDate': 'yes', '#text': '1954-10-01'}]}

	{'dateCreated': ['1955-05-19', {'@encoding': 'edtf', '@keyDate': 'yes', '#text': '1955-05-19'}]}

	{'dateCreated': ['1957-10-31', {'@encoding': 'edtf', '@keyDate': 'yes', '#text': '1957-10-31'}]}

	{'dateCreated': ['1955-08-20', {'@encoding': 'edtf', '@keyDate': 'yes', '#text': '1955-08-20'}]}

	{'dateCreated': ['1955-06-12', {'@encoding': 'edtf', '@keyDate': 'yes', '#text': '1955-06-12'}]}

	{'dateCreated': ['1954-06-08', {'@encoding': 'edtf', '@keyDate': 'yes', '#text': '1954-06-08'}]}

	{'dateCreated': ['1959-10-20', {'@encoding': 'edtf', '@keyDate': 'yes', '#text': '1959-10-20'}]}

	{'dateCreated': ['1954-08', {'@encoding': 'edtf', '@keyDate': 'yes', '#text': '1954-08'}]}

	{'dateCreated': ['1954-10-22', {'@encoding': 'edtf', '@keyDate': 'yes', '#text': '1954-10-22'}]}

	{'dateCreated': ['1954-10-11', {'@encoding': 'edtf', '@keyDate': 'yes', '#text': '1954-10-11'}]}

	{'dateCreated': ['1956-06-26', {'@encoding': 'edtf', '@keyDate': 'yes', '#text': '1956-06-26'}]}

	{'dateCreated': ['1953-10-21', {'@encoding': 'edtf', '@keyDate': 'yes', '#text': '1953-10-21'}]}

	{'dateCreated': ['1954-06-02', {'@encoding': 'edtf', '@keyDate': 'yes', '#text': '1954-06-02'}]}

	{'dateCreated': ['1954-07-06', {'@encoding': 'edtf', '@keyDate': 'yes', '#text': '1954-07-06'}]}

	{'dateCreated': ['1955-05-18', {'@encoding': 'edtf', '@keyDate': 'yes', '#text': '1955-05-18'}]}

	{'dateCreated': ['1954-10-20', {'@encoding': 'edtf', '@keyDate': 'yes', '#text': '1954-10-20'}]}

	{'dateCreated': ['1958-06-13', {'@encoding': 'edtf', '@keyDate': 'yes', '#text': '1958-06-13'}]}

	{'dateCreated': ['1956-06-25', {'@encoding': 'edtf', '@keyDate': 'yes', '#text': '1956-06-25'}]}

	{'dateCreated': ['1953-07-15', {'@encoding': 'edtf', '@keyDate': 'yes', '#text': '1953-07-15'}]}

	{'dateCreated': ['1961-11-03', {'@encoding': 'edtf', '@keyDate': 'yes', '#text': '1961-11-03'}]}

	{'dateCreated': ['1975-01', {'@encoding': 'edtf', '@keyDate': 'yes', '#text': '1975-01'}]}

	{'dateCreated': ['1958-12-17', {'@encoding': 'edtf', '@keyDate': 'yes', '#text': '1958-12-17'}]}

	{'dateCreated': ['1953-07-22', {'@encoding': 'edtf', '@keyDate': 'yes', '#text': '1953-07-22'}]}

	{'dateCreated': ['1974-10', {'@encoding': 'edtf', '@keyDate': 'yes', '#text': '1974-10'}]}

	{'dateCreated': ['1959-11-02', {'@encoding': 'edtf', '@keyDate': 'yes', '#text': '1959-11-02'}]}

	{'dateCreated': ['1955-10-26', {'@encoding': 'edtf', '@keyDate': 'yes', '#text': '1955-10-26'}]}

	{'dateCreated': ['1958-10-30', {'@encoding': 'edtf', '@keyDate': 'yes', '#text': '1958-10-30'}]}

	{'dateCreated': ['1952-10', {'@encoding': 'edtf', '@keyDate': 'yes', '#text': '1952-10'}]}

	{'dateCreated': ['1956-11-02', {'@encoding': 'edtf', '@keyDate': 'yes', '#text': '1956-11-02'}]}

	{'dateCreated': ['1953-12-16', {'@encoding': 'edtf', '@keyDate': 'yes', '#text': '1953-12-16'}]}

	{'dateCreated': ['1975-10', {'@encoding': 'edtf', '@keyDate': 'yes', '#text': '1975-10'}]}

	{'dateCreated': ['1958-05-14', {'@encoding': 'edtf', '@keyDate': 'yes', '#text': '1958-05-14'}]}

	{'dateCreated': ['1960-10-24', {'@encoding': 'edtf', '@keyDate': 'yes', '#text': '1960-10-24'}]}

	{'dateCreated': ['1960-04-29', {'@encoding': 'edtf', '@keyDate': 'yes', '#text': '1960-04-29'}]}

	{'dateCreated': ['1967-06', {'@encoding': 'edtf', '@keyDate': 'yes', '#text': '1967-06'}]}

	{'dateCreated': ['1960-05-01', {'@encoding': 'edtf', '@keyDate': 'yes', '#text': '1960-05-01'}]}

	{'dateCreated': ['1955-04-17', {'@encoding': 'edtf', '@keyDate': 'yes', '#text': '1955-04-17'}]}

	{'dateCreated': ['1954-04-21', {'@encoding': 'edtf', '@keyDate': 'yes', '#text': '1954-04-21'}]}

	{'dateCreated': ['1957-05-12', {'@encoding': 'edtf', '@keyDate': 'yes', '#text': '1957-05-12'}]}

	{'dateCreated': ['1967-04', {'@encoding': 'edtf', '@keyDate': 'yes', '#text': '1967-04'}]}

	{'dateCreated': ['1974-04', {'@encoding': 'edtf', '@keyDate': 'yes', '#text': '1974-04'}]}

	{'dateCreated': ['1956-09-30', {'@encoding': 'edtf', '@keyDate': 'yes', '#text': '1956-09-30'}]}

	{'dateCreated': ['1963-04-14', {'@encoding': 'edtf', '@keyDate': 'yes', '#text': '1963-04-14'}]}

	{'dateCreated': ['1968-04', {'@encoding': 'edtf', '@keyDate': 'yes', '#text': '1968-04'}]}

	{'dateCreated': ['1960-05-10', {'@encoding': 'edtf', '@keyDate': 'yes', '#text': '1960-05-10'}]}

	{'dateCreated': ['1956-04-28', {'@encoding': 'edtf', '@keyDate': 'yes', '#text': '1956-04-28'}]}

	{'dateCreated': ['1960-05-16', {'@encoding': 'edtf', '@keyDate': 'yes', '#text': '1960-05-16'}]}

	{'dateCreated': ['1955-05-20', {'@encoding': 'edtf', '@keyDate': 'yes', '#text': '1955-05-20'}]}

	{'dateCreated': ['1960-05-14', {'@encoding': 'edtf', '@keyDate': 'yes', '#text': '1960-05-14'}]}

	{'dateCreated': ['1955-07-23', {'@encoding': 'edtf', '@keyDate': 'yes', '#text': '1955-07-23'}]}

	{'dateCreated': ['1960-05-09', {'@encoding': 'edtf', '@keyDate': 'yes', '#text': '1960-05-09'}]}

	{'dateCreated': ['1958-08-31', {'@encoding': 'edtf', '@keyDate': 'yes', '#text': '1958-08-31'}]}

	{'dateCreated': ['1958-05-28', {'@encoding': 'edtf', '@keyDate': 'yes', '#text': '1958-05-28'}]}

	{'dateCreated': ['1958-05-01', {'@encoding': 'edtf', '@keyDate': 'yes', '#text': '1958-05-01'}]}

	{'dateCreated': ['1953-05', {'@encoding': 'edtf', '@keyDate': 'yes', '#text': '1953-05'}]}

	{'dateCreated': ['1972-10', {'@encoding': 'edtf', '@keyDate': 'yes', '#text': '1972-10'}]}

	{'dateCreated': ['1953-04', {'@encoding': 'edtf', '@keyDate': 'yes', '#text': '1953-04'}]}

	{'dateCreated': [{'@qualifier': 'inferred', '#text': '1955'}, {'@encoding': 'edtf', '@keyDate': 'yes', '#text': '1955'}]}

	{'dateCreated': ['April 16, 1961', {'@encoding': 'edtf', '@keyDate': 'yes', '#text': '1961-04-16'}]}

	{'dateCreated': ['April 16, 1959', {'@encoding': 'edtf', '@keyDate': 'yes', '#text': '1959-04-16'}]}

	{'dateCreated': [{'@qualifier': 'inferred', '#text': '1959'}, {'@encoding': 'edtf', '@keyDate': 'yes', '#text': '1959'}]}

	{'dateCreated': ['April 14, 1958', {'@encoding': 'edtf', '@keyDate': 'yes', '#text': '1958-04-14'}]}

	{'dateCreated': ['October 29, 1957', {'@encoding': 'edtf', '@keyDate': 'yes', '#text': '1957-10-29'}]}

	{'dateCreated': ['January 12, 1959', {'@encoding': 'edtf', '@keyDate': 'yes', '#text': '1959-01-12'}]}

	{'dateCreated': ['April 13, 1959', {'@encoding': 'edtf', '@keyDate': 'yes', '#text': '1959-04-13'}]}

	{'dateCreated': ['January 14, 1954', {'@encoding': 'edtf', '@keyDate': 'yes', '#text': '1954-01-14'}]}

	{'dateCreated': ['March 25, 1957', {'@encoding': 'edtf', '@keyDate': 'yes', '#text': '1957-03-25'}]}

	{'dateCreated': ['March 4, 1958', {'@encoding': 'edtf', '@keyDate': 'yes', '#text': '1958-03-04'}]}

	{'dateCreated': ['May 15, 1954', {'@encoding': 'edtf', '@keyDate': 'yes', '#text': '1954-05-15'}]}

	{'dateCreated': [{'@qualifier': 'approximate', '#text': 'circa 1960'}, {'@encoding': 'edtf', '@keyDate': 'yes', '#text': '1960'}]}

	{'dateCreated': ['March 16,1960', {'@encoding': 'edtf', '@keyDate': 'yes', '#text': '1960-03-16'}]}

	{'dateCreated': [{'@qualifier': 'approximate', '#text': 'circa 1955'}, {'@encoding': 'edtf', '@keyDate': 'yes', '#text': '1955'}]}

	{'dateCreated': [{'@qualifier': 'inferred', '#text': '1956'}, {'@encoding': 'edtf', '@keyDate': 'yes', '#text': '1956'}]}

	{'dateCreated': ['1960', {'@encoding': 'edtf', '@keyDate': 'yes', '#text': '1960'}]}

	{'dateCreated': ['August 29, 1959', {'@encoding': 'edtf', '@keyDate': 'yes', '#text': '1959-08-29'}]}

	{'dateCreated': [{'@qualifier': 'approximate', '#text': '1955'}, {'@encoding': 'edtf', '@keyDate': 'yes', '#text': '1955'}]}

	{'dateCreated': [{'@qualifier': 'approximate', '#text': '1956'}, {'@encoding': 'edtf', '@keyDate': 'yes', '#text': '1956'}]}

	{'dateCreated': [{'@qualifier': 'inferred', '#text': '1961'}, {'@encoding': 'edtf', '@keyDate': 'yes', '#text': '1961'}]}

	{'dateCreated': ['1951', {'@encoding': 'edtf', '@keyDate': 'yes', '#text': '1951'}], 'dateIssued': 'February 28, 1951'}

	{'dateCreated': [{'@qualifier': 'inferred', '#text': '1950'}, {'@encoding': 'edtf', '@keyDate': 'yes', '#text': '1950'}]}

	{'dateCreated': [{'@qualifier': 'inferred', '#text': 'March 1951'}, {'@encoding': 'edtf', '@keyDate': 'yes', '#text': '1951-03'}]}

	{'dateCreated': ['April 27, 1959', {'@encoding': 'edtf', '@keyDate': 'yes', '#text': '1959-04-27'}]}

	{'dateCreated': ['March 24, 1951', {'@encoding': 'edtf', '@keyDate': 'yes', '#text': '1951-03-24'}]}

	{'dateCreated': ['November 20, 1950', {'@encoding': 'edtf', '@keyDate': 'yes', '#text': '1950-11-20'}]}

	{'dateCreated': [{'@qualifier': 'inferred', '#text': '1951'}, {'@encoding': 'edtf', '@keyDate': 'yes', '#text': '1951'}]}

	{'dateCreated': [{'@qualifier': 'inferred', '#text': 'circa 1952'}, {'@encoding': 'edtf', '@keyDate': 'yes', '#text': '1952'}]}

	{'dateCreated': [{'@qualifier': 'approximate', '#text': '1950'}, {'@encoding': 'edtf', '@keyDate': 'yes', '#text': '1950'}]}

	{'dateCreated': ['June 18, 1951', {'@encoding': 'edtf', '@keyDate': 'yes', '#text': '1951-06-18'}]}

	{'dateCreated': [{'@qualifier': 'inferred', '#text': 'circa 1954'}, {'@encoding': 'edtf', '@keyDate': 'yes', '#text': '1954'}]}

	{'dateCreated': ['March 10, 1950', {'@encoding': 'edtf', '@keyDate': 'yes', '#text': '1950-03-10'}]}

	{'dateCreated': ['April 22, 1950', {'@encoding': 'edtf', '@keyDate': 'yes', '#text': '1950-04-22'}]}

	{'dateCreated': ['January 22, 1951', {'@encoding': 'edtf', '@keyDate': 'yes', '#text': '1951-01-22'}]}

	{'dateCreated': ['May 6, 1950', {'@encoding': 'edtf', '@keyDate': 'yes', '#text': '1950-05-06'}]}

	{'dateCreated': ['January 27, 1951', {'@encoding': 'edtf', '@keyDate': 'yes', '#text': '1951-01-27'}]}

	{'dateCreated': ['September 19, 1950', {'@encoding': 'edtf', '@keyDate': 'yes', '#text': '1950-09-19'}]}

	{'dateCreated': ['March 22, 1951', {'@encoding': 'edtf', '@keyDate': 'yes', '#text': '1951-03-22'}]}

	{'dateCreated': ['October 29, 1951', {'@encoding': 'edtf', '@keyDate': 'yes', '#text': '1951-10-29'}]}

	{'dateCreated': ['July 26, 1954', {'@encoding': 'edtf', '@keyDate': 'yes', '#text': '1954-07-26'}]}

	{'dateCreated': [{'@qualifier': 'inferred', '#text': 'circa 1953'}, {'@encoding': 'edtf', '@keyDate': 'yes', '#text': '1953'}]}

	{'dateCreated': ['October 28, 1955', {'@encoding': 'edtf', '@keyDate': 'yes', '#text': '1955-10-28'}]}

	{'dateCreated': ['May 13, 1950', {'@encoding': 'edtf', '@keyDate': 'yes', '#text': '1950-05-13'}]}

	{'dateCreated': ['March 23, 1951', {'@encoding': 'edtf', '@keyDate': 'yes', '#text': '1951-03-23'}]}

	{'dateCreated': ['October 4, 1950', {'@encoding': 'edtf', '@keyDate': 'yes', '#text': '1950-10-04'}]}

	{'dateCreated': ['December 20, 1954', {'@encoding': 'edtf', '@keyDate': 'yes', '#text': '1954-12-20'}], 'dateIssued': '1954'}

	{'dateCreated': ['1951', {'@encoding': 'edtf', '@keyDate': 'yes', '#text': '1951'}], 'dateIssued': '1951'}

	{'publisher': ['B.H. Murphey, Nashville, Tenn., 1932', 'Elihu Embree, Jonesborough, Tenn., 1820'], 'dateCreated': ['1820-04-30', {'@encoding': 'edtf', '@keyDate': 'yes', '#text': '1820-04-30'}]}

	{'publisher': ['B.H. Murphey, Nashville, Tenn., 1932', 'Elihu Embree, Jonesborough, Tenn., 1820'], 'dateCreated': ['1820-10-31', {'@encoding': 'edtf', '@keyDate': 'yes', '#text': '1820-10-31'}]}

	{'publisher': ['B.H. Murphey, Nashville, Tenn., 1932', 'Elihu Embree, Jonesborough, Tenn., 1820'], 'dateCreated': ['1820-05-31', {'@encoding': 'edtf', '@keyDate': 'yes', '#text': '1820-05-31'}]}

	{'publisher': ['B.H. Murphey, Nashville, Tenn., 1932', 'Elihu Embree, Jonesborough, Tenn., 1820'], 'dateCreated': ['1820-09-30', {'@encoding': 'edtf', '@keyDate': 'yes', '#text': '1820-09-30'}]}

	{'publisher': ['B.H. Murphey, Nashville, Tenn., 1932', 'Elihu Embree, Jonesborough, Tenn., 1820'], 'dateCreated': ['1820-08-31', {'@encoding': 'edtf', '@keyDate': 'yes', '#text': '1820-08-31'}]}

	{'publisher': ['B.H. Murphey, Nashville, Tenn., 1932', 'Elihu Embree, Jonesborough, Tenn., 1820'], 'dateCreated': ['1820-07-31', {'@encoding': 'edtf', '@keyDate': 'yes', '#text': '1820-07-31'}]}

	{'publisher': ['B.H. Murphey, Nashville, Tenn., 1932', 'Elihu Embree, Jonesborough, Tenn., 1820'], 'dateCreated': ['1820-06-30', {'@encoding': 'edtf', '@keyDate': 'yes', '#text': '1820-06-30'}]}

	{'place': {'@supplied': 'yes', 'placeTerm': {'@type': 'text', '#text': 'Jacksonville (Fla.)'}}, 'publisher': 'Florida Times-Union', 'dateCreated': ['copyright 1987', {'@encoding': 'edtf', '@keyDate': 'yes', '#text': '1987'}]}

	{'place': {'@supplied': 'yes', 'placeTerm': {'@type': 'text', '#text': 'Jacksonville (Fla.)'}}, 'publisher': 'Florida Times-Union', 'dateCreated': ['copyright 1988', {'@encoding': 'edtf', '@keyDate': 'yes', '#text': '1988'}]}

	{'place': {'@supplied': 'yes', 'placeTerm': {'@type': 'text', '#text': 'Nashville (Tenn.)'}}, 'publisher': 'Nashville Banner', 'dateCreated': ['copyright 1979', {'@encoding': 'edtf', '@keyDate': 'yes', '#text': '1979'}]}

	{'place': {'@supplied': 'yes', 'placeTerm': {'@type': 'text', '#text': 'Jacksonville (Fla.)'}}, 'publisher': 'Florida Times-Union', 'dateCreated': ['copyright 1989', {'@encoding': 'edtf', '@keyDate': 'yes', '#text': '1989'}]}

	{'place': {'@supplied': 'yes', 'placeTerm': {'@type': 'text', '#text': 'Nashville (Tenn.)'}}, 'publisher': 'Nashville Banner', 'dateCreated': ['copyright 1980', {'@encoding': 'edtf', '@keyDate': 'yes', '#text': '1980'}]}

	{'place': {'@supplied': 'yes', 'placeTerm': {'@type': 'text', '#text': 'Jacksonville (Fla.)'}}, 'publisher': 'Florida Times-Union', 'dateCreated': ['copyright 1990', {'@encoding': 'edtf', '@keyDate': 'yes', '#text': '1990'}]}

	{'place': {'@supplied': 'yes', 'placeTerm': {'@type': 'text', '#text': 'Nashville (Tenn.)'}}, 'publisher': 'Nashville Banner', 'dateCreated': ['approximate 1974', {'@encoding': 'edtf', '@keyDate': 'yes', '@qualifier': 'approximate', '#text': '1974~'}]}

	{'place': {'@supplied': 'yes', 'placeTerm': {'@type': 'text', '#text': 'Jacksonville (Fla.)'}}, 'publisher': 'Florida Times-Union', 'dateCreated': ['copyright 1980', {'@encoding': 'edtf', '@keyDate': 'yes', '#text': '1980'}]}

	{'place': {'@supplied': 'yes', 'placeTerm': {'@type': 'text', '#text': 'Jacksonville (Fla.)'}}, 'publisher': 'Florida Times-Union', 'dateCreated': ['copyright 1991', {'@encoding': 'edtf', '@keyDate': 'yes', '#text': '1991'}]}

	{'place': {'@supplied': 'yes', 'placeTerm': {'@type': 'text', '#text': 'Jacksonville (Fla.)'}}, 'publisher': 'Florida Times-Union', 'dateCreated': ['copyright 1992', {'@encoding': 'edtf', '@keyDate': 'yes', '#text': '1992'}]}

	{'place': {'@supplied': 'yes', 'placeTerm': {'@type': 'text', '#text': 'Jacksonville (Fla.)'}}, 'publisher': 'Florida Times-Union', 'dateCreated': ['copyright 1993', {'@encoding': 'edtf', '@keyDate': 'yes', '#text': '1993'}]}

	{'place': {'@supplied': 'yes', 'placeTerm': {'@type': 'text', '#text': 'Jacksonville (Fla.)'}}, 'publisher': 'Florida Times-Union', 'dateCreated': ['copyright 1994', {'@encoding': 'edtf', '@keyDate': 'yes', '#text': '1994'}]}

	{'place': {'@supplied': 'yes', 'placeTerm': {'@type': 'text', '#text': 'Jacksonville (Fla.)'}}, 'publisher': 'Florida Times-Union', 'dateCreated': ['copyright 1995', {'@encoding': 'edtf', '@keyDate': 'yes', '#text': '1995'}]}

	{'place': {'@supplied': 'yes', 'placeTerm': {'@type': 'text', '#text': 'Nashville (Tenn.)'}}, 'publisher': 'Nashville Banner', 'dateCreated': ['copyright 1977', {'@encoding': 'edtf', '@keyDate': 'yes', '#text': '1977'}]}

	{'place': {'@supplied': 'yes', 'placeTerm': {'@type': 'text', '#text': 'Jacksonville (Fla.)'}}, 'publisher': 'Florida Times-Union', 'dateCreated': ['copyright 1996', {'@encoding': 'edtf', '@keyDate': 'yes', '#text': '1996'}]}

	{'place': {'@supplied': 'yes', 'placeTerm': {'@type': 'text', '#text': 'Jacksonville (Fla.)'}}, 'publisher': 'Florida Times-Union', 'dateCreated': ['copyright 1997', {'@encoding': 'edtf', '@keyDate': 'yes', '#text': '1997'}]}

	{'place': {'@supplied': 'yes', 'placeTerm': {'@type': 'text', '#text': 'Jacksonville (Fla.)'}}, 'publisher': 'Florida Times-Union', 'dateCreated': ['copyright 1998', {'@encoding': 'edtf', '@keyDate': 'yes', '#text': '1998'}]}

	{'place': {'@supplied': 'yes', 'placeTerm': {'@type': 'text', '#text': 'Jacksonville (Fla.)'}}, 'publisher': 'Florida Times-Union', 'dateCreated': ['copyright 1999', {'@encoding': 'edtf', '@keyDate': 'yes', '#text': '1999'}]}

	{'place': {'@supplied': 'yes', 'placeTerm': {'@type': 'text', '#text': 'Jacksonville (Fla.)'}}, 'publisher': 'Florida Times-Union', 'dateCreated': ['copyright 2000', {'@encoding': 'edtf', '@keyDate': 'yes', '#text': '2000'}]}

	{'place': {'@supplied': 'yes', 'placeTerm': {'@type': 'text', '#text': 'Jacksonville (Fla.)'}}, 'publisher': 'Florida Times-Union', 'dateCreated': ['copyright 2001', {'@encoding': 'edtf', '@keyDate': 'yes', '#text': '2001'}]}

	{'place': {'@supplied': 'yes', 'placeTerm': {'@type': 'text', '#text': 'Jacksonville (Fla.)'}}, 'publisher': 'Florida Times-Union', 'dateCreated': ['copyright 2002', {'@encoding': 'edtf', '@keyDate': 'yes', '#text': '2002'}]}

	{'place': {'@supplied': 'yes', 'placeTerm': {'@type': 'text', '#text': 'Jacksonville (Fla.)'}}, 'publisher': 'Florida Times-Union', 'dateCreated': ['copyright 2003', {'@encoding': 'edtf', '@keyDate': 'yes', '#text': '2003'}]}

	{'place': {'@supplied': 'yes', 'placeTerm': {'@type': 'text', '#text': 'Jacksonville (Fla.)'}}, 'publisher': 'Florida Times-Union', 'dateCreated': ['copyright 2004', {'@encoding': 'edtf', '@keyDate': 'yes', '#text': '2004'}]}

	{'place': {'@supplied': 'yes', 'placeTerm': {'@type': 'text', '#text': 'Jacksonville (Fla.)'}}, 'publisher': 'Florida Times-Union', 'dateCreated': ['copyright 1981', {'@encoding': 'edtf', '@keyDate': 'yes', '#text': '1981'}]}

	{'place': {'@supplied': 'yes', 'placeTerm': {'@type': 'text', '#text': 'Jacksonville (Fla.)'}}, 'publisher': 'Florida Times-Union', 'dateCreated': ['copyright 1982', {'@encoding': 'edtf', '@keyDate': 'yes', '#text': '1982'}]}

	{'place': {'@supplied': 'yes', 'placeTerm': {'@type': 'text', '#text': 'Nashville (Tenn.)'}}, 'publisher': 'Nashville Banner', 'dateCreated': ['copyright 1978', {'@encoding': 'edtf', '@keyDate': 'yes', '#text': '1978'}]}

	{'place': {'@supplied': 'yes', 'placeTerm': {'@type': 'text', '#text': 'Jacksonville (Fla.)'}}, 'publisher': 'Florida Times-Union', 'dateCreated': ['copyright 1983', {'@encoding': 'edtf', '@keyDate': 'yes', '#text': '1983'}]}

	{'place': {'@supplied': 'yes', 'placeTerm': {'@type': 'text', '#text': 'Jacksonville (Fla.)'}}, 'publisher': 'Florida Times-Union', 'dateCreated': ['copyright 1984', {'@encoding': 'edtf', '@keyDate': 'yes', '#text': '1984'}]}

	{'place': {'@supplied': 'yes', 'placeTerm': {'@type': 'text', '#text': 'Jacksonville (Fla.)'}}, 'publisher': 'Florida Times-Union', 'dateCreated': ['copyright 1985', {'@encoding': 'edtf', '@keyDate': 'yes', '#text': '1985'}]}

	{'place': {'@supplied': 'yes', 'placeTerm': {'@type': 'text', '#text': 'Jacksonville (Fla.)'}}, 'publisher': 'Florida Times-Union', 'dateCreated': ['copyright 1986', {'@encoding': 'edtf', '@keyDate': 'yes', '#text': '1986'}]}

	{'place': [{'@supplied': 'yes', 'placeTerm': {'@type': 'text'}}, {'placeTerm': {'@authority': 'marccountry', '@type': 'code'}}], 'dateCreated': ['10/12/2008', {'@encoding': 'edtf', '@keyDate': 'yes', '#text': '2008-10-12'}], 'publisher': None}

	{'place': {'@supplied': 'yes', 'placeTerm': {'@type': 'text'}}, 'dateCreated': ['10/7/2008', {'@encoding': 'edtf', '@keyDate': 'yes', '#text': '2008-10-07'}]}

	{'place': {'@supplied': 'yes', 'placeTerm': {'@type': 'text'}}, 'dateCreated': ['10/16/2008', {'@encoding': 'edtf', '@keyDate': 'yes', '#text': '2008-10-16'}]}

	{'place': {'@supplied': 'yes', 'placeTerm': {'@type': 'text'}}, 'dateCreated': ['9/1/2007', {'@encoding': 'edtf', '@keyDate': 'yes', '#text': '2007-09-01'}]}

	{'place': {'@supplied': 'yes', 'placeTerm': {'@type': 'text'}}, 'dateCreated': ['3/4/1965', {'@encoding': 'edtf', '@keyDate': 'yes', '#text': '1965-03-04'}]}

	{'place': {'@supplied': 'yes', 'placeTerm': {'@type': 'text'}}, 'dateCreated': ['6/18/1989', {'@encoding': 'edtf', '@keyDate': 'yes', '#text': '1989-06-18'}]}

	{'place': {'@supplied': 'yes', 'placeTerm': {'@type': 'text'}}, 'dateCreated': ['6/22/1999', {'@encoding': 'edtf', '@keyDate': 'yes', '#text': '1999-06-22'}]}

	{'place': {'@supplied': 'yes', 'placeTerm': {'@type': 'text'}}, 'dateCreated': ['6/28/1982', {'@encoding': 'edtf', '@keyDate': 'yes', '#text': '1982-06-28'}]}

	{'place': {'@supplied': 'yes', 'placeTerm': {'@type': 'text'}}, 'dateCreated': ['8/1/1996', {'@encoding': 'edtf', '@keyDate': 'yes', '#text': '1996-08-01'}]}

	{'place': {'@supplied': 'yes', 'placeTerm': {'@type': 'text'}}, 'dateCreated': ['6/21/2000', {'@encoding': 'edtf', '@keyDate': 'yes', '#text': '2000-06-21'}]}

	{'place': {'@supplied': 'yes', 'placeTerm': {'@type': 'text'}}, 'dateCreated': ['Undated', {'@encoding': 'edtf', '@keyDate': 'yes', '@qualifier': 'inferred', '#text': '1934'}]}

	{'place': {'@supplied': 'yes', 'placeTerm': {'@type': 'text'}}, 'dateCreated': ['6/8/2003', {'@encoding': 'edtf', '@keyDate': 'yes', '#text': '2003-06-08'}]}

	{'place': {'@supplied': 'yes', 'placeTerm': {'@type': 'text'}}, 'dateCreated': ['10/23/2008', {'@encoding': 'edtf', '@keyDate': 'yes', '#text': '2008-10-23'}]}

	{'place': {'@supplied': 'yes', 'placeTerm': {'@type': 'text'}}, 'dateCreated': ['8/22/2004', {'@encoding': 'edtf', '@keyDate': 'yes', '#text': '2004-08-22'}]}

	{'place': {'@supplied': 'yes', 'placeTerm': {'@type': 'text'}}, 'dateCreated': ['9/19/2002', {'@encoding': 'edtf', '@keyDate': 'yes', '#text': '2002-09-19'}]}

	{'place': {'@supplied': 'yes', 'placeTerm': {'@type': 'text'}}, 'dateCreated': ['6/18/2010', {'@encoding': 'edtf', '@keyDate': 'yes', '#text': '2010-06-18'}]}

	{'place': {'@supplied': 'yes', 'placeTerm': {'@type': 'text'}}, 'dateCreated': ['6/5/2010', {'@encoding': 'edtf', '@keyDate': 'yes', '#text': '2010-06-05'}]}

	{'place': {'@supplied': 'yes', 'placeTerm': {'@type': 'text'}}, 'dateCreated': ['6/8/2010', {'@encoding': 'edtf', '@keyDate': 'yes', '#text': '2010-06-08'}]}

	{'place': {'@supplied': 'yes', 'placeTerm': {'@type': 'text'}}, 'dateCreated': ['5/17/2009', {'@encoding': 'edtf', '@keyDate': 'yes', '#text': '2009-05-17'}]}

	{'place': {'@supplied': 'yes', 'placeTerm': {'@type': 'text'}}, 'dateCreated': ['5/24/2009', {'@encoding': 'edtf', '@keyDate': 'yes', '#text': '2009-05-24'}]}

	{'place': {'@supplied': 'yes', 'placeTerm': {'@type': 'text'}}, 'dateCreated': ['5/28/2008', {'@encoding': 'edtf', '@keyDate': 'yes', '#text': '2008-05-28'}]}

	{'place': {'@supplied': 'yes', 'placeTerm': {'@type': 'text'}}, 'dateCreated': ['6/12/2010', {'@encoding': 'edtf', '@keyDate': 'yes', '#text': '2010-06-12'}]}

	{'place': {'@supplied': 'yes', 'placeTerm': {'@type': 'text'}}, 'dateCreated': ['5/16/2010', {'@encoding': 'edtf', '@keyDate': 'yes', '#text': '2010-05-16'}]}

	{'place': {'@supplied': 'yes', 'placeTerm': {'@type': 'text'}}, 'dateCreated': ['5/16/2006', {'@encoding': 'edtf', '@keyDate': 'yes', '#text': '2006-05-16'}]}

	{'place': {'@supplied': 'yes', 'placeTerm': {'@type': 'text'}}, 'dateCreated': ['5/2/2006', {'@encoding': 'edtf', '@keyDate': 'yes', '#text': '2006-05-02'}]}

	{'place': {'@supplied': 'yes', 'placeTerm': {'@type': 'text'}}, 'dateCreated': ['11/18/2003', {'@encoding': 'edtf', '@keyDate': 'yes', '#text': '2003-11-18'}]}

	{'place': {'@supplied': 'yes', 'placeTerm': {'@type': 'text'}}, 'dateCreated': ['11/18/2004', {'@encoding': 'edtf', '@keyDate': 'yes', '#text': '2004-11-18'}]}

	{'place': {'@supplied': 'yes', 'placeTerm': {'@type': 'text'}}, 'dateCreated': ['11/20/2004', {'@encoding': 'edtf', '@keyDate': 'yes', '#text': '2004-11-20'}]}

	{'place': {'@supplied': 'yes', 'placeTerm': {'@type': 'text'}}, 'dateCreated': ['11/22/2006', {'@encoding': 'edtf', '@keyDate': 'yes', '#text': '2006-11-22'}]}

	{'place': {'@supplied': 'yes', 'placeTerm': {'@type': 'text'}}, 'dateCreated': ['7/1/2010', {'@encoding': 'edtf', '@keyDate': 'yes', '#text': '2010-07-01'}]}

	{'place': {'@supplied': 'yes', 'placeTerm': {'@type': 'text'}}, 'dateCreated': ['3/14/2006', {'@encoding': 'edtf', '@keyDate': 'yes', '#text': '2006-03-14'}]}

	{'place': {'@supplied': 'yes', 'placeTerm': {'@type': 'text'}}, 'dateCreated': ['11/23/2003', {'@encoding': 'edtf', '@keyDate': 'yes', '#text': '2003-11-23'}]}

	{'place': {'@supplied': 'yes', 'placeTerm': {'@type': 'text'}}, 'dateCreated': ['6/6/2010', {'@encoding': 'edtf', '@keyDate': 'yes', '#text': '2010-06-06'}]}

	{'place': {'@supplied': 'yes', 'placeTerm': {'@type': 'text'}}, 'dateCreated': ['5/29/2008', {'@encoding': 'edtf', '@keyDate': 'yes', '#text': '2008-05-29'}]}

	{'place': {'@supplied': 'yes', 'placeTerm': {'@type': 'text'}}, 'dateCreated': ['9/20/2007', {'@encoding': 'edtf', '@keyDate': 'yes', '#text': '2007-09-20'}]}

	{'place': {'@supplied': 'yes', 'placeTerm': {'@type': 'text'}}, 'dateCreated': ['9/18/2007', {'@encoding': 'edtf', '@keyDate': 'yes', '#text': '2007-09-18'}]}

	{'place': {'@supplied': 'yes', 'placeTerm': {'@type': 'text'}}, 'dateCreated': ['9/16/2007', {'@encoding': 'edtf', '@keyDate': 'yes', '#text': '2007-09-16'}]}

	{'place': {'@supplied': 'yes', 'placeTerm': {'@type': 'text'}}, 'dateCreated': ['12/13/2006', {'@encoding': 'edtf', '@keyDate': 'yes', '#text': '2006-12-13'}]}

	{'place': {'@supplied': 'yes', 'placeTerm': {'@type': 'text'}}, 'dateCreated': ['11/4/2007', {'@encoding': 'edtf', '@keyDate': 'yes', '#text': '2007-11-04'}]}

	{'place': {'@supplied': 'yes', 'placeTerm': {'@type': 'text'}}, 'dateCreated': ['11/8/2007', {'@encoding': 'edtf', '@keyDate': 'yes', '#text': '2007-11-08'}]}

	{'place': {'@supplied': 'yes', 'placeTerm': {'@type': 'text'}}, 'dateCreated': ['8/28/2007', {'@encoding': 'edtf', '@keyDate': 'yes', '#text': '2007-08-28'}]}

	{'place': {'@supplied': 'yes', 'placeTerm': {'@type': 'text'}}, 'dateCreated': ['3/30/2008', {'@encoding': 'edtf', '@keyDate': 'yes', '#text': '2008-03-30'}]}

	{'place': {'@supplied': 'yes', 'placeTerm': {'@type': 'text'}}, 'dateCreated': ['3/1/1953', {'@encoding': 'edtf', '@keyDate': 'yes', '#text': '1953-03-01'}]}

	{'place': {'@supplied': 'yes', 'placeTerm': {'@type': 'text'}}, 'dateCreated': ['7/8/2008', {'@encoding': 'edtf', '@keyDate': 'yes', '#text': '2008-07-08'}]}

	{'place': {'@supplied': 'yes', 'placeTerm': {'@type': 'text'}}, 'dateCreated': ['7/23/2009', {'@encoding': 'edtf', '@keyDate': 'yes', '#text': '2009-07-23'}]}

	{'place': {'@supplied': 'yes', 'placeTerm': {'@type': 'text'}}, 'dateCreated': ['7/21/2009', {'@encoding': 'edtf', '@keyDate': 'yes', '#text': '2009-07-21'}]}

	{'place': {'@supplied': 'yes', 'placeTerm': {'@type': 'text'}}, 'dateCreated': ['7/28/2009', {'@encoding': 'edtf', '@keyDate': 'yes', '#text': '2009-07-28'}]}

	{'place': {'@supplied': 'yes', 'placeTerm': {'@type': 'text'}}, 'dateCreated': ['7/19/2009', {'@encoding': 'edtf', '@keyDate': 'yes', '#text': '2009-07-19'}]}

	{'place': {'@supplied': 'yes', 'placeTerm': {'@type': 'text'}}, 'dateCreated': ['6/18/2006', {'@encoding': 'edtf', '@keyDate': 'yes', '#text': '2006-06-18'}]}

	{'place': {'@supplied': 'yes', 'placeTerm': {'@type': 'text'}}, 'dateCreated': ['7/28/2000', {'@encoding': 'edtf', '@keyDate': 'yes', '#text': '2000-07-28'}]}

	{'place': {'@supplied': 'yes', 'placeTerm': {'@type': 'text'}}, 'dateCreated': ['9/3/2009', {'@encoding': 'edtf', '@keyDate': 'yes', '#text': '2009-09-03'}]}

	{'place': {'@supplied': 'yes', 'placeTerm': {'@type': 'text'}}, 'dateCreated': ['8/15/2009', {'@encoding': 'edtf', '@keyDate': 'yes', '#text': '2009-08-15'}]}

	{'place': {'@supplied': 'yes', 'placeTerm': {'@type': 'text'}}, 'dateCreated': ['7/11/2009', {'@encoding': 'edtf', '@keyDate': 'yes', '#text': '2009-07-11'}]}

	{'place': {'@supplied': 'yes', 'placeTerm': {'@type': 'text'}}, 'dateCreated': ['7/17/2007', {'@encoding': 'edtf', '@keyDate': 'yes', '#text': '2007-07-17'}]}

	{'place': {'@supplied': 'yes', 'placeTerm': {'@type': 'text'}}, 'dateCreated': ['7/11/2006', {'@encoding': 'edtf', '@keyDate': 'yes', '#text': '2006-07-11'}]}

	{'place': {'@supplied': 'yes', 'placeTerm': {'@type': 'text'}}, 'dateCreated': ['8/5/2007', {'@encoding': 'edtf', '@keyDate': 'yes', '#text': '2007-08-05'}]}

	{'place': {'@supplied': 'yes', 'placeTerm': {'@type': 'text'}}, 'dateCreated': ['7/25/2006', {'@encoding': 'edtf', '@keyDate': 'yes', '#text': '2006-07-25'}]}

	{'place': {'@supplied': 'yes', 'placeTerm': {'@type': 'text'}}, 'dateCreated': ['8/21/2007', {'@encoding': 'edtf', '@keyDate': 'yes', '#text': '2007-08-21'}]}

	{'place': {'@supplied': 'yes', 'placeTerm': {'@type': 'text'}}, 'dateCreated': ['6/20/2009', {'@encoding': 'edtf', '@keyDate': 'yes', '#text': '2009-06-20'}]}

	{'place': {'@supplied': 'yes', 'placeTerm': {'@type': 'text'}}, 'dateCreated': ['7/20/2002', {'@encoding': 'edtf', '@keyDate': 'yes', '#text': '2002-07-20'}]}

	{'place': {'@supplied': 'yes', 'placeTerm': {'@type': 'text'}}, 'dateCreated': ['6/12/2008', {'@encoding': 'edtf', '@keyDate': 'yes', '#text': '2008-06-12'}]}

	{'place': {'@supplied': 'yes', 'placeTerm': {'@type': 'text'}}, 'dateCreated': ['6/15/2008', {'@encoding': 'edtf', '@keyDate': 'yes', '#text': '2008-06-15'}]}

	{'place': {'@supplied': 'yes', 'placeTerm': {'@type': 'text'}}, 'dateCreated': ['6/10/2008', {'@encoding': 'edtf', '@keyDate': 'yes', '#text': '2008-06-10'}]}

	{'place': {'@supplied': 'yes', 'placeTerm': {'@type': 'text'}}, 'dateCreated': ['7/22/2009', {'@encoding': 'edtf', '@keyDate': 'yes', '#text': '2009-07-22'}]}

	{'place': {'@supplied': 'yes', 'placeTerm': {'@type': 'text'}}, 'dateCreated': ['8/4/2009', {'@encoding': 'edtf', '@keyDate': 'yes', '#text': '2009-08-04'}]}

	{'place': {'@supplied': 'yes', 'placeTerm': {'@type': 'text'}}, 'dateCreated': ['7/18/2010', {'@encoding': 'edtf', '@keyDate': 'yes', '#text': '2010-07-18'}]}

	{'place': {'@supplied': 'yes', 'placeTerm': {'@type': 'text'}}, 'dateCreated': ['7/29/2010', {'@encoding': 'edtf', '@keyDate': 'yes', '#text': '2010-07-29'}]}

	{'place': {'@supplied': 'yes', 'placeTerm': {'@type': 'text'}}, 'dateCreated': ['7/17/2010', {'@encoding': 'edtf', '@keyDate': 'yes', '#text': '2010-07-17'}]}

	{'place': {'@supplied': 'yes', 'placeTerm': {'@type': 'text'}}, 'dateCreated': ['7/31/2010', {'@encoding': 'edtf', '@keyDate': 'yes', '#text': '2010-07-31'}]}

	{'place': {'@supplied': 'yes', 'placeTerm': {'@type': 'text'}}, 'dateCreated': ['6/1/2006', {'@encoding': 'edtf', '@keyDate': 'yes', '#text': '2006-06-01'}]}

	{'place': {'@supplied': 'yes', 'placeTerm': {'@type': 'text'}}, 'dateCreated': ['11/25/2001', {'@encoding': 'edtf', '@keyDate': 'yes', '#text': '2001-11-25'}]}

	{'place': {'@supplied': 'yes', 'placeTerm': {'@type': 'text'}}, 'dateCreated': ['11/13/2001', {'@encoding': 'edtf', '@keyDate': 'yes', '#text': '2001-11-13'}]}

	{'place': {'@supplied': 'yes', 'placeTerm': {'@type': 'text'}}, 'dateCreated': ['10/31/2000', {'@encoding': 'edtf', '@keyDate': 'yes', '#text': '2000-10-31'}]}

	{'place': {'@supplied': 'yes', 'placeTerm': {'@type': 'text'}}, 'dateCreated': ['10/12/1991', {'@encoding': 'edtf', '@keyDate': 'yes', '#text': '1991-10-12'}]}

	{'place': {'@supplied': 'yes', 'placeTerm': {'@type': 'text'}}, 'dateCreated': ['11/20/1998', {'@encoding': 'edtf', '@keyDate': 'yes', '#text': '1998-11-20'}]}

	{'place': {'@supplied': 'yes', 'placeTerm': {'@type': 'text'}}, 'dateCreated': ['10/21/1999', {'@encoding': 'edtf', '@keyDate': 'yes', '#text': '1999-10-21'}]}

	{'place': {'@supplied': 'yes', 'placeTerm': {'@type': 'text'}}, 'dateCreated': ['9/1/1998', {'@encoding': 'edtf', '@keyDate': 'yes', '#text': '1998-09-01'}]}

	{'place': {'@supplied': 'yes', 'placeTerm': {'@type': 'text'}}, 'dateCreated': ['8/31/1991', {'@encoding': 'edtf', '@keyDate': 'yes', '#text': '1991-08-31'}]}

	{'place': {'@supplied': 'yes', 'placeTerm': {'@type': 'text'}}, 'dateCreated': ['4/1/2004', {'@encoding': 'edtf', '@keyDate': 'yes', '#text': '2004-04-01'}]}

	{'place': {'@supplied': 'yes', 'placeTerm': {'@type': 'text'}}, 'dateCreated': ['4/10/2005', {'@encoding': 'edtf', '@keyDate': 'yes', '#text': '2005-04-10'}]}

	{'place': {'@supplied': 'yes', 'placeTerm': {'@type': 'text'}}, 'dateCreated': ['4/6/2003', {'@encoding': 'edtf', '@keyDate': 'yes', '#text': '2003-04-06'}]}

	{'place': {'@supplied': 'yes', 'placeTerm': {'@type': 'text'}}, 'dateCreated': ['3/31/2007', {'@encoding': 'edtf', '@keyDate': 'yes', '#text': '2007-03-31'}]}

	{'place': {'@supplied': 'yes', 'placeTerm': {'@type': 'text'}}, 'dateCreated': ['4/8/2008', {'@encoding': 'edtf', '@keyDate': 'yes', '#text': '2008-04-08'}]}

	{'place': {'@supplied': 'yes', 'placeTerm': {'@type': 'text'}}, 'dateCreated': ['4/20/2004', {'@encoding': 'edtf', '@keyDate': 'yes', '#text': '2004-04-20'}]}

	{'place': {'@supplied': 'yes', 'placeTerm': {'@type': 'text'}}, 'dateCreated': ['4/29/2003', {'@encoding': 'edtf', '@keyDate': 'yes', '#text': '2003-04-29'}]}

	{'place': {'@supplied': 'yes', 'placeTerm': {'@type': 'text'}}, 'dateCreated': ['4/1/2003', {'@encoding': 'edtf', '@keyDate': 'yes', '#text': '2003-04-01'}]}

	{'place': {'@supplied': 'yes', 'placeTerm': {'@type': 'text'}}, 'dateCreated': ['4/16/2003', {'@encoding': 'edtf', '@keyDate': 'yes', '#text': '2003-04-16'}]}

	{'place': {'@supplied': 'yes', 'placeTerm': {'@type': 'text'}}, 'dateCreated': ['4/21/2003', {'@encoding': 'edtf', '@keyDate': 'yes', '#text': '2003-04-21'}]}

	{'place': {'@supplied': 'yes', 'placeTerm': {'@type': 'text'}}, 'dateCreated': ['4/8/2009', {'@encoding': 'edtf', '@keyDate': 'yes', '#text': '2009-04-08'}]}

	{'place': {'@supplied': 'yes', 'placeTerm': {'@type': 'text'}}, 'dateCreated': ['1/29/2009', {'@encoding': 'edtf', '@keyDate': 'yes', '#text': '2009-01-29'}]}

	{'place': {'@supplied': 'yes', 'placeTerm': {'@type': 'text'}}, 'dateCreated': ['4/9/2009', {'@encoding': 'edtf', '@keyDate': 'yes', '#text': '2009-04-09'}]}

	{'place': {'@supplied': 'yes', 'placeTerm': {'@type': 'text'}}, 'dateCreated': ['5/6/2007', {'@encoding': 'edtf', '@keyDate': 'yes', '#text': '2007-05-06'}]}

	{'place': {'@supplied': 'yes', 'placeTerm': {'@type': 'text'}}, 'dateCreated': ['5/11/2009', {'@encoding': 'edtf', '@keyDate': 'yes', '#text': '2009-05-11'}]}

	{'place': {'@supplied': 'yes', 'placeTerm': {'@type': 'text'}}, 'dateCreated': ['5/31/2009', {'@encoding': 'edtf', '@keyDate': 'yes', '#text': '2009-05-31'}]}

	{'place': {'@supplied': 'yes', 'placeTerm': {'@type': 'text'}}, 'dateCreated': ['5/20/2010', {'@encoding': 'edtf', '@keyDate': 'yes', '#text': '2010-05-20'}]}

	{'place': {'@supplied': 'yes', 'placeTerm': {'@type': 'text'}}, 'dateCreated': ['4/24/1992', {'@encoding': 'edtf', '@keyDate': 'yes', '#text': '1992-04-24'}]}

	{'place': {'@supplied': 'yes', 'placeTerm': {'@type': 'text'}}, 'dateCreated': ['4/1/1962', {'@encoding': 'edtf', '@keyDate': 'yes', '#text': '1962-04-01'}]}

	{'place': {'@supplied': 'yes', 'placeTerm': {'@type': 'text'}}, 'dateCreated': ['6/1/1995', {'@encoding': 'edtf', '@keyDate': 'yes', '#text': '1995-06-01'}]}

	{'place': {'@supplied': 'yes', 'placeTerm': {'@type': 'text'}}, 'dateCreated': ['4/20/2006', {'@encoding': 'edtf', '@keyDate': 'yes', '#text': '2006-04-20'}]}

	{'place': {'@supplied': 'yes', 'placeTerm': {'@type': 'text'}}, 'dateCreated': ['4/1/1967', {'@encoding': 'edtf', '@keyDate': 'yes', '#text': '1967-04-01'}]}

	{'place': {'@supplied': 'yes', 'placeTerm': {'@type': 'text'}}, 'dateCreated': ['4/18/2002', {'@encoding': 'edtf', '@keyDate': 'yes', '#text': '2002-04-18'}]}

	{'place': {'@supplied': 'yes', 'placeTerm': {'@type': 'text'}}, 'dateCreated': ['4/17/2003', {'@encoding': 'edtf', '@keyDate': 'yes', '#text': '2003-04-17'}]}

	{'place': {'@supplied': 'yes', 'placeTerm': {'@type': 'text'}}, 'dateCreated': ['5/7/2009', {'@encoding': 'edtf', '@keyDate': 'yes', '#text': '2009-05-07'}]}

	{'place': {'@supplied': 'yes', 'placeTerm': {'@type': 'text'}}, 'dateCreated': ['3/27/1949', {'@encoding': 'edtf', '@keyDate': 'yes', '#text': '1949-03-27'}]}

	{'place': {'@supplied': 'yes', 'placeTerm': {'@type': 'text'}}, 'dateCreated': ['4/11/2008', {'@encoding': 'edtf', '@keyDate': 'yes', '#text': '2008-04-11'}]}

	{'place': {'@supplied': 'yes', 'placeTerm': {'@type': 'text'}}, 'dateCreated': ['3/20/1950', {'@encoding': 'edtf', '@keyDate': 'yes', '#text': '1950-03-20'}]}

	{'place': {'@supplied': 'yes', 'placeTerm': {'@type': 'text'}}, 'dateCreated': ['4/12/2009', {'@encoding': 'edtf', '@keyDate': 'yes', '#text': '2009-04-12'}]}

	{'place': {'@supplied': 'yes', 'placeTerm': {'@type': 'text'}}, 'dateCreated': ['4/11/2009', {'@encoding': 'edtf', '@keyDate': 'yes', '#text': '2009-04-11'}]}

	{'place': {'@supplied': 'yes', 'placeTerm': {'@type': 'text'}}, 'dateCreated': ['1/28/2006', {'@encoding': 'edtf', '@keyDate': 'yes', '#text': '2006-01-28'}]}

	{'place': {'@supplied': 'yes', 'placeTerm': {'@type': 'text'}}, 'dateCreated': ['3/23/2004', {'@encoding': 'edtf', '@keyDate': 'yes', '#text': '2004-03-23'}]}

	{'place': {'@supplied': 'yes', 'placeTerm': {'@type': 'text'}}, 'dateCreated': ['1/26/2005', {'@encoding': 'edtf', '@keyDate': 'yes', '#text': '2005-01-26'}]}

	{'place': {'@supplied': 'yes', 'placeTerm': {'@type': 'text'}}, 'dateCreated': ['2/22/2007', {'@encoding': 'edtf', '@keyDate': 'yes', '#text': '2007-02-22'}]}

	{'place': {'@supplied': 'yes', 'placeTerm': {'@type': 'text'}}, 'dateCreated': ['2/24/2007', {'@encoding': 'edtf', '@keyDate': 'yes', '#text': '2007-02-24'}]}

	{'place': {'@supplied': 'yes', 'placeTerm': {'@type': 'text'}}, 'dateCreated': ['2/2/2004', {'@encoding': 'edtf', '@keyDate': 'yes', '#text': '2004-02-02'}]}

	{'place': {'@supplied': 'yes', 'placeTerm': {'@type': 'text'}}, 'dateCreated': ['2/19/2005', {'@encoding': 'edtf', '@keyDate': 'yes', '#text': '2005-02-19'}]}

	{'place': {'@supplied': 'yes', 'placeTerm': {'@type': 'text'}}, 'dateCreated': ['3/5/2004', {'@encoding': 'edtf', '@keyDate': 'yes', '#text': '2004-03-05'}]}

	{'place': {'@supplied': 'yes', 'placeTerm': {'@type': 'text'}}, 'dateCreated': ['2/1/2006', {'@encoding': 'edtf', '@keyDate': 'yes', '#text': '2006-02-01'}]}

	{'place': {'@supplied': 'yes', 'placeTerm': {'@type': 'text'}}, 'dateCreated': ['3/1/2004', {'@encoding': 'edtf', '@keyDate': 'yes', '#text': '2004-03-01'}]}

	{'place': {'@supplied': 'yes', 'placeTerm': {'@type': 'text'}}, 'dateCreated': ['2/21/2004', {'@encoding': 'edtf', '@keyDate': 'yes', '#text': '2004-02-21'}]}

	{'place': {'@supplied': 'yes', 'placeTerm': {'@type': 'text'}}, 'dateCreated': ['2/16/2006', {'@encoding': 'edtf', '@keyDate': 'yes', '#text': '2006-02-16'}]}

	{'place': {'@supplied': 'yes', 'placeTerm': {'@type': 'text'}}, 'dateCreated': ['3/14/2004', {'@encoding': 'edtf', '@keyDate': 'yes', '#text': '2004-03-14'}]}

	{'place': {'@supplied': 'yes', 'placeTerm': {'@type': 'text'}}, 'dateCreated': ['1/23/2005', {'@encoding': 'edtf', '@keyDate': 'yes', '#text': '2005-01-23'}]}

	{'place': {'@supplied': 'yes', 'placeTerm': {'@type': 'text'}}, 'dateCreated': ['3/4/2007', {'@encoding': 'edtf', '@keyDate': 'yes', '#text': '2007-03-04'}]}

	{'place': {'@supplied': 'yes', 'placeTerm': {'@type': 'text'}}, 'dateCreated': ['3/12/2007', {'@encoding': 'edtf', '@keyDate': 'yes', '#text': '2007-03-12'}]}

	{'place': {'@supplied': 'yes', 'placeTerm': {'@type': 'text'}}, 'dateCreated': ['3/13/2007', {'@encoding': 'edtf', '@keyDate': 'yes', '#text': '2007-03-13'}]}

	{'place': {'@supplied': 'yes', 'placeTerm': {'@type': 'text'}}, 'dateCreated': ['7/1/1951', {'@encoding': 'edtf', '@keyDate': 'yes', '#text': '1951-07-01'}]}

	{'place': {'@supplied': 'yes', 'placeTerm': {'@type': 'text'}}, 'dateCreated': ['3/9/2007', {'@encoding': 'edtf', '@keyDate': 'yes', '#text': '2007-03-09'}]}

	{'place': {'@supplied': 'yes', 'placeTerm': {'@type': 'text'}}, 'dateCreated': ['1/21/1985', {'@encoding': 'edtf', '@keyDate': 'yes', '#text': '1985-01-21'}]}

	{'place': {'@supplied': 'yes', 'placeTerm': {'@type': 'text'}}, 'dateCreated': ['1/1/1975', {'@encoding': 'edtf', '@keyDate': 'yes', '#text': '1975-01-01'}]}

	{'place': {'@supplied': 'yes', 'placeTerm': {'@type': 'text'}}, 'dateCreated': ['10/24/1965', {'@encoding': 'edtf', '@keyDate': 'yes', '#text': '1965-10-24'}]}

	{'place': {'@supplied': 'yes', 'placeTerm': {'@type': 'text'}}, 'dateCreated': ['1/1/1973', {'@encoding': 'edtf', '@keyDate': 'yes', '#text': '1973-01-01'}]}

	{'place': {'@supplied': 'yes', 'placeTerm': {'@type': 'text'}}, 'dateCreated': ['4/1/1980', {'@encoding': 'edtf', '@keyDate': 'yes', '#text': '1980-04-01'}]}

	{'place': {'@supplied': 'yes', 'placeTerm': {'@type': 'text'}}, 'dateCreated': ['1/3/2007', {'@encoding': 'edtf', '@keyDate': 'yes', '#text': '2007-01-03'}]}

	{'place': {'@supplied': 'yes', 'placeTerm': {'@type': 'text'}}, 'dateCreated': ['12/7/2003', {'@encoding': 'edtf', '@keyDate': 'yes', '#text': '2003-12-07'}]}

	{'place': {'@supplied': 'yes', 'placeTerm': {'@type': 'text'}}, 'dateCreated': ['12/1/1996', {'@encoding': 'edtf', '@keyDate': 'yes', '#text': '1996-12-01'}]}

	{'place': {'@supplied': 'yes', 'placeTerm': {'@type': 'text'}}, 'dateCreated': ['9/27/2008', {'@encoding': 'edtf', '@keyDate': 'yes', '#text': '2008-09-27'}]}

	{'place': {'@supplied': 'yes', 'placeTerm': {'@type': 'text'}}, 'dateCreated': ['5/12/2009', {'@encoding': 'edtf', '@keyDate': 'yes', '#text': '2009-05-12'}]}

	{'place': {'@supplied': 'yes', 'placeTerm': {'@type': 'text'}}, 'dateCreated': ['5/1/1962', {'@encoding': 'edtf', '@keyDate': 'yes', '#text': '1962-05-01'}]}

	{'place': {'@supplied': 'yes', 'placeTerm': {'@type': 'text'}}, 'dateCreated': ['5/29/2002', {'@encoding': 'edtf', '@keyDate': 'yes', '#text': '2002-05-29'}]}

	{'place': {'@supplied': 'yes', 'placeTerm': {'@type': 'text'}}, 'dateCreated': ['5/9/2010', {'@encoding': 'edtf', '@keyDate': 'yes', '#text': '2010-05-09'}]}

	{'place': {'@supplied': 'yes', 'placeTerm': {'@type': 'text'}}, 'dateCreated': ['7/1/1966', {'@encoding': 'edtf', '@keyDate': 'yes', '#text': '1966-07-01'}]}

	{'place': {'@supplied': 'yes', 'placeTerm': {'@type': 'text'}}, 'dateCreated': ['11/1/1996', {'@encoding': 'edtf', '@keyDate': 'yes', '#text': '1996-11-01'}]}

	{'place': {'@supplied': 'yes', 'placeTerm': {'@type': 'text'}}, 'dateCreated': ['9/1/2008', {'@encoding': 'edtf', '@keyDate': 'yes', '#text': '2008-09-01'}]}

	{'place': {'@supplied': 'yes', 'placeTerm': {'@type': 'text'}}, 'dateCreated': ['5/1/1998', {'@encoding': 'edtf', '@keyDate': 'yes', '#text': '1998-05-01'}]}

	{'place': {'@supplied': 'yes', 'placeTerm': {'@type': 'text'}}, 'dateCreated': ['5/1/2011', {'@encoding': 'edtf', '@keyDate': 'yes', '#text': '2011-05-01'}]}

	{'place': {'@supplied': 'yes', 'placeTerm': {'@type': 'text'}}, 'dateCreated': ['7/1/1998', {'@encoding': 'edtf', '@keyDate': 'yes', '#text': '1998-07-01'}]}

	{'place': {'@supplied': 'yes', 'placeTerm': {'@type': 'text'}}, 'dateCreated': ['4/1/1997', {'@encoding': 'edtf', '@keyDate': 'yes', '#text': '1997-04-01'}]}

	{'place': {'@supplied': 'yes', 'placeTerm': {'@type': 'text'}}, 'dateCreated': ['5/1/1995', {'@encoding': 'edtf', '@keyDate': 'yes', '#text': '1995-05-01'}]}

	{'place': {'@supplied': 'yes', 'placeTerm': {'@type': 'text'}}, 'dateCreated': ['7/1/1995', {'@encoding': 'edtf', '@keyDate': 'yes', '#text': '1995-07-01'}]}

	{'place': {'@supplied': 'yes', 'placeTerm': {'@type': 'text'}}, 'dateCreated': ['5/1/2004', {'@encoding': 'edtf', '@keyDate': 'yes', '#text': '2004-05-01'}]}

	{'place': {'@supplied': 'yes', 'placeTerm': {'@type': 'text'}}, 'dateCreated': ['6/1/1973', {'@encoding': 'edtf', '@keyDate': 'yes', '#text': '1973-06-01'}]}

	{'place': {'@supplied': 'yes', 'placeTerm': {'@type': 'text'}}, 'dateCreated': ['8/1/1981', {'@encoding': 'edtf', '@keyDate': 'yes', '#text': '1981-08-01'}]}

	{'place': {'@supplied': 'yes', 'placeTerm': {'@type': 'text'}}, 'dateCreated': ['7/1/1967', {'@encoding': 'edtf', '@keyDate': 'yes', '#text': '1967-07-01'}]}

	{'place': {'@supplied': 'yes', 'placeTerm': {'@type': 'text'}}, 'dateCreated': ['6/1/1996', {'@encoding': 'edtf', '@keyDate': 'yes', '#text': '1996-06-01'}]}

	{'place': {'@supplied': 'yes', 'placeTerm': {'@type': 'text'}}, 'dateCreated': ['6/28/1997', {'@encoding': 'edtf', '@keyDate': 'yes', '#text': '1997-06-28'}]}

	{'place': {'@supplied': 'yes', 'placeTerm': {'@type': 'text'}}, 'dateCreated': ['6/10/1998', {'@encoding': 'edtf', '@keyDate': 'yes', '#text': '1998-06-10'}]}

	{'place': {'@supplied': 'yes', 'placeTerm': {'@type': 'text'}}, 'dateCreated': ['6/1/1976', {'@encoding': 'edtf', '@keyDate': 'yes', '#text': '1976-06-01'}]}

	{'place': {'@supplied': 'yes', 'placeTerm': {'@type': 'text'}}, 'dateCreated': ['6/1/1978', {'@encoding': 'edtf', '@keyDate': 'yes', '#text': '1978-06-01'}]}

	{'place': {'@supplied': 'yes', 'placeTerm': {'@type': 'text'}}, 'dateCreated': ['6/1/1982', {'@encoding': 'edtf', '@keyDate': 'yes', '#text': '1982-06-01'}]}

	{'place': {'@supplied': 'yes', 'placeTerm': {'@type': 'text'}}, 'dateCreated': ['6/11/2002', {'@encoding': 'edtf', '@keyDate': 'yes', '#text': '2002-06-11'}]}

	{'place': {'@supplied': 'yes', 'placeTerm': {'@type': 'text'}}, 'dateCreated': ['8/1/2001', {'@encoding': 'edtf', '@keyDate': 'yes', '#text': '2001-08-01'}]}

	{'place': {'@supplied': 'yes', 'placeTerm': {'@type': 'text'}}, 'dateCreated': ['5/29/2004', {'@encoding': 'edtf', '@keyDate': 'yes', '#text': '2004-05-29'}]}

	{'place': {'@supplied': 'yes', 'placeTerm': {'@type': 'text'}}, 'dateCreated': ['7/30/2002', {'@encoding': 'edtf', '@keyDate': 'yes', '#text': '2002-07-30'}]}

	{'place': {'@supplied': 'yes', 'placeTerm': {'@type': 'text'}}, 'dateCreated': ['5/1/1984', {'@encoding': 'edtf', '@keyDate': 'yes', '#text': '1984-05-01'}]}

	{'place': {'@supplied': 'yes', 'placeTerm': {'@type': 'text'}}, 'dateCreated': ['4/1/1973', {'@encoding': 'edtf', '@keyDate': 'yes', '#text': '1973-04-01'}]}

	{'place': {'@supplied': 'yes', 'placeTerm': {'@type': 'text'}}, 'dateCreated': ['3/22/1997', {'@encoding': 'edtf', '@keyDate': 'yes', '#text': '1997-03-22'}]}

	{'place': {'@supplied': 'yes', 'placeTerm': {'@type': 'text'}}, 'dateCreated': ['7/1/1985', {'@encoding': 'edtf', '@keyDate': 'yes', '#text': '1985-07-01'}]}

	{'place': {'@supplied': 'yes', 'placeTerm': {'@type': 'text'}}, 'dateCreated': ['5/1/1996', {'@encoding': 'edtf', '@keyDate': 'yes', '#text': '1996-05-01'}]}

	{'place': {'@supplied': 'yes', 'placeTerm': {'@type': 'text'}}, 'dateCreated': ['12/1/1997', {'@encoding': 'edtf', '@keyDate': 'yes', '#text': '1997-12-01'}]}

	{'place': {'@supplied': 'yes', 'placeTerm': {'@type': 'text'}}, 'dateCreated': ['11/1/2011', {'@encoding': 'edtf', '@keyDate': 'yes', '#text': '2011-11-01'}]}

	{'place': {'@supplied': 'yes', 'placeTerm': {'@type': 'text'}}, 'dateCreated': ['8/1/1998', {'@encoding': 'edtf', '@keyDate': 'yes', '#text': '1998-08-01'}]}

	{'place': {'@supplied': 'yes', 'placeTerm': {'@type': 'text'}}, 'dateCreated': ['10/16/2007', {'@encoding': 'edtf', '@keyDate': 'yes', '#text': '2007-10-16'}]}

	{'place': {'@supplied': 'yes', 'placeTerm': {'@type': 'text'}}, 'dateCreated': ['9/30/2004', {'@encoding': 'edtf', '@keyDate': 'yes', '#text': '2004-09-30'}]}

	{'place': {'@supplied': 'yes', 'placeTerm': {'@type': 'text'}}, 'dateCreated': ['10/9/2004', {'@encoding': 'edtf', '@keyDate': 'yes', '#text': '2004-10-09'}]}

	{'place': {'@supplied': 'yes', 'placeTerm': {'@type': 'text'}}, 'dateCreated': ['7/8/2004', {'@encoding': 'edtf', '@keyDate': 'yes', '#text': '2004-07-08'}]}

	{'place': {'@supplied': 'yes', 'placeTerm': {'@type': 'text'}}, 'dateCreated': ['7/10/2004', {'@encoding': 'edtf', '@keyDate': 'yes', '#text': '2004-07-10'}]}

	{'place': {'@supplied': 'yes', 'placeTerm': {'@type': 'text'}}, 'dateCreated': ['9/1/1995', {'@encoding': 'edtf', '@keyDate': 'yes', '#text': '1995-09-01'}]}

	{'place': {'@supplied': 'yes', 'placeTerm': {'@type': 'text'}}, 'dateCreated': ['8/5/2006', {'@encoding': 'edtf', '@keyDate': 'yes', '#text': '2006-08-05'}]}

	{'place': {'@supplied': 'yes', 'placeTerm': {'@type': 'text'}}, 'dateCreated': ['7/1/2006', {'@encoding': 'edtf', '@keyDate': 'yes', '#text': '2006-07-01'}]}

	{'place': {'@supplied': 'yes', 'placeTerm': {'@type': 'text'}}, 'dateCreated': ['8/27/2008', {'@encoding': 'edtf', '@keyDate': 'yes', '#text': '2008-08-27'}]}

	{'place': {'@supplied': 'yes', 'placeTerm': {'@type': 'text'}}, 'dateCreated': ['8/16/2006', {'@encoding': 'edtf', '@keyDate': 'yes', '#text': '2006-08-16'}]}

	{'place': {'@supplied': 'yes', 'placeTerm': {'@type': 'text'}}, 'dateCreated': ['6/30/2006', {'@encoding': 'edtf', '@keyDate': 'yes', '#text': '2006-06-30'}]}

	{'place': {'@supplied': 'yes', 'placeTerm': {'@type': 'text'}}, 'dateCreated': ['8/18/2006', {'@encoding': 'edtf', '@keyDate': 'yes', '#text': '2006-08-18'}]}

	{'place': {'@supplied': 'yes', 'placeTerm': {'@type': 'text'}}, 'dateCreated': ['9/10/2006', {'@encoding': 'edtf', '@keyDate': 'yes', '#text': '2006-09-10'}]}

	{'place': {'@supplied': 'yes', 'placeTerm': {'@type': 'text'}}, 'dateCreated': ['9/1/1984', {'@encoding': 'edtf', '@keyDate': 'yes', '#text': '1984-09-01'}]}

	{'place': {'@supplied': 'yes', 'placeTerm': {'@type': 'text'}}, 'dateCreated': ['1/1/1994', {'@encoding': 'edtf', '@keyDate': 'yes', '#text': '1994-01-01'}]}

	{'place': {'@supplied': 'yes', 'placeTerm': {'@type': 'text'}}, 'dateCreated': ['4/1/1979', {'@encoding': 'edtf', '@keyDate': 'yes', '#text': '1979-04-01'}]}

	{'place': {'@supplied': 'yes', 'placeTerm': {'@type': 'text'}}, 'dateCreated': ['10/12/2003', {'@encoding': 'edtf', '@keyDate': 'yes', '#text': '2003-10-12'}]}

	{'place': {'@supplied': 'yes', 'placeTerm': {'@type': 'text'}}, 'dateCreated': ['9/7/2009', {'@encoding': 'edtf', '@keyDate': 'yes', '#text': '2009-09-07'}]}

	{'place': {'@supplied': 'yes', 'placeTerm': {'@type': 'text'}}, 'dateCreated': ['11/22/2001', {'@encoding': 'edtf', '@keyDate': 'yes', '#text': '2001-11-22'}]}

	{'place': {'@supplied': 'yes', 'placeTerm': {'@type': 'text'}}, 'dateCreated': ['9/6/2006', {'@encoding': 'edtf', '@keyDate': 'yes', '#text': '2006-09-06'}]}

	{'place': {'@supplied': 'yes', 'placeTerm': {'@type': 'text'}}, 'dateCreated': ['10/20/2009', {'@encoding': 'edtf', '@keyDate': 'yes', '#text': '2009-10-20'}]}

	{'place': {'@supplied': 'yes', 'placeTerm': {'@type': 'text'}}, 'dateCreated': ['10/23/2010', {'@encoding': 'edtf', '@keyDate': 'yes', '#text': '2010-10-23'}]}

	{'place': {'@supplied': 'yes', 'placeTerm': {'@type': 'text'}}, 'dateCreated': ['10/20/2006', {'@encoding': 'edtf', '@keyDate': 'yes', '#text': '2006-10-20'}]}

	{'place': {'@supplied': 'yes', 'placeTerm': {'@type': 'text'}}, 'dateCreated': ['10/3/2006', {'@encoding': 'edtf', '@keyDate': 'yes', '#text': '2006-10-03'}]}

	{'place': {'@supplied': 'yes', 'placeTerm': {'@type': 'text'}}, 'dateCreated': ['10/22/2006', {'@encoding': 'edtf', '@keyDate': 'yes', '#text': '2006-10-22'}]}

	{'place': {'@supplied': 'yes', 'placeTerm': {'@type': 'text'}}, 'dateCreated': ['10/25/2006', {'@encoding': 'edtf', '@keyDate': 'yes', '#text': '2006-10-25'}]}

	{'place': {'@supplied': 'yes', 'placeTerm': {'@type': 'text'}}, 'dateCreated': ['10/5/2006', {'@encoding': 'edtf', '@keyDate': 'yes', '#text': '2006-10-05'}]}

	{'place': {'@supplied': 'yes', 'placeTerm': {'@type': 'text'}}, 'dateCreated': ['10/24/2006', {'@encoding': 'edtf', '@keyDate': 'yes', '#text': '2006-10-24'}]}

	{'place': {'@supplied': 'yes', 'placeTerm': {'@type': 'text'}}, 'dateCreated': ['10/1/2006', {'@encoding': 'edtf', '@keyDate': 'yes', '#text': '2006-10-01'}]}

	{'place': {'@supplied': 'yes', 'placeTerm': {'@type': 'text'}}, 'dateCreated': ['4/1/1951', {'@encoding': 'edtf', '@keyDate': 'yes', '#text': '1951-04-01'}]}

	{'place': {'@supplied': 'yes', 'placeTerm': {'@type': 'text'}}, 'dateCreated': ['4/1/1981', {'@encoding': 'edtf', '@keyDate': 'yes', '#text': '1981-04-01'}]}

	{'place': {'@supplied': 'yes', 'placeTerm': {'@type': 'text'}}, 'dateCreated': ['4/2/2007', {'@encoding': 'edtf', '@keyDate': 'yes', '#text': '2007-04-02'}]}

	{'place': {'@supplied': 'yes', 'placeTerm': {'@type': 'text'}}, 'dateCreated': ['8/19/2008', {'@encoding': 'edtf', '@keyDate': 'yes', '#text': '2008-08-19'}]}

	{'place': {'@supplied': 'yes', 'placeTerm': {'@type': 'text'}}, 'dateCreated': ['5/1/2008', {'@encoding': 'edtf', '@keyDate': 'yes', '#text': '2008-05-01'}]}

	{'place': {'@supplied': 'yes', 'placeTerm': {'@type': 'text'}}, 'dateCreated': ['1/3/2009', {'@encoding': 'edtf', '@keyDate': 'yes', '#text': '2009-01-03'}]}

	{'place': {'@supplied': 'yes', 'placeTerm': {'@type': 'text'}}, 'dateCreated': ['5/3/2003', {'@encoding': 'edtf', '@keyDate': 'yes', '#text': '2003-05-03'}]}

	{'place': {'@supplied': 'yes', 'placeTerm': {'@type': 'text'}}, 'dateCreated': ['5/11/2010', {'@encoding': 'edtf', '@keyDate': 'yes', '#text': '2010-05-11'}]}

	{'place': {'@supplied': 'yes', 'placeTerm': {'@type': 'text'}}, 'dateCreated': ['3/23/2009', {'@encoding': 'edtf', '@keyDate': 'yes', '#text': '2009-03-23'}]}

	{'place': {'@supplied': 'yes', 'placeTerm': {'@type': 'text'}}, 'dateCreated': ['4/3/2007', {'@encoding': 'edtf', '@keyDate': 'yes', '#text': '2007-04-03'}]}

	{'place': {'@supplied': 'yes', 'placeTerm': {'@type': 'text'}}, 'dateCreated': ['3/22/2009', {'@encoding': 'edtf', '@keyDate': 'yes', '#text': '2009-03-22'}]}

	{'place': {'@supplied': 'yes', 'placeTerm': {'@type': 'text'}}, 'dateCreated': ['3/20/2009', {'@encoding': 'edtf', '@keyDate': 'yes', '#text': '2009-03-20'}]}

	{'place': {'@supplied': 'yes', 'placeTerm': {'@type': 'text'}}, 'dateCreated': ['4/1/2009', {'@encoding': 'edtf', '@keyDate': 'yes', '#text': '2009-04-01'}]}

	{'place': {'@supplied': 'yes', 'placeTerm': {'@type': 'text'}}, 'dateCreated': ['3/22/2008', {'@encoding': 'edtf', '@keyDate': 'yes', '#text': '2008-03-22'}]}

	{'place': {'@supplied': 'yes', 'placeTerm': {'@type': 'text'}}, 'dateCreated': ['10/1/2009', {'@encoding': 'edtf', '@keyDate': 'yes', '#text': '2009-10-01'}]}

	{'place': {'@supplied': 'yes', 'placeTerm': {'@type': 'text'}}, 'dateCreated': ['11/6/2008', {'@encoding': 'edtf', '@keyDate': 'yes', '#text': '2008-11-06'}]}

	{'place': {'@supplied': 'yes', 'placeTerm': {'@type': 'text'}}, 'dateCreated': ['10/28/2009', {'@encoding': 'edtf', '@keyDate': 'yes', '#text': '2009-10-28'}]}

	{'place': {'@supplied': 'yes', 'placeTerm': {'@type': 'text'}}, 'dateCreated': ['11/1/2009', {'@encoding': 'edtf', '@keyDate': 'yes', '#text': '2009-11-01'}]}

	{'place': {'@supplied': 'yes', 'placeTerm': {'@type': 'text'}}, 'dateCreated': ['10/26/2009', {'@encoding': 'edtf', '@keyDate': 'yes', '#text': '2009-10-26'}]}

	{'place': {'@supplied': 'yes', 'placeTerm': {'@type': 'text'}}, 'dateCreated': ['10/29/2009', {'@encoding': 'edtf', '@keyDate': 'yes', '#text': '2009-10-29'}]}

	{'place': {'@supplied': 'yes', 'placeTerm': {'@type': 'text'}}, 'dateCreated': ['10/30/2009', {'@encoding': 'edtf', '@keyDate': 'yes', '#text': '2009-10-30'}]}

	{'place': {'@supplied': 'yes', 'placeTerm': {'@type': 'text'}}, 'dateCreated': ['11/9/2008', {'@encoding': 'edtf', '@keyDate': 'yes', '#text': '2008-11-09'}]}

	{'place': {'@supplied': 'yes', 'placeTerm': {'@type': 'text'}}, 'dateCreated': ['11/8/2009', {'@encoding': 'edtf', '@keyDate': 'yes', '#text': '2009-11-08'}]}

	{'place': {'@supplied': 'yes', 'placeTerm': {'@type': 'text'}}, 'dateCreated': ['3/10/2009', {'@encoding': 'edtf', '@keyDate': 'yes', '#text': '2009-03-10'}]}

	{'place': {'@supplied': 'yes', 'placeTerm': {'@type': 'text'}}, 'dateCreated': ['2/1/2009', {'@encoding': 'edtf', '@keyDate': 'yes', '#text': '2009-02-01'}]}

	{'place': {'@supplied': 'yes', 'placeTerm': {'@type': 'text'}}, 'dateCreated': ['2/2/2009', {'@encoding': 'edtf', '@keyDate': 'yes', '#text': '2009-02-02'}]}

	{'place': {'@supplied': 'yes', 'placeTerm': {'@type': 'text'}}, 'dateCreated': ['2/3/2009', {'@encoding': 'edtf', '@keyDate': 'yes', '#text': '2009-02-03'}]}

	{'place': {'@supplied': 'yes', 'placeTerm': {'@type': 'text'}}, 'dateCreated': ['2/4/2009', {'@encoding': 'edtf', '@keyDate': 'yes', '#text': '2009-02-04'}]}

	{'place': {'@supplied': 'yes', 'placeTerm': {'@type': 'text'}}, 'dateCreated': ['11/12/2009', {'@encoding': 'edtf', '@keyDate': 'yes', '#text': '2009-11-12'}]}

	{'place': {'@supplied': 'yes', 'placeTerm': {'@type': 'text'}}, 'dateCreated': ['12/1/2009', {'@encoding': 'edtf', '@keyDate': 'yes', '#text': '2009-12-01'}]}

	{'place': {'@supplied': 'yes', 'placeTerm': {'@type': 'text'}}, 'dateCreated': ['11/2/2009', {'@encoding': 'edtf', '@keyDate': 'yes', '#text': '2009-11-02'}]}

	{'place': {'@supplied': 'yes', 'placeTerm': {'@type': 'text'}}, 'dateCreated': ['11/3/2009', {'@encoding': 'edtf', '@keyDate': 'yes', '#text': '2009-11-03'}]}

	{'place': {'@supplied': 'yes', 'placeTerm': {'@type': 'text'}}, 'dateCreated': ['11/4/2009', {'@encoding': 'edtf', '@keyDate': 'yes', '#text': '2009-11-04'}]}

	{'place': {'@supplied': 'yes', 'placeTerm': {'@type': 'text'}}, 'dateCreated': ['11/9/2009', {'@encoding': 'edtf', '@keyDate': 'yes', '#text': '2009-11-09'}]}

	{'place': {'@supplied': 'yes', 'placeTerm': {'@type': 'text'}}, 'dateCreated': ['11/17/2009', {'@encoding': 'edtf', '@keyDate': 'yes', '#text': '2009-11-17'}]}

	{'place': {'@supplied': 'yes', 'placeTerm': {'@type': 'text'}}, 'dateCreated': ['12/8/2009', {'@encoding': 'edtf', '@keyDate': 'yes', '#text': '2009-12-08'}]}

	{'place': {'@supplied': 'yes', 'placeTerm': {'@type': 'text'}}, 'dateCreated': ['11/18/2010', {'@encoding': 'edtf', '@keyDate': 'yes', '#text': '2010-11-18'}]}

	{'place': {'@supplied': 'yes', 'placeTerm': {'@type': 'text'}}, 'dateCreated': ['11/11/2010', {'@encoding': 'edtf', '@keyDate': 'yes', '#text': '2010-11-11'}]}

	{'place': {'@supplied': 'yes', 'placeTerm': {'@type': 'text'}}, 'dateCreated': ['11/14/2010', {'@encoding': 'edtf', '@keyDate': 'yes', '#text': '2010-11-14'}]}

	{'place': {'@supplied': 'yes', 'placeTerm': {'@type': 'text'}}, 'dateCreated': ['4/1/1969', {'@encoding': 'edtf', '@keyDate': 'yes', '#text': '1969-04-01'}]}

	{'place': {'@supplied': 'yes', 'placeTerm': {'@type': 'text'}}, 'dateCreated': ['3/1/2000', {'@encoding': 'edtf', '@keyDate': 'yes', '#text': '2000-03-01'}]}

	{'place': {'@supplied': 'yes', 'placeTerm': {'@type': 'text'}}, 'dateCreated': ['2/1/2002', {'@encoding': 'edtf', '@keyDate': 'yes', '#text': '2002-02-01'}]}

	{'place': {'@supplied': 'yes', 'placeTerm': {'@type': 'text'}}, 'dateCreated': ['3/18/2005', {'@encoding': 'edtf', '@keyDate': 'yes', '#text': '2005-03-18'}]}

	{'place': {'@supplied': 'yes', 'placeTerm': {'@type': 'text'}}, 'dateCreated': ['3/1/1996', {'@encoding': 'edtf', '@keyDate': 'yes', '#text': '1996-03-01'}]}

	{'place': {'@supplied': 'yes', 'placeTerm': {'@type': 'text'}}, 'dateCreated': ['3/1/1982', {'@encoding': 'edtf', '@keyDate': 'yes', '#text': '1982-03-01'}]}

	{'place': {'@supplied': 'yes', 'placeTerm': {'@type': 'text'}}, 'dateCreated': ['3/1/1991', {'@encoding': 'edtf', '@keyDate': 'yes', '#text': '1991-03-01'}]}

	{'place': {'@supplied': 'yes', 'placeTerm': {'@type': 'text'}}, 'dateCreated': ['3/2/1991', {'@encoding': 'edtf', '@keyDate': 'yes', '#text': '1991-03-02'}]}

	{'place': {'@supplied': 'yes', 'placeTerm': {'@type': 'text'}}, 'dateCreated': ['3/1/2001', {'@encoding': 'edtf', '@keyDate': 'yes', '#text': '2001-03-01'}]}

	{'place': {'@supplied': 'yes', 'placeTerm': {'@type': 'text'}}, 'dateCreated': ['3/1/1986', {'@encoding': 'edtf', '@keyDate': 'yes', '#text': '1986-03-01'}]}

	{'place': {'@supplied': 'yes', 'placeTerm': {'@type': 'text'}}, 'dateCreated': ['4/8/2006', {'@encoding': 'edtf', '@keyDate': 'yes', '#text': '2006-04-08'}]}

	{'place': {'@supplied': 'yes', 'placeTerm': {'@type': 'text'}}, 'dateCreated': ['3/22/2003', {'@encoding': 'edtf', '@keyDate': 'yes', '#text': '2003-03-22'}]}

	{'place': {'@supplied': 'yes', 'placeTerm': {'@type': 'text'}}, 'dateCreated': ['4/1/2000', {'@encoding': 'edtf', '@keyDate': 'yes', '#text': '2000-04-01'}]}

	{'place': {'@supplied': 'yes', 'placeTerm': {'@type': 'text'}}, 'dateCreated': ['3/20/1998', {'@encoding': 'edtf', '@keyDate': 'yes', '#text': '1998-03-20'}]}

	{'place': {'@supplied': 'yes', 'placeTerm': {'@type': 'text'}}, 'dateCreated': ['3/1/1994', {'@encoding': 'edtf', '@keyDate': 'yes', '#text': '1994-03-01'}]}

	{'place': {'@supplied': 'yes', 'placeTerm': {'@type': 'text'}}, 'dateCreated': ['4/9/2006', {'@encoding': 'edtf', '@keyDate': 'yes', '#text': '2006-04-09'}]}

	{'place': {'@supplied': 'yes', 'placeTerm': {'@type': 'text'}}, 'dateCreated': ['4/18/2007', {'@encoding': 'edtf', '@keyDate': 'yes', '#text': '2007-04-18'}]}

	{'place': {'@supplied': 'yes', 'placeTerm': {'@type': 'text'}}, 'dateCreated': ['3/1/1997', {'@encoding': 'edtf', '@keyDate': 'yes', '#text': '1997-03-01'}]}

	{'place': {'@supplied': 'yes', 'placeTerm': {'@type': 'text'}}, 'dateCreated': ['4/23/2001', {'@encoding': 'edtf', '@keyDate': 'yes', '#text': '2001-04-23'}]}

	{'place': {'@supplied': 'yes', 'placeTerm': {'@type': 'text'}}, 'dateCreated': ['4/1/1987', {'@encoding': 'edtf', '@keyDate': 'yes', '#text': '1987-04-01'}]}

	{'place': {'@supplied': 'yes', 'placeTerm': {'@type': 'text'}}, 'dateCreated': ['3/1/1998', {'@encoding': 'edtf', '@keyDate': 'yes', '#text': '1998-03-01'}]}

	{'place': {'@supplied': 'yes', 'placeTerm': {'@type': 'text'}}, 'dateCreated': ['3/23/2001', {'@encoding': 'edtf', '@keyDate': 'yes', '#text': '2001-03-23'}]}

	{'place': {'@supplied': 'yes', 'placeTerm': {'@type': 'text'}}, 'dateCreated': ['3/19/2002', {'@encoding': 'edtf', '@keyDate': 'yes', '#text': '2002-03-19'}]}

	{'place': {'@supplied': 'yes', 'placeTerm': {'@type': 'text'}}, 'dateCreated': ['5/1/1983', {'@encoding': 'edtf', '@keyDate': 'yes', '#text': '1983-05-01'}]}

	{'place': {'@supplied': 'yes', 'placeTerm': {'@type': 'text'}}, 'dateCreated': ['6/8/2006', {'@encoding': 'edtf', '@keyDate': 'yes', '#text': '2006-06-08'}]}

	{'place': {'@supplied': 'yes', 'placeTerm': {'@type': 'text'}}, 'dateCreated': ['10/2/2008', {'@encoding': 'edtf', '@keyDate': 'yes', '#text': '2008-10-02'}]}

	{'place': {'@supplied': 'yes', 'placeTerm': {'@type': 'text'}}, 'dateCreated': ['10/30/2008', {'@encoding': 'edtf', '@keyDate': 'yes', '#text': '2008-10-30'}]}

	{'place': {'@supplied': 'yes', 'placeTerm': {'@type': 'text'}}, 'dateCreated': ['6/1/2002', {'@encoding': 'edtf', '@keyDate': 'yes', '#text': '2002-06-01'}]}

	{'place': {'@supplied': 'yes', 'placeTerm': {'@type': 'text'}}, 'dateCreated': ['8/16/2008', {'@encoding': 'edtf', '@keyDate': 'yes', '#text': '2008-08-16'}]}

	{'place': {'@supplied': 'yes', 'placeTerm': {'@type': 'text'}}, 'dateCreated': ['7/20/2008', {'@encoding': 'edtf', '@keyDate': 'yes', '#text': '2008-07-20'}]}

	{'place': {'@supplied': 'yes', 'placeTerm': {'@type': 'text'}}, 'dateCreated': ['8/23/2008', {'@encoding': 'edtf', '@keyDate': 'yes', '#text': '2008-08-23'}]}

	{'place': {'@supplied': 'yes', 'placeTerm': {'@type': 'text'}}, 'dateCreated': ['5/20/2006', {'@encoding': 'edtf', '@keyDate': 'yes', '#text': '2006-05-20'}]}

	{'place': {'@supplied': 'yes', 'placeTerm': {'@type': 'text'}}, 'dateCreated': ['5/4/2006', {'@encoding': 'edtf', '@keyDate': 'yes', '#text': '2006-05-04'}]}

	{'place': {'@supplied': 'yes', 'placeTerm': {'@type': 'text'}}, 'dateCreated': ['5/22/2006', {'@encoding': 'edtf', '@keyDate': 'yes', '#text': '2006-05-22'}]}

	{'place': {'@supplied': 'yes', 'placeTerm': {'@type': 'text'}}, 'dateCreated': ['5/23/2006', {'@encoding': 'edtf', '@keyDate': 'yes', '#text': '2006-05-23'}]}

	{'place': {'@supplied': 'yes', 'placeTerm': {'@type': 'text'}}, 'dateCreated': ['5/21/2006', {'@encoding': 'edtf', '@keyDate': 'yes', '#text': '2006-05-21'}]}

	{'place': {'@supplied': 'yes', 'placeTerm': {'@type': 'text'}}, 'dateCreated': ['2/1/1958', {'@encoding': 'edtf', '@keyDate': 'yes', '#text': '1958-02-01'}]}

	{'place': {'@supplied': 'yes', 'placeTerm': {'@type': 'text'}}, 'dateCreated': ['9/14/2006', {'@encoding': 'edtf', '@keyDate': 'yes', '#text': '2006-09-14'}]}

	{'place': {'@supplied': 'yes', 'placeTerm': {'@type': 'text'}}, 'dateCreated': ['10/25/2007', {'@encoding': 'edtf', '@keyDate': 'yes', '#text': '2007-10-25'}]}

	{'place': {'@supplied': 'yes', 'placeTerm': {'@type': 'text'}}, 'dateCreated': ['10/30/2007', {'@encoding': 'edtf', '@keyDate': 'yes', '#text': '2007-10-30'}]}

	{'place': {'@supplied': 'yes', 'placeTerm': {'@type': 'text'}}, 'dateCreated': ['10/10/2006', {'@encoding': 'edtf', '@keyDate': 'yes', '#text': '2006-10-10'}]}

	{'place': {'@supplied': 'yes', 'placeTerm': {'@type': 'text'}}, 'dateCreated': ['8/5/2009', {'@encoding': 'edtf', '@keyDate': 'yes', '#text': '2009-08-05'}]}

	{'place': {'@supplied': 'yes', 'placeTerm': {'@type': 'text'}}, 'dateCreated': ['5/8/2009', {'@encoding': 'edtf', '@keyDate': 'yes', '#text': '2009-05-08'}]}

	{'place': {'@supplied': 'yes', 'placeTerm': {'@type': 'text'}}, 'dateCreated': ['7/13/2003', {'@encoding': 'edtf', '@keyDate': 'yes', '#text': '2003-07-13'}]}

	{'place': {'@supplied': 'yes', 'placeTerm': {'@type': 'text'}}, 'dateCreated': ['10/8/2009', {'@encoding': 'edtf', '@keyDate': 'yes', '#text': '2009-10-08'}]}

	{'place': {'@supplied': 'yes', 'placeTerm': {'@type': 'text'}}, 'dateCreated': ['11/16/2008', {'@encoding': 'edtf', '@keyDate': 'yes', '#text': '2008-11-16'}]}

	{'place': {'@supplied': 'yes', 'placeTerm': {'@type': 'text'}}, 'dateCreated': ['6/2/2004', {'@encoding': 'edtf', '@keyDate': 'yes', '#text': '2004-06-02'}]}

	{'place': {'@supplied': 'yes', 'placeTerm': {'@type': 'text'}}, 'dateCreated': ['10/3/1998', {'@encoding': 'edtf', '@keyDate': 'yes', '#text': '1998-10-03'}]}

	{'place': {'@supplied': 'yes', 'placeTerm': {'@type': 'text'}}, 'dateCreated': ['9/3/2006', {'@encoding': 'edtf', '@keyDate': 'yes', '#text': '2006-09-03'}]}

	{'place': {'@supplied': 'yes', 'placeTerm': {'@type': 'text'}}, 'dateCreated': ['9/9/2003', {'@encoding': 'edtf', '@keyDate': 'yes', '#text': '2003-09-09'}]}

	{'place': {'@supplied': 'yes', 'placeTerm': {'@type': 'text'}}, 'dateCreated': ['9/13/2003', {'@encoding': 'edtf', '@keyDate': 'yes', '#text': '2003-09-13'}]}

	{'place': {'@supplied': 'yes', 'placeTerm': {'@type': 'text'}}, 'dateCreated': ['9/18/2003', {'@encoding': 'edtf', '@keyDate': 'yes', '#text': '2003-09-18'}]}

	{'place': {'@supplied': 'yes', 'placeTerm': {'@type': 'text'}}, 'dateCreated': ['7/7/2006', {'@encoding': 'edtf', '@keyDate': 'yes', '#text': '2006-07-07'}]}

	{'place': {'@supplied': 'yes', 'placeTerm': {'@type': 'text'}}, 'dateCreated': ['8/23/2006', {'@encoding': 'edtf', '@keyDate': 'yes', '#text': '2006-08-23'}]}

	{'place': {'@supplied': 'yes', 'placeTerm': {'@type': 'text'}}, 'dateCreated': ['3/7/2008', {'@encoding': 'edtf', '@keyDate': 'yes', '#text': '2008-03-07'}]}

	{'place': {'@supplied': 'yes', 'placeTerm': {'@type': 'text'}}, 'dateCreated': ['3/7/2009', {'@encoding': 'edtf', '@keyDate': 'yes', '#text': '2009-03-07'}]}

	{'place': {'@supplied': 'yes', 'placeTerm': {'@type': 'text'}}, 'dateCreated': ['8/6/2004', {'@encoding': 'edtf', '@keyDate': 'yes', '#text': '2004-08-06'}]}

	{'place': {'@supplied': 'yes', 'placeTerm': {'@type': 'text'}}, 'dateCreated': ['8/2/2004', {'@encoding': 'edtf', '@keyDate': 'yes', '#text': '2004-08-02'}]}

	{'place': {'@supplied': 'yes', 'placeTerm': {'@type': 'text'}}, 'dateCreated': ['5/18/2006', {'@encoding': 'edtf', '@keyDate': 'yes', '#text': '2006-05-18'}]}

	{'place': {'@supplied': 'yes', 'placeTerm': {'@type': 'text'}}, 'dateCreated': ['9/12/2004', {'@encoding': 'edtf', '@keyDate': 'yes', '#text': '2004-09-12'}]}

	{'place': {'@supplied': 'yes', 'placeTerm': {'@type': 'text'}}, 'dateCreated': ['8/16/2004', {'@encoding': 'edtf', '@keyDate': 'yes', '#text': '2004-08-16'}]}

	{'place': {'@supplied': 'yes', 'placeTerm': {'@type': 'text'}}, 'dateCreated': ['5/1/2002', {'@encoding': 'edtf', '@keyDate': 'yes', '#text': '2002-05-01'}]}

	{'place': {'@supplied': 'yes', 'placeTerm': {'@type': 'text'}}, 'dateCreated': ['3/20/2010', {'@encoding': 'edtf', '@keyDate': 'yes', '#text': '2010-03-20'}]}

	{'place': {'@supplied': 'yes', 'placeTerm': {'@type': 'text'}}, 'dateCreated': ['3/11/2010', {'@encoding': 'edtf', '@keyDate': 'yes', '#text': '2010-03-11'}]}

	{'place': {'@supplied': 'yes', 'placeTerm': {'@type': 'text'}}, 'dateCreated': ['3/9/2010', {'@encoding': 'edtf', '@keyDate': 'yes', '#text': '2010-03-09'}]}

	{'place': {'@supplied': 'yes', 'placeTerm': {'@type': 'text'}}, 'dateCreated': ['5/1/2009', {'@encoding': 'edtf', '@keyDate': 'yes', '#text': '2009-05-01'}]}

	{'place': {'@supplied': 'yes', 'placeTerm': {'@type': 'text'}}, 'dateCreated': ['2/28/2006', {'@encoding': 'edtf', '@keyDate': 'yes', '#text': '2006-02-28'}]}

	{'place': {'@supplied': 'yes', 'placeTerm': {'@type': 'text'}}, 'dateCreated': ['2/24/2006', {'@encoding': 'edtf', '@keyDate': 'yes', '#text': '2006-02-24'}]}

	{'place': {'@supplied': 'yes', 'placeTerm': {'@type': 'text'}}, 'dateCreated': ['2/26/2006', {'@encoding': 'edtf', '@keyDate': 'yes', '#text': '2006-02-26'}]}

	{'place': {'@supplied': 'yes', 'placeTerm': {'@type': 'text'}}, 'dateCreated': ['6/1/1992', {'@encoding': 'edtf', '@keyDate': 'yes', '#text': '1992-06-01'}]}

	{'place': {'@supplied': 'yes', 'placeTerm': {'@type': 'text'}}, 'dateCreated': ['8/1/1997', {'@encoding': 'edtf', '@keyDate': 'yes', '#text': '1997-08-01'}]}

	{'place': {'@supplied': 'yes', 'placeTerm': {'@type': 'text'}}, 'dateCreated': ['6/8/2002', {'@encoding': 'edtf', '@keyDate': 'yes', '#text': '2002-06-08'}]}

	{'place': {'@supplied': 'yes', 'placeTerm': {'@type': 'text'}}, 'dateCreated': ['7/4/2002', {'@encoding': 'edtf', '@keyDate': 'yes', '#text': '2002-07-04'}]}

	{'place': {'@supplied': 'yes', 'placeTerm': {'@type': 'text'}}, 'dateCreated': ['4/30/2008', {'@encoding': 'edtf', '@keyDate': 'yes', '#text': '2008-04-30'}]}

	{'place': {'@supplied': 'yes', 'placeTerm': {'@type': 'text'}}, 'dateCreated': ['5/3/2009', {'@encoding': 'edtf', '@keyDate': 'yes', '#text': '2009-05-03'}]}

	{'place': {'@supplied': 'yes', 'placeTerm': {'@type': 'text'}}, 'dateCreated': ['5/16/2009', {'@encoding': 'edtf', '@keyDate': 'yes', '#text': '2009-05-16'}]}

	{'place': {'@supplied': 'yes', 'placeTerm': {'@type': 'text'}}, 'dateCreated': ['5/24/2008', {'@encoding': 'edtf', '@keyDate': 'yes', '#text': '2008-05-24'}]}

	{'place': {'@supplied': 'yes', 'placeTerm': {'@type': 'text'}}, 'dateCreated': ['6/2/2008', {'@encoding': 'edtf', '@keyDate': 'yes', '#text': '2008-06-02'}]}

	{'place': {'@supplied': 'yes', 'placeTerm': {'@type': 'text'}}, 'dateCreated': ['8/4/2001', {'@encoding': 'edtf', '@keyDate': 'yes', '#text': '2001-08-04'}]}

	{'place': {'@supplied': 'yes', 'placeTerm': {'@type': 'text'}}, 'dateCreated': ['9/2/2001', {'@encoding': 'edtf', '@keyDate': 'yes', '#text': '2001-09-02'}]}

	{'place': {'@supplied': 'yes', 'placeTerm': {'@type': 'text'}}, 'dateCreated': ['9/2/2004', {'@encoding': 'edtf', '@keyDate': 'yes', '#text': '2004-09-02'}]}

	{'place': {'@supplied': 'yes', 'placeTerm': {'@type': 'text'}}, 'dateCreated': ['6/14/2006', {'@encoding': 'edtf', '@keyDate': 'yes', '#text': '2006-06-14'}]}

	{'place': {'@supplied': 'yes', 'placeTerm': {'@type': 'text'}}, 'dateCreated': ['10/12/2005', {'@encoding': 'edtf', '@keyDate': 'yes', '#text': '2005-10-12'}]}

	{'place': {'@supplied': 'yes', 'placeTerm': {'@type': 'text'}}, 'dateCreated': ['6/30/2004', {'@encoding': 'edtf', '@keyDate': 'yes', '#text': '2004-06-30'}]}

	{'place': {'@supplied': 'yes', 'placeTerm': {'@type': 'text'}}, 'dateCreated': ['8/15/2001', {'@encoding': 'edtf', '@keyDate': 'yes', '#text': '2001-08-15'}]}

	{'place': {'@supplied': 'yes', 'placeTerm': {'@type': 'text'}}, 'dateCreated': ['7/29/2007', {'@encoding': 'edtf', '@keyDate': 'yes', '#text': '2007-07-29'}]}

	{'place': {'@supplied': 'yes', 'placeTerm': {'@type': 'text'}}, 'dateCreated': ['10/4/2003', {'@encoding': 'edtf', '@keyDate': 'yes', '#text': '2003-10-04'}]}

	{'place': {'@supplied': 'yes', 'placeTerm': {'@type': 'text'}}, 'dateCreated': ['7/3/2010', {'@encoding': 'edtf', '@keyDate': 'yes', '#text': '2010-07-03'}]}

	{'place': {'@supplied': 'yes', 'placeTerm': {'@type': 'text'}}, 'dateCreated': ['3/24/2004', {'@encoding': 'edtf', '@keyDate': 'yes', '#text': '2004-03-24'}]}

	{'place': {'@supplied': 'yes', 'placeTerm': {'@type': 'text'}}, 'dateCreated': ['4/3/2004', {'@encoding': 'edtf', '@keyDate': 'yes', '#text': '2004-04-03'}]}

	{'place': {'@supplied': 'yes', 'placeTerm': {'@type': 'text'}}, 'dateCreated': ['4/5/2010', {'@encoding': 'edtf', '@keyDate': 'yes', '#text': '2010-04-05'}]}

	{'place': {'@supplied': 'yes', 'placeTerm': {'@type': 'text'}}, 'dateCreated': ['4/17/2005', {'@encoding': 'edtf', '@keyDate': 'yes', '#text': '2005-04-17'}]}

	{'place': {'@supplied': 'yes', 'placeTerm': {'@type': 'text'}}, 'dateCreated': ['10/1/2003', {'@encoding': 'edtf', '@keyDate': 'yes', '#text': '2003-10-01'}]}

	{'place': {'@supplied': 'yes', 'placeTerm': {'@type': 'text'}}, 'dateCreated': ['11/2/2003', {'@encoding': 'edtf', '@keyDate': 'yes', '#text': '2003-11-02'}]}

	{'place': {'@supplied': 'yes', 'placeTerm': {'@type': 'text'}}, 'dateCreated': ['10/23/2003', {'@encoding': 'edtf', '@keyDate': 'yes', '#text': '2003-10-23'}]}

	{'place': {'@supplied': 'yes', 'placeTerm': {'@type': 'text'}}, 'dateCreated': ['2/14/2009', {'@encoding': 'edtf', '@keyDate': 'yes', '#text': '2009-02-14'}]}

	{'place': {'@supplied': 'yes', 'placeTerm': {'@type': 'text'}}, 'dateCreated': ['4/17/2010', {'@encoding': 'edtf', '@keyDate': 'yes', '#text': '2010-04-17'}]}

	{'place': {'@supplied': 'yes', 'placeTerm': {'@type': 'text'}}, 'dateCreated': ['1/4/2009', {'@encoding': 'edtf', '@keyDate': 'yes', '#text': '2009-01-04'}]}

	{'place': {'@supplied': 'yes', 'placeTerm': {'@type': 'text'}}, 'dateCreated': ['6/1/2003', {'@encoding': 'edtf', '@keyDate': 'yes', '#text': '2003-06-01'}]}

	{'place': {'@supplied': 'yes', 'placeTerm': {'@type': 'text'}}, 'dateCreated': ['7/9/2009', {'@encoding': 'edtf', '@keyDate': 'yes', '#text': '2009-07-09'}]}

	{'place': {'@supplied': 'yes', 'placeTerm': {'@type': 'text'}}, 'dateCreated': ['1/26/2009', {'@encoding': 'edtf', '@keyDate': 'yes', '#text': '2009-01-26'}]}

	{'place': {'@supplied': 'yes', 'placeTerm': {'@type': 'text'}}, 'dateCreated': ['3/1/2009', {'@encoding': 'edtf', '@keyDate': 'yes', '#text': '2009-03-01'}]}

	{'place': {'@supplied': 'yes', 'placeTerm': {'@type': 'text'}}, 'dateCreated': ['3/17/2009', {'@encoding': 'edtf', '@keyDate': 'yes', '#text': '2009-03-17'}]}

	{'place': {'@supplied': 'yes', 'placeTerm': {'@type': 'text'}}, 'dateCreated': ['11/1/2010', {'@encoding': 'edtf', '@keyDate': 'yes', '#text': '2010-11-01'}]}

	{'place': {'@supplied': 'yes', 'placeTerm': {'@type': 'text'}}, 'dateCreated': ['5/20/1999', {'@encoding': 'edtf', '@keyDate': 'yes', '#text': '1999-05-20'}]}

	{'place': {'@supplied': 'yes', 'placeTerm': {'@type': 'text'}}, 'dateCreated': ['5/1/1951', {'@encoding': 'edtf', '@keyDate': 'yes', '#text': '1951-05-01'}]}

	{'place': {'@supplied': 'yes', 'placeTerm': {'@type': 'text'}}, 'dateCreated': ['5/25/1952', {'@encoding': 'edtf', '@keyDate': 'yes', '#text': '1952-05-25'}]}

	{'place': {'@supplied': 'yes', 'placeTerm': {'@type': 'text'}}, 'dateCreated': ['8/1/1999', {'@encoding': 'edtf', '@keyDate': 'yes', '#text': '1999-08-01'}]}

	{'place': {'@supplied': 'yes', 'placeTerm': {'@type': 'text'}}, 'dateCreated': ['9/4/2000', {'@encoding': 'edtf', '@keyDate': 'yes', '#text': '2000-09-04'}]}

	{'place': {'@supplied': 'yes', 'placeTerm': {'@type': 'text'}}, 'dateCreated': ['10/20/2005', {'@encoding': 'edtf', '@keyDate': 'yes', '#text': '2005-10-20'}]}

	{'place': {'@supplied': 'yes', 'placeTerm': {'@type': 'text'}}, 'dateCreated': ['9/30/2006', {'@encoding': 'edtf', '@keyDate': 'yes', '#text': '2006-09-30'}]}

	{'place': {'@supplied': 'yes', 'placeTerm': {'@type': 'text'}}, 'dateCreated': ['12/1/1983', {'@encoding': 'edtf', '@keyDate': 'yes', '#text': '1983-12-01'}]}

	{'place': {'@supplied': 'yes', 'placeTerm': {'@type': 'text'}}, 'dateCreated': ['5/10/2008', {'@encoding': 'edtf', '@keyDate': 'yes', '#text': '2008-05-10'}]}

	{'place': {'@supplied': 'yes', 'placeTerm': {'@type': 'text'}}, 'dateCreated': ['7/2/2005', {'@encoding': 'edtf', '@keyDate': 'yes', '#text': '2005-07-02'}]}

	{'place': {'@supplied': 'yes', 'placeTerm': {'@type': 'text'}}, 'dateCreated': ['6/21/2008', {'@encoding': 'edtf', '@keyDate': 'yes', '#text': '2008-06-21'}]}

	{'place': {'@supplied': 'yes', 'placeTerm': {'@type': 'text'}}, 'dateCreated': ['7/9/2005', {'@encoding': 'edtf', '@keyDate': 'yes', '#text': '2005-07-09'}]}

	{'place': {'@supplied': 'yes', 'placeTerm': {'@type': 'text'}}, 'dateCreated': ['7/3/2008', {'@encoding': 'edtf', '@keyDate': 'yes', '#text': '2008-07-03'}]}

	{'place': {'@supplied': 'yes', 'placeTerm': {'@type': 'text'}}, 'dateCreated': ['7/1/2008', {'@encoding': 'edtf', '@keyDate': 'yes', '#text': '2008-07-01'}]}

	{'place': {'@supplied': 'yes', 'placeTerm': {'@type': 'text'}}, 'dateCreated': ['6/18/2008', {'@encoding': 'edtf', '@keyDate': 'yes', '#text': '2008-06-18'}]}

	{'place': {'@supplied': 'yes', 'placeTerm': {'@type': 'text'}}, 'dateCreated': ['6/20/2008', {'@encoding': 'edtf', '@keyDate': 'yes', '#text': '2008-06-20'}]}

	{'place': {'@supplied': 'yes', 'placeTerm': {'@type': 'text'}}, 'dateCreated': ['6/19/2008', {'@encoding': 'edtf', '@keyDate': 'yes', '#text': '2008-06-19'}]}

	{'place': {'@supplied': 'yes', 'placeTerm': {'@type': 'text'}}, 'dateCreated': ['5/26/2006', {'@encoding': 'edtf', '@keyDate': 'yes', '#text': '2006-05-26'}]}

	{'place': {'@supplied': 'yes', 'placeTerm': {'@type': 'text'}}, 'dateCreated': ['6/23/2005', {'@encoding': 'edtf', '@keyDate': 'yes', '#text': '2005-06-23'}]}

	{'place': {'@supplied': 'yes', 'placeTerm': {'@type': 'text'}}, 'dateCreated': ['5/28/2006', {'@encoding': 'edtf', '@keyDate': 'yes', '#text': '2006-05-28'}]}

	{'place': {'@supplied': 'yes', 'placeTerm': {'@type': 'text'}}, 'dateCreated': ['7/6/2010', {'@encoding': 'edtf', '@keyDate': 'yes', '#text': '2010-07-06'}]}

	{'place': {'@supplied': 'yes', 'placeTerm': {'@type': 'text'}}, 'dateCreated': ['6/13/2009', {'@encoding': 'edtf', '@keyDate': 'yes', '#text': '2009-06-13'}]}

	{'place': {'@supplied': 'yes', 'placeTerm': {'@type': 'text'}}, 'dateCreated': ['7/19/2005', {'@encoding': 'edtf', '@keyDate': 'yes', '#text': '2005-07-19'}]}

	{'place': {'@supplied': 'yes', 'placeTerm': {'@type': 'text'}}, 'dateCreated': ['6/15/2006', {'@encoding': 'edtf', '@keyDate': 'yes', '#text': '2006-06-15'}]}

	{'place': {'@supplied': 'yes', 'placeTerm': {'@type': 'text'}}, 'dateCreated': ['8/18/2007', {'@encoding': 'edtf', '@keyDate': 'yes', '#text': '2007-08-18'}]}

	{'place': {'@supplied': 'yes', 'placeTerm': {'@type': 'text'}}, 'dateCreated': ['8/17/2007', {'@encoding': 'edtf', '@keyDate': 'yes', '#text': '2007-08-17'}]}

	{'place': {'@supplied': 'yes', 'placeTerm': {'@type': 'text'}}, 'dateCreated': ['6/11/2009', {'@encoding': 'edtf', '@keyDate': 'yes', '#text': '2009-06-11'}]}

	{'place': {'@supplied': 'yes', 'placeTerm': {'@type': 'text'}}, 'dateCreated': ['8/26/2007', {'@encoding': 'edtf', '@keyDate': 'yes', '#text': '2007-08-26'}]}

	{'place': {'@supplied': 'yes', 'placeTerm': {'@type': 'text'}}, 'dateCreated': ['6/30/2005', {'@encoding': 'edtf', '@keyDate': 'yes', '#text': '2005-06-30'}]}

	{'place': {'@supplied': 'yes', 'placeTerm': {'@type': 'text'}}, 'dateCreated': ['6/14/2008', {'@encoding': 'edtf', '@keyDate': 'yes', '#text': '2008-06-14'}]}

	{'place': {'@supplied': 'yes', 'placeTerm': {'@type': 'text'}}, 'dateCreated': ['8/11/2007', {'@encoding': 'edtf', '@keyDate': 'yes', '#text': '2007-08-11'}]}

	{'place': {'@supplied': 'yes', 'placeTerm': {'@type': 'text'}}, 'dateCreated': ['7/6/2006', {'@encoding': 'edtf', '@keyDate': 'yes', '#text': '2006-07-06'}]}

	{'place': {'@supplied': 'yes', 'placeTerm': {'@type': 'text'}}, 'dateCreated': ['7/15/2008', {'@encoding': 'edtf', '@keyDate': 'yes', '#text': '2008-07-15'}]}

	{'place': {'@supplied': 'yes', 'placeTerm': {'@type': 'text'}}, 'dateCreated': ['8/2/2008', {'@encoding': 'edtf', '@keyDate': 'yes', '#text': '2008-08-02'}]}

	{'place': {'@supplied': 'yes', 'placeTerm': {'@type': 'text'}}, 'dateCreated': ['10/3/2007', {'@encoding': 'edtf', '@keyDate': 'yes', '#text': '2007-10-03'}]}

	{'place': {'@supplied': 'yes', 'placeTerm': {'@type': 'text'}}, 'dateCreated': ['9/30/2007', {'@encoding': 'edtf', '@keyDate': 'yes', '#text': '2007-09-30'}]}

	{'place': {'@supplied': 'yes', 'placeTerm': {'@type': 'text'}}, 'dateCreated': ['10/13/2007', {'@encoding': 'edtf', '@keyDate': 'yes', '#text': '2007-10-13'}]}

	{'place': {'@supplied': 'yes', 'placeTerm': {'@type': 'text'}}, 'dateCreated': ['1/2/2007', {'@encoding': 'edtf', '@keyDate': 'yes', '#text': '2007-01-02'}]}

	{'place': {'@supplied': 'yes', 'placeTerm': {'@type': 'text'}}, 'dateCreated': ['4/5/2004', {'@encoding': 'edtf', '@keyDate': 'yes', '#text': '2004-04-05'}]}

	{'place': {'@supplied': 'yes', 'placeTerm': {'@type': 'text'}}, 'dateCreated': ['9/7/2003', {'@encoding': 'edtf', '@keyDate': 'yes', '#text': '2003-09-07'}]}

	{'place': {'@supplied': 'yes', 'placeTerm': {'@type': 'text'}}, 'dateCreated': ['2/1/2004', {'@encoding': 'edtf', '@keyDate': 'yes', '#text': '2004-02-01'}]}

	{'place': {'@supplied': 'yes', 'placeTerm': {'@type': 'text'}}, 'dateCreated': ['4/15/2003', {'@encoding': 'edtf', '@keyDate': 'yes', '#text': '2003-04-15'}]}

	{'place': {'@supplied': 'yes', 'placeTerm': {'@type': 'text'}}, 'dateCreated': ['5/8/2005', {'@encoding': 'edtf', '@keyDate': 'yes', '#text': '2005-05-08'}]}

	{'place': {'@supplied': 'yes', 'placeTerm': {'@type': 'text'}}, 'dateCreated': ['7/19/2008', {'@encoding': 'edtf', '@keyDate': 'yes', '#text': '2008-07-19'}]}

	{'place': {'@supplied': 'yes', 'placeTerm': {'@type': 'text'}}, 'dateCreated': ['7/10/2008', {'@encoding': 'edtf', '@keyDate': 'yes', '#text': '2008-07-10'}]}

	{'place': {'@supplied': 'yes', 'placeTerm': {'@type': 'text'}}, 'dateCreated': ['5/2/2008', {'@encoding': 'edtf', '@keyDate': 'yes', '#text': '2008-05-02'}]}

	{'place': {'@supplied': 'yes', 'placeTerm': {'@type': 'text'}}, 'dateCreated': ['9/20/2008', {'@encoding': 'edtf', '@keyDate': 'yes', '#text': '2008-09-20'}]}

	{'place': {'@supplied': 'yes', 'placeTerm': {'@type': 'text'}}, 'dateCreated': ['4/2/1999', {'@encoding': 'edtf', '@keyDate': 'yes', '#text': '1999-04-02'}]}

	{'place': {'@supplied': 'yes', 'placeTerm': {'@type': 'text'}}, 'dateCreated': ['5/17/2008', {'@encoding': 'edtf', '@keyDate': 'yes', '#text': '2008-05-17'}]}

	{'place': {'@supplied': 'yes', 'placeTerm': {'@type': 'text'}}, 'dateCreated': ['2/8/2007', {'@encoding': 'edtf', '@keyDate': 'yes', '#text': '2007-02-08'}]}

	{'place': {'@supplied': 'yes', 'placeTerm': {'@type': 'text'}}, 'dateCreated': ['3/1/1961', {'@encoding': 'edtf', '@keyDate': 'yes', '#text': '1961-03-01'}]}

	{'place': {'@supplied': 'yes', 'placeTerm': {'@type': 'text'}}, 'dateCreated': ['4/15/2010', {'@encoding': 'edtf', '@keyDate': 'yes', '#text': '2010-04-15'}]}

	{'place': {'@supplied': 'yes', 'placeTerm': {'@type': 'text'}}, 'dateCreated': ['2/1/1972', {'@encoding': 'edtf', '@keyDate': 'yes', '#text': '1972-02-01'}]}

	{'place': {'@supplied': 'yes', 'placeTerm': {'@type': 'text'}}, 'dateCreated': ['5/20/2004', {'@encoding': 'edtf', '@keyDate': 'yes', '#text': '2004-05-20'}]}

	{'place': {'@supplied': 'yes', 'placeTerm': {'@type': 'text'}}, 'dateCreated': ['6/16/2004', {'@encoding': 'edtf', '@keyDate': 'yes', '#text': '2004-06-16'}]}

	{'place': {'@supplied': 'yes', 'placeTerm': {'@type': 'text'}}, 'dateCreated': ['9/1/2006', {'@encoding': 'edtf', '@keyDate': 'yes', '#text': '2006-09-01'}]}

	{'place': {'@supplied': 'yes', 'placeTerm': {'@type': 'text'}}, 'dateCreated': ['6/1/1953', {'@encoding': 'edtf', '@keyDate': 'yes', '#text': '1953-06-01'}]}

	{'place': {'@supplied': 'yes', 'placeTerm': {'@type': 'text'}}, 'dateCreated': ['8/1/1954', {'@encoding': 'edtf', '@keyDate': 'yes', '#text': '1954-08-01'}]}

	{'place': {'@supplied': 'yes', 'placeTerm': {'@type': 'text'}}, 'dateCreated': ['6/1/1971', {'@encoding': 'edtf', '@keyDate': 'yes', '#text': '1971-06-01'}]}

	{'place': {'@supplied': 'yes', 'placeTerm': {'@type': 'text'}}, 'dateCreated': ['5/1/1972', {'@encoding': 'edtf', '@keyDate': 'yes', '#text': '1972-05-01'}]}

	{'place': {'@supplied': 'yes', 'placeTerm': {'@type': 'text'}}, 'dateCreated': ['4/2/1961', {'@encoding': 'edtf', '@keyDate': 'yes', '#text': '1961-04-02'}]}

	{'place': {'@supplied': 'yes', 'placeTerm': {'@type': 'text'}}, 'dateCreated': ['5/1/1979', {'@encoding': 'edtf', '@keyDate': 'yes', '#text': '1979-05-01'}]}

	{'place': {'@supplied': 'yes', 'placeTerm': {'@type': 'text'}}, 'dateCreated': ['7/1/1978', {'@encoding': 'edtf', '@keyDate': 'yes', '#text': '1978-07-01'}]}

	{'place': {'@supplied': 'yes', 'placeTerm': {'@type': 'text'}}, 'dateCreated': ['2/1/1979', {'@encoding': 'edtf', '@keyDate': 'yes', '#text': '1979-02-01'}]}

	{'place': {'@supplied': 'yes', 'placeTerm': {'@type': 'text'}}, 'dateCreated': ['3/1/1979', {'@encoding': 'edtf', '@keyDate': 'yes', '#text': '1979-03-01'}]}

	{'place': {'@supplied': 'yes', 'placeTerm': {'@type': 'text'}}, 'dateCreated': ['8/30/2004', {'@encoding': 'edtf', '@keyDate': 'yes', '#text': '2004-08-30'}]}

	{'place': {'@supplied': 'yes', 'placeTerm': {'@type': 'text'}}, 'dateCreated': ['5/25/2008', {'@encoding': 'edtf', '@keyDate': 'yes', '#text': '2008-05-25'}]}

	{'place': {'@supplied': 'yes', 'placeTerm': {'@type': 'text'}}, 'dateCreated': ['8/14/2008', {'@encoding': 'edtf', '@keyDate': 'yes', '#text': '2008-08-14'}]}

	{'place': {'@supplied': 'yes', 'placeTerm': {'@type': 'text'}}, 'dateCreated': ['5/26/2007', {'@encoding': 'edtf', '@keyDate': 'yes', '#text': '2007-05-26'}]}

	{'place': {'@supplied': 'yes', 'placeTerm': {'@type': 'text'}}, 'dateCreated': ['6/3/2006', {'@encoding': 'edtf', '@keyDate': 'yes', '#text': '2006-06-03'}]}

	{'place': {'@supplied': 'yes', 'placeTerm': {'@type': 'text'}}, 'dateCreated': ['8/21/2010', {'@encoding': 'edtf', '@keyDate': 'yes', '#text': '2010-08-21'}]}

	{'place': {'@supplied': 'yes', 'placeTerm': {'@type': 'text'}}, 'dateCreated': ['11/2/2008', {'@encoding': 'edtf', '@keyDate': 'yes', '#text': '2008-11-02'}]}

	{'place': {'@supplied': 'yes', 'placeTerm': {'@type': 'text'}}, 'dateCreated': ['6/16/2009', {'@encoding': 'edtf', '@keyDate': 'yes', '#text': '2009-06-16'}]}

	{'place': {'@supplied': 'yes', 'placeTerm': {'@type': 'text'}}, 'dateCreated': ['6/21/1980', {'@encoding': 'edtf', '@keyDate': 'yes', '#text': '1980-06-21'}]}

	{'place': {'@supplied': 'yes', 'placeTerm': {'@type': 'text'}}, 'dateCreated': ['3/1/1984', {'@encoding': 'edtf', '@keyDate': 'yes', '#text': '1984-03-01'}]}

	{'place': {'@supplied': 'yes', 'placeTerm': {'@type': 'text'}}, 'dateCreated': ['1/1/1955', {'@encoding': 'edtf', '@keyDate': 'yes', '#text': '1955-01-01'}]}

	{'place': {'@supplied': 'yes', 'placeTerm': {'@type': 'text'}}, 'dateCreated': ['8/1/1983', {'@encoding': 'edtf', '@keyDate': 'yes', '#text': '1983-08-01'}]}

	{'place': {'@supplied': 'yes', 'placeTerm': {'@type': 'text'}}, 'dateCreated': ['8/1/1994', {'@encoding': 'edtf', '@keyDate': 'yes', '#text': '1994-08-01'}]}

	{'place': {'@supplied': 'yes', 'placeTerm': {'@type': 'text'}}, 'dateCreated': ['8/24/1999', {'@encoding': 'edtf', '@keyDate': 'yes', '#text': '1999-08-24'}]}

	{'place': {'@supplied': 'yes', 'placeTerm': {'@type': 'text'}}, 'dateCreated': ['6/29/2003', {'@encoding': 'edtf', '@keyDate': 'yes', '#text': '2003-06-29'}]}

	{'place': {'@supplied': 'yes', 'placeTerm': {'@type': 'text'}}, 'dateCreated': ['8/1/2000', {'@encoding': 'edtf', '@keyDate': 'yes', '#text': '2000-08-01'}]}

	{'place': {'@supplied': 'yes', 'placeTerm': {'@type': 'text'}}, 'dateCreated': ['7/1/1981', {'@encoding': 'edtf', '@keyDate': 'yes', '#text': '1981-07-01'}]}

	{'place': {'@supplied': 'yes', 'placeTerm': {'@type': 'text'}}, 'dateCreated': ['7/1/1965', {'@encoding': 'edtf', '@keyDate': 'yes', '#text': '1965-07-01'}]}

	{'place': {'@supplied': 'yes', 'placeTerm': {'@type': 'text'}}, 'dateCreated': ['9/1/1969', {'@encoding': 'edtf', '@keyDate': 'yes', '#text': '1969-09-01'}]}

	{'place': {'@supplied': 'yes', 'placeTerm': {'@type': 'text'}}, 'dateCreated': ['8/1/2002', {'@encoding': 'edtf', '@keyDate': 'yes', '#text': '2002-08-01'}]}

	{'place': {'@supplied': 'yes', 'placeTerm': {'@type': 'text'}}, 'dateCreated': ['9/1/1954', {'@encoding': 'edtf', '@keyDate': 'yes', '#text': '1954-09-01'}]}

	{'place': {'@supplied': 'yes', 'placeTerm': {'@type': 'text'}}, 'dateCreated': ['9/29/2007', {'@encoding': 'edtf', '@keyDate': 'yes', '#text': '2007-09-29'}]}

	{'place': {'@supplied': 'yes', 'placeTerm': {'@type': 'text'}}, 'dateCreated': ['8/19/2000', {'@encoding': 'edtf', '@keyDate': 'yes', '#text': '2000-08-19'}]}

	{'place': {'@supplied': 'yes', 'placeTerm': {'@type': 'text'}}, 'dateCreated': ['7/27/2002', {'@encoding': 'edtf', '@keyDate': 'yes', '#text': '2002-07-27'}]}

	{'place': {'@supplied': 'yes', 'placeTerm': {'@type': 'text'}}, 'dateCreated': ['8/1/1995', {'@encoding': 'edtf', '@keyDate': 'yes', '#text': '1995-08-01'}]}

	{'place': {'@supplied': 'yes', 'placeTerm': {'@type': 'text'}}, 'dateCreated': ['7/6/2003', {'@encoding': 'edtf', '@keyDate': 'yes', '#text': '2003-07-06'}]}

	{'place': {'@supplied': 'yes', 'placeTerm': {'@type': 'text'}}, 'dateCreated': ['9/1/2000', {'@encoding': 'edtf', '@keyDate': 'yes', '#text': '2000-09-01'}]}

	{'place': {'@supplied': 'yes', 'placeTerm': {'@type': 'text'}}, 'dateCreated': ['8/15/1999', {'@encoding': 'edtf', '@keyDate': 'yes', '#text': '1999-08-15'}]}

	{'place': {'@supplied': 'yes', 'placeTerm': {'@type': 'text'}}, 'dateCreated': ['10/13/1955', {'@encoding': 'edtf', '@keyDate': 'yes', '#text': '1955-10-13'}]}

	{'place': {'@supplied': 'yes', 'placeTerm': {'@type': 'text'}}, 'dateCreated': ['7/1/1974', {'@encoding': 'edtf', '@keyDate': 'yes', '#text': '1974-07-01'}]}

	{'place': {'@supplied': 'yes', 'placeTerm': {'@type': 'text'}}, 'dateCreated': ['3/24/2010', {'@encoding': 'edtf', '@keyDate': 'yes', '#text': '2010-03-24'}]}

	{'place': {'@supplied': 'yes', 'placeTerm': {'@type': 'text'}}, 'dateCreated': ['3/30/2010', {'@encoding': 'edtf', '@keyDate': 'yes', '#text': '2010-03-30'}]}

	{'place': {'@supplied': 'yes', 'placeTerm': {'@type': 'text'}}, 'dateCreated': ['3/27/2010', {'@encoding': 'edtf', '@keyDate': 'yes', '#text': '2010-03-27'}]}

	{'place': {'@supplied': 'yes', 'placeTerm': {'@type': 'text'}}, 'dateCreated': ['4/29/2010', {'@encoding': 'edtf', '@keyDate': 'yes', '#text': '2010-04-29'}]}

	{'place': {'@supplied': 'yes', 'placeTerm': {'@type': 'text'}}, 'dateCreated': ['4/10/2010', {'@encoding': 'edtf', '@keyDate': 'yes', '#text': '2010-04-10'}]}

	{'place': {'@supplied': 'yes', 'placeTerm': {'@type': 'text'}}, 'dateCreated': ['7/3/2006', {'@encoding': 'edtf', '@keyDate': 'yes', '#text': '2006-07-03'}]}

	{'place': {'@supplied': 'yes', 'placeTerm': {'@type': 'text'}}, 'dateCreated': ['6/18/2005', {'@encoding': 'edtf', '@keyDate': 'yes', '#text': '2005-06-18'}]}

	{'place': {'@supplied': 'yes', 'placeTerm': {'@type': 'text'}}, 'dateCreated': ['7/1/1999', {'@encoding': 'edtf', '@keyDate': 'yes', '#text': '1999-07-01'}]}

	{'place': {'@supplied': 'yes', 'placeTerm': {'@type': 'text'}}, 'dateCreated': ['4/13/2006', {'@encoding': 'edtf', '@keyDate': 'yes', '#text': '2006-04-13'}]}

	{'place': {'@supplied': 'yes', 'placeTerm': {'@type': 'text'}}, 'dateCreated': ['5/22/2007', {'@encoding': 'edtf', '@keyDate': 'yes', '#text': '2007-05-22'}]}

	{'place': {'@supplied': 'yes', 'placeTerm': {'@type': 'text'}}, 'dateCreated': ['6/27/2006', {'@encoding': 'edtf', '@keyDate': 'yes', '#text': '2006-06-27'}]}

	{'place': {'@supplied': 'yes', 'placeTerm': {'@type': 'text'}}, 'dateCreated': ['5/13/2007', {'@encoding': 'edtf', '@keyDate': 'yes', '#text': '2007-05-13'}]}

	{'place': {'@supplied': 'yes', 'placeTerm': {'@type': 'text'}}, 'dateCreated': ['5/11/2007', {'@encoding': 'edtf', '@keyDate': 'yes', '#text': '2007-05-11'}]}

	{'place': {'@supplied': 'yes', 'placeTerm': {'@type': 'text'}}, 'dateCreated': ['4/15/2008', {'@encoding': 'edtf', '@keyDate': 'yes', '#text': '2008-04-15'}]}

	{'place': {'@supplied': 'yes', 'placeTerm': {'@type': 'text'}}, 'dateCreated': ['3/29/2007', {'@encoding': 'edtf', '@keyDate': 'yes', '#text': '2007-03-29'}]}

	{'place': {'@supplied': 'yes', 'placeTerm': {'@type': 'text'}}, 'dateCreated': ['10/1/1996', {'@encoding': 'edtf', '@keyDate': 'yes', '#text': '1996-10-01'}]}

	{'place': {'@supplied': 'yes', 'placeTerm': {'@type': 'text'}}, 'dateCreated': ['7/1/1986', {'@encoding': 'edtf', '@keyDate': 'yes', '#text': '1986-07-01'}]}

	{'place': {'@supplied': 'yes', 'placeTerm': {'@type': 'text'}}, 'dateCreated': ['7/3/2009', {'@encoding': 'edtf', '@keyDate': 'yes', '#text': '2009-07-03'}]}

	{'place': {'@supplied': 'yes', 'placeTerm': {'@type': 'text'}}, 'dateCreated': ['7/4/2009', {'@encoding': 'edtf', '@keyDate': 'yes', '#text': '2009-07-04'}]}

	{'place': {'@supplied': 'yes', 'placeTerm': {'@type': 'text'}}, 'dateCreated': ['7/26/2003', {'@encoding': 'edtf', '@keyDate': 'yes', '#text': '2003-07-26'}]}

	{'place': {'@supplied': 'yes', 'placeTerm': {'@type': 'text'}}, 'dateCreated': ['7/28/2003', {'@encoding': 'edtf', '@keyDate': 'yes', '#text': '2003-07-28'}]}

	{'place': {'@supplied': 'yes', 'placeTerm': {'@type': 'text'}}, 'dateCreated': ['6/2/2006', {'@encoding': 'edtf', '@keyDate': 'yes', '#text': '2006-06-02'}]}

	{'place': {'@supplied': 'yes', 'placeTerm': {'@type': 'text'}}, 'dateCreated': ['5/19/2009', {'@encoding': 'edtf', '@keyDate': 'yes', '#text': '2009-05-19'}]}

	{'place': {'@supplied': 'yes', 'placeTerm': {'@type': 'text'}}, 'dateCreated': ['4/5/2009', {'@encoding': 'edtf', '@keyDate': 'yes', '#text': '2009-04-05'}]}

	{'place': {'@supplied': 'yes', 'placeTerm': {'@type': 'text'}}, 'dateCreated': ['4/11/2010', {'@encoding': 'edtf', '@keyDate': 'yes', '#text': '2010-04-11'}]}

	{'place': {'@supplied': 'yes', 'placeTerm': {'@type': 'text'}}, 'dateCreated': ['4/1/2006', {'@encoding': 'edtf', '@keyDate': 'yes', '#text': '2006-04-01'}]}

	{'place': {'@supplied': 'yes', 'placeTerm': {'@type': 'text'}}, 'dateCreated': ['3/30/2009', {'@encoding': 'edtf', '@keyDate': 'yes', '#text': '2009-03-30'}]}

	{'place': {'@supplied': 'yes', 'placeTerm': {'@type': 'text'}}, 'dateCreated': ['4/2/2010', {'@encoding': 'edtf', '@keyDate': 'yes', '#text': '2010-04-02'}]}

	{'place': {'@supplied': 'yes', 'placeTerm': {'@type': 'text'}}, 'dateCreated': ['4/4/2010', {'@encoding': 'edtf', '@keyDate': 'yes', '#text': '2010-04-04'}]}

	{'place': {'@supplied': 'yes', 'placeTerm': {'@type': 'text'}}, 'dateCreated': ['4/7/2010', {'@encoding': 'edtf', '@keyDate': 'yes', '#text': '2010-04-07'}]}

	{'place': {'@supplied': 'yes', 'placeTerm': {'@type': 'text'}}, 'dateCreated': ['6/10/2006', {'@encoding': 'edtf', '@keyDate': 'yes', '#text': '2006-06-10'}]}

	{'place': {'@supplied': 'yes', 'placeTerm': {'@type': 'text'}}, 'dateCreated': ['6/6/2006', {'@encoding': 'edtf', '@keyDate': 'yes', '#text': '2006-06-06'}]}

	{'place': {'@supplied': 'yes', 'placeTerm': {'@type': 'text'}}, 'dateCreated': ['6/3/2009', {'@encoding': 'edtf', '@keyDate': 'yes', '#text': '2009-06-03'}]}

	{'place': {'@supplied': 'yes', 'placeTerm': {'@type': 'text'}}, 'dateCreated': ['5/30/2010', {'@encoding': 'edtf', '@keyDate': 'yes', '#text': '2010-05-30'}]}

	{'place': {'@supplied': 'yes', 'placeTerm': {'@type': 'text'}}, 'dateCreated': ['7/10/2010', {'@encoding': 'edtf', '@keyDate': 'yes', '#text': '2010-07-10'}]}

	{'place': {'@supplied': 'yes', 'placeTerm': {'@type': 'text'}}, 'dateCreated': ['11/24/2005', {'@encoding': 'edtf', '@keyDate': 'yes', '#text': '2005-11-24'}]}

	{'place': {'@supplied': 'yes', 'placeTerm': {'@type': 'text'}}, 'dateCreated': ['5/1/2006', {'@encoding': 'edtf', '@keyDate': 'yes', '#text': '2006-05-01'}]}

	{'place': {'@supplied': 'yes', 'placeTerm': {'@type': 'text'}}, 'dateCreated': ['3/25/2007', {'@encoding': 'edtf', '@keyDate': 'yes', '#text': '2007-03-25'}]}

	{'place': {'@supplied': 'yes', 'placeTerm': {'@type': 'text'}}, 'dateCreated': ['3/1/2002', {'@encoding': 'edtf', '@keyDate': 'yes', '#text': '2002-03-01'}]}

	{'place': {'@supplied': 'yes', 'placeTerm': {'@type': 'text'}}, 'dateCreated': ['5/19/2006', {'@encoding': 'edtf', '@keyDate': 'yes', '#text': '2006-05-19'}]}

	{'place': {'@supplied': 'yes', 'placeTerm': {'@type': 'text'}}, 'dateCreated': ['5/22/2008', {'@encoding': 'edtf', '@keyDate': 'yes', '#text': '2008-05-22'}]}

	{'place': {'@supplied': 'yes', 'placeTerm': {'@type': 'text'}}, 'dateCreated': ['5/21/2008', {'@encoding': 'edtf', '@keyDate': 'yes', '#text': '2008-05-21'}]}

	{'place': {'@supplied': 'yes', 'placeTerm': {'@type': 'text'}}, 'dateCreated': ['5/22/2005', {'@encoding': 'edtf', '@keyDate': 'yes', '#text': '2005-05-22'}]}

	{'place': {'@supplied': 'yes', 'placeTerm': {'@type': 'text'}}, 'dateCreated': ['5/29/2005', {'@encoding': 'edtf', '@keyDate': 'yes', '#text': '2005-05-29'}]}

	{'place': {'@supplied': 'yes', 'placeTerm': {'@type': 'text'}}, 'dateCreated': ['5/28/2005', {'@encoding': 'edtf', '@keyDate': 'yes', '#text': '2005-05-28'}]}

	{'place': {'@supplied': 'yes', 'placeTerm': {'@type': 'text'}}, 'dateCreated': ['3/2/2008', {'@encoding': 'edtf', '@keyDate': 'yes', '#text': '2008-03-02'}]}

	{'place': {'@supplied': 'yes', 'placeTerm': {'@type': 'text'}}, 'dateCreated': ['6/1/2005', {'@encoding': 'edtf', '@keyDate': 'yes', '#text': '2005-06-01'}]}

	{'place': {'@supplied': 'yes', 'placeTerm': {'@type': 'text'}}, 'dateCreated': ['5/1/1997', {'@encoding': 'edtf', '@keyDate': 'yes', '#text': '1997-05-01'}]}

	{'place': {'@supplied': 'yes', 'placeTerm': {'@type': 'text'}}, 'dateCreated': ['5/13/2005', {'@encoding': 'edtf', '@keyDate': 'yes', '#text': '2005-05-13'}]}

	{'place': {'@supplied': 'yes', 'placeTerm': {'@type': 'text'}}, 'dateCreated': ['7/15/2010', {'@encoding': 'edtf', '@keyDate': 'yes', '#text': '2010-07-15'}]}

	{'place': {'@supplied': 'yes', 'placeTerm': {'@type': 'text'}}, 'dateCreated': ['7/11/2010', {'@encoding': 'edtf', '@keyDate': 'yes', '#text': '2010-07-11'}]}

	{'place': {'@supplied': 'yes', 'placeTerm': {'@type': 'text'}}, 'dateCreated': ['10/10/2010', {'@encoding': 'edtf', '@keyDate': 'yes', '#text': '2010-10-10'}]}

	{'place': {'@supplied': 'yes', 'placeTerm': {'@type': 'text'}}, 'dateCreated': ['10/17/2010', {'@encoding': 'edtf', '@keyDate': 'yes', '#text': '2010-10-17'}]}

	{'place': {'@supplied': 'yes', 'placeTerm': {'@type': 'text'}}, 'dateCreated': ['10/24/2010', {'@encoding': 'edtf', '@keyDate': 'yes', '#text': '2010-10-24'}]}

	{'place': {'@supplied': 'yes', 'placeTerm': {'@type': 'text'}}, 'dateCreated': ['10/25/2010', {'@encoding': 'edtf', '@keyDate': 'yes', '#text': '2010-10-25'}]}

	{'place': {'@supplied': 'yes', 'placeTerm': {'@type': 'text'}}, 'dateCreated': ['10/29/2010', {'@encoding': 'edtf', '@keyDate': 'yes', '#text': '2010-10-29'}]}

	{'place': {'@supplied': 'yes', 'placeTerm': {'@type': 'text'}}, 'dateCreated': ['10/31/2010', {'@encoding': 'edtf', '@keyDate': 'yes', '#text': '2010-10-31'}]}

	{'place': {'@supplied': 'yes', 'placeTerm': {'@type': 'text'}}, 'dateCreated': ['11/2/2010', {'@encoding': 'edtf', '@keyDate': 'yes', '#text': '2010-11-02'}]}

	{'place': {'@supplied': 'yes', 'placeTerm': {'@type': 'text'}}, 'dateCreated': ['5/13/2008', {'@encoding': 'edtf', '@keyDate': 'yes', '#text': '2008-05-13'}]}

	{'place': {'@supplied': 'yes', 'placeTerm': {'@type': 'text'}}, 'dateCreated': ['2/22/2010', {'@encoding': 'edtf', '@keyDate': 'yes', '#text': '2010-02-22'}]}

	{'place': {'@supplied': 'yes', 'placeTerm': {'@type': 'text'}}, 'dateCreated': ['2/28/2010', {'@encoding': 'edtf', '@keyDate': 'yes', '#text': '2010-02-28'}]}

	{'place': {'@supplied': 'yes', 'placeTerm': {'@type': 'text'}}, 'dateCreated': ['10/6/2002', {'@encoding': 'edtf', '@keyDate': 'yes', '#text': '2002-10-06'}]}

	{'place': {'@supplied': 'yes', 'placeTerm': {'@type': 'text'}}, 'dateCreated': ['9/17/2006', {'@encoding': 'edtf', '@keyDate': 'yes', '#text': '2006-09-17'}]}

	{'place': {'@supplied': 'yes', 'placeTerm': {'@type': 'text'}}, 'dateCreated': ['10/5/2003', {'@encoding': 'edtf', '@keyDate': 'yes', '#text': '2003-10-05'}]}

	{'place': {'@supplied': 'yes', 'placeTerm': {'@type': 'text'}}, 'dateCreated': ['4/1/1965', {'@encoding': 'edtf', '@keyDate': 'yes', '#text': '1965-04-01'}]}

	{'place': {'@supplied': 'yes', 'placeTerm': {'@type': 'text'}}, 'dateCreated': ['4/1/1964', {'@encoding': 'edtf', '@keyDate': 'yes', '#text': '1964-04-01'}]}

	{'place': {'@supplied': 'yes', 'placeTerm': {'@type': 'text'}}, 'dateCreated': ['6/1/2004', {'@encoding': 'edtf', '@keyDate': 'yes', '#text': '2004-06-01'}]}

	{'place': {'@supplied': 'yes', 'placeTerm': {'@type': 'text'}}, 'dateCreated': ['1/1/2000', {'@encoding': 'edtf', '@keyDate': 'yes', '#text': '2000-01-01'}]}

	{'place': {'@supplied': 'yes', 'placeTerm': {'@type': 'text'}}, 'dateCreated': ['10/20/2001', {'@encoding': 'edtf', '@keyDate': 'yes', '#text': '2001-10-20'}]}

	{'place': {'@supplied': 'yes', 'placeTerm': {'@type': 'text'}}, 'dateCreated': ['10/1/1995', {'@encoding': 'edtf', '@keyDate': 'yes', '#text': '1995-10-01'}]}

	{'place': {'@supplied': 'yes', 'placeTerm': {'@type': 'text'}}, 'dateCreated': ['10/1/1974', {'@encoding': 'edtf', '@keyDate': 'yes', '#text': '1974-10-01'}]}

	{'place': {'@supplied': 'yes', 'placeTerm': {'@type': 'text'}}, 'dateCreated': ['10/1/1973', {'@encoding': 'edtf', '@keyDate': 'yes', '#text': '1973-10-01'}]}

	{'place': {'@supplied': 'yes', 'placeTerm': {'@type': 'text'}}, 'dateCreated': ['12/1/1990', {'@encoding': 'edtf', '@keyDate': 'yes', '#text': '1990-12-01'}]}

	{'place': {'@supplied': 'yes', 'placeTerm': {'@type': 'text'}}, 'dateCreated': ['11/23/2000', {'@encoding': 'edtf', '@keyDate': 'yes', '#text': '2000-11-23'}]}

	{'place': {'@supplied': 'yes', 'placeTerm': {'@type': 'text'}}, 'dateCreated': ['11/1/1994', {'@encoding': 'edtf', '@keyDate': 'yes', '#text': '1994-11-01'}]}

	{'place': {'@supplied': 'yes', 'placeTerm': {'@type': 'text'}}, 'dateCreated': ['1/1/1985', {'@encoding': 'edtf', '@keyDate': 'yes', '#text': '1985-01-01'}]}

	{'place': {'@supplied': 'yes', 'placeTerm': {'@type': 'text'}}, 'dateCreated': ['10/1/1964', {'@encoding': 'edtf', '@keyDate': 'yes', '#text': '1964-10-01'}]}

	{'place': {'@supplied': 'yes', 'placeTerm': {'@type': 'text'}}, 'dateCreated': ['9/1/1979', {'@encoding': 'edtf', '@keyDate': 'yes', '#text': '1979-09-01'}]}

	{'place': {'@supplied': 'yes', 'placeTerm': {'@type': 'text'}}, 'dateCreated': ['11/1/1970', {'@encoding': 'edtf', '@keyDate': 'yes', '#text': '1970-11-01'}]}

	{'place': {'@supplied': 'yes', 'placeTerm': {'@type': 'text'}}, 'dateCreated': ['6/3/1997', {'@encoding': 'edtf', '@keyDate': 'yes', '#text': '1997-06-03'}]}

	{'place': {'@supplied': 'yes', 'placeTerm': {'@type': 'text'}}, 'dateCreated': ['3/17/2005', {'@encoding': 'edtf', '@keyDate': 'yes', '#text': '2005-03-17'}]}

	{'place': {'@supplied': 'yes', 'placeTerm': {'@type': 'text'}}, 'dateCreated': ['10/11/2001', {'@encoding': 'edtf', '@keyDate': 'yes', '#text': '2001-10-11'}]}

	{'place': {'@supplied': 'yes', 'placeTerm': {'@type': 'text'}}, 'dateCreated': ['2/1/2000', {'@encoding': 'edtf', '@keyDate': 'yes', '#text': '2000-02-01'}]}

	{'place': {'@supplied': 'yes', 'placeTerm': {'@type': 'text'}}, 'dateCreated': ['2/24/2000', {'@encoding': 'edtf', '@keyDate': 'yes', '#text': '2000-02-24'}]}

	{'place': {'@supplied': 'yes', 'placeTerm': {'@type': 'text'}}, 'dateCreated': ['4/1/1998', {'@encoding': 'edtf', '@keyDate': 'yes', '#text': '1998-04-01'}]}

	{'place': {'@supplied': 'yes', 'placeTerm': {'@type': 'text'}}, 'dateCreated': ['6/1/1963', {'@encoding': 'edtf', '@keyDate': 'yes', '#text': '1963-06-01'}]}

	{'place': {'@supplied': 'yes', 'placeTerm': {'@type': 'text'}}, 'dateCreated': ['1/9/1900', {'@encoding': 'edtf', '@keyDate': 'yes', '#text': '1900-01-09'}]}

	{'place': {'@supplied': 'yes', 'placeTerm': {'@type': 'text'}}, 'dateCreated': ['11/1/1990', {'@encoding': 'edtf', '@keyDate': 'yes', '#text': '1990-11-01'}]}

	{'place': {'@supplied': 'yes', 'placeTerm': {'@type': 'text'}}, 'dateCreated': ['3/1/1967', {'@encoding': 'edtf', '@keyDate': 'yes', '#text': '1967-03-01'}]}

	{'place': {'@supplied': 'yes', 'placeTerm': {'@type': 'text'}}, 'dateCreated': ['10/20/1962', {'@encoding': 'edtf', '@keyDate': 'yes', '#text': '1962-10-20'}]}

	{'place': {'@supplied': 'yes', 'placeTerm': {'@type': 'text'}}, 'dateCreated': ['7/31/2008', {'@encoding': 'edtf', '@keyDate': 'yes', '#text': '2008-07-31'}]}

	{'place': {'@supplied': 'yes', 'placeTerm': {'@type': 'text'}}, 'dateCreated': ['6/14/2009', {'@encoding': 'edtf', '@keyDate': 'yes', '#text': '2009-06-14'}]}

	{'place': {'@supplied': 'yes', 'placeTerm': {'@type': 'text'}}, 'dateCreated': ['7/14/2005', {'@encoding': 'edtf', '@keyDate': 'yes', '#text': '2005-07-14'}]}

	{'place': {'@supplied': 'yes', 'placeTerm': {'@type': 'text'}}, 'dateCreated': ['5/23/2009', {'@encoding': 'edtf', '@keyDate': 'yes', '#text': '2009-05-23'}]}

	{'place': {'@supplied': 'yes', 'placeTerm': {'@type': 'text'}}, 'dateCreated': ['5/30/2009', {'@encoding': 'edtf', '@keyDate': 'yes', '#text': '2009-05-30'}]}

	{'place': {'@supplied': 'yes', 'placeTerm': {'@type': 'text'}}, 'dateCreated': ['3/25/2003', {'@encoding': 'edtf', '@keyDate': 'yes', '#text': '2003-03-25'}]}

	{'place': {'@supplied': 'yes', 'placeTerm': {'@type': 'text'}}, 'dateCreated': ['4/1/2001', {'@encoding': 'edtf', '@keyDate': 'yes', '#text': '2001-04-01'}]}

	{'place': {'@supplied': 'yes', 'placeTerm': {'@type': 'text'}}, 'dateCreated': ['5/26/1953', {'@encoding': 'edtf', '@keyDate': 'yes', '#text': '1953-05-26'}]}

	{'place': {'@supplied': 'yes', 'placeTerm': {'@type': 'text'}}, 'dateCreated': ['10/17/1999', {'@encoding': 'edtf', '@keyDate': 'yes', '#text': '1999-10-17'}]}

	{'place': {'@supplied': 'yes', 'placeTerm': {'@type': 'text'}}, 'dateCreated': ['3/27/2000', {'@encoding': 'edtf', '@keyDate': 'yes', '#text': '2000-03-27'}]}

	{'place': {'@supplied': 'yes', 'placeTerm': {'@type': 'text'}}, 'dateCreated': ['4/7/2005', {'@encoding': 'edtf', '@keyDate': 'yes', '#text': '2005-04-07'}]}

	{'place': {'@supplied': 'yes', 'placeTerm': {'@type': 'text'}}, 'dateCreated': ['4/29/2006', {'@encoding': 'edtf', '@keyDate': 'yes', '#text': '2006-04-29'}]}

	{'place': {'@supplied': 'yes', 'placeTerm': {'@type': 'text'}}, 'dateCreated': ['3/25/2000', {'@encoding': 'edtf', '@keyDate': 'yes', '#text': '2000-03-25'}]}

	{'place': {'@supplied': 'yes', 'placeTerm': {'@type': 'text'}}, 'dateCreated': ['2/6/1999', {'@encoding': 'edtf', '@keyDate': 'yes', '#text': '1999-02-06'}]}

	{'place': {'@supplied': 'yes', 'placeTerm': {'@type': 'text'}}, 'dateCreated': ['2/14/1998', {'@encoding': 'edtf', '@keyDate': 'yes', '#text': '1998-02-14'}]}

	{'place': {'@supplied': 'yes', 'placeTerm': {'@type': 'text'}}, 'dateCreated': ['3/1/1958', {'@encoding': 'edtf', '@keyDate': 'yes', '#text': '1958-03-01'}]}

	{'place': {'@supplied': 'yes', 'placeTerm': {'@type': 'text'}}, 'dateCreated': ['7/14/2001', {'@encoding': 'edtf', '@keyDate': 'yes', '#text': '2001-07-14'}]}

	{'place': {'@supplied': 'yes', 'placeTerm': {'@type': 'text'}}, 'dateCreated': ['7/28/2001', {'@encoding': 'edtf', '@keyDate': 'yes', '#text': '2001-07-28'}]}

	{'place': {'@supplied': 'yes', 'placeTerm': {'@type': 'text'}}, 'dateCreated': ['6/26/2003', {'@encoding': 'edtf', '@keyDate': 'yes', '#text': '2003-06-26'}]}

	{'place': {'@supplied': 'yes', 'placeTerm': {'@type': 'text'}}, 'dateCreated': ['6/21/2003', {'@encoding': 'edtf', '@keyDate': 'yes', '#text': '2003-06-21'}]}

	{'place': {'@supplied': 'yes', 'placeTerm': {'@type': 'text'}}, 'dateCreated': ['10/1/1999', {'@encoding': 'edtf', '@keyDate': 'yes', '#text': '1999-10-01'}]}

	{'place': {'@supplied': 'yes', 'placeTerm': {'@type': 'text'}}, 'dateCreated': ['1/28/1999', {'@encoding': 'edtf', '@keyDate': 'yes', '#text': '1999-01-28'}]}

	{'place': {'@supplied': 'yes', 'placeTerm': {'@type': 'text'}}, 'dateCreated': ['5/1/2001', {'@encoding': 'edtf', '@keyDate': 'yes', '#text': '2001-05-01'}]}

	{'place': {'@supplied': 'yes', 'placeTerm': {'@type': 'text'}}, 'dateCreated': ['11/6/2004', {'@encoding': 'edtf', '@keyDate': 'yes', '#text': '2004-11-06'}]}

	{'place': {'@supplied': 'yes', 'placeTerm': {'@type': 'text'}}, 'dateCreated': ['3/24/2007', {'@encoding': 'edtf', '@keyDate': 'yes', '#text': '2007-03-24'}]}

	{'place': {'@supplied': 'yes', 'placeTerm': {'@type': 'text'}}, 'dateCreated': ['6/20/1989', {'@encoding': 'edtf', '@keyDate': 'yes', '#text': '1989-06-20'}]}

	{'place': {'@supplied': 'yes', 'placeTerm': {'@type': 'text'}}, 'dateCreated': ['6/1/1983', {'@encoding': 'edtf', '@keyDate': 'yes', '#text': '1983-06-01'}]}

	{'place': {'@supplied': 'yes', 'placeTerm': {'@type': 'text'}}, 'dateCreated': ['9/5/1998', {'@encoding': 'edtf', '@keyDate': 'yes', '#text': '1998-09-05'}]}

	{'place': {'@supplied': 'yes', 'placeTerm': {'@type': 'text'}}, 'dateCreated': ['9/1/1999', {'@encoding': 'edtf', '@keyDate': 'yes', '#text': '1999-09-01'}]}

	{'place': {'@supplied': 'yes', 'placeTerm': {'@type': 'text'}}, 'dateCreated': ['9/10/2000', {'@encoding': 'edtf', '@keyDate': 'yes', '#text': '2000-09-10'}]}

	{'place': {'@supplied': 'yes', 'placeTerm': {'@type': 'text'}}, 'dateCreated': ['9/7/2000', {'@encoding': 'edtf', '@keyDate': 'yes', '#text': '2000-09-07'}]}

	{'place': {'@supplied': 'yes', 'placeTerm': {'@type': 'text'}}, 'dateCreated': ['10/1/2000', {'@encoding': 'edtf', '@keyDate': 'yes', '#text': '2000-10-01'}]}

	{'place': {'@supplied': 'yes', 'placeTerm': {'@type': 'text'}}, 'dateCreated': ['10/1/1982', {'@encoding': 'edtf', '@keyDate': 'yes', '#text': '1982-10-01'}]}

	{'place': {'@supplied': 'yes', 'placeTerm': {'@type': 'text'}}, 'dateCreated': ['9/12/1998', {'@encoding': 'edtf', '@keyDate': 'yes', '#text': '1998-09-12'}]}

	{'place': {'@supplied': 'yes', 'placeTerm': {'@type': 'text'}}, 'dateCreated': ['11/1/1982', {'@encoding': 'edtf', '@keyDate': 'yes', '#text': '1982-11-01'}]}

	{'place': {'@supplied': 'yes', 'placeTerm': {'@type': 'text'}}, 'dateCreated': ['4/1/1972', {'@encoding': 'edtf', '@keyDate': 'yes', '#text': '1972-04-01'}]}

	{'place': {'@supplied': 'yes', 'placeTerm': {'@type': 'text'}}, 'dateCreated': ['3/23/1963', {'@encoding': 'edtf', '@keyDate': 'yes', '#text': '1963-03-23'}]}

	{'place': {'@supplied': 'yes', 'placeTerm': {'@type': 'text'}}, 'dateCreated': ['5/9/1999', {'@encoding': 'edtf', '@keyDate': 'yes', '#text': '1999-05-09'}]}

	{'place': {'@supplied': 'yes', 'placeTerm': {'@type': 'text'}}, 'dateCreated': ['8/19/1989', {'@encoding': 'edtf', '@keyDate': 'yes', '#text': '1989-08-19'}]}

	{'place': {'@supplied': 'yes', 'placeTerm': {'@type': 'text'}}, 'dateCreated': ['3/1/1995', {'@encoding': 'edtf', '@keyDate': 'yes', '#text': '1995-03-01'}]}

	{'place': {'@supplied': 'yes', 'placeTerm': {'@type': 'text'}}, 'dateCreated': ['3/14/1999', {'@encoding': 'edtf', '@keyDate': 'yes', '#text': '1999-03-14'}]}

	{'place': {'@supplied': 'yes', 'placeTerm': {'@type': 'text'}}, 'dateCreated': ['9/27/2005', {'@encoding': 'edtf', '@keyDate': 'yes', '#text': '2005-09-27'}]}

	{'place': {'@supplied': 'yes', 'placeTerm': {'@type': 'text'}}, 'dateCreated': ['3/1/1990', {'@encoding': 'edtf', '@keyDate': 'yes', '#text': '1990-03-01'}]}

	{'place': {'@supplied': 'yes', 'placeTerm': {'@type': 'text'}}, 'dateCreated': ['3/1/1992', {'@encoding': 'edtf', '@keyDate': 'yes', '#text': '1992-03-01'}]}

	{'place': {'@supplied': 'yes', 'placeTerm': {'@type': 'text'}}, 'dateCreated': ['2/1/1990', {'@encoding': 'edtf', '@keyDate': 'yes', '#text': '1990-02-01'}]}

	{'place': {'@supplied': 'yes', 'placeTerm': {'@type': 'text'}}, 'dateCreated': ['5/1/1957', {'@encoding': 'edtf', '@keyDate': 'yes', '#text': '1957-05-01'}]}

	{'place': {'@supplied': 'yes', 'placeTerm': {'@type': 'text'}}, 'dateCreated': ['5/1/1969', {'@encoding': 'edtf', '@keyDate': 'yes', '#text': '1969-05-01'}]}

	{'place': {'@supplied': 'yes', 'placeTerm': {'@type': 'text'}}, 'dateCreated': ['4/1/1966', {'@encoding': 'edtf', '@keyDate': 'yes', '#text': '1966-04-01'}]}

	{'place': {'@supplied': 'yes', 'placeTerm': {'@type': 'text'}}, 'dateCreated': ['5/18/2008', {'@encoding': 'edtf', '@keyDate': 'yes', '#text': '2008-05-18'}]}

	{'place': {'@supplied': 'yes', 'placeTerm': {'@type': 'text'}}, 'dateCreated': ['11/20/2010', {'@encoding': 'edtf', '@keyDate': 'yes', '#text': '2010-11-20'}]}

	{'place': {'@supplied': 'yes', 'placeTerm': {'@type': 'text'}}, 'dateCreated': ['3/3/2008', {'@encoding': 'edtf', '@keyDate': 'yes', '#text': '2008-03-03'}]}

	{'place': {'@supplied': 'yes', 'placeTerm': {'@type': 'text'}}, 'dateCreated': ['3/29/2008', {'@encoding': 'edtf', '@keyDate': 'yes', '#text': '2008-03-29'}]}

	{'place': {'@supplied': 'yes', 'placeTerm': {'@type': 'text'}}, 'dateCreated': ['5/1/2005', {'@encoding': 'edtf', '@keyDate': 'yes', '#text': '2005-05-01'}]}

	{'place': {'@supplied': 'yes', 'placeTerm': {'@type': 'text'}}, 'dateCreated': ['7/16/2005', {'@encoding': 'edtf', '@keyDate': 'yes', '#text': '2005-07-16'}]}

	{'place': {'@supplied': 'yes', 'placeTerm': {'@type': 'text'}}, 'dateCreated': ['7/1/2000', {'@encoding': 'edtf', '@keyDate': 'yes', '#text': '2000-07-01'}]}

	{'place': {'@supplied': 'yes', 'placeTerm': {'@type': 'text'}}, 'dateCreated': ['7/14/2000', {'@encoding': 'edtf', '@keyDate': 'yes', '#text': '2000-07-14'}]}

	{'place': {'@supplied': 'yes', 'placeTerm': {'@type': 'text'}}, 'dateCreated': ['7/1/2001', {'@encoding': 'edtf', '@keyDate': 'yes', '#text': '2001-07-01'}]}

	{'place': {'@supplied': 'yes', 'placeTerm': {'@type': 'text'}}, 'dateCreated': ['7/10/2001', {'@encoding': 'edtf', '@keyDate': 'yes', '#text': '2001-07-10'}]}

	{'place': {'@supplied': 'yes', 'placeTerm': {'@type': 'text'}}, 'dateCreated': ['7/22/2001', {'@encoding': 'edtf', '@keyDate': 'yes', '#text': '2001-07-22'}]}

	{'place': {'@supplied': 'yes', 'placeTerm': {'@type': 'text'}}, 'dateCreated': ['8/2/2003', {'@encoding': 'edtf', '@keyDate': 'yes', '#text': '2003-08-02'}]}

	{'place': {'@supplied': 'yes', 'placeTerm': {'@type': 'text'}}, 'dateCreated': ['9/1/1997', {'@encoding': 'edtf', '@keyDate': 'yes', '#text': '1997-09-01'}]}

	{'place': {'@supplied': 'yes', 'placeTerm': {'@type': 'text'}}, 'dateCreated': ['8/3/2002', {'@encoding': 'edtf', '@keyDate': 'yes', '#text': '2002-08-03'}]}

	{'place': {'@supplied': 'yes', 'placeTerm': {'@type': 'text'}}, 'dateCreated': ['6/12/2006', {'@encoding': 'edtf', '@keyDate': 'yes', '#text': '2006-06-12'}]}

	{'place': {'@supplied': 'yes', 'placeTerm': {'@type': 'text'}}, 'dateCreated': ['5/23/2008', {'@encoding': 'edtf', '@keyDate': 'yes', '#text': '2008-05-23'}]}

	{'place': {'@supplied': 'yes', 'placeTerm': {'@type': 'text'}}, 'dateCreated': ['9/18/2008', {'@encoding': 'edtf', '@keyDate': 'yes', '#text': '2008-09-18'}]}

	{'place': {'@supplied': 'yes', 'placeTerm': {'@type': 'text'}}, 'dateCreated': ['9/11/2008', {'@encoding': 'edtf', '@keyDate': 'yes', '#text': '2008-09-11'}]}

	{'place': {'@supplied': 'yes', 'placeTerm': {'@type': 'text'}}, 'dateCreated': ['9/4/2008', {'@encoding': 'edtf', '@keyDate': 'yes', '#text': '2008-09-04'}]}

	{'place': {'@supplied': 'yes', 'placeTerm': {'@type': 'text'}}, 'dateCreated': ['9/14/2008', {'@encoding': 'edtf', '@keyDate': 'yes', '#text': '2008-09-14'}]}

	{'place': {'@supplied': 'yes', 'placeTerm': {'@type': 'text'}}, 'dateCreated': ['8/31/2008', {'@encoding': 'edtf', '@keyDate': 'yes', '#text': '2008-08-31'}]}

	{'place': {'@supplied': 'yes', 'placeTerm': {'@type': 'text'}}, 'dateCreated': ['9/7/2008', {'@encoding': 'edtf', '@keyDate': 'yes', '#text': '2008-09-07'}]}

	{'place': {'@supplied': 'yes', 'placeTerm': {'@type': 'text'}}, 'dateCreated': ['9/16/2008', {'@encoding': 'edtf', '@keyDate': 'yes', '#text': '2008-09-16'}]}

	{'place': {'@supplied': 'yes', 'placeTerm': {'@type': 'text'}}, 'dateCreated': ['5/11/2011', {'@encoding': 'edtf', '@keyDate': 'yes', '#text': '2011-05-11'}]}

	{'place': {'@supplied': 'yes', 'placeTerm': {'@type': 'text'}}, 'dateCreated': ['5/1/1999', {'@encoding': 'edtf', '@keyDate': 'yes', '#text': '1999-05-01'}]}

	{'place': {'@supplied': 'yes', 'placeTerm': {'@type': 'text'}}, 'dateCreated': ['7/1/2002', {'@encoding': 'edtf', '@keyDate': 'yes', '#text': '2002-07-01'}]}

	{'place': {'@supplied': 'yes', 'placeTerm': {'@type': 'text'}}, 'dateCreated': ['7/14/2007', {'@encoding': 'edtf', '@keyDate': 'yes', '#text': '2007-07-14'}]}

	{'place': {'@supplied': 'yes', 'placeTerm': {'@type': 'text'}}, 'dateCreated': ['8/1/1978', {'@encoding': 'edtf', '@keyDate': 'yes', '#text': '1978-08-01'}]}

	{'place': {'@supplied': 'yes', 'placeTerm': {'@type': 'text'}}, 'dateCreated': ['10/7/2000', {'@encoding': 'edtf', '@keyDate': 'yes', '#text': '2000-10-07'}]}

	{'place': {'@supplied': 'yes', 'placeTerm': {'@type': 'text'}}, 'dateCreated': ['8/19/1999', {'@encoding': 'edtf', '@keyDate': 'yes', '#text': '1999-08-19'}]}

	{'place': {'@supplied': 'yes', 'placeTerm': {'@type': 'text'}}, 'dateCreated': ['4/1/1999', {'@encoding': 'edtf', '@keyDate': 'yes', '#text': '1999-04-01'}]}

	{'place': {'@supplied': 'yes', 'placeTerm': {'@type': 'text'}}, 'dateCreated': ['9/1/1974', {'@encoding': 'edtf', '@keyDate': 'yes', '#text': '1974-09-01'}]}

	{'place': {'@supplied': 'yes', 'placeTerm': {'@type': 'text'}}, 'dateCreated': ['11/22/1963', {'@encoding': 'edtf', '@keyDate': 'yes', '#text': '1963-11-22'}]}

	{'place': {'@supplied': 'yes', 'placeTerm': {'@type': 'text'}}, 'dateCreated': ['7/1/1997', {'@encoding': 'edtf', '@keyDate': 'yes', '#text': '1997-07-01'}]}

	{'place': {'@supplied': 'yes', 'placeTerm': {'@type': 'text'}}, 'dateCreated': ['8/26/2010', {'@encoding': 'edtf', '@keyDate': 'yes', '#text': '2010-08-26'}]}

	{'place': {'@supplied': 'yes', 'placeTerm': {'@type': 'text'}}, 'dateCreated': ['8/27/2010', {'@encoding': 'edtf', '@keyDate': 'yes', '#text': '2010-08-27'}]}

	{'place': {'@supplied': 'yes', 'placeTerm': {'@type': 'text'}}, 'dateCreated': ['8/26/2009', {'@encoding': 'edtf', '@keyDate': 'yes', '#text': '2009-08-26'}]}

	{'place': {'@supplied': 'yes', 'placeTerm': {'@type': 'text'}}, 'dateCreated': ['4/30/2009', {'@encoding': 'edtf', '@keyDate': 'yes', '#text': '2009-04-30'}]}

	{'place': {'@supplied': 'yes', 'placeTerm': {'@type': 'text'}}, 'dateCreated': ['5/19/2007', {'@encoding': 'edtf', '@keyDate': 'yes', '#text': '2007-05-19'}]}

	{'place': {'@supplied': 'yes', 'placeTerm': {'@type': 'text'}}, 'dateCreated': ['11/11/2008', {'@encoding': 'edtf', '@keyDate': 'yes', '#text': '2008-11-11'}]}

	{'place': {'@supplied': 'yes', 'placeTerm': {'@type': 'text'}}, 'dateCreated': ['11/18/2006', {'@encoding': 'edtf', '@keyDate': 'yes', '#text': '2006-11-18'}]}

	{'place': {'@supplied': 'yes', 'placeTerm': {'@type': 'text'}}, 'dateCreated': ['4/14/2009', {'@encoding': 'edtf', '@keyDate': 'yes', '#text': '2009-04-14'}]}

	{'place': {'@supplied': 'yes', 'placeTerm': {'@type': 'text'}}, 'dateCreated': ['5/1/2010', {'@encoding': 'edtf', '@keyDate': 'yes', '#text': '2010-05-01'}]}

	{'place': {'@supplied': 'yes', 'placeTerm': {'@type': 'text'}}, 'dateCreated': ['4/28/2010', {'@encoding': 'edtf', '@keyDate': 'yes', '#text': '2010-04-28'}]}

	{'place': {'@supplied': 'yes', 'placeTerm': {'@type': 'text'}}, 'dateCreated': ['4/26/2009', {'@encoding': 'edtf', '@keyDate': 'yes', '#text': '2009-04-26'}]}

	{'place': {'@supplied': 'yes', 'placeTerm': {'@type': 'text'}}, 'dateCreated': ['8/28/2010', {'@encoding': 'edtf', '@keyDate': 'yes', '#text': '2010-08-28'}]}

	{'place': {'@supplied': 'yes', 'placeTerm': {'@type': 'text'}}, 'dateCreated': ['9/5/2010', {'@encoding': 'edtf', '@keyDate': 'yes', '#text': '2010-09-05'}]}

	{'place': {'@supplied': 'yes', 'placeTerm': {'@type': 'text'}}, 'dateCreated': ['9/23/2010', {'@encoding': 'edtf', '@keyDate': 'yes', '#text': '2010-09-23'}]}

	{'place': {'@supplied': 'yes', 'placeTerm': {'@type': 'text'}}, 'dateCreated': ['9/28/2010', {'@encoding': 'edtf', '@keyDate': 'yes', '#text': '2010-09-28'}]}

	{'place': {'@supplied': 'yes', 'placeTerm': {'@type': 'text'}}, 'dateCreated': ['9/30/2010', {'@encoding': 'edtf', '@keyDate': 'yes', '#text': '2010-09-30'}]}

	{'place': {'@supplied': 'yes', 'placeTerm': {'@type': 'text'}}, 'dateCreated': ['10/5/2010', {'@encoding': 'edtf', '@keyDate': 'yes', '#text': '2010-10-05'}]}

	{'place': {'@supplied': 'yes', 'placeTerm': {'@type': 'text'}}, 'dateCreated': ['4/15/2009', {'@encoding': 'edtf', '@keyDate': 'yes', '#text': '2009-04-15'}]}

	{'place': {'@supplied': 'yes', 'placeTerm': {'@type': 'text'}}, 'dateCreated': ['5/16/2008', {'@encoding': 'edtf', '@keyDate': 'yes', '#text': '2008-05-16'}]}

	{'place': {'@supplied': 'yes', 'placeTerm': {'@type': 'text'}}, 'dateCreated': ['1/12/2009', {'@encoding': 'edtf', '@keyDate': 'yes', '#text': '2009-01-12'}]}

	{'place': {'@supplied': 'yes', 'placeTerm': {'@type': 'text'}}, 'dateCreated': ['5/8/2008', {'@encoding': 'edtf', '@keyDate': 'yes', '#text': '2008-05-08'}]}

	{'place': {'@supplied': 'yes', 'placeTerm': {'@type': 'text'}}, 'dateCreated': ['3/7/2010', {'@encoding': 'edtf', '@keyDate': 'yes', '#text': '2010-03-07'}]}

	{'place': {'@supplied': 'yes', 'placeTerm': {'@type': 'text'}}, 'dateCreated': ['2/10/2010', {'@encoding': 'edtf', '@keyDate': 'yes', '#text': '2010-02-10'}]}

	{'place': {'@supplied': 'yes', 'placeTerm': {'@type': 'text'}}, 'dateCreated': ['2/5/2010', {'@encoding': 'edtf', '@keyDate': 'yes', '#text': '2010-02-05'}]}

	{'place': {'@supplied': 'yes', 'placeTerm': {'@type': 'text'}}, 'dateCreated': ['7/1/1983', {'@encoding': 'edtf', '@keyDate': 'yes', '#text': '1983-07-01'}]}

	{'place': {'@supplied': 'yes', 'placeTerm': {'@type': 'text'}}, 'dateCreated': ['6/19/2000', {'@encoding': 'edtf', '@keyDate': 'yes', '#text': '2000-06-19'}]}

	{'place': {'@supplied': 'yes', 'placeTerm': {'@type': 'text'}}, 'dateCreated': ['6/1/1965', {'@encoding': 'edtf', '@keyDate': 'yes', '#text': '1965-06-01'}]}

	{'place': {'@supplied': 'yes', 'placeTerm': {'@type': 'text'}}, 'dateCreated': ['9/2/2008', {'@encoding': 'edtf', '@keyDate': 'yes', '#text': '2008-09-02'}]}

	{'place': {'@supplied': 'yes', 'placeTerm': {'@type': 'text'}}, 'dateCreated': ['4/2/2009', {'@encoding': 'edtf', '@keyDate': 'yes', '#text': '2009-04-02'}]}

	{'place': {'@supplied': 'yes', 'placeTerm': {'@type': 'text'}}, 'dateCreated': ['9/21/2008', {'@encoding': 'edtf', '@keyDate': 'yes', '#text': '2008-09-21'}]}

	{'place': {'@supplied': 'yes', 'placeTerm': {'@type': 'text'}}, 'dateCreated': ['10/5/2008', {'@encoding': 'edtf', '@keyDate': 'yes', '#text': '2008-10-05'}]}

	{'place': {'@supplied': 'yes', 'placeTerm': {'@type': 'text'}}, 'dateCreated': ['9/30/2008', {'@encoding': 'edtf', '@keyDate': 'yes', '#text': '2008-09-30'}]}

	{'place': {'@supplied': 'yes', 'placeTerm': {'@type': 'text'}}, 'dateCreated': ['10/9/2008', {'@encoding': 'edtf', '@keyDate': 'yes', '#text': '2008-10-09'}]}

	{'dateCreated': ['[1925-1967?]', {'@encoding': 'edtf', '@keyDate': 'yes', '@point': 'start', '@qualifier': 'inferred', '#text': '1925'}, {'@encoding': 'edtf', '@keyDate': 'yes', '@point': 'end', '#text': '1967'}]}

	{'dateCreated': ['2/12/1953', {'@encoding': 'edtf', '@keyDate': 'yes', '#text': '1953-02-12'}]}

	{'dateCreated': ['6/15/1951', {'@encoding': 'edtf', '@keyDate': 'yes', '#text': '1951-06-15'}]}

	{'dateCreated': ['1/7/1953', {'@encoding': 'edtf', '@keyDate': 'yes', '#text': '1953-01-07'}]}

	{'dateCreated': ['4/1/1954', {'@encoding': 'edtf', '@keyDate': 'yes', '#text': '1954-04-01'}]}

	{'place': {'@supplied': 'yes', 'placeTerm': {'@type': 'text', '@valueURI': 'http://id.loc.gov/authorities/names/n83023394', '#text': 'Ripley (Tenn.)'}}, 'dateCreated': ['10/1/1958', {'@encoding': 'edtf', '@keyDate': 'yes', '#text': '1958-10-01'}]}

	{'place': {'@supplied': 'yes', 'placeTerm': {'@type': 'text', '@valueURI': 'http://id.loc.gov/authorities/names/n79100849', '#text': 'Oak Ridge (Tenn.)'}}, 'dateCreated': ['10/1/1958', {'@encoding': 'edtf', '@keyDate': 'yes', '#text': '1958-10-01'}]}

	{'place': {'@supplied': 'yes', 'placeTerm': {'@type': 'text', '@valueURI': 'http://id.loc.gov/authorities/names/n79115394', '#text': 'Bermuda Islands'}}, 'dateCreated': ['[1925-1967?]', {'@encoding': 'edtf', '@keyDate': 'yes', '@point': 'start', '@qualifier': 'inferred', '#text': '1925'}, {'@encoding': 'edtf', '@keyDate': 'yes', '@point': 'end', '#text': '1967'}]}

	{'place': [{'@supplied': 'yes', 'placeTerm': {'@type': 'text', '#text': 'Windmill Points (Va.)'}}, {'@supplied': 'yes', 'placeTerm': {'@type': 'text', '@valueURI': 'http://id.loc.gov/authorities/names/n79022909', '#text': 'Virginia'}}], 'dateCreated': ['5/8/1932', {'@encoding': 'edtf', '@keyDate': 'yes', '#text': '1932-05-08'}]}

	{'dateCreated': ['9/1/1961', {'@encoding': 'edtf', '@keyDate': 'yes', '#text': '1961-09-01'}]}

	{'place': [{'@supplied': 'yes', 'placeTerm': {'@type': 'text', '#text': 'Chowringhee Centre, Kolkata (India)'}}, {'@supplied': 'yes', 'placeTerm': {'@type': 'text', '@valueURI': 'http://id.loc.gov/authorities/names/n2012073732', '#text': 'Kolkata (India)'}}], 'dateCreated': ['[1925-1967?]', {'@encoding': 'edtf', '@keyDate': 'yes', '@point': 'start', '@qualifier': 'inferred', '#text': '1925'}, {'@encoding': 'edtf', '@keyDate': 'yes', '@point': 'end', '#text': '1967'}]}

	{'place': [{'@supplied': 'yes', 'placeTerm': {'@type': 'text', '#text': 'Chowringhee Centre, Kolkata (India)'}}, {'@supplied': 'yes', 'placeTerm': {'@type': 'text', '@valueURI': 'http://id.loc.gov/authorities/names/n2012073732', '#text': 'Kolkata (India)'}}], 'dateCreated': ['9/30/1955', {'@encoding': 'edtf', '@keyDate': 'yes', '#text': '1955-09-30'}]}

	{'place': {'@supplied': 'yes', 'placeTerm': {'@type': 'text', '@valueURI': 'http://id.loc.gov/authorities/names/n79087976', '#text': 'Tazewell (Tenn.)'}}, 'dateCreated': ['[1925-1967?]', {'@encoding': 'edtf', '@keyDate': 'yes', '@point': 'start', '@qualifier': 'inferred', '#text': '1925'}, {'@encoding': 'edtf', '@keyDate': 'yes', '@point': 'end', '#text': '1967'}]}

	{'place': {'@supplied': 'yes', 'placeTerm': {'@type': 'text', '@valueURI': 'http://id.loc.gov/authorities/names/n83024601', '#text': 'La Follette (Tenn.)'}}, 'dateCreated': ['[1925-1967?]', {'@encoding': 'edtf', '@keyDate': 'yes', '@point': 'start', '@qualifier': 'inferred', '#text': '1925'}, {'@encoding': 'edtf', '@keyDate': 'yes', '@point': 'end', '#text': '1967'}]}

	{'place': {'@supplied': 'yes', 'placeTerm': {'@type': 'text', '@valueURI': 'http://id.loc.gov/authorities/names/n96046228', '#text': 'McMinnville (Tenn.)'}}, 'dateCreated': ['[1925-1967?]', {'@encoding': 'edtf', '@keyDate': 'yes', '@point': 'start', '@qualifier': 'inferred', '#text': '1925'}, {'@encoding': 'edtf', '@keyDate': 'yes', '@point': 'end', '#text': '1967'}]}

	{'dateCreated': ['3/1/1957', {'@encoding': 'edtf', '@keyDate': 'yes', '#text': '1957-03-01'}]}

	{'dateCreated': ['1/1/1963', {'@encoding': 'edtf', '@keyDate': 'yes', '#text': '1963-01-01'}]}

	{'place': {'@supplied': 'yes', 'placeTerm': {'@type': 'text', '@valueURI': 'http://id.loc.gov/authorities/names/n79021953', '#text': 'Oregon'}}, 'dateCreated': ['[1925-1967?]', {'@encoding': 'edtf', '@keyDate': 'yes', '@point': 'start', '@qualifier': 'inferred', '#text': '1925'}, {'@encoding': 'edtf', '@keyDate': 'yes', '@point': 'end', '#text': '1967'}]}

	{'place': {'@supplied': 'yes', 'placeTerm': {'@type': 'text', '@valueURI': 'http://id.loc.gov/authorities/names/n83205419', '#text': 'Redmond (Or.)'}}, 'dateCreated': ['[1925-1967?]', {'@encoding': 'edtf', '@keyDate': 'yes', '@point': 'start', '@qualifier': 'inferred', '#text': '1925'}, {'@encoding': 'edtf', '@keyDate': 'yes', '@point': 'end', '#text': '1967'}]}

	{'place': {'@supplied': 'yes', 'placeTerm': {'@type': 'text', '@valueURI': 'http://id.loc.gov/authorities/names/n82063401', '#text': 'Jackson (Tenn.)'}}, 'dateCreated': ['[1925-1967?]', {'@encoding': 'edtf', '@keyDate': 'yes', '@point': 'start', '@qualifier': 'inferred', '#text': '1925'}, {'@encoding': 'edtf', '@keyDate': 'yes', '@point': 'end', '#text': '1967'}]}

	{'place': {'@supplied': 'yes', 'placeTerm': {'@type': 'text', '@valueURI': 'http://id.loc.gov/authorities/names/n82273698', '#text': 'Savannah (Tenn.)'}}, 'dateCreated': ['7/29/1957', {'@encoding': 'edtf', '@keyDate': 'yes', '#text': '1957-07-29'}]}

	{'place': {'@supplied': 'yes', 'placeTerm': {'@type': 'text', '@valueURI': 'http://id.loc.gov/authorities/names/n85081939', '#text': 'Madisonville (Tenn.)'}}, 'dateCreated': ['[1925-1967?]', {'@encoding': 'edtf', '@keyDate': 'yes', '@point': 'start', '@qualifier': 'inferred', '#text': '1925'}, {'@encoding': 'edtf', '@keyDate': 'yes', '@point': 'end', '#text': '1967'}]}

	{'dateCreated': ['1908', {'@encoding': 'edtf', '@keyDate': 'yes', '#text': '1908'}]}

	{'place': {'@supplied': 'yes', 'placeTerm': {'@type': 'text', '@valueURI': 'http://id.loc.gov/authorities/names/n82020480', '#text': 'Hot Springs (Ark.)'}}, 'dateCreated': ['1923', {'@encoding': 'edtf', '@keyDate': 'yes', '#text': '1923'}]}

	{'place': {'@supplied': 'yes', 'placeTerm': {'@type': 'text', '@valueURI': 'http://id.loc.gov/authorities/names/n79034503', '#text': 'Arkansas'}}, 'dateCreated': ['[1925-1967?]', {'@encoding': 'edtf', '@keyDate': 'yes', '@point': 'start', '@qualifier': 'inferred', '#text': '1925'}, {'@encoding': 'edtf', '@keyDate': 'yes', '@point': 'end', '#text': '1967'}]}

	{'dateCreated': ['11/1/1962', {'@encoding': 'edtf', '@keyDate': 'yes', '#text': '1962-11-01'}]}

	{'dateCreated': ['1919', {'@encoding': 'edtf', '@keyDate': 'yes', '#text': '1919'}]}

	{'place': {'@supplied': 'yes', 'placeTerm': {'@type': 'text', '@valueURI': 'http://id.loc.gov/authorities/subjects/sh90004196', '#text': 'Roan Mountain (N.C. and Tenn.)'}}, 'dateCreated': ['1954', {'@encoding': 'edtf', '@keyDate': 'yes', '#text': '1954'}]}

	{'place': {'@supplied': 'yes', 'placeTerm': {'@type': 'text', '@valueURI': 'http://id.loc.gov/authorities/names/n79006971', '#text': 'Spain'}}, 'dateCreated': ['[1925-1967?]', {'@encoding': 'edtf', '@keyDate': 'yes', '@point': 'start', '@qualifier': 'inferred', '#text': '1925'}, {'@encoding': 'edtf', '@keyDate': 'yes', '@point': 'end', '#text': '1967'}]}

	{'dateCreated': ['1905', {'@encoding': 'edtf', '@keyDate': 'yes', '#text': '1905'}]}

	{'place': {'@supplied': 'yes', 'placeTerm': {'@type': 'text', '@valueURI': 'http://id.loc.gov/authorities/names/n80037799', '#text': 'Monroe County (Tenn.)'}}, 'dateCreated': ['[1925-1967?]', {'@encoding': 'edtf', '@keyDate': 'yes', '@point': 'start', '@qualifier': 'inferred', '#text': '1925'}, {'@encoding': 'edtf', '@keyDate': 'yes', '@point': 'end', '#text': '1967'}]}

	{'place': {'@supplied': 'yes', 'placeTerm': {'@type': 'text', '@valueURI': 'http://id.loc.gov/authorities/names/n80037799', '#text': 'Monroe County (Tenn.)'}}, 'dateCreated': ['1920', {'@encoding': 'edtf', '@keyDate': 'yes', '#text': '1920'}]}

	{'dateCreated': ['8/6/1957', {'@encoding': 'edtf', '@keyDate': 'yes', '#text': '1957-08-06'}]}

	{'place': {'@supplied': 'yes', 'placeTerm': {'@type': 'text', '@valueURI': 'http://id.loc.gov/authorities/names/n80113486', '#text': 'Highland Park (Ill.)'}}, 'dateCreated': ['11/18/1951', {'@encoding': 'edtf', '@keyDate': 'yes', '#text': '1951-11-18'}]}

	{'place': {'@supplied': 'yes', 'placeTerm': {'@type': 'text', '@valueURI': 'http://id.loc.gov/authorities/names/n82063401', '#text': 'Jackson (Tenn.)'}}, 'dateCreated': ['7/14/1951', {'@encoding': 'edtf', '@keyDate': 'yes', '#text': '1951-07-14'}]}

	{'place': {'@supplied': 'yes', 'placeTerm': {'@type': 'text', '@valueURI': 'http://id.loc.gov/authorities/names/n94077173', '#text': 'Alpine (San Diego County, Calif.)'}}, 'dateCreated': ['[1925-1967?]', {'@encoding': 'edtf', '@keyDate': 'yes', '@point': 'start', '@qualifier': 'inferred', '#text': '1925'}, {'@encoding': 'edtf', '@keyDate': 'yes', '@point': 'end', '#text': '1967'}]}

	{'place': {'@supplied': 'yes', 'placeTerm': {'@type': 'text', '@valueURI': 'http://id.loc.gov/authorities/names/n82005757', '#text': 'Waterloo (Iowa)'}}, 'dateCreated': ['10/1/1956', {'@encoding': 'edtf', '@keyDate': 'yes', '#text': '1956-10-01'}]}

	{'place': {'@supplied': 'yes', 'placeTerm': {'@type': 'text', '@valueURI': 'http://id.loc.gov/authorities/names/n84065028', '#text': 'Charles City (Iowa)'}}, 'dateCreated': ['3/19/1959', {'@encoding': 'edtf', '@keyDate': 'yes', '#text': '1959-03-19'}]}

	{'place': {'@supplied': 'yes', 'placeTerm': {'@type': 'text', '@valueURI': 'http://id.loc.gov/authorities/names/n82005757', '#text': 'Waterloo (Iowa)'}}, 'dateCreated': ['3/19/1959', {'@encoding': 'edtf', '@keyDate': 'yes', '#text': '1959-03-19'}]}

	{'dateCreated': ['1956', {'@encoding': 'edtf', '@keyDate': 'yes', '#text': '1956'}]}

	{'dateCreated': ['7/17/1950', {'@encoding': 'edtf', '@keyDate': 'yes', '#text': '1950-07-17'}]}

	{'dateCreated': ['9/19/1956', {'@encoding': 'edtf', '@keyDate': 'yes', '#text': '1956-09-19'}]}

	{'place': {'@supplied': 'yes', 'placeTerm': {'@type': 'text', '@valueURI': 'http://id.loc.gov/authorities/names/n79022909', '#text': 'Virginia'}}, 'dateCreated': ['8/1/1960', {'@encoding': 'edtf', '@keyDate': 'yes', '#text': '1960-08-01'}]}

	{'place': {'@supplied': 'yes', 'placeTerm': {'@type': 'text', '@valueURI': 'http://id.loc.gov/authorities/names/n80060996', '#text': 'Virginia Beach (Va.)'}}, 'dateCreated': ['8/1/1960', {'@encoding': 'edtf', '@keyDate': 'yes', '#text': '1960-08-01'}]}

	{'place': {'@supplied': 'yes', 'placeTerm': {'@type': 'text', '@valueURI': 'http://id.loc.gov/authorities/names/n86079794', '#text': 'Put-in-Bay (Ohio)'}}, 'dateCreated': ['8/15/1953', {'@encoding': 'edtf', '@keyDate': 'yes', '#text': '1953-08-15'}]}

	{'place': [{'@supplied': 'yes', 'placeTerm': {'@type': 'text', '#text': 'Palatra (Fla.)'}}, {'@supplied': 'yes', 'placeTerm': {'@type': 'text', '@valueURI': 'http://id.loc.gov/authorities/names/n79053995', '#text': 'Florida'}}], 'dateCreated': ['[1925-1967?]', {'@encoding': 'edtf', '@keyDate': 'yes', '@point': 'start', '@qualifier': 'inferred', '#text': '1925'}, {'@encoding': 'edtf', '@keyDate': 'yes', '@point': 'end', '#text': '1967'}]}

	{'place': {'@supplied': 'yes', 'placeTerm': {'@type': 'text', '@valueURI': 'http://id.loc.gov/authorities/names/n79032186', '#text': 'Vietnam'}}, 'dateCreated': ['[1925-1967?]', {'@encoding': 'edtf', '@keyDate': 'yes', '@point': 'start', '@qualifier': 'inferred', '#text': '1925'}, {'@encoding': 'edtf', '@keyDate': 'yes', '@point': 'end', '#text': '1967'}]}

	{'place': {'@supplied': 'yes', 'placeTerm': {'@type': 'text', '@valueURI': 'http://id.loc.gov/authorities/names/n86079794', '#text': 'Put-in-Bay (Ohio)'}}, 'dateCreated': ['9/1/1953', {'@encoding': 'edtf', '@keyDate': 'yes', '#text': '1953-09-01'}]}

	{'place': {'@supplied': 'yes', 'placeTerm': {'@type': 'text', '@valueURI': 'http://id.loc.gov/authorities/names/n83205380', '#text': 'Emmett (Idaho)'}}, 'dateCreated': ['5/1/1941', {'@encoding': 'edtf', '@keyDate': 'yes', '#text': '1941-05-01'}]}

	{'dateCreated': ['1922', {'@encoding': 'edtf', '@keyDate': 'yes', '#text': '1922'}]}

	{'place': {'@supplied': 'yes', 'placeTerm': {'@type': 'text', '@valueURI': 'http://id.loc.gov/authorities/names/n82020480', '#text': 'Hot Springs (Ark.)'}}, 'dateCreated': ['[1925-1967?]', {'@encoding': 'edtf', '@keyDate': 'yes', '@point': 'start', '@qualifier': 'inferred', '#text': '1925'}, {'@encoding': 'edtf', '@keyDate': 'yes', '@point': 'end', '#text': '1967'}]}

	{'place': {'@supplied': 'yes', 'placeTerm': {'@type': 'text', '@valueURI': 'http://id.loc.gov/authorities/names/n79109786', '#text': 'Knoxville (Tenn.)'}}, 'dateCreated': ['[1925-1967?]', {'@encoding': 'edtf', '@keyDate': 'yes', '@point': 'start', '@qualifier': 'inferred', '#text': '1925'}, {'@encoding': 'edtf', '@keyDate': 'yes', '@point': 'end', '#text': '1967'}]}

	{'place': {'@supplied': 'yes', 'placeTerm': {'@type': 'text', '@valueURI': 'http://id.loc.gov/authorities/names/n82124044', '#text': 'Loudon (Tenn.)'}}, 'dateCreated': ['7/4/1958', {'@encoding': 'edtf', '@keyDate': 'yes', '#text': '1958-07-04'}]}

	{'place': {'@supplied': 'yes', 'placeTerm': {'@type': 'text', '@valueURI': 'http://id.loc.gov/authorities/names/n79075123', '#text': 'Chattanooga (Tenn.)'}}, 'dateCreated': ['8/4/1944', {'@encoding': 'edtf', '@keyDate': 'yes', '#text': '1944-08-04'}]}

	{'place': {'@supplied': 'yes', 'placeTerm': {'@type': 'text', '@valueURI': 'http://id.loc.gov/authorities/names/n80040520', '#text': 'Gatlinburg (Tenn.)'}}, 'dateCreated': ['9/1/1958', {'@encoding': 'edtf', '@keyDate': 'yes', '#text': '1958-09-01'}]}

	{'place': {'@supplied': 'yes', 'placeTerm': {'@type': 'text', '@valueURI': 'http://id.loc.gov/authorities/names/n79053995', '#text': 'Florida'}}, 'dateCreated': ['3/16/1949', {'@encoding': 'edtf', '@keyDate': 'yes', '#text': '1949-03-16'}]}

	{'dateCreated': ['2/19/1960', {'@encoding': 'edtf', '@keyDate': 'yes', '#text': '1960-02-19'}]}

	{'dateCreated': ['2/20/1960', {'@encoding': 'edtf', '@keyDate': 'yes', '#text': '1960-02-20'}]}

	{'dateCreated': ['1935', {'@encoding': 'edtf', '@keyDate': 'yes', '#text': '1935'}]}

	{'place': {'@supplied': 'yes', 'placeTerm': {'@type': 'text', '@valueURI': 'http://id.loc.gov/authorities/names/n79109786', '#text': 'Knoxville (Tenn.)'}}, 'dateCreated': ['1953', {'@encoding': 'edtf', '@keyDate': 'yes', '#text': '1953'}]}

	{'place': {'@supplied': 'yes', 'placeTerm': {'@type': 'text', '@valueURI': 'http://id.loc.gov/authorities/names/n95053102', '#text': 'Lookout Mountain (Tenn.)'}}, 'dateCreated': ['1940', {'@encoding': 'edtf', '@keyDate': 'yes', '#text': '1940'}]}

	{'place': {'@supplied': 'yes', 'placeTerm': {'@type': 'text', '@valueURI': 'http://id.loc.gov/authorities/names/n82056085', '#text': 'Laconia (N.H.)'}}, 'dateCreated': ['[1925-1967?]', {'@encoding': 'edtf', '@keyDate': 'yes', '@point': 'start', '@qualifier': 'inferred', '#text': '1925'}, {'@encoding': 'edtf', '@keyDate': 'yes', '@point': 'end', '#text': '1967'}]}

	{'place': {'@supplied': 'yes', 'placeTerm': {'@type': 'text', '@valueURI': 'http://id.loc.gov/authorities/names/n79075123', '#text': 'Chattanooga (Tenn.)'}}, 'dateCreated': ['[1925-1967?]', {'@encoding': 'edtf', '@keyDate': 'yes', '@point': 'start', '@qualifier': 'inferred', '#text': '1925'}, {'@encoding': 'edtf', '@keyDate': 'yes', '@point': 'end', '#text': '1967'}]}

	{'place': {'@supplied': 'yes', 'placeTerm': {'@type': 'text', '@valueURI': 'http://id.loc.gov/authorities/names/n80014439', '#text': 'Portsmouth (N.H.)'}}, 'dateCreated': ['[1925-1967?]', {'@encoding': 'edtf', '@keyDate': 'yes', '@point': 'start', '@qualifier': 'inferred', '#text': '1925'}, {'@encoding': 'edtf', '@keyDate': 'yes', '@point': 'end', '#text': '1967'}]}

	{'place': {'@supplied': 'yes', 'placeTerm': {'@type': 'text', '@valueURI': 'http://id.loc.gov/authorities/names/n80040520', '#text': 'Gatlinburg (Tenn.)'}}, 'dateCreated': ['[1925-1967?]', {'@encoding': 'edtf', '@keyDate': 'yes', '@point': 'start', '@qualifier': 'inferred', '#text': '1925'}, {'@encoding': 'edtf', '@keyDate': 'yes', '@point': 'end', '#text': '1967'}]}

	{'place': {'@supplied': 'yes', 'placeTerm': {'@type': 'text', '@valueURI': 'http://id.loc.gov/authorities/names/n82076113', '#text': 'Southern Pines (N.C.)'}}, 'dateCreated': ['[1925-1967?]', {'@encoding': 'edtf', '@keyDate': 'yes', '@point': 'start', '@qualifier': 'inferred', '#text': '1925'}, {'@encoding': 'edtf', '@keyDate': 'yes', '@point': 'end', '#text': '1967'}]}

	{'place': {'@supplied': 'yes', 'placeTerm': {'@type': 'text', '@valueURI': 'http://id.loc.gov/authorities/names/n85064013', '#text': 'Mitchell (S.D.)'}}, 'dateCreated': ['[1925-1967?]', {'@encoding': 'edtf', '@keyDate': 'yes', '@point': 'start', '@qualifier': 'inferred', '#text': '1925'}, {'@encoding': 'edtf', '@keyDate': 'yes', '@point': 'end', '#text': '1967'}]}

	{'dateCreated': ['9/1/1956', {'@encoding': 'edtf', '@keyDate': 'yes', '#text': '1956-09-01'}]}

	{'place': {'@supplied': 'yes', 'placeTerm': {'@type': 'text', '@valueURI': 'http://id.loc.gov/authorities/names/n79022909', '#text': 'Virginia'}}, 'dateCreated': ['9/1/1956', {'@encoding': 'edtf', '@keyDate': 'yes', '#text': '1956-09-01'}]}

	{'place': {'@supplied': 'yes', 'placeTerm': {'@type': 'text', '@valueURI': 'http://id.loc.gov/authorities/names/n81066308', '#text': 'Grants Pass (Or.)'}}, 'dateCreated': ['5/15/1952', {'@encoding': 'edtf', '@keyDate': 'yes', '#text': '1952-05-15'}]}

	{'place': {'@supplied': 'yes', 'placeTerm': {'@type': 'text', '@valueURI': 'http://id.loc.gov/authorities/names/n80046126', '#text': 'Michigan'}}, 'dateCreated': ['10/1/1956', {'@encoding': 'edtf', '@keyDate': 'yes', '#text': '1956-10-01'}]}

	{'dateCreated': ['2/5/1954', {'@encoding': 'edtf', '@keyDate': 'yes', '#text': '1954-02-05'}]}

	{'place': {'@supplied': 'yes', 'placeTerm': {'@type': 'text', '@valueURI': 'http://id.loc.gov/authorities/names/n50055702', '#text': 'Great Falls (Mont.)'}}, 'dateCreated': ['3/21/1956', {'@encoding': 'edtf', '@keyDate': 'yes', '#text': '1956-03-21'}]}

	{'place': {'@supplied': 'yes', 'placeTerm': {'@type': 'text', '@valueURI': 'http://id.loc.gov/authorities/names/n81066308', '#text': 'Grants Pass (Or.)'}}, 'dateCreated': ['5/1/1952', {'@encoding': 'edtf', '@keyDate': 'yes', '#text': '1952-05-01'}]}

	{'dateCreated': ['1948', {'@encoding': 'edtf', '@keyDate': 'yes', '#text': '1948'}]}

	{'place': {'@supplied': 'yes', 'placeTerm': {'@type': 'text', '@valueURI': 'http://id.loc.gov/authorities/names/n84112173', '#text': 'Rockwood (Tenn.)'}}, 'dateCreated': ['1948', {'@encoding': 'edtf', '@keyDate': 'yes', '#text': '1948'}]}

	{'place': {'@supplied': 'yes', 'placeTerm': {'@type': 'text', '@valueURI': 'http://id.loc.gov/authorities/names/n79045553', '#text': 'Boston (Mass.)'}}, 'dateCreated': ['1952', {'@encoding': 'edtf', '@keyDate': 'yes', '#text': '1952'}]}

	{'place': [{'@supplied': 'yes', 'placeTerm': {'@type': 'text', '#text': 'Saulico (Calif.)'}}, {'@supplied': 'yes', 'placeTerm': {'@type': 'text', '@valueURI': 'http://id.loc.gov/authorities/names/n79041717', '#text': 'California'}}], 'dateCreated': ['5/26/1952', {'@encoding': 'edtf', '@keyDate': 'yes', '#text': '1952-05-26'}]}

	{'place': {'@supplied': 'yes', 'placeTerm': {'@type': 'text', '@valueURI': 'http://id.loc.gov/authorities/names/n79041717', '#text': 'California'}}, 'dateCreated': ['1952', {'@encoding': 'edtf', '@keyDate': 'yes', '#text': '1952'}]}

	{'place': {'@supplied': 'yes', 'placeTerm': {'@type': 'text', '@valueURI': 'http://id.loc.gov/authorities/names/n79064631', '#text': 'Tucson (Ariz.)'}}, 'dateCreated': ['[1925-1967?]', {'@encoding': 'edtf', '@keyDate': 'yes', '@point': 'start', '@qualifier': 'inferred', '#text': '1925'}, {'@encoding': 'edtf', '@keyDate': 'yes', '@point': 'end', '#text': '1967'}]}

	{'place': {'@supplied': 'yes', 'placeTerm': {'@type': 'text', '@valueURI': 'http://id.loc.gov/authorities/names/n99044828', '#text': 'Lincoln (N.H.)'}}, 'dateCreated': ['3/8/1952', {'@encoding': 'edtf', '@keyDate': 'yes', '#text': '1952-03-08'}]}

	{'place': {'@supplied': 'yes', 'placeTerm': {'@type': 'text', '@valueURI': 'http://id.loc.gov/authorities/names/n82056085', '#text': 'Laconia (N.H.)'}}, 'dateCreated': ['2/1/1952', {'@encoding': 'edtf', '@keyDate': 'yes', '#text': '1952-02-01'}]}

	{'place': {'@supplied': 'yes', 'placeTerm': {'@type': 'text', '@valueURI': 'http://id.loc.gov/authorities/names/n81042707', '#text': 'Manchester (N.H.)'}}, 'dateCreated': ['3/10/1952', {'@encoding': 'edtf', '@keyDate': 'yes', '#text': '1952-03-10'}]}

	{'place': {'@supplied': 'yes', 'placeTerm': {'@type': 'text', '@valueURI': 'http://id.loc.gov/authorities/names/n79005595', '#text': 'New Mexico'}}, 'dateCreated': ['4/20/1952', {'@encoding': 'edtf', '@keyDate': 'yes', '#text': '1952-04-20'}]}

	{'place': {'@supplied': 'yes', 'placeTerm': {'@type': 'text', '@valueURI': 'http://id.loc.gov/authorities/names/n79079329', '#text': 'Albuquerque (N.M.)'}}, 'dateCreated': ['5/25/1952', {'@encoding': 'edtf', '@keyDate': 'yes', '#text': '1952-05-25'}]}

	{'place': {'@supplied': 'yes', 'placeTerm': {'@type': 'text', '@valueURI': 'http://id.loc.gov/authorities/names/n79007751', '#text': 'New York (N.Y.)'}}, 'dateCreated': ['4/4/1952', {'@encoding': 'edtf', '@keyDate': 'yes', '#text': '1952-04-04'}]}

	{'place': {'@supplied': 'yes', 'placeTerm': {'@type': 'text', '@valueURI': 'http://id.loc.gov/authorities/names/n79049197', '#text': 'Ohio'}}, 'dateCreated': ['1956', {'@encoding': 'edtf', '@keyDate': 'yes', '#text': '1956'}]}

	{'place': {'@supplied': 'yes', 'placeTerm': {'@type': 'text', '@valueURI': 'http://id.loc.gov/authorities/names/n79086863', '#text': 'Cleveland (Ohio)'}}, 'dateCreated': ['1956', {'@encoding': 'edtf', '@keyDate': 'yes', '#text': '1956'}]}

	{'place': {'@supplied': 'yes', 'placeTerm': {'@type': 'text', '@valueURI': 'http://id.loc.gov/authorities/names/n79086863', '#text': 'Cleveland (Ohio)'}}, 'dateCreated': ['2/15/1956', {'@encoding': 'edtf', '@keyDate': 'yes', '#text': '1956-02-15'}]}

	{'dateCreated': ['8/22/1956', {'@encoding': 'edtf', '@keyDate': 'yes', '#text': '1956-08-22'}]}

	{'place': {'@supplied': 'yes', 'placeTerm': {'@type': 'text', '@valueURI': 'http://id.loc.gov/authorities/names/n79018774', '#text': 'Washington (D.C.)'}}, 'dateCreated': ['[1925-1967?]', {'@encoding': 'edtf', '@keyDate': 'yes', '@point': 'start', '@qualifier': 'inferred', '#text': '1925'}, {'@encoding': 'edtf', '@keyDate': 'yes', '@point': 'end', '#text': '1967'}]}

	{'place': {'@supplied': 'yes', 'placeTerm': {'@type': 'text', '@valueURI': 'http://id.loc.gov/authorities/names/n81068040', '#text': 'Evansville (Ind.)'}}, 'dateCreated': ['2/17/1956', {'@encoding': 'edtf', '@keyDate': 'yes', '#text': '1956-02-17'}]}

	{'place': {'@supplied': 'yes', 'placeTerm': {'@type': 'text', '@valueURI': 'http://id.loc.gov/authorities/names/n78095537', '#text': 'Sioux City (Iowa)'}}, 'dateCreated': ['8/8/1967', {'@encoding': 'edtf', '@keyDate': 'yes', '#text': '1967-08-08'}]}

	{'place': {'@supplied': 'yes', 'placeTerm': {'@type': 'text', '@valueURI': 'http://id.loc.gov/authorities/names/n79064631', '#text': 'Tucson (Ariz.)'}}, 'dateCreated': ['7/13/1956', {'@encoding': 'edtf', '@keyDate': 'yes', '#text': '1956-07-13'}]}

	{'place': {'@supplied': 'yes', 'placeTerm': {'@type': 'text', '@valueURI': 'http://id.loc.gov/authorities/names/n79064631', '#text': 'Tucson (Ariz.)'}}, 'dateCreated': ['1956', {'@encoding': 'edtf', '@keyDate': 'yes', '#text': '1956'}]}

	{'place': {'@supplied': 'yes', 'placeTerm': {'@type': 'text', '@valueURI': 'http://id.loc.gov/authorities/names/n79041717', '#text': 'California'}}, 'dateCreated': ['1956', {'@encoding': 'edtf', '@keyDate': 'yes', '#text': '1956'}]}

	{'place': {'@supplied': 'yes', 'placeTerm': {'@type': 'text', '@valueURI': 'http://id.loc.gov/authorities/names/n79053995', '#text': 'Florida'}}, 'dateCreated': ['1956', {'@encoding': 'edtf', '@keyDate': 'yes', '#text': '1956'}]}

	{'dateOther': 'February 5, 1969'}

	{'dateOther': 'November 8, 1969'}

	{'dateOther': 'February 20, 1972'}

	{'dateOther': 'February 1973'}

	{'dateOther': '1977 September 28'}

	{'dateOther': 'February 23, 1974'}

	{'dateOther': 'July 1968'}

	{'dateOther': 'December 26, 1974'}

	{'dateOther': 'circa January 1975'}

	{'dateOther': 'between January 9 and April 26, 1975'}

	{'dateOther': '1975 July 23'}

	{'dateOther': '1975 July 30'}

	{'dateOther': 'circa 1968'}

	{'dateOther': '1975 September 9'}

	{'dateOther': '1975 Ocboter 21'}

	{'dateOther': '1975 December 01'}

	{'dateOther': '1975 December 06'}

	{'dateOther': '1976 February 9'}

	{'dateOther': '1976 February 24'}

	{'dateOther': '1976 July 19'}

	{'dateOther': '1976 December 18'}

	{'dateOther': '1977 April 09'}

	{'dateOther': '1977 May 14'}

	{'dateOther': '1977 September 05'}

	{'dateOther': '1974 December 10'}

	{'dateOther': 'February 1981'}

	{'dateOther': 'circa Fall 1968'}

	{'dateOther': 'circa February 5, 1969'}

	{'dateCreated': ['1976', {'@encoding': 'edtf', '@keyDate': 'yes', '#text': '1976'}]}

	{'dateCreated': ['unknown', {'@encoding': 'edtf', '@keyDate': 'yes', '@qualifier': 'inferred', '#text': '1966'}]}

	{'dateCreated': ['1981', {'@encoding': 'edtf', '@keyDate': 'yes', '#text': '1981'}]}

	{'dateCreated': ['1982', {'@encoding': 'edtf', '@keyDate': 'yes', '#text': '1982'}]}

	{'dateCreated': ['1975', {'@encoding': 'edtf', '@keyDate': 'yes', '#text': '1975'}]}

	{'dateCreated': ['1978', {'@encoding': 'edtf', '@keyDate': 'yes', '#text': '1978'}]}

	{'dateCreated': ['1977', {'@encoding': 'edtf', '@keyDate': 'yes', '#text': '1977'}]}

	{'dateCreated': ['1983', {'@encoding': 'edtf', '@keyDate': 'yes', '#text': '1983'}]}

	{'dateCreated': ['1980', {'@encoding': 'edtf', '@keyDate': 'yes', '#text': '1980'}]}

	{'dateCreated': ['1930', {'@encoding': 'edtf', '@keyDate': 'yes', '#text': '1930'}]}

	{'dateCreated': ['1979', {'@encoding': 'edtf', '@keyDate': 'yes', '#text': '1979'}]}

	{'dateCreated': ['1972', {'@encoding': 'edtf', '@keyDate': 'yes', '#text': '1972'}]}

	{'dateCreated': ['1987-1988', {'@encoding': 'edtf', '@keyDate': 'yes', '#text': '1987'}]}

	{'dateCreated': ['1964', {'@encoding': 'edtf', '@keyDate': 'yes', '#text': '1964'}]}

	{'dateCreated': ['1984', {'@encoding': 'edtf', '@keyDate': 'yes', '#text': '1984'}]}

	{'dateCreated': ['1987', {'@encoding': 'edtf', '@keyDate': 'yes', '#text': '1987'}]}

	{'dateCreated': ['1989', {'@encoding': 'edtf', '@keyDate': 'yes', '#text': '1989'}]}

	{'dateCreated': ['1955', {'@encoding': 'edtf', '@keyDate': 'yes', '#text': '1955'}]}

	{'dateCreated': ['2004', {'@encoding': 'edtf', '@keyDate': 'yes', '#text': '2004'}]}

	{'dateCreated': ['1995', {'@encoding': 'edtf', '@keyDate': 'yes', '#text': '1995'}]}

	{'dateCreated': ['1988', {'@encoding': 'edtf', '@keyDate': 'yes', '#text': '1988'}]}

	{'dateCreated': ['1971-1972', {'@encoding': 'edtf', '@keyDate': 'yes', '#text': '1971'}]}

	{'dateCreated': ['1991', {'@encoding': 'edtf', '@keyDate': 'yes', '#text': '1991'}]}

	{'dateCreated': ['2001', {'@encoding': 'edtf', '@keyDate': 'yes', '#text': '2001'}]}

	{'place': {'@supplied': 'yes', 'placeTerm': {'@type': 'text', '#text': 'New Delhi, India'}}, 'dateCreated': ['1971', {'@encoding': 'edtf', '@keyDate': 'yes', '#text': '1971'}]}

	{'place': {'@supplied': 'yes', 'placeTerm': {'@type': 'text', '#text': 'Knoxville (Tenn.)'}}, 'dateCreated': ['1944-03-02', {'@encoding': 'edtf', '@keyDate': 'yes', '#text': '1944-03-02'}]}

	{'dateCreated': ['Circa 1950s', {'@encoding': 'edtf', '@keyDate': 'yes', '@point': 'start', '@qualifier': 'approximate', '#text': '1950'}, {'@encoding': 'edtf', '@keyDate': 'yes', '@point': 'end', '@qualifier': 'approximate', '#text': '1959'}]}

	{'place': {'@supplied': 'yes', 'placeTerm': {'@type': 'text', '#text': 'Knoxville (Tenn.)'}}, 'dateCreated': ['Undated', {'@encoding': 'edtf', '@keyDate': 'yes', '@point': 'start', '@qualifier': 'inferred', '#text': '1910'}, {'@encoding': 'edtf', '@keyDate': 'yes', '@point': 'end', '@qualifier': 'inferred', '#text': '1955'}]}

	{'place': {'@supplied': 'yes', 'placeTerm': {'@type': 'text', '#text': 'Asheville (N.C.)'}}, 'dateCreated': ['Undated', {'@encoding': 'edtf', '@keyDate': 'yes', '@point': 'start', '@qualifier': 'inferred', '#text': '1910'}, {'@encoding': 'edtf', '@keyDate': 'yes', '@point': 'end', '@qualifier': 'inferred', '#text': '1955'}]}

	{'dateCreated': ['1946-09-04', {'@encoding': 'edtf', '@keyDate': 'yes', '#text': '1946-09-04'}]}

	{'dateCreated': ['Undated', {'@encoding': 'edtf', '@keyDate': 'yes', '@point': 'start', '@qualifier': 'inferred', '#text': '1910'}, {'@encoding': 'edtf', '@keyDate': 'yes', '@point': 'end', '@qualifier': 'inferred', '#text': '1955'}]}

	{'dateCreated': ['Circa 1940s', {'@encoding': 'edtf', '@keyDate': 'yes', '@point': 'start', '@qualifier': 'approximate', '#text': '1940'}, {'@encoding': 'edtf', '@keyDate': 'yes', '@point': 'end', '@qualifier': 'approximate', '#text': '1949'}]}

	{'place': {'@supplied': 'yes', 'placeTerm': {'@type': 'text', '#text': 'Asheville (N.C.)'}}, 'dateCreated': ['1943-08-09', {'@encoding': 'edtf', '@keyDate': 'yes', '#text': '1943-08-09'}]}

	{'place': {'@supplied': 'yes', 'placeTerm': {'@type': 'text', '#text': 'Knoxville (Tenn.)'}}, 'dateCreated': ['1944-04-24', {'@encoding': 'edtf', '@keyDate': 'yes', '#text': '1944-04-24'}]}

	{'dateCreated': ['1943-08-02', {'@encoding': 'edtf', '@keyDate': 'yes', '#text': '1943-08-02'}]}

	{'dateCreated': ['1944-08-19', {'@encoding': 'edtf', '@keyDate': 'yes', '#text': '1944-08-19'}]}

	{'place': {'@supplied': 'yes', 'placeTerm': {'@type': 'text', '#text': 'Asheville (N.C.)'}}, 'dateCreated': ['1943-06-29', {'@encoding': 'edtf', '@keyDate': 'yes', '#text': '1943-06-29'}]}

	{'place': {'@supplied': 'yes', 'placeTerm': {'@type': 'text', '#text': 'Knoxville (Tenn.)'}}, 'dateCreated': ['1944-04-01', {'@encoding': 'edtf', '@keyDate': 'yes', '#text': '1944-04-01'}]}

	{'place': {'@supplied': 'yes', 'placeTerm': {'@type': 'text', '#text': 'Knoxville (Tenn.)'}}, 'dateCreated': ['1944-03-08', {'@encoding': 'edtf', '@keyDate': 'yes', '#text': '1944-03-08'}]}

	{'place': {'@supplied': 'yes', 'placeTerm': {'@type': 'text', '#text': 'Knoxville (Tenn.)'}}, 'dateCreated': ['1944-03-14', {'@encoding': 'edtf', '@keyDate': 'yes', '#text': '1944-03-14'}]}

	{'place': {'@supplied': 'yes', 'placeTerm': {'@type': 'text', '#text': 'Knoxville (Tenn.)'}}, 'dateCreated': ['1944-03-30', {'@encoding': 'edtf', '@keyDate': 'yes', '#text': '1944-03-30'}]}

	{'place': {'@supplied': 'yes', 'placeTerm': {'@type': 'text', '#text': 'Knoxville (Tenn.)'}}, 'dateCreated': ['1941-11-03', {'@encoding': 'edtf', '@keyDate': 'yes', '#text': '1941-11-03'}]}

	{'place': {'@supplied': 'yes', 'placeTerm': {'@type': 'text', '#text': 'Knoxville (Tenn.)'}}, 'dateCreated': ['1945-01-29', {'@encoding': 'edtf', '@keyDate': 'yes', '#text': '1945-01-29'}]}

	{'place': {'@supplied': 'yes', 'placeTerm': {'@type': 'text', '#text': 'Knoxville (Tenn.)'}}, 'dateCreated': ['Circa 1940s', {'@encoding': 'edtf', '@keyDate': 'yes', '@point': 'start', '@qualifier': 'approximate', '#text': '1940'}, {'@encoding': 'edtf', '@keyDate': 'yes', '@point': 'end', '@qualifier': 'approximate', '#text': '1949'}]}

	{'dateCreated': ['1943-07-01', {'@encoding': 'edtf', '@keyDate': 'yes', '#text': '1943-07-01'}]}

	{'place': {'@supplied': 'yes', 'placeTerm': {'@type': 'text', '#text': 'Knoxville (Tenn.)'}}, 'dateCreated': ['1944-03-09', {'@encoding': 'edtf', '@keyDate': 'yes', '#text': '1944-03-09'}]}

	{'dateCreated': ['1912-07-03', {'@encoding': 'edtf', '@keyDate': 'yes', '#text': '1912-07-03'}]}

	{'dateCreated': ['Circa 1912', {'@encoding': 'edtf', '@keyDate': 'yes', '@qualifier': 'approximate', '#text': '1912'}]}

	{'dateCreated': ['1912-02-28', {'@encoding': 'edtf', '@keyDate': 'yes', '#text': '1912-02-28'}]}

	{'place': {'@supplied': 'yes', 'placeTerm': {'@type': 'text', '#text': 'Maryville (Tenn.)'}}, 'dateCreated': ['1909-01-20', {'@encoding': 'edtf', '@keyDate': 'yes', '#text': '1909-01-20'}]}

	{'dateCreated': ['1912-09-24', {'@encoding': 'edtf', '@keyDate': 'yes', '#text': '1912-09-24'}]}

	{'dateCreated': ['Circa 1910', {'@encoding': 'edtf', '@keyDate': 'yes', '@qualifier': 'approximate', '#text': '1910'}]}

	{'place': {'@supplied': 'yes', 'placeTerm': {'@type': 'text', '#text': 'Knoxville (Tenn.)'}}, 'dateCreated': ['1944-08-22', {'@encoding': 'edtf', '@keyDate': 'yes', '#text': '1944-08-22'}]}

	{'place': {'@supplied': 'yes', 'placeTerm': {'@type': 'text', '#text': 'Knoxville (Tenn.)'}}, 'dateCreated': ['1926-08-19', {'@encoding': 'edtf', '@keyDate': 'yes', '#text': '1926-08-19'}]}

	{'dateCreated': ['1916-08-24', {'@encoding': 'edtf', '@keyDate': 'yes', '#text': '1916-08-24'}]}

	{'dateCreated': '1962', 'publisher': 'W. M. Cline Company', 'place': {'placeTerm': {'@valueURI': 'http://id.loc.gov/authorities/names/n79075123', '#text': 'Chattanooga (Tenn.)'}}}

	{'dateCreated': ['Unknown', {'@encoding': 'edtf', '@keyDate': 'yes', '@point': 'start', '#text': '1910'}, {'@encoding': 'edtf', '@keyDate': 'yes', '@point': 'end', '#text': '1999'}], 'publisher': 'W. M. Cline Company', 'place': {'placeTerm': {'@valueURI': 'http://id.loc.gov/authorities/names/n79075123', '#text': 'Chattanooga (Tenn.)'}}}

	{'dateCreated': ['Unknown', {'@encoding': 'edtf', '@keyDate': 'yes', '@point': 'start', '#text': '1910'}, {'@encoding': 'edtf', '@keyDate': 'yes', '@point': 'end', '#text': '1999'}]}

	{'dateCreated': '1949'}

	{'dateCreated': '1949', 'publisher': 'W. M. Cline Company', 'place': {'placeTerm': {'@valueURI': 'http://id.loc.gov/authorities/names/n79075123', '#text': 'Chattanooga (Tenn.)'}}}

	{'dateCreated': ['Unknown', {'@encoding': 'edtf', '@keyDate': 'yes', '@point': 'start', '#text': '1910'}, {'@encoding': 'edtf', '@keyDate': 'yes', '@point': 'end', '#text': '1999'}], 'publisher': 'Mountain Press', 'place': {'placeTerm': {'@valueURI': 'http://id.loc.gov/authorities/names/n80040520', '#text': 'Gatlinburg (Tenn.)'}}}

	{'dateCreated': '1939', 'publisher': 'Orcajo Photo Art', 'place': {'placeTerm': {'@valueURI': 'http://id.loc.gov/authorities/names/n79027170', '#text': 'Dayton (Ohio)'}}}

	{'dateCreated': ['Unknown', {'@encoding': 'edtf', '@keyDate': 'yes', '@point': 'start', '#text': '1910'}, {'@encoding': 'edtf', '@keyDate': 'yes', '@point': 'end', '#text': '1999'}], 'publisher': 'Cline Studios', 'place': {'placeTerm': {'@valueURI': 'http://id.loc.gov/authorities/names/n79075123', '#text': 'Chattanooga (Tenn.)'}}}

	{'dateCreated': '1950', 'publisher': 'W. M. Cline Company', 'place': {'placeTerm': {'@valueURI': 'http://id.loc.gov/authorities/names/n79075123', '#text': 'Chattanooga (Tenn.)'}}}

	{'dateCreated': '1961', 'publisher': 'W. M. Cline Company', 'place': {'placeTerm': {'@valueURI': 'http://id.loc.gov/authorities/names/n79075123', '#text': 'Chattanooga (Tenn.)'}}}

	{'dateCreated': ['Unknown', {'@encoding': 'edtf', '@keyDate': 'yes', '@point': 'start', '#text': '1910'}, {'@encoding': 'edtf', '@keyDate': 'yes', '@point': 'end', '#text': '1999'}], 'publisher': 'Asheville Post Card Co.', 'place': {'placeTerm': {'@valueURI': 'http://id.loc.gov/authorities/names/n79063971', '#text': 'Asheville (N.C.)'}}}

	{'dateCreated': ['Unknown', {'@encoding': 'edtf', '@keyDate': 'yes', '@point': 'start', '#text': '1910'}, {'@encoding': 'edtf', '@keyDate': 'yes', '@point': 'end', '#text': '1999'}], 'publisher': 'Standard Souvenirs & Novelties, Inc.', 'place': {'placeTerm': {'@valueURI': 'http://id.loc.gov/authorities/names/n79109786', '#text': 'Knoxville (Tenn.)'}}}

	{'dateCreated': '1956', 'publisher': 'W. M. Cline Company', 'place': {'placeTerm': {'@valueURI': 'http://id.loc.gov/authorities/names/n79075123', '#text': 'Chattanooga (Tenn.)'}}}

	{'dateCreated': '1962', 'publisher': 'Tennessee TruColor Inc.', 'place': {'placeTerm': {'@valueURI': 'http://id.loc.gov/authorities/names/n80040520', '#text': 'Gatlinburg (Tenn.)'}}}

	{'dateCreated': '1964', 'publisher': 'Tennessee TruColor Inc.', 'place': {'placeTerm': {'@valueURI': 'http://id.loc.gov/authorities/names/n80040520', '#text': 'Gatlinburg (Tenn.)'}}}

	{'dateCreated': '1963', 'publisher': 'W. M. Cline Company', 'place': {'placeTerm': {'@valueURI': 'http://id.loc.gov/authorities/names/n79075123', '#text': 'Chattanooga (Tenn.)'}}}

	{'dateCreated': '1955', 'publisher': 'W. M. Cline Company', 'place': {'placeTerm': {'@valueURI': 'http://id.loc.gov/authorities/names/n79075123', '#text': 'Chattanooga (Tenn.)'}}}

	{'dateCreated': '1957', 'publisher': 'W. M. Cline Company', 'place': {'placeTerm': {'@valueURI': 'http://id.loc.gov/authorities/names/n79075123', '#text': 'Chattanooga (Tenn.)'}}}

	{'dateCreated': '1941', 'publisher': 'Curt Teich & Co.', 'place': {'placeTerm': {'@valueURI': 'http://id.loc.gov/authorities/names/n78086438', '#text': 'Chicago (Ill.)'}}}

	{'dateCreated': '1962', 'publisher': 'Thompsons Commercial Photographers', 'place': {'placeTerm': {'@valueURI': 'http://id.loc.gov/authorities/names/n79109786', '#text': 'Knoxville (Tenn.)'}}}

	{'dateCreated': ['Unknown', {'@encoding': 'edtf', '@keyDate': 'yes', '@point': 'start', '#text': '1910'}, {'@encoding': 'edtf', '@keyDate': 'yes', '@point': 'end', '#text': '1999'}], 'publisher': 'Thompsons Commercial Photographers', 'place': {'placeTerm': {'@valueURI': 'http://id.loc.gov/authorities/names/n79109786', '#text': 'Knoxville (Tenn.)'}}}

	{'dateCreated': ['Unknown', {'@encoding': 'edtf', '@keyDate': 'yes', '@point': 'start', '#text': '1910'}, {'@encoding': 'edtf', '@keyDate': 'yes', '@point': 'end', '#text': '1999'}], 'publisher': 'Graphic News Service', 'place': {'placeTerm': {'@valueURI': 'http://id.loc.gov/authorities/names/n80040520', '#text': 'Gatlinburg (Tenn.)'}}}

	{'dateCreated': ['Unknown', {'@encoding': 'edtf', '@keyDate': 'yes', '@point': 'start', '#text': '1910'}, {'@encoding': 'edtf', '@keyDate': 'yes', '@point': 'end', '#text': '1999'}], 'publisher': 'Melton, Harold K.', 'place': {'placeTerm': {'@valueURI': 'http://id.loc.gov/authorities/names/n80040520', '#text': 'Gatlinburg (Tenn.)'}}}

	{'dateCreated': '1963', 'publisher': 'Thompsons Commercial Photographers', 'place': {'placeTerm': {'@valueURI': 'http://id.loc.gov/authorities/names/n79109786', '#text': 'Knoxville (Tenn.)'}}}

	{'dateCreated': '1953', 'publisher': 'Thompsons, Inc.', 'place': {'placeTerm': {'@valueURI': 'http://id.loc.gov/authorities/names/n79109786', '#text': 'Knoxville (Tenn.)'}}}

	{'dateCreated': '1961', 'publisher': 'Stanley, Fred W.', 'place': {'placeTerm': {'@valueURI': 'http://id.loc.gov/authorities/names/n79071806', '#text': 'Johnson City (Tenn.)'}}}

	{'dateCreated': ['Unknown', {'@encoding': 'edtf', '@keyDate': 'yes', '@point': 'start', '#text': '1910'}, {'@encoding': 'edtf', '@keyDate': 'yes', '@point': 'end', '#text': '1999'}], 'publisher': 'Kaeser & Blair', 'place': {'placeTerm': {'@valueURI': 'http://id.loc.gov/authorities/names/n79053745', '#text': 'Cincinnati (Ohio)'}}}

	{'dateCreated': ['Unknown', {'@encoding': 'edtf', '@keyDate': 'yes', '@point': 'start', '#text': '1910'}, {'@encoding': 'edtf', '@keyDate': 'yes', '@point': 'end', '#text': '1999'}], 'publisher': 'National Press, Inc.', 'place': {'placeTerm': {'@valueURI': 'http://id.loc.gov/authorities/names/n78086438', '#text': 'Chicago (Ill.)'}}}

	{'dateCreated': '1944'}

	{'dateCreated': '1949', 'publisher': 'Mountain Press', 'place': {'placeTerm': {'@valueURI': 'http://id.loc.gov/authorities/names/n80040520', '#text': 'Gatlinburg (Tenn.)'}}}

	{'dateCreated': ['Unknown', {'@encoding': 'edtf', '@keyDate': 'yes', '@point': 'start', '#text': '1910'}, {'@encoding': 'edtf', '@keyDate': 'yes', '@point': 'end', '#text': '1999'}], 'publisher': 'Artvue Post Card Co.', 'place': {'placeTerm': {'@valueURI': 'http://id.loc.gov/authorities/names/n79007751', '#text': 'New York (N.Y.)'}}}

	{'dateCreated': ['Unknown', {'@encoding': 'edtf', '@keyDate': 'yes', '@point': 'start', '#text': '1910'}, {'@encoding': 'edtf', '@keyDate': 'yes', '@point': 'end', '#text': '1999'}], 'publisher': 'Cline Photo Co.', 'place': {'placeTerm': {'@valueURI': 'http://id.loc.gov/authorities/names/n79075123', '#text': 'Chattanooga (Tenn.)'}}}

	{'dateCreated': '1954', 'publisher': 'Thompsons, Inc.', 'place': {'placeTerm': {'@valueURI': 'http://id.loc.gov/authorities/names/n79109786', '#text': 'Knoxville (Tenn.)'}}}

	{'dateCreated': '1946', 'publisher': 'W. M. Cline Company', 'place': {'placeTerm': {'@valueURI': 'http://id.loc.gov/authorities/names/n79075123', '#text': 'Chattanooga (Tenn.)'}}}

	{'dateCreated': '1940', 'publisher': 'Cline Studios', 'place': {'placeTerm': {'@valueURI': 'http://id.loc.gov/authorities/names/n79075123', '#text': 'Chattanooga (Tenn.)'}}}

	{'dateCreated': ['Unknown', {'@encoding': 'edtf', '@keyDate': 'yes', '@point': 'start', '#text': '1910'}, {'@encoding': 'edtf', '@keyDate': 'yes', '@point': 'end', '#text': '1999'}], 'publisher': "Whitman's Phototypes", 'place': {'placeTerm': {'@valueURI': 'http://id.loc.gov/authorities/names/no2010148240', '#text': 'Canton (Pa.)'}}}

	{'dateCreated': '1956'}

	{'dateCreated': '1939'}

	{'dateCreated': ['Unknown', {'@encoding': 'edtf', '@keyDate': 'yes', '@point': 'start', '#text': '1910'}, {'@encoding': 'edtf', '@keyDate': 'yes', '@point': 'end', '#text': '1999'}], 'publisher': 'C. T. Art-Colortone', 'place': {'placeTerm': {'@valueURI': 'http://id.loc.gov/authorities/names/n78086438', '#text': 'Chicago (Ill.)'}}}

	{'dateCreated': '1942', 'publisher': 'Standard News Agency', 'place': {'placeTerm': {'@valueURI': 'http://id.loc.gov/authorities/names/n79109786', '#text': 'Knoxville (Tenn.)'}}}

	{'dateCreated': ['Unknown', {'@encoding': 'edtf', '@keyDate': 'yes', '@point': 'start', '#text': '1910'}, {'@encoding': 'edtf', '@keyDate': 'yes', '@point': 'end', '#text': '1999'}], 'publisher': 'Knox Litho Co.', 'place': {'placeTerm': {'@valueURI': 'http://id.loc.gov/authorities/names/n79109786', '#text': 'Knoxville (Tenn.)'}}}

	{'dateCreated': ['Unknown', {'@encoding': 'edtf', '@keyDate': 'yes', '@point': 'start', '#text': '1910'}, {'@encoding': 'edtf', '@keyDate': 'yes', '@point': 'end', '#text': '1999'}], 'publisher': 'M.W.M.', 'place': {'placeTerm': {'@valueURI': 'http://id.loc.gov/authorities/names/n82090490', '#text': 'Aurora (Mo.)'}}}

	{'dateCreated': '1955', 'publisher': 'M.W.M.', 'place': {'placeTerm': {'@valueURI': 'http://id.loc.gov/authorities/names/n82090490', '#text': 'Aurora (Mo.)'}}}

	{'dateCreated': ['Unknown', {'@encoding': 'edtf', '@keyDate': 'yes', '@point': 'start', '#text': '1910'}, {'@encoding': 'edtf', '@keyDate': 'yes', '@point': 'end', '#text': '1999'}], 'publisher': 'Genuine Curteich', 'place': {'placeTerm': {'@valueURI': 'http://id.loc.gov/authorities/names/n78086438', '#text': 'Chicago (Ill.)'}}}

	{'dateCreated': '1937', 'publisher': 'Asheville Post Card Co.', 'place': {'placeTerm': {'@valueURI': 'http://id.loc.gov/authorities/names/n79063971', '#text': 'Asheville (N.C.)'}}}

	{'dateCreated': '1955', 'publisher': 'Genuine Curteich', 'place': {'placeTerm': {'@valueURI': 'http://id.loc.gov/authorities/names/n78086438', '#text': 'Chicago (Ill.)'}}}

	{'dateCreated': ['Unknown', {'@encoding': 'edtf', '@keyDate': 'yes', '@point': 'start', '#text': '1910'}, {'@encoding': 'edtf', '@keyDate': 'yes', '@point': 'end', '#text': '1999'}], 'publisher': 'Motel Contract Supply Corp.', 'place': {'placeTerm': 'St. Louis (Mo.)'}}

	{'dateCreated': ['Unknown', {'@encoding': 'edtf', '@keyDate': 'yes', '@point': 'start', '#text': '1910'}, {'@encoding': 'edtf', '@keyDate': 'yes', '@point': 'end', '#text': '1999'}], 'publisher': 'Cline Advertising', 'place': {'placeTerm': {'@valueURI': 'http://id.loc.gov/authorities/names/n80040520', '#text': 'Gatlinburg (Tenn.)'}}}

	{'dateCreated': '1962', 'publisher': 'Davis, Harold', 'place': {'placeTerm': {'@valueURI': 'http://id.loc.gov/authorities/names/n79109786', '#text': 'Knoxville (Tenn.)'}}}

	{'dateCreated': ['Unknown', {'@encoding': 'edtf', '@keyDate': 'yes', '@point': 'start', '#text': '1910'}, {'@encoding': 'edtf', '@keyDate': 'yes', '@point': 'end', '#text': '1999'}], 'publisher': 'W. M. Cline Company', 'place': {'placeTerm': {'@valueURI': 'http://id.loc.gov/authorities/names/n80040520', '#text': 'Gatlinburg (Tenn.)'}}}

	{'dateCreated': '1959', 'publisher': 'W. M. Cline Company', 'place': {'placeTerm': {'@valueURI': 'http://id.loc.gov/authorities/names/n79075123', '#text': 'Chattanooga (Tenn.)'}}}

	{'dateCreated': '1953', 'publisher': 'Somerset Post Card Co.', 'place': {'placeTerm': {'@valueURI': 'http://id.loc.gov/authorities/names/n89120954', '#text': 'Jennerstown (Pa.)'}}}

	{'dateCreated': ['Unknown', {'@encoding': 'edtf', '@keyDate': 'yes', '@point': 'start', '#text': '1910'}, {'@encoding': 'edtf', '@keyDate': 'yes', '@point': 'end', '#text': '1999'}], 'publisher': 'Buckhorn Press', 'place': {'placeTerm': {'@valueURI': 'http://id.loc.gov/authorities/names/n80040520', '#text': 'Gatlinburg (Tenn.)'}}}

